benchmark/subgraphs/resnet/tvm_ansor.log
{"i": [["[\"a440b35ba75b754caeba4a36289bc999\", [16, 1, 28, 28], [16, 1, 28, 28], [], [16, 1, 28, 28]]", "cuda -keys=cuda,gpu -arch=sm_80 -max_num_threads=1024 -thread_warp_size=32", [-1, 16, 64, 49152, 2147483647, 1024, 8, 32], "llvm -keys=cpu ", 0, []], [[], [["CI", 5], ["CI", 3], ["CI", 2], ["FU", 6, [0, 1, 2, 3]], ["SP", 6, 0, 12544, [32], 1], ["AN", 6, 0, 5], ["AN", 6, 1, 6]]]], "r": [[2.93679e-06], 0, 1.18482, 1709600020], "v": "v0.6"}
{"i": [["[\"a440b35ba75b754caeba4a36289bc999\", [16, 1, 28, 28], [16, 1, 28, 28], [], [16, 1, 28, 28]]", "cuda -keys=cuda,gpu -arch=sm_80 -max_num_threads=1024 -thread_warp_size=32", [-1, 16, 64, 49152, 2147483647, 1024, 8, 32], "llvm -keys=cpu ", 0, []], [[], [["CI", 5], ["CI", 3], ["CI", 2], ["FU", 6, [0, 1, 2, 3]], ["SP", 6, 0, 12544, [14], 1], ["AN", 6, 0, 5], ["AN", 6, 1, 6]]]], "r": [[3.51107e-06], 0, 0.728834, 1709600020], "v": "v0.6"}
{"i": [["[\"a440b35ba75b754caeba4a36289bc999\", [16, 1, 28, 28], [16, 1, 28, 28], [], [16, 1, 28, 28]]", "cuda -keys=cuda,gpu -arch=sm_80 -max_num_threads=1024 -thread_warp_size=32", [-1, 16, 64, 49152, 2147483647, 1024, 8, 32], "llvm -keys=cpu ", 0, []], [[], [["CI", 5], ["CI", 3], ["CI", 2], ["FU", 6, [0, 1, 2, 3]], ["SP", 6, 0, 12544, [64], 1], ["AN", 6, 0, 5], ["AN", 6, 1, 6]]]], "r": [[2.99644e-06], 0, 0.830086, 1709600021], "v": "v0.6"}
{"i": [["[\"a440b35ba75b754caeba4a36289bc999\", [16, 1, 28, 28], [16, 1, 28, 28], [], [16, 1, 28, 28]]", "cuda -keys=cuda,gpu -arch=sm_80 -max_num_threads=1024 -thread_warp_size=32", [-1, 16, 64, 49152, 2147483647, 1024, 8, 32], "llvm -keys=cpu ", 0, []], [[], [["CI", 5], ["CI", 3], ["CI", 2], ["FU", 6, [0, 1, 2, 3]], ["SP", 6, 0, 12544, [7], 1], ["AN", 6, 0, 5], ["AN", 6, 1, 6]]]], "r": [[3.97873e-06], 0, 0.748707, 1709600021], "v": "v0.6"}
{"i": [["[\"a440b35ba75b754caeba4a36289bc999\", [16, 1, 28, 28], [16, 1, 28, 28], [], [16, 1, 28, 28]]", "cuda -keys=cuda,gpu -arch=sm_80 -max_num_threads=1024 -thread_warp_size=32", [-1, 16, 64, 49152, 2147483647, 1024, 8, 32], "llvm -keys=cpu ", 0, []], [[], [["CI", 5], ["CI", 3], ["CI", 2], ["FU", 6, [0, 1, 2, 3]], ["SP", 6, 0, 12544, [8], 1], ["AN", 6, 0, 5], ["AN", 6, 1, 6]]]], "r": [[4.03493e-06], 0, 0.735636, 1709600021], "v": "v0.6"}
{"i": [["[\"a440b35ba75b754caeba4a36289bc999\", [16, 1, 28, 28], [16, 1, 28, 28], [], [16, 1, 28, 28]]", "cuda -keys=cuda,gpu -arch=sm_80 -max_num_threads=1024 -thread_warp_size=32", [-1, 16, 64, 49152, 2147483647, 1024, 8, 32], "llvm -keys=cpu ", 0, []], [[], [["CI", 5], ["CI", 3], ["CI", 2], ["FU", 6, [0, 1, 2, 3]], ["SP", 6, 0, 12544, [1], 1], ["AN", 6, 0, 5], ["AN", 6, 1, 6]]]], "r": [[1.21964e-05], 0, 0.756399, 1709600021], "v": "v0.6"}
{"i": [["[\"a440b35ba75b754caeba4a36289bc999\", [16, 1, 28, 28], [16, 1, 28, 28], [], [16, 1, 28, 28]]", "cuda -keys=cuda,gpu -arch=sm_80 -max_num_threads=1024 -thread_warp_size=32", [-1, 16, 64, 49152, 2147483647, 1024, 8, 32], "llvm -keys=cpu ", 0, []], [[], [["CI", 5], ["CI", 3], ["CI", 2], ["FU", 6, [0, 1, 2, 3]], ["SP", 6, 0, 12544, [56], 1], ["AN", 6, 0, 5], ["AN", 6, 1, 6]]]], "r": [[2.98194e-06], 0, 0.845313, 1709600022], "v": "v0.6"}
{"i": [["[\"a440b35ba75b754caeba4a36289bc999\", [16, 1, 28, 28], [16, 1, 28, 28], [], [16, 1, 28, 28]]", "cuda -keys=cuda,gpu -arch=sm_80 -max_num_threads=1024 -thread_warp_size=32", [-1, 16, 64, 49152, 2147483647, 1024, 8, 32], "llvm -keys=cpu ", 0, []], [[], [["CI", 5], ["CI", 3], ["CI", 2], ["FU", 6, [0, 1, 2, 3]], ["SP", 6, 0, 12544, [49], 1], ["AN", 6, 0, 5], ["AN", 6, 1, 6]]]], "r": [[2.97431e-06], 0, 0.710146, 1709600022], "v": "v0.6"}
{"i": [["[\"a440b35ba75b754caeba4a36289bc999\", [16, 1, 28, 28], [16, 1, 28, 28], [], [16, 1, 28, 28]]", "cuda -keys=cuda,gpu -arch=sm_80 -max_num_threads=1024 -thread_warp_size=32", [-1, 16, 64, 49152, 2147483647, 1024, 8, 32], "llvm -keys=cpu ", 0, []], [[], [["CI", 5], ["CI", 3], ["CI", 2], ["FU", 6, [0, 1, 2, 3]], ["SP", 6, 0, 12544, [4], 1], ["AN", 6, 0, 5], ["AN", 6, 1, 6]]]], "r": [[5.02003e-06], 0, 0.740317, 1709600022], "v": "v0.6"}
{"i": [["[\"a440b35ba75b754caeba4a36289bc999\", [16, 1, 28, 28], [16, 1, 28, 28], [], [16, 1, 28, 28]]", "cuda -keys=cuda,gpu -arch=sm_80 -max_num_threads=1024 -thread_warp_size=32", [-1, 16, 64, 49152, 2147483647, 1024, 8, 32], "llvm -keys=cpu ", 0, []], [[], [["CI", 5], ["CI", 3], ["CI", 2], ["FU", 6, [0, 1, 2, 3]], ["SP", 6, 0, 12544, [28], 1], ["AN", 6, 0, 5], ["AN", 6, 1, 6]]]], "r": [[3.09003e-06], 0, 0.833407, 1709600022], "v": "v0.6"}
{"i": [["[\"a440b35ba75b754caeba4a36289bc999\", [16, 1, 28, 28], [16, 1, 28, 28], [], [16, 1, 28, 28]]", "cuda -keys=cuda,gpu -arch=sm_80 -max_num_threads=1024 -thread_warp_size=32", [-1, 16, 64, 49152, 2147483647, 1024, 8, 32], "llvm -keys=cpu ", 0, []], [[], [["CI", 5], ["CI", 3], ["CI", 2], ["FU", 6, [0, 1, 2, 3]], ["SP", 6, 0, 12544, [2], 1], ["AN", 6, 0, 5], ["AN", 6, 1, 6]]]], "r": [[7.53338e-06], 0, 0.753045, 1709600023], "v": "v0.6"}
{"i": [["[\"a440b35ba75b754caeba4a36289bc999\", [16, 1, 28, 28], [16, 1, 28, 28], [], [16, 1, 28, 28]]", "cuda -keys=cuda,gpu -arch=sm_80 -max_num_threads=1024 -thread_warp_size=32", [-1, 16, 64, 49152, 2147483647, 1024, 8, 32], "llvm -keys=cpu ", 0, []], [[], [["CI", 5], ["CI", 3], ["CI", 2], ["FU", 6, [0, 1, 2, 3]], ["SP", 6, 0, 12544, [16], 1], ["AN", 6, 0, 5], ["AN", 6, 1, 6]]]], "r": [[3.18962e-06], 0, 0.73765, 1709600023], "v": "v0.6"}
{"i": [["[\"64fc294db670ac5881ff1574fd6ef294\", [16, 256, 28, 28], [], [16, 1, 28, 28]]", "cuda -keys=cuda,gpu -arch=sm_80 -max_num_threads=1024 -thread_warp_size=32", [-1, 16, 64, 49152, 2147483647, 1024, 8, 32], "llvm -keys=cpu ", 0, []], [[], [["CI", 5], ["CI", 3], ["CI", 2], ["FU", 6, [0, 1, 2, 3]], ["SP", 6, 0, 12544, [7], 1], ["AN", 6, 0, 5], ["AN", 6, 1, 6], ["FU", 4, [0, 1, 2, 3]], ["SP", 4, 0, 12544, [1], 1], ["AN", 4, 0, 5], ["AN", 4, 1, 6], ["PR", 4, 0, "auto_unroll_max_step$16"]]]], "r": [[0.000904035], 0, 1.18626, 1709600081], "v": "v0.6"}
{"i": [["[\"64fc294db670ac5881ff1574fd6ef294\", [16, 256, 28, 28], [], [16, 1, 28, 28]]", "cuda -keys=cuda,gpu -arch=sm_80 -max_num_threads=1024 -thread_warp_size=32", [-1, 16, 64, 49152, 2147483647, 1024, 8, 32], "llvm -keys=cpu ", 0, []], [[], [["CI", 5], ["CI", 3], ["CI", 2], ["FU", 6, [0, 1, 2, 3]], ["SP", 6, 0, 12544, [14], 1], ["AN", 6, 0, 5], ["AN", 6, 1, 6], ["FU", 4, [0, 1, 2, 3]], ["SP", 4, 0, 12544, [32], 1], ["AN", 4, 0, 5], ["AN", 4, 1, 6], ["PR", 4, 0, "auto_unroll_max_step$1024"]]]], "r": [[0.000101635], 0, 0.999048, 1709600082], "v": "v0.6"}
{"i": [["[\"64fc294db670ac5881ff1574fd6ef294\", [16, 256, 28, 28], [], [16, 1, 28, 28]]", "cuda -keys=cuda,gpu -arch=sm_80 -max_num_threads=1024 -thread_warp_size=32", [-1, 16, 64, 49152, 2147483647, 1024, 8, 32], "llvm -keys=cpu ", 0, []], [[], [["CI", 5], ["CI", 3], ["CI", 2], ["FU", 6, [0, 1, 2, 3]], ["SP", 6, 0, 12544, [14], 1], ["AN", 6, 0, 5], ["AN", 6, 1, 6], ["FU", 4, [0, 1, 2, 3]], ["SP", 4, 0, 12544, [32], 1], ["AN", 4, 0, 5], ["AN", 4, 1, 6], ["PR", 4, 0, "auto_unroll_max_step$0"]]]], "r": [[0.00010162], 0, 1.00653, 1709600082], "v": "v0.6"}
{"i": [["[\"64fc294db670ac5881ff1574fd6ef294\", [16, 256, 28, 28], [], [16, 1, 28, 28]]", "cuda -keys=cuda,gpu -arch=sm_80 -max_num_threads=1024 -thread_warp_size=32", [-1, 16, 64, 49152, 2147483647, 1024, 8, 32], "llvm -keys=cpu ", 0, []], [[], [["CI", 5], ["CI", 3], ["CI", 2], ["FU", 6, [0, 1, 2, 3]], ["SP", 6, 0, 12544, [64], 1], ["AN", 6, 0, 5], ["AN", 6, 1, 6], ["FU", 4, [0, 1, 2, 3]], ["SP", 4, 0, 12544, [1], 1], ["AN", 4, 0, 5], ["AN", 4, 1, 6], ["PR", 4, 0, "auto_unroll_max_step$1024"]]]], "r": [[0.000707337], 0, 1.03233, 1709600082], "v": "v0.6"}
{"i": [["[\"64fc294db670ac5881ff1574fd6ef294\", [16, 256, 28, 28], [], [16, 1, 28, 28]]", "cuda -keys=cuda,gpu -arch=sm_80 -max_num_threads=1024 -thread_warp_size=32", [-1, 16, 64, 49152, 2147483647, 1024, 8, 32], "llvm -keys=cpu ", 0, []], [[], [["CI", 5], ["CI", 3], ["CI", 2], ["FU", 6, [0, 1, 2, 3]], ["SP", 6, 0, 12544, [1], 1], ["AN", 6, 0, 5], ["AN", 6, 1, 6], ["FU", 4, [0, 1, 2, 3]], ["SP", 4, 0, 12544, [16], 1], ["AN", 4, 0, 5], ["AN", 4, 1, 6], ["PR", 4, 0, "auto_unroll_max_step$512"]]]], "r": [[0.00011689], 0, 1.01877, 1709600083], "v": "v0.6"}
{"i": [["[\"64fc294db670ac5881ff1574fd6ef294\", [16, 256, 28, 28], [], [16, 1, 28, 28]]", "cuda -keys=cuda,gpu -arch=sm_80 -max_num_threads=1024 -thread_warp_size=32", [-1, 16, 64, 49152, 2147483647, 1024, 8, 32], "llvm -keys=cpu ", 0, []], [[], [["CI", 5], ["CI", 3], ["CI", 2], ["FU", 6, [0, 1, 2, 3]], ["SP", 6, 0, 12544, [64], 1], ["AN", 6, 0, 5], ["AN", 6, 1, 6], ["FU", 4, [0, 1, 2, 3]], ["SP", 4, 0, 12544, [28], 1], ["AN", 4, 0, 5], ["AN", 4, 1, 6], ["PR", 4, 0, "auto_unroll_max_step$64"]]]], "r": [[0.000105943], 0, 0.989523, 1709600083], "v": "v0.6"}
{"i": [["[\"64fc294db670ac5881ff1574fd6ef294\", [16, 256, 28, 28], [], [16, 1, 28, 28]]", "cuda -keys=cuda,gpu -arch=sm_80 -max_num_threads=1024 -thread_warp_size=32", [-1, 16, 64, 49152, 2147483647, 1024, 8, 32], "llvm -keys=cpu ", 0, []], [[], [["CI", 5], ["CI", 3], ["CI", 2], ["FU", 6, [0, 1, 2, 3]], ["SP", 6, 0, 12544, [4], 1], ["AN", 6, 0, 5], ["AN", 6, 1, 6], ["FU", 4, [0, 1, 2, 3]], ["SP", 4, 0, 12544, [32], 1], ["AN", 4, 0, 5], ["AN", 4, 1, 6], ["PR", 4, 0, "auto_unroll_max_step$16"]]]], "r": [[0.000103269], 0, 1.01242, 1709600084], "v": "v0.6"}
{"i": [["[\"64fc294db670ac5881ff1574fd6ef294\", [16, 256, 28, 28], [], [16, 1, 28, 28]]", "cuda -keys=cuda,gpu -arch=sm_80 -max_num_threads=1024 -thread_warp_size=32", [-1, 16, 64, 49152, 2147483647, 1024, 8, 32], "llvm -keys=cpu ", 0, []], [[], [["CI", 5], ["CI", 3], ["CI", 2], ["FU", 6, [0, 1, 2, 3]], ["SP", 6, 0, 12544, [8], 1], ["AN", 6, 0, 5], ["AN", 6, 1, 6], ["FU", 4, [0, 1, 2, 3]], ["SP", 4, 0, 12544, [56], 1], ["AN", 4, 0, 5], ["AN", 4, 1, 6], ["PR", 4, 0, "auto_unroll_max_step$0"]]]], "r": [[0.000109545], 0, 1.03007, 1709600084], "v": "v0.6"}
{"i": [["[\"64fc294db670ac5881ff1574fd6ef294\", [16, 256, 28, 28], [], [16, 1, 28, 28]]", "cuda -keys=cuda,gpu -arch=sm_80 -max_num_threads=1024 -thread_warp_size=32", [-1, 16, 64, 49152, 2147483647, 1024, 8, 32], "llvm -keys=cpu ", 0, []], [[], [["CI", 5], ["CI", 3], ["CI", 2], ["FU", 6, [0, 1, 2, 3]], ["SP", 6, 0, 12544, [64], 1], ["AN", 6, 0, 5], ["AN", 6, 1, 6], ["FU", 4, [0, 1, 2, 3]], ["SP", 4, 0, 12544, [32], 1], ["AN", 4, 0, 5], ["AN", 4, 1, 6], ["PR", 4, 0, "auto_unroll_max_step$512"]]]], "r": [[0.000101261], 0, 1.00767, 1709600085], "v": "v0.6"}
{"i": [["[\"64fc294db670ac5881ff1574fd6ef294\", [16, 256, 28, 28], [], [16, 1, 28, 28]]", "cuda -keys=cuda,gpu -arch=sm_80 -max_num_threads=1024 -thread_warp_size=32", [-1, 16, 64, 49152, 2147483647, 1024, 8, 32], "llvm -keys=cpu ", 0, []], [[], [["CI", 5], ["SP", 6, 3, 28, [28], 1], ["AN", 6, 4, 6], ["FSP", 4, 4, 1, 1], ["AN", 4, 5, 6], ["CA", 4, 6, 3], ["CI", 3], ["CI", 2], ["FU", 6, [0, 1, 2, 3]], ["AN", 6, 0, 5], ["PR", 4, 0, "auto_unroll_max_step$0"]]]], "r": [[0.000127796], 0, 0.999194, 1709600085], "v": "v0.6"}
{"i": [["[\"64fc294db670ac5881ff1574fd6ef294\", [16, 256, 28, 28], [], [16, 1, 28, 28]]", "cuda -keys=cuda,gpu -arch=sm_80 -max_num_threads=1024 -thread_warp_size=32", [-1, 16, 64, 49152, 2147483647, 1024, 8, 32], "llvm -keys=cpu ", 0, []], [[], [["CI", 5], ["CI", 3], ["CI", 2], ["FU", 6, [0, 1, 2, 3]], ["SP", 6, 0, 12544, [1], 1], ["AN", 6, 0, 5], ["AN", 6, 1, 6], ["FU", 4, [0, 1, 2, 3]], ["SP", 4, 0, 12544, [32], 1], ["AN", 4, 0, 5], ["AN", 4, 1, 6], ["PR", 4, 0, "auto_unroll_max_step$0"]]]], "r": [[0.000110286], 0, 1.03922, 1709600085], "v": "v0.6"}
{"i": [["[\"64fc294db670ac5881ff1574fd6ef294\", [16, 256, 28, 28], [], [16, 1, 28, 28]]", "cuda -keys=cuda,gpu -arch=sm_80 -max_num_threads=1024 -thread_warp_size=32", [-1, 16, 64, 49152, 2147483647, 1024, 8, 32], "llvm -keys=cpu ", 0, []], [[], [["CI", 5], ["CI", 3], ["CI", 2], ["FU", 6, [0, 1, 2, 3]], ["SP", 6, 0, 12544, [8], 1], ["AN", 6, 0, 5], ["AN", 6, 1, 6], ["FU", 4, [0, 1, 2, 3]], ["SP", 4, 0, 12544, [64], 1], ["AN", 4, 0, 5], ["AN", 4, 1, 6], ["PR", 4, 0, "auto_unroll_max_step$16"]]]], "r": [[0.000109646], 0, 1.00309, 1709600086], "v": "v0.6"}
{"i": [["[\"64fc294db670ac5881ff1574fd6ef294\", [16, 256, 28, 28], [], [16, 1, 28, 28]]", "cuda -keys=cuda,gpu -arch=sm_80 -max_num_threads=1024 -thread_warp_size=32", [-1, 16, 64, 49152, 2147483647, 1024, 8, 32], "llvm -keys=cpu ", 0, []], [[], [["CI", 5], ["CI", 3], ["CI", 2], ["FU", 6, [0, 1, 2, 3]], ["SP", 6, 0, 12544, [8], 1], ["AN", 6, 0, 5], ["AN", 6, 1, 6], ["FU", 4, [0, 1, 2, 3]], ["SP", 4, 0, 12544, [32], 1], ["AN", 4, 0, 5], ["AN", 4, 1, 6], ["PR", 4, 0, "auto_unroll_max_step$1024"]]]], "r": [[0.000102219], 0, 1.0206, 1709600086], "v": "v0.6"}
{"i": [["[\"64fc294db670ac5881ff1574fd6ef294\", [16, 256, 28, 28], [], [16, 1, 28, 28]]", "cuda -keys=cuda,gpu -arch=sm_80 -max_num_threads=1024 -thread_warp_size=32", [-1, 16, 64, 49152, 2147483647, 1024, 8, 32], "llvm -keys=cpu ", 0, []], [[], [["CI", 5], ["SP", 6, 3, 28, [3], 1], ["AN", 6, 4, 6], ["FSP", 4, 4, 1, 1], ["AN", 4, 5, 6], ["CA", 4, 6, 3], ["CI", 3], ["CI", 2], ["FU", 6, [0, 1, 2, 3]], ["AN", 6, 0, 5], ["PR", 4, 0, "auto_unroll_max_step$64"]]]], "r": [[0.000292234], 0, 1.01669, 1709600087], "v": "v0.6"}
{"i": [["[\"64fc294db670ac5881ff1574fd6ef294\", [16, 256, 28, 28], [], [16, 1, 28, 28]]", "cuda -keys=cuda,gpu -arch=sm_80 -max_num_threads=1024 -thread_warp_size=32", [-1, 16, 64, 49152, 2147483647, 1024, 8, 32], "llvm -keys=cpu ", 0, []], [[], [["CI", 5], ["CI", 3], ["CI", 2], ["FU", 6, [0, 1, 2, 3]], ["SP", 6, 0, 12544, [14], 1], ["AN", 6, 0, 5], ["AN", 6, 1, 6], ["FU", 4, [0, 1, 2, 3]], ["SP", 4, 0, 12544, [64], 1], ["AN", 4, 0, 5], ["AN", 4, 1, 6], ["PR", 4, 0, "auto_unroll_max_step$0"]]]], "r": [[0.00010894], 0, 1.00963, 1709600087], "v": "v0.6"}
{"i": [["[\"64fc294db670ac5881ff1574fd6ef294\", [16, 256, 28, 28], [], [16, 1, 28, 28]]", "cuda -keys=cuda,gpu -arch=sm_80 -max_num_threads=1024 -thread_warp_size=32", [-1, 16, 64, 49152, 2147483647, 1024, 8, 32], "llvm -keys=cpu ", 0, []], [[], [["CI", 5], ["CI", 3], ["CI", 2], ["FU", 6, [0, 1, 2, 3]], ["SP", 6, 0, 12544, [32], 1], ["AN", 6, 0, 5], ["AN", 6, 1, 6], ["FU", 4, [0, 1, 2, 3]], ["SP", 4, 0, 12544, [32], 1], ["AN", 4, 0, 5], ["AN", 4, 1, 6], ["PR", 4, 0, "auto_unroll_max_step$1024"]]]], "r": [[0.000101199], 0, 1.0236, 1709600087], "v": "v0.6"}
{"i": [["[\"64fc294db670ac5881ff1574fd6ef294\", [16, 256, 28, 28], [], [16, 1, 28, 28]]", "cuda -keys=cuda,gpu -arch=sm_80 -max_num_threads=1024 -thread_warp_size=32", [-1, 16, 64, 49152, 2147483647, 1024, 8, 32], "llvm -keys=cpu ", 0, []], [[], [["CI", 5], ["SP", 6, 3, 28, [7], 1], ["AN", 6, 4, 6], ["FSP", 4, 4, 1, 1], ["AN", 4, 5, 6], ["CA", 4, 6, 3], ["CI", 3], ["CI", 2], ["FU", 6, [0, 1, 2, 3]], ["AN", 6, 0, 5], ["PR", 4, 0, "auto_unroll_max_step$64"]]]], "r": [[0.000127767], 0, 1.38316, 1709600088], "v": "v0.6"}
{"i": [["[\"64fc294db670ac5881ff1574fd6ef294\", [16, 256, 28, 28], [], [16, 1, 28, 28]]", "cuda -keys=cuda,gpu -arch=sm_80 -max_num_threads=1024 -thread_warp_size=32", [-1, 16, 64, 49152, 2147483647, 1024, 8, 32], "llvm -keys=cpu ", 0, []], [[], [["CI", 5], ["CI", 3], ["CI", 2], ["FU", 6, [0, 1, 2, 3]], ["SP", 6, 0, 12544, [64], 1], ["AN", 6, 0, 5], ["AN", 6, 1, 6], ["FU", 4, [0, 1, 2, 3]], ["SP", 4, 0, 12544, [2], 1], ["AN", 4, 0, 5], ["AN", 4, 1, 6], ["PR", 4, 0, "auto_unroll_max_step$512"]]]], "r": [[0.000325272], 0, 1.03847, 1709600088], "v": "v0.6"}
{"i": [["[\"64fc294db670ac5881ff1574fd6ef294\", [16, 256, 28, 28], [], [16, 1, 28, 28]]", "cuda -keys=cuda,gpu -arch=sm_80 -max_num_threads=1024 -thread_warp_size=32", [-1, 16, 64, 49152, 2147483647, 1024, 8, 32], "llvm -keys=cpu ", 0, []], [[], [["CI", 5], ["SP", 6, 3, 28, [7], 1], ["AN", 6, 4, 6], ["FSP", 4, 4, 1, 1], ["AN", 4, 5, 6], ["CA", 4, 6, 3], ["CI", 3], ["CI", 2], ["FU", 6, [0, 1, 2, 3]], ["AN", 6, 0, 5], ["PR", 4, 0, "auto_unroll_max_step$16"]]]], "r": [[0.000148997], 0, 1.0258, 1709600089], "v": "v0.6"}
{"i": [["[\"64fc294db670ac5881ff1574fd6ef294\", [16, 256, 28, 28], [], [16, 1, 28, 28]]", "cuda -keys=cuda,gpu -arch=sm_80 -max_num_threads=1024 -thread_warp_size=32", [-1, 16, 64, 49152, 2147483647, 1024, 8, 32], "llvm -keys=cpu ", 0, []], [[], [["CI", 5], ["SP", 6, 3, 28, [4], 1], ["AN", 6, 4, 6], ["FSP", 4, 4, 1, 1], ["AN", 4, 5, 6], ["CA", 4, 6, 3], ["CI", 3], ["CI", 2], ["FU", 6, [0, 1, 2, 3]], ["AN", 6, 0, 5], ["PR", 4, 0, "auto_unroll_max_step$16"]]]], "r": [[0.000185737], 0, 1.00532, 1709600089], "v": "v0.6"}
{"i": [["[\"64fc294db670ac5881ff1574fd6ef294\", [16, 256, 28, 28], [], [16, 1, 28, 28]]", "cuda -keys=cuda,gpu -arch=sm_80 -max_num_threads=1024 -thread_warp_size=32", [-1, 16, 64, 49152, 2147483647, 1024, 8, 32], "llvm -keys=cpu ", 0, []], [[], [["CI", 5], ["SP", 6, 3, 28, [1], 1], ["AN", 6, 4, 6], ["FSP", 4, 4, 1, 1], ["AN", 4, 5, 6], ["CA", 4, 6, 3], ["CI", 3], ["CI", 2], ["FU", 6, [0, 1, 2, 3]], ["AN", 6, 0, 5], ["PR", 4, 0, "auto_unroll_max_step$0"]]]], "r": [[0.00058024], 0, 1.0331, 1709600090], "v": "v0.6"}
{"i": [["[\"64fc294db670ac5881ff1574fd6ef294\", [16, 256, 28, 28], [], [16, 1, 28, 28]]", "cuda -keys=cuda,gpu -arch=sm_80 -max_num_threads=1024 -thread_warp_size=32", [-1, 16, 64, 49152, 2147483647, 1024, 8, 32], "llvm -keys=cpu ", 0, []], [[], [["CI", 5], ["CI", 3], ["CI", 2], ["FU", 6, [0, 1, 2, 3]], ["SP", 6, 0, 12544, [2], 1], ["AN", 6, 0, 5], ["AN", 6, 1, 6], ["FU", 4, [0, 1, 2, 3]], ["SP", 4, 0, 12544, [4], 1], ["AN", 4, 0, 5], ["AN", 4, 1, 6], ["PR", 4, 0, "auto_unroll_max_step$16"]]]], "r": [[0.000193837], 0, 1.00552, 1709600090], "v": "v0.6"}
{"i": [["[\"64fc294db670ac5881ff1574fd6ef294\", [16, 256, 28, 28], [], [16, 1, 28, 28]]", "cuda -keys=cuda,gpu -arch=sm_80 -max_num_threads=1024 -thread_warp_size=32", [-1, 16, 64, 49152, 2147483647, 1024, 8, 32], "llvm -keys=cpu ", 0, []], [[], [["CI", 5], ["CI", 3], ["CI", 2], ["FU", 6, [0, 1, 2, 3]], ["SP", 6, 0, 12544, [32], 1], ["AN", 6, 0, 5], ["AN", 6, 1, 6], ["FU", 4, [0, 1, 2, 3]], ["SP", 4, 0, 12544, [1], 1], ["AN", 4, 0, 5], ["AN", 4, 1, 6], ["PR", 4, 0, "auto_unroll_max_step$1024"]]]], "r": [[0.000706861], 0, 0.983469, 1709600090], "v": "v0.6"}
{"i": [["[\"64fc294db670ac5881ff1574fd6ef294\", [16, 256, 28, 28], [], [16, 1, 28, 28]]", "cuda -keys=cuda,gpu -arch=sm_80 -max_num_threads=1024 -thread_warp_size=32", [-1, 16, 64, 49152, 2147483647, 1024, 8, 32], "llvm -keys=cpu ", 0, []], [[], [["CI", 5], ["CI", 3], ["CI", 2], ["FU", 6, [0, 1, 2, 3]], ["SP", 6, 0, 12544, [2], 1], ["AN", 6, 0, 5], ["AN", 6, 1, 6], ["FU", 4, [0, 1, 2, 3]], ["SP", 4, 0, 12544, [8], 1], ["AN", 4, 0, 5], ["AN", 4, 1, 6], ["PR", 4, 0, "auto_unroll_max_step$16"]]]], "r": [[0.000122539], 0, 0.98672, 1709600091], "v": "v0.6"}
{"i": [["[\"64fc294db670ac5881ff1574fd6ef294\", [16, 256, 28, 28], [], [16, 1, 28, 28]]", "cuda -keys=cuda,gpu -arch=sm_80 -max_num_threads=1024 -thread_warp_size=32", [-1, 16, 64, 49152, 2147483647, 1024, 8, 32], "llvm -keys=cpu ", 0, []], [[], [["CI", 5], ["SP", 6, 3, 28, [4], 1], ["AN", 6, 4, 6], ["FSP", 4, 4, 1, 1], ["AN", 4, 5, 6], ["CA", 4, 6, 3], ["CI", 3], ["CI", 2], ["FU", 6, [0, 1, 2, 3]], ["AN", 6, 0, 5], ["PR", 4, 0, "auto_unroll_max_step$0"]]]], "r": [[0.000185737], 0, 1.03203, 1709600091], "v": "v0.6"}
{"i": [["[\"64fc294db670ac5881ff1574fd6ef294\", [16, 256, 28, 28], [], [16, 1, 28, 28]]", "cuda -keys=cuda,gpu -arch=sm_80 -max_num_threads=1024 -thread_warp_size=32", [-1, 16, 64, 49152, 2147483647, 1024, 8, 32], "llvm -keys=cpu ", 0, []], [[], [["CI", 5], ["CI", 3], ["CI", 2], ["FU", 6, [0, 1, 2, 3]], ["SP", 6, 0, 12544, [2], 1], ["AN", 6, 0, 5], ["AN", 6, 1, 6], ["FU", 4, [0, 1, 2, 3]], ["SP", 4, 0, 12544, [32], 1], ["AN", 4, 0, 5], ["AN", 4, 1, 6], ["PR", 4, 0, "auto_unroll_max_step$512"]]]], "r": [[0.000105639], 0, 1.01678, 1709600092], "v": "v0.6"}
{"i": [["[\"64fc294db670ac5881ff1574fd6ef294\", [16, 256, 28, 28], [], [16, 1, 28, 28]]", "cuda -keys=cuda,gpu -arch=sm_80 -max_num_threads=1024 -thread_warp_size=32", [-1, 16, 64, 49152, 2147483647, 1024, 8, 32], "llvm -keys=cpu ", 0, []], [[], [["CI", 5], ["SP", 6, 3, 28, [3], 1], ["AN", 6, 4, 6], ["FSP", 4, 4, 1, 1], ["AN", 4, 5, 6], ["CA", 4, 6, 3], ["CI", 3], ["CI", 2], ["FU", 6, [0, 1, 2, 3]], ["AN", 6, 0, 5], ["PR", 4, 0, "auto_unroll_max_step$0"]]]], "r": [[0.000292368], 0, 1.01389, 1709600092], "v": "v0.6"}
{"i": [["[\"64fc294db670ac5881ff1574fd6ef294\", [16, 256, 28, 28], [], [16, 1, 28, 28]]", "cuda -keys=cuda,gpu -arch=sm_80 -max_num_threads=1024 -thread_warp_size=32", [-1, 16, 64, 49152, 2147483647, 1024, 8, 32], "llvm -keys=cpu ", 0, []], [[], [["CI", 5], ["CI", 3], ["CI", 2], ["FU", 6, [0, 1, 2, 3]], ["SP", 6, 0, 12544, [64], 1], ["AN", 6, 0, 5], ["AN", 6, 1, 6], ["FU", 4, [0, 1, 2, 3]], ["SP", 4, 0, 12544, [4], 1], ["AN", 4, 0, 5], ["AN", 4, 1, 6], ["PR", 4, 0, "auto_unroll_max_step$64"]]]], "r": [[0.000189452], 0, 0.999835, 1709600093], "v": "v0.6"}
{"i": [["[\"64fc294db670ac5881ff1574fd6ef294\", [16, 256, 28, 28], [], [16, 1, 28, 28]]", "cuda -keys=cuda,gpu -arch=sm_80 -max_num_threads=1024 -thread_warp_size=32", [-1, 16, 64, 49152, 2147483647, 1024, 8, 32], "llvm -keys=cpu ", 0, []], [[], [["CI", 5], ["CI", 3], ["CI", 2], ["FU", 6, [0, 1, 2, 3]], ["SP", 6, 0, 12544, [64], 1], ["AN", 6, 0, 5], ["AN", 6, 1, 6], ["FU", 4, [0, 1, 2, 3]], ["SP", 4, 0, 12544, [16], 1], ["AN", 4, 0, 5], ["AN", 4, 1, 6], ["PR", 4, 0, "auto_unroll_max_step$16"]]]], "r": [[0.000107824], 0, 0.986722, 1709600093], "v": "v0.6"}
{"i": [["[\"64fc294db670ac5881ff1574fd6ef294\", [16, 256, 28, 28], [], [16, 1, 28, 28]]", "cuda -keys=cuda,gpu -arch=sm_80 -max_num_threads=1024 -thread_warp_size=32", [-1, 16, 64, 49152, 2147483647, 1024, 8, 32], "llvm -keys=cpu ", 0, []], [[], [["CI", 5], ["CI", 3], ["CI", 2], ["FU", 6, [0, 1, 2, 3]], ["SP", 6, 0, 12544, [64], 1], ["AN", 6, 0, 5], ["AN", 6, 1, 6], ["FU", 4, [0, 1, 2, 3]], ["SP", 4, 0, 12544, [32], 1], ["AN", 4, 0, 5], ["AN", 4, 1, 6], ["PR", 4, 0, "auto_unroll_max_step$1024"]]]], "r": [[0.000101306], 0, 0.997627, 1709600093], "v": "v0.6"}
{"i": [["[\"64fc294db670ac5881ff1574fd6ef294\", [16, 256, 28, 28], [], [16, 1, 28, 28]]", "cuda -keys=cuda,gpu -arch=sm_80 -max_num_threads=1024 -thread_warp_size=32", [-1, 16, 64, 49152, 2147483647, 1024, 8, 32], "llvm -keys=cpu ", 0, []], [[], [["CI", 5], ["SP", 6, 3, 28, [32], 1], ["AN", 6, 4, 6], ["FSP", 4, 4, 1, 1], ["AN", 4, 5, 6], ["CA", 4, 6, 3], ["CI", 3], ["CI", 2], ["FU", 6, [0, 1, 2, 3]], ["AN", 6, 0, 5], ["PR", 4, 0, "auto_unroll_max_step$64"]]]], "r": [[9.59175e-05], 0, 1.08846, 1709600094], "v": "v0.6"}
{"i": [["[\"64fc294db670ac5881ff1574fd6ef294\", [16, 256, 28, 28], [], [16, 1, 28, 28]]", "cuda -keys=cuda,gpu -arch=sm_80 -max_num_threads=1024 -thread_warp_size=32", [-1, 16, 64, 49152, 2147483647, 1024, 8, 32], "llvm -keys=cpu ", 0, []], [[], [["CI", 5], ["CI", 3], ["CI", 2], ["FU", 6, [0, 1, 2, 3]], ["SP", 6, 0, 12544, [2], 1], ["AN", 6, 0, 5], ["AN", 6, 1, 6], ["FU", 4, [0, 1, 2, 3]], ["SP", 4, 0, 12544, [16], 1], ["AN", 4, 0, 5], ["AN", 4, 1, 6], ["PR", 4, 0, "auto_unroll_max_step$1024"]]]], "r": [[0.000112219], 0, 1.02012, 1709600094], "v": "v0.6"}
{"i": [["[\"64fc294db670ac5881ff1574fd6ef294\", [16, 256, 28, 28], [], [16, 1, 28, 28]]", "cuda -keys=cuda,gpu -arch=sm_80 -max_num_threads=1024 -thread_warp_size=32", [-1, 16, 64, 49152, 2147483647, 1024, 8, 32], "llvm -keys=cpu ", 0, []], [[], [["CI", 5], ["CI", 3], ["CI", 2], ["FU", 6, [0, 1, 2, 3]], ["SP", 6, 0, 12544, [64], 1], ["AN", 6, 0, 5], ["AN", 6, 1, 6], ["FU", 4, [0, 1, 2, 3]], ["SP", 4, 0, 12544, [4], 1], ["AN", 4, 0, 5], ["AN", 4, 1, 6], ["PR", 4, 0, "auto_unroll_max_step$16"]]]], "r": [[0.000189463], 0, 1.06265, 1709600095], "v": "v0.6"}
{"i": [["[\"64fc294db670ac5881ff1574fd6ef294\", [16, 256, 28, 28], [], [16, 1, 28, 28]]", "cuda -keys=cuda,gpu -arch=sm_80 -max_num_threads=1024 -thread_warp_size=32", [-1, 16, 64, 49152, 2147483647, 1024, 8, 32], "llvm -keys=cpu ", 0, []], [[], [["CI", 5], ["CI", 3], ["CI", 2], ["FU", 6, [0, 1, 2, 3]], ["SP", 6, 0, 12544, [1], 1], ["AN", 6, 0, 5], ["AN", 6, 1, 6], ["FU", 4, [0, 1, 2, 3]], ["SP", 4, 0, 12544, [64], 1], ["AN", 4, 0, 5], ["AN", 4, 1, 6], ["PR", 4, 0, "auto_unroll_max_step$0"]]]], "r": [[0.000117692], 0, 1.02945, 1709600095], "v": "v0.6"}
{"i": [["[\"64fc294db670ac5881ff1574fd6ef294\", [16, 256, 28, 28], [], [16, 1, 28, 28]]", "cuda -keys=cuda,gpu -arch=sm_80 -max_num_threads=1024 -thread_warp_size=32", [-1, 16, 64, 49152, 2147483647, 1024, 8, 32], "llvm -keys=cpu ", 0, []], [[], [["CI", 5], ["CI", 3], ["CI", 2], ["FU", 6, [0, 1, 2, 3]], ["SP", 6, 0, 12544, [32], 1], ["AN", 6, 0, 5], ["AN", 6, 1, 6], ["FU", 4, [0, 1, 2, 3]], ["SP", 4, 0, 12544, [4], 1], ["AN", 4, 0, 5], ["AN", 4, 1, 6], ["PR", 4, 0, "auto_unroll_max_step$16"]]]], "r": [[0.000189456], 0, 1.03992, 1709600095], "v": "v0.6"}
{"i": [["[\"64fc294db670ac5881ff1574fd6ef294\", [16, 256, 28, 28], [], [16, 1, 28, 28]]", "cuda -keys=cuda,gpu -arch=sm_80 -max_num_threads=1024 -thread_warp_size=32", [-1, 16, 64, 49152, 2147483647, 1024, 8, 32], "llvm -keys=cpu ", 0, []], [[], [["CI", 5], ["CI", 3], ["CI", 2], ["FU", 6, [0, 1, 2, 3]], ["SP", 6, 0, 12544, [2], 1], ["AN", 6, 0, 5], ["AN", 6, 1, 6], ["FU", 4, [0, 1, 2, 3]], ["SP", 4, 0, 12544, [2], 1], ["AN", 4, 0, 5], ["AN", 4, 1, 6], ["PR", 4, 0, "auto_unroll_max_step$16"]]]], "r": [[0.000329646], 0, 1.02831, 1709600096], "v": "v0.6"}
{"i": [["[\"64fc294db670ac5881ff1574fd6ef294\", [16, 256, 28, 28], [], [16, 1, 28, 28]]", "cuda -keys=cuda,gpu -arch=sm_80 -max_num_threads=1024 -thread_warp_size=32", [-1, 16, 64, 49152, 2147483647, 1024, 8, 32], "llvm -keys=cpu ", 0, []], [[], [["CI", 5], ["CI", 3], ["CI", 2], ["FU", 6, [0, 1, 2, 3]], ["SP", 6, 0, 12544, [64], 1], ["AN", 6, 0, 5], ["AN", 6, 1, 6], ["FU", 4, [0, 1, 2, 3]], ["SP", 4, 0, 12544, [8], 1], ["AN", 4, 0, 5], ["AN", 4, 1, 6], ["PR", 4, 0, "auto_unroll_max_step$1024"]]]], "r": [[0.00011812], 0, 0.983957, 1709600096], "v": "v0.6"}
{"i": [["[\"64fc294db670ac5881ff1574fd6ef294\", [16, 256, 28, 28], [], [16, 1, 28, 28]]", "cuda -keys=cuda,gpu -arch=sm_80 -max_num_threads=1024 -thread_warp_size=32", [-1, 16, 64, 49152, 2147483647, 1024, 8, 32], "llvm -keys=cpu ", 0, []], [[], [["CI", 5], ["CI", 3], ["CI", 2], ["FU", 6, [0, 1, 2, 3]], ["SP", 6, 0, 12544, [64], 1], ["AN", 6, 0, 5], ["AN", 6, 1, 6], ["FU", 4, [0, 1, 2, 3]], ["SP", 4, 0, 12544, [64], 1], ["AN", 4, 0, 5], ["AN", 4, 1, 6], ["PR", 4, 0, "auto_unroll_max_step$0"]]]], "r": [[0.000108515], 0, 1.01253, 1709600097], "v": "v0.6"}
{"i": [["[\"64fc294db670ac5881ff1574fd6ef294\", [16, 256, 28, 28], [], [16, 1, 28, 28]]", "cuda -keys=cuda,gpu -arch=sm_80 -max_num_threads=1024 -thread_warp_size=32", [-1, 16, 64, 49152, 2147483647, 1024, 8, 32], "llvm -keys=cpu ", 0, []], [[], [["CI", 5], ["CI", 3], ["CI", 2], ["FU", 6, [0, 1, 2, 3]], ["SP", 6, 0, 12544, [1], 1], ["AN", 6, 0, 5], ["AN", 6, 1, 6], ["FU", 4, [0, 1, 2, 3]], ["SP", 4, 0, 12544, [8], 1], ["AN", 4, 0, 5], ["AN", 4, 1, 6], ["PR", 4, 0, "auto_unroll_max_step$0"]]]], "r": [[0.000127195], 0, 1.03488, 1709600097], "v": "v0.6"}
{"i": [["[\"64fc294db670ac5881ff1574fd6ef294\", [16, 256, 28, 28], [], [16, 1, 28, 28]]", "cuda -keys=cuda,gpu -arch=sm_80 -max_num_threads=1024 -thread_warp_size=32", [-1, 16, 64, 49152, 2147483647, 1024, 8, 32], "llvm -keys=cpu ", 0, []], [[], [["CI", 5], ["CI", 3], ["CI", 2], ["FU", 6, [0, 1, 2, 3]], ["SP", 6, 0, 12544, [64], 1], ["AN", 6, 0, 5], ["AN", 6, 1, 6], ["FU", 4, [0, 1, 2, 3]], ["SP", 4, 0, 12544, [8], 1], ["AN", 4, 0, 5], ["AN", 4, 1, 6], ["PR", 4, 0, "auto_unroll_max_step$16"]]]], "r": [[0.000118155], 0, 0.987841, 1709600098], "v": "v0.6"}
{"i": [["[\"64fc294db670ac5881ff1574fd6ef294\", [16, 256, 28, 28], [], [16, 1, 28, 28]]", "cuda -keys=cuda,gpu -arch=sm_80 -max_num_threads=1024 -thread_warp_size=32", [-1, 16, 64, 49152, 2147483647, 1024, 8, 32], "llvm -keys=cpu ", 0, []], [[], [["CI", 5], ["CI", 3], ["CI", 2], ["FU", 6, [0, 1, 2, 3]], ["SP", 6, 0, 12544, [1], 1], ["AN", 6, 0, 5], ["AN", 6, 1, 6], ["FU", 4, [0, 1, 2, 3]], ["SP", 4, 0, 12544, [2], 1], ["AN", 4, 0, 5], ["AN", 4, 1, 6], ["PR", 4, 0, "auto_unroll_max_step$0"]]]], "r": [[0.000334351], 0, 1.03106, 1709600098], "v": "v0.6"}
{"i": [["[\"64fc294db670ac5881ff1574fd6ef294\", [16, 256, 28, 28], [], [16, 1, 28, 28]]", "cuda -keys=cuda,gpu -arch=sm_80 -max_num_threads=1024 -thread_warp_size=32", [-1, 16, 64, 49152, 2147483647, 1024, 8, 32], "llvm -keys=cpu ", 0, []], [[], [["CI", 5], ["SP", 6, 3, 28, [1], 1], ["AN", 6, 4, 6], ["FSP", 4, 4, 1, 1], ["AN", 4, 5, 6], ["CA", 4, 6, 3], ["CI", 3], ["CI", 2], ["FU", 6, [0, 1, 2, 3]], ["AN", 6, 0, 5], ["PR", 4, 0, "auto_unroll_max_step$1024"]]]], "r": [[0.00086814], 0, 3.7302, 1709600098], "v": "v0.6"}
{"i": [["[\"64fc294db670ac5881ff1574fd6ef294\", [16, 256, 28, 28], [], [16, 1, 28, 28]]", "cuda -keys=cuda,gpu -arch=sm_80 -max_num_threads=1024 -thread_warp_size=32", [-1, 16, 64, 49152, 2147483647, 1024, 8, 32], "llvm -keys=cpu ", 0, []], [[], [["CI", 5], ["SP", 6, 3, 28, [1], 1], ["AN", 6, 4, 6], ["FSP", 4, 4, 1, 1], ["AN", 4, 5, 6], ["CA", 4, 6, 3], ["CI", 3], ["CI", 2], ["FU", 6, [0, 1, 2, 3]], ["AN", 6, 0, 5], ["PR", 4, 0, "auto_unroll_max_step$64"]]]], "r": [[0.000580454], 0, 0.86983, 1709600099], "v": "v0.6"}
{"i": [["[\"64fc294db670ac5881ff1574fd6ef294\", [16, 256, 28, 28], [], [16, 1, 28, 28]]", "cuda -keys=cuda,gpu -arch=sm_80 -max_num_threads=1024 -thread_warp_size=32", [-1, 16, 64, 49152, 2147483647, 1024, 8, 32], "llvm -keys=cpu ", 0, []], [[], [["CI", 5], ["CI", 3], ["CI", 2], ["FU", 6, [0, 1, 2, 3]], ["SP", 6, 0, 12544, [4], 1], ["AN", 6, 0, 5], ["AN", 6, 1, 6], ["FU", 4, [0, 1, 2, 3]], ["SP", 4, 0, 12544, [64], 1], ["AN", 4, 0, 5], ["AN", 4, 1, 6], ["PR", 4, 0, "auto_unroll_max_step$64"]]]], "r": [[0.00011067], 0, 1.01037, 1709600099], "v": "v0.6"}
{"i": [["[\"64fc294db670ac5881ff1574fd6ef294\", [16, 256, 28, 28], [], [16, 1, 28, 28]]", "cuda -keys=cuda,gpu -arch=sm_80 -max_num_threads=1024 -thread_warp_size=32", [-1, 16, 64, 49152, 2147483647, 1024, 8, 32], "llvm -keys=cpu ", 0, []], [[], [["CI", 5], ["CI", 3], ["CI", 2], ["FU", 6, [0, 1, 2, 3]], ["SP", 6, 0, 12544, [64], 1], ["AN", 6, 0, 5], ["AN", 6, 1, 6], ["FU", 4, [0, 1, 2, 3]], ["SP", 4, 0, 12544, [1], 1], ["AN", 4, 0, 5], ["AN", 4, 1, 6], ["PR", 4, 0, "auto_unroll_max_step$64"]]]], "r": [[0.000707534], 0, 0.860074, 1709600099], "v": "v0.6"}
{"i": [["[\"64fc294db670ac5881ff1574fd6ef294\", [16, 256, 28, 28], [], [16, 1, 28, 28]]", "cuda -keys=cuda,gpu -arch=sm_80 -max_num_threads=1024 -thread_warp_size=32", [-1, 16, 64, 49152, 2147483647, 1024, 8, 32], "llvm -keys=cpu ", 0, []], [[], [["CI", 5], ["CI", 3], ["CI", 2], ["FU", 6, [0, 1, 2, 3]], ["SP", 6, 0, 12544, [16], 1], ["AN", 6, 0, 5], ["AN", 6, 1, 6], ["FU", 4, [0, 1, 2, 3]], ["SP", 4, 0, 12544, [64], 1], ["AN", 4, 0, 5], ["AN", 4, 1, 6], ["PR", 4, 0, "auto_unroll_max_step$0"]]]], "r": [[0.000108969], 0, 1.03996, 1709600100], "v": "v0.6"}
{"i": [["[\"64fc294db670ac5881ff1574fd6ef294\", [16, 256, 28, 28], [], [16, 1, 28, 28]]", "cuda -keys=cuda,gpu -arch=sm_80 -max_num_threads=1024 -thread_warp_size=32", [-1, 16, 64, 49152, 2147483647, 1024, 8, 32], "llvm -keys=cpu ", 0, []], [[], [["CI", 5], ["CI", 3], ["CI", 2], ["FU", 6, [0, 1, 2, 3]], ["SP", 6, 0, 12544, [16], 1], ["AN", 6, 0, 5], ["AN", 6, 1, 6], ["FU", 4, [0, 1, 2, 3]], ["SP", 4, 0, 12544, [4], 1], ["AN", 4, 0, 5], ["AN", 4, 1, 6], ["PR", 4, 0, "auto_unroll_max_step$1024"]]]], "r": [[0.000189709], 0, 0.988936, 1709600100], "v": "v0.6"}
{"i": [["[\"64fc294db670ac5881ff1574fd6ef294\", [16, 256, 28, 28], [], [16, 1, 28, 28]]", "cuda -keys=cuda,gpu -arch=sm_80 -max_num_threads=1024 -thread_warp_size=32", [-1, 16, 64, 49152, 2147483647, 1024, 8, 32], "llvm -keys=cpu ", 0, []], [[], [["CI", 5], ["SP", 6, 3, 28, [28], 1], ["AN", 6, 4, 6], ["FSP", 4, 4, 1, 1], ["AN", 4, 5, 6], ["CA", 4, 6, 3], ["CI", 3], ["CI", 2], ["FU", 6, [0, 1, 2, 3]], ["AN", 6, 0, 5], ["PR", 4, 0, "auto_unroll_max_step$64"]]]], "r": [[0.000114826], 0, 1.10363, 1709600100], "v": "v0.6"}
{"i": [["[\"64fc294db670ac5881ff1574fd6ef294\", [16, 256, 28, 28], [], [16, 1, 28, 28]]", "cuda -keys=cuda,gpu -arch=sm_80 -max_num_threads=1024 -thread_warp_size=32", [-1, 16, 64, 49152, 2147483647, 1024, 8, 32], "llvm -keys=cpu ", 0, []], [[], [["CI", 5], ["CI", 3], ["CI", 2], ["FU", 6, [0, 1, 2, 3]], ["SP", 6, 0, 12544, [8], 1], ["AN", 6, 0, 5], ["AN", 6, 1, 6], ["FU", 4, [0, 1, 2, 3]], ["SP", 4, 0, 12544, [4], 1], ["AN", 4, 0, 5], ["AN", 4, 1, 6], ["PR", 4, 0, "auto_unroll_max_step$16"]]]], "r": [[0.00019044], 0, 0.999261, 1709600101], "v": "v0.6"}
{"i": [["[\"64fc294db670ac5881ff1574fd6ef294\", [16, 256, 28, 28], [], [16, 1, 28, 28]]", "cuda -keys=cuda,gpu -arch=sm_80 -max_num_threads=1024 -thread_warp_size=32", [-1, 16, 64, 49152, 2147483647, 1024, 8, 32], "llvm -keys=cpu ", 0, []], [[], [["CI", 5], ["SP", 6, 3, 28, [16], 1], ["AN", 6, 4, 6], ["FSP", 4, 4, 1, 1], ["AN", 4, 5, 6], ["CA", 4, 6, 3], ["CI", 3], ["CI", 2], ["FU", 6, [0, 1, 2, 3]], ["AN", 6, 0, 5], ["PR", 4, 0, "auto_unroll_max_step$16"]]]], "r": [[0.000113564], 0, 1.17807, 1709600101], "v": "v0.6"}
{"i": [["[\"64fc294db670ac5881ff1574fd6ef294\", [16, 256, 28, 28], [], [16, 1, 28, 28]]", "cuda -keys=cuda,gpu -arch=sm_80 -max_num_threads=1024 -thread_warp_size=32", [-1, 16, 64, 49152, 2147483647, 1024, 8, 32], "llvm -keys=cpu ", 0, []], [[], [["CI", 5], ["CI", 3], ["CI", 2], ["FU", 6, [0, 1, 2, 3]], ["SP", 6, 0, 12544, [32], 1], ["AN", 6, 0, 5], ["AN", 6, 1, 6], ["FU", 4, [0, 1, 2, 3]], ["SP", 4, 0, 12544, [16], 1], ["AN", 4, 0, 5], ["AN", 4, 1, 6], ["PR", 4, 0, "auto_unroll_max_step$0"]]]], "r": [[0.000107729], 0, 0.979759, 1709600102], "v": "v0.6"}
{"i": [["[\"64fc294db670ac5881ff1574fd6ef294\", [16, 256, 28, 28], [], [16, 1, 28, 28]]", "cuda -keys=cuda,gpu -arch=sm_80 -max_num_threads=1024 -thread_warp_size=32", [-1, 16, 64, 49152, 2147483647, 1024, 8, 32], "llvm -keys=cpu ", 0, []], [[], [["CI", 5], ["CI", 3], ["CI", 2], ["FU", 6, [0, 1, 2, 3]], ["SP", 6, 0, 12544, [49], 1], ["AN", 6, 0, 5], ["AN", 6, 1, 6], ["FU", 4, [0, 1, 2, 3]], ["SP", 4, 0, 12544, [32], 1], ["AN", 4, 0, 5], ["AN", 4, 1, 6], ["PR", 4, 0, "auto_unroll_max_step$0"]]]], "r": [[0.000101273], 0, 1.04599, 1709600102], "v": "v0.6"}
{"i": [["[\"64fc294db670ac5881ff1574fd6ef294\", [16, 256, 28, 28], [], [16, 1, 28, 28]]", "cuda -keys=cuda,gpu -arch=sm_80 -max_num_threads=1024 -thread_warp_size=32", [-1, 16, 64, 49152, 2147483647, 1024, 8, 32], "llvm -keys=cpu ", 0, []], [[], [["CI", 5], ["CI", 3], ["CI", 2], ["FU", 6, [0, 1, 2, 3]], ["SP", 6, 0, 12544, [4], 1], ["AN", 6, 0, 5], ["AN", 6, 1, 6], ["FU", 4, [0, 1, 2, 3]], ["SP", 4, 0, 12544, [64], 1], ["AN", 4, 0, 5], ["AN", 4, 1, 6], ["PR", 4, 0, "auto_unroll_max_step$512"]]]], "r": [[0.000110661], 0, 1.04329, 1709600103], "v": "v0.6"}
{"i": [["[\"64fc294db670ac5881ff1574fd6ef294\", [16, 256, 28, 28], [], [16, 1, 28, 28]]", "cuda -keys=cuda,gpu -arch=sm_80 -max_num_threads=1024 -thread_warp_size=32", [-1, 16, 64, 49152, 2147483647, 1024, 8, 32], "llvm -keys=cpu ", 0, []], [[], [["CI", 5], ["CI", 3], ["CI", 2], ["FU", 6, [0, 1, 2, 3]], ["SP", 6, 0, 12544, [32], 1], ["AN", 6, 0, 5], ["AN", 6, 1, 6], ["FU", 4, [0, 1, 2, 3]], ["SP", 4, 0, 12544, [32], 1], ["AN", 4, 0, 5], ["AN", 4, 1, 6], ["PR", 4, 0, "auto_unroll_max_step$16"]]]], "r": [[0.000101519], 0, 1.01664, 1709600103], "v": "v0.6"}
{"i": [["[\"64fc294db670ac5881ff1574fd6ef294\", [16, 256, 28, 28], [], [16, 1, 28, 28]]", "cuda -keys=cuda,gpu -arch=sm_80 -max_num_threads=1024 -thread_warp_size=32", [-1, 16, 64, 49152, 2147483647, 1024, 8, 32], "llvm -keys=cpu ", 0, []], [[], [["CI", 5], ["SP", 6, 3, 28, [32], 1], ["AN", 6, 4, 6], ["FSP", 4, 4, 1, 1], ["AN", 4, 5, 6], ["CA", 4, 6, 3], ["CI", 3], ["CI", 2], ["FU", 6, [0, 1, 2, 3]], ["AN", 6, 0, 5], ["PR", 4, 0, "auto_unroll_max_step$16"]]]], "r": [[9.59198e-05], 0, 1.10265, 1709600103], "v": "v0.6"}
{"i": [["[\"64fc294db670ac5881ff1574fd6ef294\", [16, 256, 28, 28], [], [16, 1, 28, 28]]", "cuda -keys=cuda,gpu -arch=sm_80 -max_num_threads=1024 -thread_warp_size=32", [-1, 16, 64, 49152, 2147483647, 1024, 8, 32], "llvm -keys=cpu ", 0, []], [[], [["CI", 5], ["CI", 3], ["CI", 2], ["FU", 6, [0, 1, 2, 3]], ["SP", 6, 0, 12544, [32], 1], ["AN", 6, 0, 5], ["AN", 6, 1, 6], ["FU", 4, [0, 1, 2, 3]], ["SP", 4, 0, 12544, [32], 1], ["AN", 4, 0, 5], ["AN", 4, 1, 6], ["PR", 4, 0, "auto_unroll_max_step$0"]]]], "r": [[0.000101316], 0, 0.976366, 1709600104], "v": "v0.6"}
{"i": [["[\"e626244ee8f5215994f59dd6fdf80d98\", [16, 256, 28, 28], [16, 1, 28, 28], [1, 256, 1, 1], [16, 1, 28, 28], [1, 256, 1, 1], [16, 256, 28, 28]]", "cuda -keys=cuda,gpu -arch=sm_80 -max_num_threads=1024 -thread_warp_size=32", [-1, 16, 64, 49152, 2147483647, 1024, 8, 32], "llvm -keys=cpu ", 0, []], [[], [["CI", 6], ["CI", 4], ["CI", 2], ["FU", 8, [0, 1, 2, 3]], ["SP", 8, 0, 3211264, [64], 1], ["AN", 8, 0, 5], ["AN", 8, 1, 6]]]], "r": [[4.95421e-05], 0, 1.35959, 1709600154], "v": "v0.6"}
{"i": [["[\"e626244ee8f5215994f59dd6fdf80d98\", [16, 256, 28, 28], [16, 1, 28, 28], [1, 256, 1, 1], [16, 1, 28, 28], [1, 256, 1, 1], [16, 256, 28, 28]]", "cuda -keys=cuda,gpu -arch=sm_80 -max_num_threads=1024 -thread_warp_size=32", [-1, 16, 64, 49152, 2147483647, 1024, 8, 32], "llvm -keys=cpu ", 0, []], [[], [["CI", 6], ["CI", 4], ["CI", 2], ["FU", 8, [0, 1, 2, 3]], ["SP", 8, 0, 3211264, [4], 1], ["AN", 8, 0, 5], ["AN", 8, 1, 6]]]], "r": [[0.000597553], 0, 1.04165, 1709600154], "v": "v0.6"}
{"i": [["[\"e626244ee8f5215994f59dd6fdf80d98\", [16, 256, 28, 28], [16, 1, 28, 28], [1, 256, 1, 1], [16, 1, 28, 28], [1, 256, 1, 1], [16, 256, 28, 28]]", "cuda -keys=cuda,gpu -arch=sm_80 -max_num_threads=1024 -thread_warp_size=32", [-1, 16, 64, 49152, 2147483647, 1024, 8, 32], "llvm -keys=cpu ", 0, []], [[], [["CI", 6], ["CI", 4], ["CI", 2], ["FU", 8, [0, 1, 2, 3]], ["SP", 8, 0, 3211264, [49], 1], ["AN", 8, 0, 5], ["AN", 8, 1, 6]]]], "r": [[5.1063e-05], 0, 1.03627, 1709600155], "v": "v0.6"}
{"i": [["[\"e626244ee8f5215994f59dd6fdf80d98\", [16, 256, 28, 28], [16, 1, 28, 28], [1, 256, 1, 1], [16, 1, 28, 28], [1, 256, 1, 1], [16, 256, 28, 28]]", "cuda -keys=cuda,gpu -arch=sm_80 -max_num_threads=1024 -thread_warp_size=32", [-1, 16, 64, 49152, 2147483647, 1024, 8, 32], "llvm -keys=cpu ", 0, []], [[], [["CI", 6], ["CI", 4], ["CI", 2], ["FU", 8, [0, 1, 2, 3]], ["SP", 8, 0, 3211264, [16], 1], ["AN", 8, 0, 5], ["AN", 8, 1, 6]]]], "r": [[0.000151557], 0, 1.04222, 1709600155], "v": "v0.6"}
{"i": [["[\"e626244ee8f5215994f59dd6fdf80d98\", [16, 256, 28, 28], [16, 1, 28, 28], [1, 256, 1, 1], [16, 1, 28, 28], [1, 256, 1, 1], [16, 256, 28, 28]]", "cuda -keys=cuda,gpu -arch=sm_80 -max_num_threads=1024 -thread_warp_size=32", [-1, 16, 64, 49152, 2147483647, 1024, 8, 32], "llvm -keys=cpu ", 0, []], [[], [["CI", 6], ["CI", 4], ["CI", 2], ["FU", 8, [0, 1, 2, 3]], ["SP", 8, 0, 3211264, [1], 1], ["AN", 8, 0, 5], ["AN", 8, 1, 6]]]], "r": [[0.00238202], 0, 0.883469, 1709600156], "v": "v0.6"}
{"i": [["[\"e626244ee8f5215994f59dd6fdf80d98\", [16, 256, 28, 28], [16, 1, 28, 28], [1, 256, 1, 1], [16, 1, 28, 28], [1, 256, 1, 1], [16, 256, 28, 28]]", "cuda -keys=cuda,gpu -arch=sm_80 -max_num_threads=1024 -thread_warp_size=32", [-1, 16, 64, 49152, 2147483647, 1024, 8, 32], "llvm -keys=cpu ", 0, []], [[], [["CI", 6], ["CI", 4], ["CI", 2], ["FU", 8, [0, 1, 2, 3]], ["SP", 8, 0, 3211264, [56], 1], ["AN", 8, 0, 5], ["AN", 8, 1, 6]]]], "r": [[4.50388e-05], 0, 1.02945, 1709600156], "v": "v0.6"}
{"i": [["[\"e626244ee8f5215994f59dd6fdf80d98\", [16, 256, 28, 28], [16, 1, 28, 28], [1, 256, 1, 1], [16, 1, 28, 28], [1, 256, 1, 1], [16, 256, 28, 28]]", "cuda -keys=cuda,gpu -arch=sm_80 -max_num_threads=1024 -thread_warp_size=32", [-1, 16, 64, 49152, 2147483647, 1024, 8, 32], "llvm -keys=cpu ", 0, []], [[], [["CI", 6], ["CI", 4], ["CI", 2], ["FU", 8, [0, 1, 2, 3]], ["SP", 8, 0, 3211264, [2], 1], ["AN", 8, 0, 5], ["AN", 8, 1, 6]]]], "r": [[0.00119224], 0, 0.872916, 1709600156], "v": "v0.6"}
{"i": [["[\"e626244ee8f5215994f59dd6fdf80d98\", [16, 256, 28, 28], [16, 1, 28, 28], [1, 256, 1, 1], [16, 1, 28, 28], [1, 256, 1, 1], [16, 256, 28, 28]]", "cuda -keys=cuda,gpu -arch=sm_80 -max_num_threads=1024 -thread_warp_size=32", [-1, 16, 64, 49152, 2147483647, 1024, 8, 32], "llvm -keys=cpu ", 0, []], [[], [["CI", 6], ["CI", 4], ["CI", 2], ["FU", 8, [0, 1, 2, 3]], ["SP", 8, 0, 3211264, [7], 1], ["AN", 8, 0, 5], ["AN", 8, 1, 6]]]], "r": [[0.000342698], 0, 1.05333, 1709600157], "v": "v0.6"}
{"i": [["[\"e626244ee8f5215994f59dd6fdf80d98\", [16, 256, 28, 28], [16, 1, 28, 28], [1, 256, 1, 1], [16, 1, 28, 28], [1, 256, 1, 1], [16, 256, 28, 28]]", "cuda -keys=cuda,gpu -arch=sm_80 -max_num_threads=1024 -thread_warp_size=32", [-1, 16, 64, 49152, 2147483647, 1024, 8, 32], "llvm -keys=cpu ", 0, []], [[], [["CI", 6], ["CI", 4], ["CI", 2], ["FU", 8, [0, 1, 2, 3]], ["SP", 8, 0, 3211264, [32], 1], ["AN", 8, 0, 5], ["AN", 8, 1, 6]]]], "r": [[7.72793e-05], 0, 1.0242, 1709600157], "v": "v0.6"}
{"i": [["[\"e626244ee8f5215994f59dd6fdf80d98\", [16, 256, 28, 28], [16, 1, 28, 28], [1, 256, 1, 1], [16, 1, 28, 28], [1, 256, 1, 1], [16, 256, 28, 28]]", "cuda -keys=cuda,gpu -arch=sm_80 -max_num_threads=1024 -thread_warp_size=32", [-1, 16, 64, 49152, 2147483647, 1024, 8, 32], "llvm -keys=cpu ", 0, []], [[], [["CI", 6], ["CI", 4], ["CI", 2], ["FU", 8, [0, 1, 2, 3]], ["SP", 8, 0, 3211264, [14], 1], ["AN", 8, 0, 5], ["AN", 8, 1, 6]]]], "r": [[0.000172695], 0, 1.06027, 1709600158], "v": "v0.6"}
{"i": [["[\"e626244ee8f5215994f59dd6fdf80d98\", [16, 256, 28, 28], [16, 1, 28, 28], [1, 256, 1, 1], [16, 1, 28, 28], [1, 256, 1, 1], [16, 256, 28, 28]]", "cuda -keys=cuda,gpu -arch=sm_80 -max_num_threads=1024 -thread_warp_size=32", [-1, 16, 64, 49152, 2147483647, 1024, 8, 32], "llvm -keys=cpu ", 0, []], [[], [["CI", 6], ["CI", 4], ["CI", 2], ["FU", 8, [0, 1, 2, 3]], ["SP", 8, 0, 3211264, [8], 1], ["AN", 8, 0, 5], ["AN", 8, 1, 6]]]], "r": [[0.000300181], 0, 1.05732, 1709600159], "v": "v0.6"}
{"i": [["[\"e626244ee8f5215994f59dd6fdf80d98\", [16, 256, 28, 28], [16, 1, 28, 28], [1, 256, 1, 1], [16, 1, 28, 28], [1, 256, 1, 1], [16, 256, 28, 28]]", "cuda -keys=cuda,gpu -arch=sm_80 -max_num_threads=1024 -thread_warp_size=32", [-1, 16, 64, 49152, 2147483647, 1024, 8, 32], "llvm -keys=cpu ", 0, []], [[], [["CI", 6], ["CI", 4], ["CI", 2], ["FU", 8, [0, 1, 2, 3]], ["SP", 8, 0, 3211264, [28], 1], ["AN", 8, 0, 5], ["AN", 8, 1, 6]]]], "r": [[8.77101e-05], 0, 1.0548, 1709600159], "v": "v0.6"}
{"i": [["[\"74163f45f8ae062cfd50252b9c22bad8\", [16, 256, 28, 28], [16, 1, 28, 28]]", "cuda -keys=cuda,gpu -arch=sm_80 -max_num_threads=1024 -thread_warp_size=32", [-1, 16, 64, 49152, 2147483647, 1024, 8, 32], "llvm -keys=cpu ", 0, []], [[], [["CI", 3], ["CI", 1], ["FU", 4, [0, 1, 2, 3]], ["SP", 4, 0, 12544, [64], 1], ["AN", 4, 0, 5], ["AN", 4, 1, 6], ["FU", 2, [0, 1, 2, 3]], ["SP", 2, 0, 12544, [64], 1], ["AN", 2, 0, 5], ["AN", 2, 1, 6], ["PR", 2, 0, "auto_unroll_max_step$16"]]]], "r": [[1.21134e-05], 0, 1.30974, 1709600215], "v": "v0.6"}
{"i": [["[\"74163f45f8ae062cfd50252b9c22bad8\", [16, 256, 28, 28], [16, 1, 28, 28]]", "cuda -keys=cuda,gpu -arch=sm_80 -max_num_threads=1024 -thread_warp_size=32", [-1, 16, 64, 49152, 2147483647, 1024, 8, 32], "llvm -keys=cpu ", 0, []], [[], [["CI", 3], ["CI", 1], ["FU", 4, [0, 1, 2, 3]], ["SP", 4, 0, 12544, [1], 1], ["AN", 4, 0, 5], ["AN", 4, 1, 6], ["FU", 2, [0, 1, 2, 3]], ["SP", 2, 0, 12544, [1], 1], ["AN", 2, 0, 5], ["AN", 2, 1, 6], ["PR", 2, 0, "auto_unroll_max_step$512"]]]], "r": [[7.09395e-05], 0, 1.03078, 1709600216], "v": "v0.6"}
{"i": [["[\"74163f45f8ae062cfd50252b9c22bad8\", [16, 256, 28, 28], [16, 1, 28, 28]]", "cuda -keys=cuda,gpu -arch=sm_80 -max_num_threads=1024 -thread_warp_size=32", [-1, 16, 64, 49152, 2147483647, 1024, 8, 32], "llvm -keys=cpu ", 0, []], [[], [["CI", 3], ["SP", 4, 3, 28, [28], 1], ["AN", 4, 4, 6], ["FSP", 2, 4, 1, 1], ["AN", 2, 5, 6], ["CA", 2, 4, 3], ["CI", 1], ["FU", 4, [0, 1, 2, 3]], ["AN", 4, 0, 5], ["PR", 2, 0, "auto_unroll_max_step$0"]]]], "r": [[2.42262e-05], 0, 1.00801, 1709600216], "v": "v0.6"}
{"i": [["[\"74163f45f8ae062cfd50252b9c22bad8\", [16, 256, 28, 28], [16, 1, 28, 28]]", "cuda -keys=cuda,gpu -arch=sm_80 -max_num_threads=1024 -thread_warp_size=32", [-1, 16, 64, 49152, 2147483647, 1024, 8, 32], "llvm -keys=cpu ", 0, []], [[], [["CI", 3], ["CI", 1], ["FU", 4, [0, 1, 2, 3]], ["SP", 4, 0, 12544, [64], 1], ["AN", 4, 0, 5], ["AN", 4, 1, 6], ["FU", 2, [0, 1, 2, 3]], ["SP", 2, 0, 12544, [64], 1], ["AN", 2, 0, 5], ["AN", 2, 1, 6], ["PR", 2, 0, "auto_unroll_max_step$0"]]]], "r": [[9.78553e-06], 0, 0.979906, 1709600216], "v": "v0.6"}
{"i": [["[\"74163f45f8ae062cfd50252b9c22bad8\", [16, 256, 28, 28], [16, 1, 28, 28]]", "cuda -keys=cuda,gpu -arch=sm_80 -max_num_threads=1024 -thread_warp_size=32", [-1, 16, 64, 49152, 2147483647, 1024, 8, 32], "llvm -keys=cpu ", 0, []], [[], [["CI", 3], ["CI", 1], ["FU", 4, [0, 1, 2, 3]], ["SP", 4, 0, 12544, [2], 1], ["AN", 4, 0, 5], ["AN", 4, 1, 6], ["FU", 2, [0, 1, 2, 3]], ["SP", 2, 0, 12544, [1], 1], ["AN", 2, 0, 5], ["AN", 2, 1, 6], ["PR", 2, 0, "auto_unroll_max_step$0"]]]], "r": [[6.6291e-05], 0, 1.008, 1709600217], "v": "v0.6"}
{"i": [["[\"74163f45f8ae062cfd50252b9c22bad8\", [16, 256, 28, 28], [16, 1, 28, 28]]", "cuda -keys=cuda,gpu -arch=sm_80 -max_num_threads=1024 -thread_warp_size=32", [-1, 16, 64, 49152, 2147483647, 1024, 8, 32], "llvm -keys=cpu ", 0, []], [[], [["CI", 3], ["CI", 1], ["FU", 4, [0, 1, 2, 3]], ["SP", 4, 0, 12544, [4], 1], ["AN", 4, 0, 5], ["AN", 4, 1, 6], ["FU", 2, [0, 1, 2, 3]], ["SP", 2, 0, 12544, [16], 1], ["AN", 2, 0, 5], ["AN", 2, 1, 6], ["PR", 2, 0, "auto_unroll_max_step$512"]]]], "r": [[1.2247e-05], 0, 0.990252, 1709600217], "v": "v0.6"}
{"i": [["[\"74163f45f8ae062cfd50252b9c22bad8\", [16, 256, 28, 28], [16, 1, 28, 28]]", "cuda -keys=cuda,gpu -arch=sm_80 -max_num_threads=1024 -thread_warp_size=32", [-1, 16, 64, 49152, 2147483647, 1024, 8, 32], "llvm -keys=cpu ", 0, []], [[], [["CI", 3], ["SP", 4, 3, 28, [4], 1], ["AN", 4, 4, 6], ["FSP", 2, 4, 1, 1], ["AN", 2, 5, 6], ["CA", 2, 4, 3], ["CI", 1], ["FU", 4, [0, 1, 2, 3]], ["AN", 4, 0, 5], ["PR", 2, 0, "auto_unroll_max_step$64"]]]], "r": [[3.55066e-05], 0, 1.1133, 1709600218], "v": "v0.6"}
{"i": [["[\"74163f45f8ae062cfd50252b9c22bad8\", [16, 256, 28, 28], [16, 1, 28, 28]]", "cuda -keys=cuda,gpu -arch=sm_80 -max_num_threads=1024 -thread_warp_size=32", [-1, 16, 64, 49152, 2147483647, 1024, 8, 32], "llvm -keys=cpu ", 0, []], [[], [["CI", 3], ["CI", 1], ["FU", 4, [0, 1, 2, 3]], ["SP", 4, 0, 12544, [64], 1], ["AN", 4, 0, 5], ["AN", 4, 1, 6], ["FU", 2, [0, 1, 2, 3]], ["SP", 2, 0, 12544, [28], 1], ["AN", 2, 0, 5], ["AN", 2, 1, 6], ["PR", 2, 0, "auto_unroll_max_step$64"]]]], "r": [[9.11099e-06], 0, 0.951713, 1709600218], "v": "v0.6"}
{"i": [["[\"74163f45f8ae062cfd50252b9c22bad8\", [16, 256, 28, 28], [16, 1, 28, 28]]", "cuda -keys=cuda,gpu -arch=sm_80 -max_num_threads=1024 -thread_warp_size=32", [-1, 16, 64, 49152, 2147483647, 1024, 8, 32], "llvm -keys=cpu ", 0, []], [[], [["CI", 3], ["CI", 1], ["FU", 4, [0, 1, 2, 3]], ["SP", 4, 0, 12544, [32], 1], ["AN", 4, 0, 5], ["AN", 4, 1, 6], ["FU", 2, [0, 1, 2, 3]], ["SP", 2, 0, 12544, [7], 1], ["AN", 2, 0, 5], ["AN", 2, 1, 6], ["PR", 2, 0, "auto_unroll_max_step$0"]]]], "r": [[1.38984e-05], 0, 0.998219, 1709600218], "v": "v0.6"}
{"i": [["[\"74163f45f8ae062cfd50252b9c22bad8\", [16, 256, 28, 28], [16, 1, 28, 28]]", "cuda -keys=cuda,gpu -arch=sm_80 -max_num_threads=1024 -thread_warp_size=32", [-1, 16, 64, 49152, 2147483647, 1024, 8, 32], "llvm -keys=cpu ", 0, []], [[], [["CI", 3], ["CI", 1], ["FU", 4, [0, 1, 2, 3]], ["SP", 4, 0, 12544, [4], 1], ["AN", 4, 0, 5], ["AN", 4, 1, 6], ["FU", 2, [0, 1, 2, 3]], ["SP", 2, 0, 12544, [1], 1], ["AN", 2, 0, 5], ["AN", 2, 1, 6], ["PR", 2, 0, "auto_unroll_max_step$64"]]]], "r": [[6.39992e-05], 0, 1.00938, 1709600219], "v": "v0.6"}
{"i": [["[\"74163f45f8ae062cfd50252b9c22bad8\", [16, 256, 28, 28], [16, 1, 28, 28]]", "cuda -keys=cuda,gpu -arch=sm_80 -max_num_threads=1024 -thread_warp_size=32", [-1, 16, 64, 49152, 2147483647, 1024, 8, 32], "llvm -keys=cpu ", 0, []], [[], [["CI", 3], ["CI", 1], ["FU", 4, [0, 1, 2, 3]], ["SP", 4, 0, 12544, [1], 1], ["AN", 4, 0, 5], ["AN", 4, 1, 6], ["FU", 2, [0, 1, 2, 3]], ["SP", 2, 0, 12544, [64], 1], ["AN", 2, 0, 5], ["AN", 2, 1, 6], ["PR", 2, 0, "auto_unroll_max_step$0"]]]], "r": [[1.91869e-05], 0, 1.01965, 1709600219], "v": "v0.6"}
{"i": [["[\"74163f45f8ae062cfd50252b9c22bad8\", [16, 256, 28, 28], [16, 1, 28, 28]]", "cuda -keys=cuda,gpu -arch=sm_80 -max_num_threads=1024 -thread_warp_size=32", [-1, 16, 64, 49152, 2147483647, 1024, 8, 32], "llvm -keys=cpu ", 0, []], [[], [["CI", 3], ["CI", 1], ["FU", 4, [0, 1, 2, 3]], ["SP", 4, 0, 12544, [32], 1], ["AN", 4, 0, 5], ["AN", 4, 1, 6], ["FU", 2, [0, 1, 2, 3]], ["SP", 2, 0, 12544, [16], 1], ["AN", 2, 0, 5], ["AN", 2, 1, 6], ["PR", 2, 0, "auto_unroll_max_step$1024"]]]], "r": [[1.01122e-05], 0, 0.967944, 1709600220], "v": "v0.6"}
{"i": [["[\"74163f45f8ae062cfd50252b9c22bad8\", [16, 256, 28, 28], [16, 1, 28, 28]]", "cuda -keys=cuda,gpu -arch=sm_80 -max_num_threads=1024 -thread_warp_size=32", [-1, 16, 64, 49152, 2147483647, 1024, 8, 32], "llvm -keys=cpu ", 0, []], [[], [["CI", 3], ["CI", 1], ["FU", 4, [0, 1, 2, 3]], ["SP", 4, 0, 12544, [1], 1], ["AN", 4, 0, 5], ["AN", 4, 1, 6], ["FU", 2, [0, 1, 2, 3]], ["SP", 2, 0, 12544, [32], 1], ["AN", 2, 0, 5], ["AN", 2, 1, 6], ["PR", 2, 0, "auto_unroll_max_step$0"]]]], "r": [[1.78864e-05], 0, 1.02673, 1709600220], "v": "v0.6"}
{"i": [["[\"74163f45f8ae062cfd50252b9c22bad8\", [16, 256, 28, 28], [16, 1, 28, 28]]", "cuda -keys=cuda,gpu -arch=sm_80 -max_num_threads=1024 -thread_warp_size=32", [-1, 16, 64, 49152, 2147483647, 1024, 8, 32], "llvm -keys=cpu ", 0, []], [[], [["CI", 3], ["SP", 4, 3, 28, [8], 1], ["AN", 4, 4, 6], ["FSP", 2, 4, 1, 1], ["AN", 2, 5, 6], ["CA", 2, 4, 3], ["CI", 1], ["FU", 4, [0, 1, 2, 3]], ["AN", 4, 0, 5], ["PR", 2, 0, "auto_unroll_max_step$64"]]]], "r": [[3.55292e-05], 0, 1.09328, 1709600220], "v": "v0.6"}
{"i": [["[\"74163f45f8ae062cfd50252b9c22bad8\", [16, 256, 28, 28], [16, 1, 28, 28]]", "cuda -keys=cuda,gpu -arch=sm_80 -max_num_threads=1024 -thread_warp_size=32", [-1, 16, 64, 49152, 2147483647, 1024, 8, 32], "llvm -keys=cpu ", 0, []], [[], [["CI", 3], ["SP", 4, 3, 28, [1], 1], ["AN", 4, 4, 6], ["FSP", 2, 4, 1, 1], ["AN", 2, 5, 6], ["CA", 2, 4, 3], ["CI", 1], ["FU", 4, [0, 1, 2, 3]], ["AN", 4, 0, 5], ["PR", 2, 0, "auto_unroll_max_step$512"]]]], "r": [[4.90259e-05], 0, 1.34517, 1709600221], "v": "v0.6"}
{"i": [["[\"74163f45f8ae062cfd50252b9c22bad8\", [16, 256, 28, 28], [16, 1, 28, 28]]", "cuda -keys=cuda,gpu -arch=sm_80 -max_num_threads=1024 -thread_warp_size=32", [-1, 16, 64, 49152, 2147483647, 1024, 8, 32], "llvm -keys=cpu ", 0, []], [[], [["CI", 3], ["CI", 1], ["FU", 4, [0, 1, 2, 3]], ["SP", 4, 0, 12544, [1], 1], ["AN", 4, 0, 5], ["AN", 4, 1, 6], ["FU", 2, [0, 1, 2, 3]], ["SP", 2, 0, 12544, [64], 1], ["AN", 2, 0, 5], ["AN", 2, 1, 6], ["PR", 2, 0, "auto_unroll_max_step$1024"]]]], "r": [[1.91833e-05], 0, 1.00627, 1709600221], "v": "v0.6"}
{"i": [["[\"74163f45f8ae062cfd50252b9c22bad8\", [16, 256, 28, 28], [16, 1, 28, 28]]", "cuda -keys=cuda,gpu -arch=sm_80 -max_num_threads=1024 -thread_warp_size=32", [-1, 16, 64, 49152, 2147483647, 1024, 8, 32], "llvm -keys=cpu ", 0, []], [[], [["CI", 3], ["CI", 1], ["FU", 4, [0, 1, 2, 3]], ["SP", 4, 0, 12544, [2], 1], ["AN", 4, 0, 5], ["AN", 4, 1, 6], ["FU", 2, [0, 1, 2, 3]], ["SP", 2, 0, 12544, [32], 1], ["AN", 2, 0, 5], ["AN", 2, 1, 6], ["PR", 2, 0, "auto_unroll_max_step$1024"]]]], "r": [[1.32612e-05], 0, 1.02968, 1709600222], "v": "v0.6"}
{"i": [["[\"74163f45f8ae062cfd50252b9c22bad8\", [16, 256, 28, 28], [16, 1, 28, 28]]", "cuda -keys=cuda,gpu -arch=sm_80 -max_num_threads=1024 -thread_warp_size=32", [-1, 16, 64, 49152, 2147483647, 1024, 8, 32], "llvm -keys=cpu ", 0, []], [[], [["CI", 3], ["SP", 4, 3, 28, [14], 1], ["AN", 4, 4, 6], ["FSP", 2, 4, 1, 1], ["AN", 2, 5, 6], ["CA", 2, 4, 3], ["CI", 1], ["FU", 4, [0, 1, 2, 3]], ["AN", 4, 0, 5], ["PR", 2, 0, "auto_unroll_max_step$64"]]]], "r": [[3.21802e-05], 0, 1.02233, 1709600222], "v": "v0.6"}
{"i": [["[\"74163f45f8ae062cfd50252b9c22bad8\", [16, 256, 28, 28], [16, 1, 28, 28]]", "cuda -keys=cuda,gpu -arch=sm_80 -max_num_threads=1024 -thread_warp_size=32", [-1, 16, 64, 49152, 2147483647, 1024, 8, 32], "llvm -keys=cpu ", 0, []], [[], [["CI", 3], ["CI", 1], ["FU", 4, [0, 1, 2, 3]], ["SP", 4, 0, 12544, [2], 1], ["AN", 4, 0, 5], ["AN", 4, 1, 6], ["FU", 2, [0, 1, 2, 3]], ["SP", 2, 0, 12544, [2], 1], ["AN", 2, 0, 5], ["AN", 2, 1, 6], ["PR", 2, 0, "auto_unroll_max_step$64"]]]], "r": [[3.46216e-05], 0, 1.00472, 1709600222], "v": "v0.6"}
{"i": [["[\"74163f45f8ae062cfd50252b9c22bad8\", [16, 256, 28, 28], [16, 1, 28, 28]]", "cuda -keys=cuda,gpu -arch=sm_80 -max_num_threads=1024 -thread_warp_size=32", [-1, 16, 64, 49152, 2147483647, 1024, 8, 32], "llvm -keys=cpu ", 0, []], [[], [["CI", 3], ["CI", 1], ["FU", 4, [0, 1, 2, 3]], ["SP", 4, 0, 12544, [32], 1], ["AN", 4, 0, 5], ["AN", 4, 1, 6], ["FU", 2, [0, 1, 2, 3]], ["SP", 2, 0, 12544, [28], 1], ["AN", 2, 0, 5], ["AN", 2, 1, 6], ["PR", 2, 0, "auto_unroll_max_step$512"]]]], "r": [[9.09599e-06], 0, 1.0123, 1709600223], "v": "v0.6"}
{"i": [["[\"74163f45f8ae062cfd50252b9c22bad8\", [16, 256, 28, 28], [16, 1, 28, 28]]", "cuda -keys=cuda,gpu -arch=sm_80 -max_num_threads=1024 -thread_warp_size=32", [-1, 16, 64, 49152, 2147483647, 1024, 8, 32], "llvm -keys=cpu ", 0, []], [[], [["CI", 3], ["SP", 4, 3, 28, [1], 1], ["AN", 4, 4, 6], ["FSP", 2, 4, 1, 1], ["AN", 2, 5, 6], ["CA", 2, 4, 3], ["CI", 1], ["FU", 4, [0, 1, 2, 3]], ["AN", 4, 0, 5], ["PR", 2, 0, "auto_unroll_max_step$1024"]]]], "r": [[4.90155e-05], 0, 1.41273, 1709600223], "v": "v0.6"}
{"i": [["[\"74163f45f8ae062cfd50252b9c22bad8\", [16, 256, 28, 28], [16, 1, 28, 28]]", "cuda -keys=cuda,gpu -arch=sm_80 -max_num_threads=1024 -thread_warp_size=32", [-1, 16, 64, 49152, 2147483647, 1024, 8, 32], "llvm -keys=cpu ", 0, []], [[], [["CI", 3], ["CI", 1], ["FU", 4, [0, 1, 2, 3]], ["SP", 4, 0, 12544, [64], 1], ["AN", 4, 0, 5], ["AN", 4, 1, 6], ["FU", 2, [0, 1, 2, 3]], ["SP", 2, 0, 12544, [1], 1], ["AN", 2, 0, 5], ["AN", 2, 1, 6], ["PR", 2, 0, "auto_unroll_max_step$512"]]]], "r": [[6.1955e-05], 0, 1.04155, 1709600224], "v": "v0.6"}
{"i": [["[\"74163f45f8ae062cfd50252b9c22bad8\", [16, 256, 28, 28], [16, 1, 28, 28]]", "cuda -keys=cuda,gpu -arch=sm_80 -max_num_threads=1024 -thread_warp_size=32", [-1, 16, 64, 49152, 2147483647, 1024, 8, 32], "llvm -keys=cpu ", 0, []], [[], [["CI", 3], ["CI", 1], ["FU", 4, [0, 1, 2, 3]], ["SP", 4, 0, 12544, [28], 1], ["AN", 4, 0, 5], ["AN", 4, 1, 6], ["FU", 2, [0, 1, 2, 3]], ["SP", 2, 0, 12544, [4], 1], ["AN", 2, 0, 5], ["AN", 2, 1, 6], ["PR", 2, 0, "auto_unroll_max_step$64"]]]], "r": [[1.89182e-05], 0, 1.03577, 1709600224], "v": "v0.6"}
{"i": [["[\"74163f45f8ae062cfd50252b9c22bad8\", [16, 256, 28, 28], [16, 1, 28, 28]]", "cuda -keys=cuda,gpu -arch=sm_80 -max_num_threads=1024 -thread_warp_size=32", [-1, 16, 64, 49152, 2147483647, 1024, 8, 32], "llvm -keys=cpu ", 0, []], [[], [["CI", 3], ["CI", 1], ["FU", 4, [0, 1, 2, 3]], ["SP", 4, 0, 12544, [16], 1], ["AN", 4, 0, 5], ["AN", 4, 1, 6], ["FU", 2, [0, 1, 2, 3]], ["SP", 2, 0, 12544, [28], 1], ["AN", 2, 0, 5], ["AN", 2, 1, 6], ["PR", 2, 0, "auto_unroll_max_step$1024"]]]], "r": [[9.33005e-06], 0, 0.980903, 1709600224], "v": "v0.6"}
{"i": [["[\"74163f45f8ae062cfd50252b9c22bad8\", [16, 256, 28, 28], [16, 1, 28, 28]]", "cuda -keys=cuda,gpu -arch=sm_80 -max_num_threads=1024 -thread_warp_size=32", [-1, 16, 64, 49152, 2147483647, 1024, 8, 32], "llvm -keys=cpu ", 0, []], [[], [["CI", 3], ["CI", 1], ["FU", 4, [0, 1, 2, 3]], ["SP", 4, 0, 12544, [4], 1], ["AN", 4, 0, 5], ["AN", 4, 1, 6], ["FU", 2, [0, 1, 2, 3]], ["SP", 2, 0, 12544, [32], 1], ["AN", 2, 0, 5], ["AN", 2, 1, 6], ["PR", 2, 0, "auto_unroll_max_step$1024"]]]], "r": [[1.09023e-05], 0, 0.987103, 1709600225], "v": "v0.6"}
{"i": [["[\"74163f45f8ae062cfd50252b9c22bad8\", [16, 256, 28, 28], [16, 1, 28, 28]]", "cuda -keys=cuda,gpu -arch=sm_80 -max_num_threads=1024 -thread_warp_size=32", [-1, 16, 64, 49152, 2147483647, 1024, 8, 32], "llvm -keys=cpu ", 0, []], [[], [["CI", 3], ["CI", 1], ["FU", 4, [0, 1, 2, 3]], ["SP", 4, 0, 12544, [64], 1], ["AN", 4, 0, 5], ["AN", 4, 1, 6], ["FU", 2, [0, 1, 2, 3]], ["SP", 2, 0, 12544, [4], 1], ["AN", 2, 0, 5], ["AN", 2, 1, 6], ["PR", 2, 0, "auto_unroll_max_step$0"]]]], "r": [[1.88128e-05], 0, 0.999108, 1709600225], "v": "v0.6"}
{"i": [["[\"74163f45f8ae062cfd50252b9c22bad8\", [16, 256, 28, 28], [16, 1, 28, 28]]", "cuda -keys=cuda,gpu -arch=sm_80 -max_num_threads=1024 -thread_warp_size=32", [-1, 16, 64, 49152, 2147483647, 1024, 8, 32], "llvm -keys=cpu ", 0, []], [[], [["CI", 3], ["CI", 1], ["FU", 4, [0, 1, 2, 3]], ["SP", 4, 0, 12544, [2], 1], ["AN", 4, 0, 5], ["AN", 4, 1, 6], ["FU", 2, [0, 1, 2, 3]], ["SP", 2, 0, 12544, [2], 1], ["AN", 2, 0, 5], ["AN", 2, 1, 6], ["PR", 2, 0, "auto_unroll_max_step$1024"]]]], "r": [[3.46395e-05], 0, 1.0092, 1709600226], "v": "v0.6"}
{"i": [["[\"74163f45f8ae062cfd50252b9c22bad8\", [16, 256, 28, 28], [16, 1, 28, 28]]", "cuda -keys=cuda,gpu -arch=sm_80 -max_num_threads=1024 -thread_warp_size=32", [-1, 16, 64, 49152, 2147483647, 1024, 8, 32], "llvm -keys=cpu ", 0, []], [[], [["CI", 3], ["SP", 4, 3, 28, [14], 1], ["AN", 4, 4, 6], ["FSP", 2, 4, 1, 1], ["AN", 2, 5, 6], ["CA", 2, 4, 3], ["CI", 1], ["FU", 4, [0, 1, 2, 3]], ["AN", 4, 0, 5], ["PR", 2, 0, "auto_unroll_max_step$16"]]]], "r": [[3.14777e-05], 0, 1.01339, 1709600226], "v": "v0.6"}
{"i": [["[\"74163f45f8ae062cfd50252b9c22bad8\", [16, 256, 28, 28], [16, 1, 28, 28]]", "cuda -keys=cuda,gpu -arch=sm_80 -max_num_threads=1024 -thread_warp_size=32", [-1, 16, 64, 49152, 2147483647, 1024, 8, 32], "llvm -keys=cpu ", 0, []], [[], [["CI", 3], ["SP", 4, 3, 28, [2], 1], ["AN", 4, 4, 6], ["FSP", 2, 4, 1, 1], ["AN", 2, 5, 6], ["CA", 2, 4, 3], ["CI", 1], ["FU", 4, [0, 1, 2, 3]], ["AN", 4, 0, 5], ["PR", 2, 0, "auto_unroll_max_step$16"]]]], "r": [[3.53032e-05], 0, 1.04868, 1709600226], "v": "v0.6"}
{"i": [["[\"74163f45f8ae062cfd50252b9c22bad8\", [16, 256, 28, 28], [16, 1, 28, 28]]", "cuda -keys=cuda,gpu -arch=sm_80 -max_num_threads=1024 -thread_warp_size=32", [-1, 16, 64, 49152, 2147483647, 1024, 8, 32], "llvm -keys=cpu ", 0, []], [[], [["CI", 3], ["CI", 1], ["FU", 4, [0, 1, 2, 3]], ["SP", 4, 0, 12544, [2], 1], ["AN", 4, 0, 5], ["AN", 4, 1, 6], ["FU", 2, [0, 1, 2, 3]], ["SP", 2, 0, 12544, [16], 1], ["AN", 2, 0, 5], ["AN", 2, 1, 6], ["PR", 2, 0, "auto_unroll_max_step$64"]]]], "r": [[1.45896e-05], 0, 1.01961, 1709600227], "v": "v0.6"}
{"i": [["[\"74163f45f8ae062cfd50252b9c22bad8\", [16, 256, 28, 28], [16, 1, 28, 28]]", "cuda -keys=cuda,gpu -arch=sm_80 -max_num_threads=1024 -thread_warp_size=32", [-1, 16, 64, 49152, 2147483647, 1024, 8, 32], "llvm -keys=cpu ", 0, []], [[], [["CI", 3], ["CI", 1], ["FU", 4, [0, 1, 2, 3]], ["SP", 4, 0, 12544, [4], 1], ["AN", 4, 0, 5], ["AN", 4, 1, 6], ["FU", 2, [0, 1, 2, 3]], ["SP", 2, 0, 12544, [2], 1], ["AN", 2, 0, 5], ["AN", 2, 1, 6], ["PR", 2, 0, "auto_unroll_max_step$16"]]]], "r": [[3.23564e-05], 0, 1.03825, 1709600227], "v": "v0.6"}
{"i": [["[\"74163f45f8ae062cfd50252b9c22bad8\", [16, 256, 28, 28], [16, 1, 28, 28]]", "cuda -keys=cuda,gpu -arch=sm_80 -max_num_threads=1024 -thread_warp_size=32", [-1, 16, 64, 49152, 2147483647, 1024, 8, 32], "llvm -keys=cpu ", 0, []], [[], [["CI", 3], ["SP", 4, 3, 28, [28], 1], ["AN", 4, 4, 6], ["FSP", 2, 4, 1, 1], ["AN", 2, 5, 6], ["CA", 2, 4, 3], ["CI", 1], ["FU", 4, [0, 1, 2, 3]], ["AN", 4, 0, 5], ["PR", 2, 0, "auto_unroll_max_step$16"]]]], "r": [[2.31317e-05], 0, 1.00453, 1709600228], "v": "v0.6"}
{"i": [["[\"74163f45f8ae062cfd50252b9c22bad8\", [16, 256, 28, 28], [16, 1, 28, 28]]", "cuda -keys=cuda,gpu -arch=sm_80 -max_num_threads=1024 -thread_warp_size=32", [-1, 16, 64, 49152, 2147483647, 1024, 8, 32], "llvm -keys=cpu ", 0, []], [[], [["CI", 3], ["CI", 1], ["FU", 4, [0, 1, 2, 3]], ["SP", 4, 0, 12544, [64], 1], ["AN", 4, 0, 5], ["AN", 4, 1, 6], ["FU", 2, [0, 1, 2, 3]], ["SP", 2, 0, 12544, [64], 1], ["AN", 2, 0, 5], ["AN", 2, 1, 6], ["PR", 2, 0, "auto_unroll_max_step$1024"]]]], "r": [[9.99417e-06], 0, 0.967148, 1709600228], "v": "v0.6"}
{"i": [["[\"74163f45f8ae062cfd50252b9c22bad8\", [16, 256, 28, 28], [16, 1, 28, 28]]", "cuda -keys=cuda,gpu -arch=sm_80 -max_num_threads=1024 -thread_warp_size=32", [-1, 16, 64, 49152, 2147483647, 1024, 8, 32], "llvm -keys=cpu ", 0, []], [[], [["CI", 3], ["CI", 1], ["FU", 4, [0, 1, 2, 3]], ["SP", 4, 0, 12544, [64], 1], ["AN", 4, 0, 5], ["AN", 4, 1, 6], ["FU", 2, [0, 1, 2, 3]], ["SP", 2, 0, 12544, [2], 1], ["AN", 2, 0, 5], ["AN", 2, 1, 6], ["PR", 2, 0, "auto_unroll_max_step$0"]]]], "r": [[3.03823e-05], 0, 0.998943, 1709600228], "v": "v0.6"}
{"i": [["[\"74163f45f8ae062cfd50252b9c22bad8\", [16, 256, 28, 28], [16, 1, 28, 28]]", "cuda -keys=cuda,gpu -arch=sm_80 -max_num_threads=1024 -thread_warp_size=32", [-1, 16, 64, 49152, 2147483647, 1024, 8, 32], "llvm -keys=cpu ", 0, []], [[], [["CI", 3], ["SP", 4, 3, 28, [3], 1], ["AN", 4, 4, 6], ["FSP", 2, 4, 1, 1], ["AN", 2, 5, 6], ["CA", 2, 4, 3], ["CI", 1], ["FU", 4, [0, 1, 2, 3]], ["AN", 4, 0, 5], ["PR", 2, 0, "auto_unroll_max_step$0"]]]], "r": [[4.12675e-05], 0, 1.10759, 1709600229], "v": "v0.6"}
{"i": [["[\"74163f45f8ae062cfd50252b9c22bad8\", [16, 256, 28, 28], [16, 1, 28, 28]]", "cuda -keys=cuda,gpu -arch=sm_80 -max_num_threads=1024 -thread_warp_size=32", [-1, 16, 64, 49152, 2147483647, 1024, 8, 32], "llvm -keys=cpu ", 0, []], [[], [["CI", 3], ["CI", 1], ["FU", 4, [0, 1, 2, 3]], ["SP", 4, 0, 12544, [32], 1], ["AN", 4, 0, 5], ["AN", 4, 1, 6], ["FU", 2, [0, 1, 2, 3]], ["SP", 2, 0, 12544, [64], 1], ["AN", 2, 0, 5], ["AN", 2, 1, 6], ["PR", 2, 0, "auto_unroll_max_step$512"]]]], "r": [[9.91977e-06], 0, 0.960541, 1709600229], "v": "v0.6"}
{"i": [["[\"74163f45f8ae062cfd50252b9c22bad8\", [16, 256, 28, 28], [16, 1, 28, 28]]", "cuda -keys=cuda,gpu -arch=sm_80 -max_num_threads=1024 -thread_warp_size=32", [-1, 16, 64, 49152, 2147483647, 1024, 8, 32], "llvm -keys=cpu ", 0, []], [[], [["CI", 3], ["CI", 1], ["FU", 4, [0, 1, 2, 3]], ["SP", 4, 0, 12544, [16], 1], ["AN", 4, 0, 5], ["AN", 4, 1, 6], ["FU", 2, [0, 1, 2, 3]], ["SP", 2, 0, 12544, [64], 1], ["AN", 2, 0, 5], ["AN", 2, 1, 6], ["PR", 2, 0, "auto_unroll_max_step$1024"]]]], "r": [[1.01923e-05], 0, 1.00396, 1709600230], "v": "v0.6"}
{"i": [["[\"74163f45f8ae062cfd50252b9c22bad8\", [16, 256, 28, 28], [16, 1, 28, 28]]", "cuda -keys=cuda,gpu -arch=sm_80 -max_num_threads=1024 -thread_warp_size=32", [-1, 16, 64, 49152, 2147483647, 1024, 8, 32], "llvm -keys=cpu ", 0, []], [[], [["CI", 3], ["CI", 1], ["FU", 4, [0, 1, 2, 3]], ["SP", 4, 0, 12544, [32], 1], ["AN", 4, 0, 5], ["AN", 4, 1, 6], ["FU", 2, [0, 1, 2, 3]], ["SP", 2, 0, 12544, [1], 1], ["AN", 2, 0, 5], ["AN", 2, 1, 6], ["PR", 2, 0, "auto_unroll_max_step$64"]]]], "r": [[6.19208e-05], 0, 0.996055, 1709600230], "v": "v0.6"}
{"i": [["[\"74163f45f8ae062cfd50252b9c22bad8\", [16, 256, 28, 28], [16, 1, 28, 28]]", "cuda -keys=cuda,gpu -arch=sm_80 -max_num_threads=1024 -thread_warp_size=32", [-1, 16, 64, 49152, 2147483647, 1024, 8, 32], "llvm -keys=cpu ", 0, []], [[], [["CI", 3], ["CI", 1], ["FU", 4, [0, 1, 2, 3]], ["SP", 4, 0, 12544, [1], 1], ["AN", 4, 0, 5], ["AN", 4, 1, 6], ["FU", 2, [0, 1, 2, 3]], ["SP", 2, 0, 12544, [32], 1], ["AN", 2, 0, 5], ["AN", 2, 1, 6], ["PR", 2, 0, "auto_unroll_max_step$64"]]]], "r": [[1.78875e-05], 0, 0.999013, 1709600230], "v": "v0.6"}
{"i": [["[\"74163f45f8ae062cfd50252b9c22bad8\", [16, 256, 28, 28], [16, 1, 28, 28]]", "cuda -keys=cuda,gpu -arch=sm_80 -max_num_threads=1024 -thread_warp_size=32", [-1, 16, 64, 49152, 2147483647, 1024, 8, 32], "llvm -keys=cpu ", 0, []], [[], [["CI", 3], ["CI", 1], ["FU", 4, [0, 1, 2, 3]], ["SP", 4, 0, 12544, [8], 1], ["AN", 4, 0, 5], ["AN", 4, 1, 6], ["FU", 2, [0, 1, 2, 3]], ["SP", 2, 0, 12544, [4], 1], ["AN", 2, 0, 5], ["AN", 2, 1, 6], ["PR", 2, 0, "auto_unroll_max_step$512"]]]], "r": [[1.97316e-05], 0, 0.969339, 1709600231], "v": "v0.6"}
