benchmark/subgraphs/resnet/tvm_ansor.log
{"i": [["[\"a440b35ba75b754caeba4a36289bc999\", [32, 1, 28, 28], [32, 1, 28, 28], [], [32, 1, 28, 28]]", "cuda -keys=cuda,gpu -arch=sm_80 -max_num_threads=1024 -thread_warp_size=32", [-1, 16, 64, 49152, 2147483647, 1024, 8, 32], "llvm -keys=cpu ", 0, []], [[], [["CI", 5], ["CI", 3], ["CI", 2], ["FU", 6, [0, 1, 2, 3]], ["SP", 6, 0, 25088, [8], 1], ["AN", 6, 0, 5], ["AN", 6, 1, 6]]]], "r": [[5.84435e-06], 0, 1.39093, 1701292808], "v": "v0.6"}
{"i": [["[\"a440b35ba75b754caeba4a36289bc999\", [32, 1, 28, 28], [32, 1, 28, 28], [], [32, 1, 28, 28]]", "cuda -keys=cuda,gpu -arch=sm_80 -max_num_threads=1024 -thread_warp_size=32", [-1, 16, 64, 49152, 2147483647, 1024, 8, 32], "llvm -keys=cpu ", 0, []], [[], [["CI", 5], ["CI", 3], ["CI", 2], ["FU", 6, [0, 1, 2, 3]], ["SP", 6, 0, 25088, [16], 1], ["AN", 6, 0, 5], ["AN", 6, 1, 6]]]], "r": [[3.76926e-06], 0, 0.884333, 1701292809], "v": "v0.6"}
{"i": [["[\"a440b35ba75b754caeba4a36289bc999\", [32, 1, 28, 28], [32, 1, 28, 28], [], [32, 1, 28, 28]]", "cuda -keys=cuda,gpu -arch=sm_80 -max_num_threads=1024 -thread_warp_size=32", [-1, 16, 64, 49152, 2147483647, 1024, 8, 32], "llvm -keys=cpu ", 0, []], [[], [["CI", 5], ["CI", 3], ["CI", 2], ["FU", 6, [0, 1, 2, 3]], ["SP", 6, 0, 25088, [2], 1], ["AN", 6, 0, 5], ["AN", 6, 1, 6]]]], "r": [[1.21404e-05], 0, 0.823457, 1701292809], "v": "v0.6"}
{"i": [["[\"a440b35ba75b754caeba4a36289bc999\", [32, 1, 28, 28], [32, 1, 28, 28], [], [32, 1, 28, 28]]", "cuda -keys=cuda,gpu -arch=sm_80 -max_num_threads=1024 -thread_warp_size=32", [-1, 16, 64, 49152, 2147483647, 1024, 8, 32], "llvm -keys=cpu ", 0, []], [[], [["CI", 5], ["CI", 3], ["CI", 2], ["FU", 6, [0, 1, 2, 3]], ["SP", 6, 0, 25088, [14], 1], ["AN", 6, 0, 5], ["AN", 6, 1, 6]]]], "r": [[3.9588e-06], 0, 0.736866, 1701292809], "v": "v0.6"}
{"i": [["[\"a440b35ba75b754caeba4a36289bc999\", [32, 1, 28, 28], [32, 1, 28, 28], [], [32, 1, 28, 28]]", "cuda -keys=cuda,gpu -arch=sm_80 -max_num_threads=1024 -thread_warp_size=32", [-1, 16, 64, 49152, 2147483647, 1024, 8, 32], "llvm -keys=cpu ", 0, []], [[], [["CI", 5], ["CI", 3], ["CI", 2], ["FU", 6, [0, 1, 2, 3]], ["SP", 6, 0, 25088, [56], 1], ["AN", 6, 0, 5], ["AN", 6, 1, 6]]]], "r": [[3.08298e-06], 0, 0.73753, 1701292810], "v": "v0.6"}
{"i": [["[\"a440b35ba75b754caeba4a36289bc999\", [32, 1, 28, 28], [32, 1, 28, 28], [], [32, 1, 28, 28]]", "cuda -keys=cuda,gpu -arch=sm_80 -max_num_threads=1024 -thread_warp_size=32", [-1, 16, 64, 49152, 2147483647, 1024, 8, 32], "llvm -keys=cpu ", 0, []], [[], [["CI", 5], ["CI", 3], ["CI", 2], ["FU", 6, [0, 1, 2, 3]], ["SP", 6, 0, 25088, [49], 1], ["AN", 6, 0, 5], ["AN", 6, 1, 6]]]], "r": [[3.11571e-06], 0, 0.874217, 1701292810], "v": "v0.6"}
{"i": [["[\"a440b35ba75b754caeba4a36289bc999\", [32, 1, 28, 28], [32, 1, 28, 28], [], [32, 1, 28, 28]]", "cuda -keys=cuda,gpu -arch=sm_80 -max_num_threads=1024 -thread_warp_size=32", [-1, 16, 64, 49152, 2147483647, 1024, 8, 32], "llvm -keys=cpu ", 0, []], [[], [["CI", 5], ["CI", 3], ["CI", 2], ["FU", 6, [0, 1, 2, 3]], ["SP", 6, 0, 25088, [7], 1], ["AN", 6, 0, 5], ["AN", 6, 1, 6]]]], "r": [[5.29702e-06], 0, 0.765009, 1701292810], "v": "v0.6"}
{"i": [["[\"a440b35ba75b754caeba4a36289bc999\", [32, 1, 28, 28], [32, 1, 28, 28], [], [32, 1, 28, 28]]", "cuda -keys=cuda,gpu -arch=sm_80 -max_num_threads=1024 -thread_warp_size=32", [-1, 16, 64, 49152, 2147483647, 1024, 8, 32], "llvm -keys=cpu ", 0, []], [[], [["CI", 5], ["CI", 3], ["CI", 2], ["FU", 6, [0, 1, 2, 3]], ["SP", 6, 0, 25088, [28], 1], ["AN", 6, 0, 5], ["AN", 6, 1, 6]]]], "r": [[3.29943e-06], 0, 0.787972, 1701292810], "v": "v0.6"}
{"i": [["[\"a440b35ba75b754caeba4a36289bc999\", [32, 1, 28, 28], [32, 1, 28, 28], [], [32, 1, 28, 28]]", "cuda -keys=cuda,gpu -arch=sm_80 -max_num_threads=1024 -thread_warp_size=32", [-1, 16, 64, 49152, 2147483647, 1024, 8, 32], "llvm -keys=cpu ", 0, []], [[], [["CI", 5], ["CI", 3], ["CI", 2], ["FU", 6, [0, 1, 2, 3]], ["SP", 6, 0, 25088, [4], 1], ["AN", 6, 0, 5], ["AN", 6, 1, 6]]]], "r": [[7.2718e-06], 0, 0.784084, 1701292811], "v": "v0.6"}
{"i": [["[\"a440b35ba75b754caeba4a36289bc999\", [32, 1, 28, 28], [32, 1, 28, 28], [], [32, 1, 28, 28]]", "cuda -keys=cuda,gpu -arch=sm_80 -max_num_threads=1024 -thread_warp_size=32", [-1, 16, 64, 49152, 2147483647, 1024, 8, 32], "llvm -keys=cpu ", 0, []], [[], [["CI", 5], ["CI", 3], ["CI", 2], ["FU", 6, [0, 1, 2, 3]], ["SP", 6, 0, 25088, [32], 1], ["AN", 6, 0, 5], ["AN", 6, 1, 6]]]], "r": [[3.24906e-06], 0, 0.874273, 1701292811], "v": "v0.6"}
{"i": [["[\"a440b35ba75b754caeba4a36289bc999\", [32, 1, 28, 28], [32, 1, 28, 28], [], [32, 1, 28, 28]]", "cuda -keys=cuda,gpu -arch=sm_80 -max_num_threads=1024 -thread_warp_size=32", [-1, 16, 64, 49152, 2147483647, 1024, 8, 32], "llvm -keys=cpu ", 0, []], [[], [["CI", 5], ["CI", 3], ["CI", 2], ["FU", 6, [0, 1, 2, 3]], ["SP", 6, 0, 25088, [1], 1], ["AN", 6, 0, 5], ["AN", 6, 1, 6]]]], "r": [[2.1458e-05], 0, 0.821777, 1701292811], "v": "v0.6"}
{"i": [["[\"a440b35ba75b754caeba4a36289bc999\", [32, 1, 28, 28], [32, 1, 28, 28], [], [32, 1, 28, 28]]", "cuda -keys=cuda,gpu -arch=sm_80 -max_num_threads=1024 -thread_warp_size=32", [-1, 16, 64, 49152, 2147483647, 1024, 8, 32], "llvm -keys=cpu ", 0, []], [[], [["CI", 5], ["CI", 3], ["CI", 2], ["FU", 6, [0, 1, 2, 3]], ["SP", 6, 0, 25088, [64], 1], ["AN", 6, 0, 5], ["AN", 6, 1, 6]]]], "r": [[3.02324e-06], 0, 0.897209, 1701292812], "v": "v0.6"}
{"i": [["[\"64fc294db670ac5881ff1574fd6ef294\", [32, 256, 28, 28], [], [32, 1, 28, 28]]", "cuda -keys=cuda,gpu -arch=sm_80 -max_num_threads=1024 -thread_warp_size=32", [-1, 16, 64, 49152, 2147483647, 1024, 8, 32], "llvm -keys=cpu ", 0, []], [[], [["CI", 5], ["SP", 6, 3, 28, [4], 1], ["AN", 6, 4, 6], ["FSP", 4, 4, 1, 1], ["AN", 4, 5, 6], ["CA", 4, 6, 3], ["CI", 3], ["CI", 2], ["FU", 6, [0, 1, 2, 3]], ["AN", 6, 0, 5], ["PR", 4, 0, "auto_unroll_max_step$0"]]]], "r": [[0.000366489], 0, 1.53515, 1701292867], "v": "v0.6"}
{"i": [["[\"64fc294db670ac5881ff1574fd6ef294\", [32, 256, 28, 28], [], [32, 1, 28, 28]]", "cuda -keys=cuda,gpu -arch=sm_80 -max_num_threads=1024 -thread_warp_size=32", [-1, 16, 64, 49152, 2147483647, 1024, 8, 32], "llvm -keys=cpu ", 0, []], [[], [["CI", 5], ["CI", 3], ["CI", 2], ["FU", 6, [0, 1, 2, 3]], ["SP", 6, 0, 25088, [1], 1], ["AN", 6, 0, 5], ["AN", 6, 1, 6], ["FU", 4, [0, 1, 2, 3]], ["SP", 4, 0, 25088, [1], 1], ["AN", 4, 0, 5], ["AN", 4, 1, 6], ["PR", 4, 0, "auto_unroll_max_step$0"]]]], "r": [[0.0013607], 0, 1.00104, 1701292868], "v": "v0.6"}
{"i": [["[\"64fc294db670ac5881ff1574fd6ef294\", [32, 256, 28, 28], [], [32, 1, 28, 28]]", "cuda -keys=cuda,gpu -arch=sm_80 -max_num_threads=1024 -thread_warp_size=32", [-1, 16, 64, 49152, 2147483647, 1024, 8, 32], "llvm -keys=cpu ", 0, []], [[], [["CI", 5], ["SP", 6, 3, 28, [16], 1], ["AN", 6, 4, 6], ["FSP", 4, 4, 1, 1], ["AN", 4, 5, 6], ["CA", 4, 6, 3], ["CI", 3], ["CI", 2], ["FU", 6, [0, 1, 2, 3]], ["AN", 6, 0, 5], ["PR", 4, 0, "auto_unroll_max_step$16"]]]], "r": [[0.000134041], 0, 1.27611, 1701292868], "v": "v0.6"}
{"i": [["[\"64fc294db670ac5881ff1574fd6ef294\", [32, 256, 28, 28], [], [32, 1, 28, 28]]", "cuda -keys=cuda,gpu -arch=sm_80 -max_num_threads=1024 -thread_warp_size=32", [-1, 16, 64, 49152, 2147483647, 1024, 8, 32], "llvm -keys=cpu ", 0, []], [[], [["CI", 5], ["CI", 3], ["CI", 2], ["FU", 6, [0, 1, 2, 3]], ["SP", 6, 0, 25088, [28], 1], ["AN", 6, 0, 5], ["AN", 6, 1, 6], ["FU", 4, [0, 1, 2, 3]], ["SP", 4, 0, 25088, [64], 1], ["AN", 4, 0, 5], ["AN", 4, 1, 6], ["PR", 4, 0, "auto_unroll_max_step$0"]]]], "r": [[0.000110443], 0, 1.16027, 1701292869], "v": "v0.6"}
{"i": [["[\"64fc294db670ac5881ff1574fd6ef294\", [32, 256, 28, 28], [], [32, 1, 28, 28]]", "cuda -keys=cuda,gpu -arch=sm_80 -max_num_threads=1024 -thread_warp_size=32", [-1, 16, 64, 49152, 2147483647, 1024, 8, 32], "llvm -keys=cpu ", 0, []], [[], [["CI", 5], ["CI", 3], ["CI", 2], ["FU", 6, [0, 1, 2, 3]], ["SP", 6, 0, 25088, [64], 1], ["AN", 6, 0, 5], ["AN", 6, 1, 6], ["FU", 4, [0, 1, 2, 3]], ["SP", 4, 0, 25088, [2], 1], ["AN", 4, 0, 5], ["AN", 4, 1, 6], ["PR", 4, 0, "auto_unroll_max_step$0"]]]], "r": [[0.000598807], 0, 1.05769, 1701292869], "v": "v0.6"}
{"i": [["[\"64fc294db670ac5881ff1574fd6ef294\", [32, 256, 28, 28], [], [32, 1, 28, 28]]", "cuda -keys=cuda,gpu -arch=sm_80 -max_num_threads=1024 -thread_warp_size=32", [-1, 16, 64, 49152, 2147483647, 1024, 8, 32], "llvm -keys=cpu ", 0, []], [[], [["CI", 5], ["CI", 3], ["CI", 2], ["FU", 6, [0, 1, 2, 3]], ["SP", 6, 0, 25088, [8], 1], ["AN", 6, 0, 5], ["AN", 6, 1, 6], ["FU", 4, [0, 1, 2, 3]], ["SP", 4, 0, 25088, [7], 1], ["AN", 4, 0, 5], ["AN", 4, 1, 6], ["PR", 4, 0, "auto_unroll_max_step$0"]]]], "r": [[0.000227001], 0, 1.6264, 1701292870], "v": "v0.6"}
{"i": [["[\"64fc294db670ac5881ff1574fd6ef294\", [32, 256, 28, 28], [], [32, 1, 28, 28]]", "cuda -keys=cuda,gpu -arch=sm_80 -max_num_threads=1024 -thread_warp_size=32", [-1, 16, 64, 49152, 2147483647, 1024, 8, 32], "llvm -keys=cpu ", 0, []], [[], [["CI", 5], ["CI", 3], ["CI", 2], ["FU", 6, [0, 1, 2, 3]], ["SP", 6, 0, 25088, [64], 1], ["AN", 6, 0, 5], ["AN", 6, 1, 6], ["FU", 4, [0, 1, 2, 3]], ["SP", 4, 0, 25088, [4], 1], ["AN", 4, 0, 5], ["AN", 4, 1, 6], ["PR", 4, 0, "auto_unroll_max_step$64"]]]], "r": [[0.000323891], 0, 1.16122, 1701292870], "v": "v0.6"}
{"i": [["[\"64fc294db670ac5881ff1574fd6ef294\", [32, 256, 28, 28], [], [32, 1, 28, 28]]", "cuda -keys=cuda,gpu -arch=sm_80 -max_num_threads=1024 -thread_warp_size=32", [-1, 16, 64, 49152, 2147483647, 1024, 8, 32], "llvm -keys=cpu ", 0, []], [[], [["CI", 5], ["CI", 3], ["CI", 2], ["FU", 6, [0, 1, 2, 3]], ["SP", 6, 0, 25088, [32], 1], ["AN", 6, 0, 5], ["AN", 6, 1, 6], ["FU", 4, [0, 1, 2, 3]], ["SP", 4, 0, 25088, [4], 1], ["AN", 4, 0, 5], ["AN", 4, 1, 6], ["PR", 4, 0, "auto_unroll_max_step$0"]]]], "r": [[0.000324034], 0, 1.1438, 1701292871], "v": "v0.6"}
{"i": [["[\"64fc294db670ac5881ff1574fd6ef294\", [32, 256, 28, 28], [], [32, 1, 28, 28]]", "cuda -keys=cuda,gpu -arch=sm_80 -max_num_threads=1024 -thread_warp_size=32", [-1, 16, 64, 49152, 2147483647, 1024, 8, 32], "llvm -keys=cpu ", 0, []], [[], [["CI", 5], ["SP", 6, 3, 28, [32], 1], ["AN", 6, 4, 6], ["FSP", 4, 4, 1, 1], ["AN", 4, 5, 6], ["CA", 4, 6, 3], ["CI", 3], ["CI", 2], ["FU", 6, [0, 1, 2, 3]], ["AN", 6, 0, 5], ["PR", 4, 0, "auto_unroll_max_step$64"]]]], "r": [[0.000102106], 0, 1.17793, 1701292871], "v": "v0.6"}
{"i": [["[\"64fc294db670ac5881ff1574fd6ef294\", [32, 256, 28, 28], [], [32, 1, 28, 28]]", "cuda -keys=cuda,gpu -arch=sm_80 -max_num_threads=1024 -thread_warp_size=32", [-1, 16, 64, 49152, 2147483647, 1024, 8, 32], "llvm -keys=cpu ", 0, []], [[], [["CI", 5], ["CI", 3], ["CI", 2], ["FU", 6, [0, 1, 2, 3]], ["SP", 6, 0, 25088, [64], 1], ["AN", 6, 0, 5], ["AN", 6, 1, 6], ["FU", 4, [0, 1, 2, 3]], ["SP", 4, 0, 25088, [1], 1], ["AN", 4, 0, 5], ["AN", 4, 1, 6], ["PR", 4, 0, "auto_unroll_max_step$0"]]]], "r": [[0.00134174], 0, 1.07844, 1701292872], "v": "v0.6"}
{"i": [["[\"64fc294db670ac5881ff1574fd6ef294\", [32, 256, 28, 28], [], [32, 1, 28, 28]]", "cuda -keys=cuda,gpu -arch=sm_80 -max_num_threads=1024 -thread_warp_size=32", [-1, 16, 64, 49152, 2147483647, 1024, 8, 32], "llvm -keys=cpu ", 0, []], [[], [["CI", 5], ["CI", 3], ["CI", 2], ["FU", 6, [0, 1, 2, 3]], ["SP", 6, 0, 25088, [49], 1], ["AN", 6, 0, 5], ["AN", 6, 1, 6], ["FU", 4, [0, 1, 2, 3]], ["SP", 4, 0, 25088, [32], 1], ["AN", 4, 0, 5], ["AN", 4, 1, 6], ["PR", 4, 0, "auto_unroll_max_step$0"]]]], "r": [[0.00011141], 0, 1.13174, 1701292872], "v": "v0.6"}
{"i": [["[\"64fc294db670ac5881ff1574fd6ef294\", [32, 256, 28, 28], [], [32, 1, 28, 28]]", "cuda -keys=cuda,gpu -arch=sm_80 -max_num_threads=1024 -thread_warp_size=32", [-1, 16, 64, 49152, 2147483647, 1024, 8, 32], "llvm -keys=cpu ", 0, []], [[], [["CI", 5], ["CI", 3], ["CI", 2], ["FU", 6, [0, 1, 2, 3]], ["SP", 6, 0, 25088, [32], 1], ["AN", 6, 0, 5], ["AN", 6, 1, 6], ["FU", 4, [0, 1, 2, 3]], ["SP", 4, 0, 25088, [1], 1], ["AN", 4, 0, 5], ["AN", 4, 1, 6], ["PR", 4, 0, "auto_unroll_max_step$512"]]]], "r": [[0.00134093], 0, 1.01174, 1701292873], "v": "v0.6"}
{"i": [["[\"64fc294db670ac5881ff1574fd6ef294\", [32, 256, 28, 28], [], [32, 1, 28, 28]]", "cuda -keys=cuda,gpu -arch=sm_80 -max_num_threads=1024 -thread_warp_size=32", [-1, 16, 64, 49152, 2147483647, 1024, 8, 32], "llvm -keys=cpu ", 0, []], [[], [["CI", 5], ["SP", 6, 3, 28, [28], 1], ["AN", 6, 4, 6], ["FSP", 4, 4, 1, 1], ["AN", 4, 5, 6], ["CA", 4, 6, 3], ["CI", 3], ["CI", 2], ["FU", 6, [0, 1, 2, 3]], ["AN", 6, 0, 5], ["PR", 4, 0, "auto_unroll_max_step$16"]]]], "r": [[0.000124917], 0, 1.21333, 1701292873], "v": "v0.6"}
{"i": [["[\"64fc294db670ac5881ff1574fd6ef294\", [32, 256, 28, 28], [], [32, 1, 28, 28]]", "cuda -keys=cuda,gpu -arch=sm_80 -max_num_threads=1024 -thread_warp_size=32", [-1, 16, 64, 49152, 2147483647, 1024, 8, 32], "llvm -keys=cpu ", 0, []], [[], [["CI", 5], ["CI", 3], ["CI", 2], ["FU", 6, [0, 1, 2, 3]], ["SP", 6, 0, 25088, [32], 1], ["AN", 6, 0, 5], ["AN", 6, 1, 6], ["FU", 4, [0, 1, 2, 3]], ["SP", 4, 0, 25088, [64], 1], ["AN", 4, 0, 5], ["AN", 4, 1, 6], ["PR", 4, 0, "auto_unroll_max_step$0"]]]], "r": [[0.000110344], 0, 1.15512, 1701292874], "v": "v0.6"}
{"i": [["[\"64fc294db670ac5881ff1574fd6ef294\", [32, 256, 28, 28], [], [32, 1, 28, 28]]", "cuda -keys=cuda,gpu -arch=sm_80 -max_num_threads=1024 -thread_warp_size=32", [-1, 16, 64, 49152, 2147483647, 1024, 8, 32], "llvm -keys=cpu ", 0, []], [[], [["CI", 5], ["CI", 3], ["CI", 2], ["FU", 6, [0, 1, 2, 3]], ["SP", 6, 0, 25088, [32], 1], ["AN", 6, 0, 5], ["AN", 6, 1, 6], ["FU", 4, [0, 1, 2, 3]], ["SP", 4, 0, 25088, [64], 1], ["AN", 4, 0, 5], ["AN", 4, 1, 6], ["PR", 4, 0, "auto_unroll_max_step$1024"]]]], "r": [[0.00011037], 0, 1.06567, 1701292874], "v": "v0.6"}
{"i": [["[\"64fc294db670ac5881ff1574fd6ef294\", [32, 256, 28, 28], [], [32, 1, 28, 28]]", "cuda -keys=cuda,gpu -arch=sm_80 -max_num_threads=1024 -thread_warp_size=32", [-1, 16, 64, 49152, 2147483647, 1024, 8, 32], "llvm -keys=cpu ", 0, []], [[], [["CI", 5], ["CI", 3], ["CI", 2], ["FU", 6, [0, 1, 2, 3]], ["SP", 6, 0, 25088, [4], 1], ["AN", 6, 0, 5], ["AN", 6, 1, 6], ["FU", 4, [0, 1, 2, 3]], ["SP", 4, 0, 25088, [4], 1], ["AN", 4, 0, 5], ["AN", 4, 1, 6], ["PR", 4, 0, "auto_unroll_max_step$64"]]]], "r": [[0.000328049], 0, 1.31046, 1701292875], "v": "v0.6"}
{"i": [["[\"64fc294db670ac5881ff1574fd6ef294\", [32, 256, 28, 28], [], [32, 1, 28, 28]]", "cuda -keys=cuda,gpu -arch=sm_80 -max_num_threads=1024 -thread_warp_size=32", [-1, 16, 64, 49152, 2147483647, 1024, 8, 32], "llvm -keys=cpu ", 0, []], [[], [["CI", 5], ["CI", 3], ["CI", 2], ["FU", 6, [0, 1, 2, 3]], ["SP", 6, 0, 25088, [16], 1], ["AN", 6, 0, 5], ["AN", 6, 1, 6], ["FU", 4, [0, 1, 2, 3]], ["SP", 4, 0, 25088, [64], 1], ["AN", 4, 0, 5], ["AN", 4, 1, 6], ["PR", 4, 0, "auto_unroll_max_step$64"]]]], "r": [[0.000110798], 0, 1.19462, 1701292875], "v": "v0.6"}
{"i": [["[\"64fc294db670ac5881ff1574fd6ef294\", [32, 256, 28, 28], [], [32, 1, 28, 28]]", "cuda -keys=cuda,gpu -arch=sm_80 -max_num_threads=1024 -thread_warp_size=32", [-1, 16, 64, 49152, 2147483647, 1024, 8, 32], "llvm -keys=cpu ", 0, []], [[], [["CI", 5], ["CI", 3], ["CI", 2], ["FU", 6, [0, 1, 2, 3]], ["SP", 6, 0, 25088, [16], 1], ["AN", 6, 0, 5], ["AN", 6, 1, 6], ["FU", 4, [0, 1, 2, 3]], ["SP", 4, 0, 25088, [32], 1], ["AN", 4, 0, 5], ["AN", 4, 1, 6], ["PR", 4, 0, "auto_unroll_max_step$0"]]]], "r": [[0.000112224], 0, 1.13139, 1701292876], "v": "v0.6"}
{"i": [["[\"64fc294db670ac5881ff1574fd6ef294\", [32, 256, 28, 28], [], [32, 1, 28, 28]]", "cuda -keys=cuda,gpu -arch=sm_80 -max_num_threads=1024 -thread_warp_size=32", [-1, 16, 64, 49152, 2147483647, 1024, 8, 32], "llvm -keys=cpu ", 0, []], [[], [["CI", 5], ["CI", 3], ["CI", 2], ["FU", 6, [0, 1, 2, 3]], ["SP", 6, 0, 25088, [1], 1], ["AN", 6, 0, 5], ["AN", 6, 1, 6], ["FU", 4, [0, 1, 2, 3]], ["SP", 4, 0, 25088, [2], 1], ["AN", 4, 0, 5], ["AN", 4, 1, 6], ["PR", 4, 0, "auto_unroll_max_step$16"]]]], "r": [[0.000616823], 0, 1.16846, 1701292876], "v": "v0.6"}
{"i": [["[\"64fc294db670ac5881ff1574fd6ef294\", [32, 256, 28, 28], [], [32, 1, 28, 28]]", "cuda -keys=cuda,gpu -arch=sm_80 -max_num_threads=1024 -thread_warp_size=32", [-1, 16, 64, 49152, 2147483647, 1024, 8, 32], "llvm -keys=cpu ", 0, []], [[], [["CI", 5], ["CI", 3], ["CI", 2], ["FU", 6, [0, 1, 2, 3]], ["SP", 6, 0, 25088, [4], 1], ["AN", 6, 0, 5], ["AN", 6, 1, 6], ["FU", 4, [0, 1, 2, 3]], ["SP", 4, 0, 25088, [32], 1], ["AN", 4, 0, 5], ["AN", 4, 1, 6], ["PR", 4, 0, "auto_unroll_max_step$64"]]]], "r": [[0.00011573], 0, 1.09699, 1701292877], "v": "v0.6"}
{"i": [["[\"64fc294db670ac5881ff1574fd6ef294\", [32, 256, 28, 28], [], [32, 1, 28, 28]]", "cuda -keys=cuda,gpu -arch=sm_80 -max_num_threads=1024 -thread_warp_size=32", [-1, 16, 64, 49152, 2147483647, 1024, 8, 32], "llvm -keys=cpu ", 0, []], [[], [["CI", 5], ["SP", 6, 3, 28, [24], 1], ["AN", 6, 4, 6], ["FSP", 4, 4, 1, 1], ["AN", 4, 5, 6], ["CA", 4, 6, 3], ["CI", 3], ["CI", 2], ["FU", 6, [0, 1, 2, 3]], ["AN", 6, 0, 5], ["PR", 4, 0, "auto_unroll_max_step$0"]]]], "r": [[0.000153254], 0, 0.994672, 1701292877], "v": "v0.6"}
{"i": [["[\"64fc294db670ac5881ff1574fd6ef294\", [32, 256, 28, 28], [], [32, 1, 28, 28]]", "cuda -keys=cuda,gpu -arch=sm_80 -max_num_threads=1024 -thread_warp_size=32", [-1, 16, 64, 49152, 2147483647, 1024, 8, 32], "llvm -keys=cpu ", 0, []], [[], [["CI", 5], ["CI", 3], ["CI", 2], ["FU", 6, [0, 1, 2, 3]], ["SP", 6, 0, 25088, [64], 1], ["AN", 6, 0, 5], ["AN", 6, 1, 6], ["FU", 4, [0, 1, 2, 3]], ["SP", 4, 0, 25088, [16], 1], ["AN", 4, 0, 5], ["AN", 4, 1, 6], ["PR", 4, 0, "auto_unroll_max_step$1024"]]]], "r": [[0.000118002], 0, 1.25617, 1701292878], "v": "v0.6"}
{"i": [["[\"64fc294db670ac5881ff1574fd6ef294\", [32, 256, 28, 28], [], [32, 1, 28, 28]]", "cuda -keys=cuda,gpu -arch=sm_80 -max_num_threads=1024 -thread_warp_size=32", [-1, 16, 64, 49152, 2147483647, 1024, 8, 32], "llvm -keys=cpu ", 0, []], [[], [["CI", 5], ["CI", 3], ["CI", 2], ["FU", 6, [0, 1, 2, 3]], ["SP", 6, 0, 25088, [32], 1], ["AN", 6, 0, 5], ["AN", 6, 1, 6], ["FU", 4, [0, 1, 2, 3]], ["SP", 4, 0, 25088, [28], 1], ["AN", 4, 0, 5], ["AN", 4, 1, 6], ["PR", 4, 0, "auto_unroll_max_step$64"]]]], "r": [[0.000112499], 0, 1.08902, 1701292878], "v": "v0.6"}
{"i": [["[\"64fc294db670ac5881ff1574fd6ef294\", [32, 256, 28, 28], [], [32, 1, 28, 28]]", "cuda -keys=cuda,gpu -arch=sm_80 -max_num_threads=1024 -thread_warp_size=32", [-1, 16, 64, 49152, 2147483647, 1024, 8, 32], "llvm -keys=cpu ", 0, []], [[], [["CI", 5], ["CI", 3], ["CI", 2], ["FU", 6, [0, 1, 2, 3]], ["SP", 6, 0, 25088, [8], 1], ["AN", 6, 0, 5], ["AN", 6, 1, 6], ["FU", 4, [0, 1, 2, 3]], ["SP", 4, 0, 25088, [64], 1], ["AN", 4, 0, 5], ["AN", 4, 1, 6], ["PR", 4, 0, "auto_unroll_max_step$1024"]]]], "r": [[0.000112197], 0, 1.5136, 1701292879], "v": "v0.6"}
{"i": [["[\"64fc294db670ac5881ff1574fd6ef294\", [32, 256, 28, 28], [], [32, 1, 28, 28]]", "cuda -keys=cuda,gpu -arch=sm_80 -max_num_threads=1024 -thread_warp_size=32", [-1, 16, 64, 49152, 2147483647, 1024, 8, 32], "llvm -keys=cpu ", 0, []], [[], [["CI", 5], ["CI", 3], ["CI", 2], ["FU", 6, [0, 1, 2, 3]], ["SP", 6, 0, 25088, [1], 1], ["AN", 6, 0, 5], ["AN", 6, 1, 6], ["FU", 4, [0, 1, 2, 3]], ["SP", 4, 0, 25088, [4], 1], ["AN", 4, 0, 5], ["AN", 4, 1, 6], ["PR", 4, 0, "auto_unroll_max_step$1024"]]]], "r": [[0.00034224], 0, 1.10998, 1701292879], "v": "v0.6"}
{"i": [["[\"64fc294db670ac5881ff1574fd6ef294\", [32, 256, 28, 28], [], [32, 1, 28, 28]]", "cuda -keys=cuda,gpu -arch=sm_80 -max_num_threads=1024 -thread_warp_size=32", [-1, 16, 64, 49152, 2147483647, 1024, 8, 32], "llvm -keys=cpu ", 0, []], [[], [["CI", 5], ["CI", 3], ["CI", 2], ["FU", 6, [0, 1, 2, 3]], ["SP", 6, 0, 25088, [16], 1], ["AN", 6, 0, 5], ["AN", 6, 1, 6], ["FU", 4, [0, 1, 2, 3]], ["SP", 4, 0, 25088, [32], 1], ["AN", 4, 0, 5], ["AN", 4, 1, 6], ["PR", 4, 0, "auto_unroll_max_step$1024"]]]], "r": [[0.000112239], 0, 1.11572, 1701292880], "v": "v0.6"}
{"i": [["[\"64fc294db670ac5881ff1574fd6ef294\", [32, 256, 28, 28], [], [32, 1, 28, 28]]", "cuda -keys=cuda,gpu -arch=sm_80 -max_num_threads=1024 -thread_warp_size=32", [-1, 16, 64, 49152, 2147483647, 1024, 8, 32], "llvm -keys=cpu ", 0, []], [[], [["CI", 5], ["CI", 3], ["CI", 2], ["FU", 6, [0, 1, 2, 3]], ["SP", 6, 0, 25088, [16], 1], ["AN", 6, 0, 5], ["AN", 6, 1, 6], ["FU", 4, [0, 1, 2, 3]], ["SP", 4, 0, 25088, [32], 1], ["AN", 4, 0, 5], ["AN", 4, 1, 6], ["PR", 4, 0, "auto_unroll_max_step$512"]]]], "r": [[0.000112247], 0, 1.1258, 1701292880], "v": "v0.6"}
{"i": [["[\"64fc294db670ac5881ff1574fd6ef294\", [32, 256, 28, 28], [], [32, 1, 28, 28]]", "cuda -keys=cuda,gpu -arch=sm_80 -max_num_threads=1024 -thread_warp_size=32", [-1, 16, 64, 49152, 2147483647, 1024, 8, 32], "llvm -keys=cpu ", 0, []], [[], [["CI", 5], ["CI", 3], ["CI", 2], ["FU", 6, [0, 1, 2, 3]], ["SP", 6, 0, 25088, [32], 1], ["AN", 6, 0, 5], ["AN", 6, 1, 6], ["FU", 4, [0, 1, 2, 3]], ["SP", 4, 0, 25088, [4], 1], ["AN", 4, 0, 5], ["AN", 4, 1, 6], ["PR", 4, 0, "auto_unroll_max_step$16"]]]], "r": [[0.000324115], 0, 1.08801, 1701292881], "v": "v0.6"}
{"i": [["[\"64fc294db670ac5881ff1574fd6ef294\", [32, 256, 28, 28], [], [32, 1, 28, 28]]", "cuda -keys=cuda,gpu -arch=sm_80 -max_num_threads=1024 -thread_warp_size=32", [-1, 16, 64, 49152, 2147483647, 1024, 8, 32], "llvm -keys=cpu ", 0, []], [[], [["CI", 5], ["SP", 6, 3, 28, [2], 1], ["AN", 6, 4, 6], ["FSP", 4, 4, 1, 1], ["AN", 4, 5, 6], ["CA", 4, 6, 3], ["CI", 3], ["CI", 2], ["FU", 6, [0, 1, 2, 3]], ["AN", 6, 0, 5], ["PR", 4, 0, "auto_unroll_max_step$16"]]]], "r": [[0.000600408], 0, 1.17428, 1701292881], "v": "v0.6"}
{"i": [["[\"64fc294db670ac5881ff1574fd6ef294\", [32, 256, 28, 28], [], [32, 1, 28, 28]]", "cuda -keys=cuda,gpu -arch=sm_80 -max_num_threads=1024 -thread_warp_size=32", [-1, 16, 64, 49152, 2147483647, 1024, 8, 32], "llvm -keys=cpu ", 0, []], [[], [["CI", 5], ["CI", 3], ["CI", 2], ["FU", 6, [0, 1, 2, 3]], ["SP", 6, 0, 25088, [56], 1], ["AN", 6, 0, 5], ["AN", 6, 1, 6], ["FU", 4, [0, 1, 2, 3]], ["SP", 4, 0, 25088, [1], 1], ["AN", 4, 0, 5], ["AN", 4, 1, 6], ["PR", 4, 0, "auto_unroll_max_step$16"]]]], "r": [[0.00134085], 0, 0.998565, 1701292882], "v": "v0.6"}
{"i": [["[\"64fc294db670ac5881ff1574fd6ef294\", [32, 256, 28, 28], [], [32, 1, 28, 28]]", "cuda -keys=cuda,gpu -arch=sm_80 -max_num_threads=1024 -thread_warp_size=32", [-1, 16, 64, 49152, 2147483647, 1024, 8, 32], "llvm -keys=cpu ", 0, []], [[], [["CI", 5], ["CI", 3], ["CI", 2], ["FU", 6, [0, 1, 2, 3]], ["SP", 6, 0, 25088, [64], 1], ["AN", 6, 0, 5], ["AN", 6, 1, 6], ["FU", 4, [0, 1, 2, 3]], ["SP", 4, 0, 25088, [64], 1], ["AN", 4, 0, 5], ["AN", 4, 1, 6], ["PR", 4, 0, "auto_unroll_max_step$1024"]]]], "r": [[0.000110222], 0, 1.1374, 1701292882], "v": "v0.6"}
{"i": [["[\"64fc294db670ac5881ff1574fd6ef294\", [32, 256, 28, 28], [], [32, 1, 28, 28]]", "cuda -keys=cuda,gpu -arch=sm_80 -max_num_threads=1024 -thread_warp_size=32", [-1, 16, 64, 49152, 2147483647, 1024, 8, 32], "llvm -keys=cpu ", 0, []], [[], [["CI", 5], ["CI", 3], ["CI", 2], ["FU", 6, [0, 1, 2, 3]], ["SP", 6, 0, 25088, [1], 1], ["AN", 6, 0, 5], ["AN", 6, 1, 6], ["FU", 4, [0, 1, 2, 3]], ["SP", 4, 0, 25088, [32], 1], ["AN", 4, 0, 5], ["AN", 4, 1, 6], ["PR", 4, 0, "auto_unroll_max_step$64"]]]], "r": [[0.00012981], 0, 1.15408, 1701292883], "v": "v0.6"}
{"i": [["[\"64fc294db670ac5881ff1574fd6ef294\", [32, 256, 28, 28], [], [32, 1, 28, 28]]", "cuda -keys=cuda,gpu -arch=sm_80 -max_num_threads=1024 -thread_warp_size=32", [-1, 16, 64, 49152, 2147483647, 1024, 8, 32], "llvm -keys=cpu ", 0, []], [[], [["CI", 5], ["CI", 3], ["CI", 2], ["FU", 6, [0, 1, 2, 3]], ["SP", 6, 0, 25088, [64], 1], ["AN", 6, 0, 5], ["AN", 6, 1, 6], ["FU", 4, [0, 1, 2, 3]], ["SP", 4, 0, 25088, [8], 1], ["AN", 4, 0, 5], ["AN", 4, 1, 6], ["PR", 4, 0, "auto_unroll_max_step$64"]]]], "r": [[0.00019091], 0, 1.14537, 1701292883], "v": "v0.6"}
{"i": [["[\"64fc294db670ac5881ff1574fd6ef294\", [32, 256, 28, 28], [], [32, 1, 28, 28]]", "cuda -keys=cuda,gpu -arch=sm_80 -max_num_threads=1024 -thread_warp_size=32", [-1, 16, 64, 49152, 2147483647, 1024, 8, 32], "llvm -keys=cpu ", 0, []], [[], [["CI", 5], ["SP", 6, 3, 28, [28], 1], ["AN", 6, 4, 6], ["FSP", 4, 4, 1, 1], ["AN", 4, 5, 6], ["CA", 4, 6, 3], ["CI", 3], ["CI", 2], ["FU", 6, [0, 1, 2, 3]], ["AN", 6, 0, 5], ["PR", 4, 0, "auto_unroll_max_step$64"]]]], "r": [[0.000124931], 0, 1.22566, 1701292884], "v": "v0.6"}
{"i": [["[\"64fc294db670ac5881ff1574fd6ef294\", [32, 256, 28, 28], [], [32, 1, 28, 28]]", "cuda -keys=cuda,gpu -arch=sm_80 -max_num_threads=1024 -thread_warp_size=32", [-1, 16, 64, 49152, 2147483647, 1024, 8, 32], "llvm -keys=cpu ", 0, []], [[], [["CI", 5], ["CI", 3], ["CI", 2], ["FU", 6, [0, 1, 2, 3]], ["SP", 6, 0, 25088, [32], 1], ["AN", 6, 0, 5], ["AN", 6, 1, 6], ["FU", 4, [0, 1, 2, 3]], ["SP", 4, 0, 25088, [2], 1], ["AN", 4, 0, 5], ["AN", 4, 1, 6], ["PR", 4, 0, "auto_unroll_max_step$0"]]]], "r": [[0.000598723], 0, 1.12284, 1701292884], "v": "v0.6"}
{"i": [["[\"64fc294db670ac5881ff1574fd6ef294\", [32, 256, 28, 28], [], [32, 1, 28, 28]]", "cuda -keys=cuda,gpu -arch=sm_80 -max_num_threads=1024 -thread_warp_size=32", [-1, 16, 64, 49152, 2147483647, 1024, 8, 32], "llvm -keys=cpu ", 0, []], [[], [["CI", 5], ["CI", 3], ["CI", 2], ["FU", 6, [0, 1, 2, 3]], ["SP", 6, 0, 25088, [32], 1], ["AN", 6, 0, 5], ["AN", 6, 1, 6], ["FU", 4, [0, 1, 2, 3]], ["SP", 4, 0, 25088, [2], 1], ["AN", 4, 0, 5], ["AN", 4, 1, 6], ["PR", 4, 0, "auto_unroll_max_step$1024"]]]], "r": [[0.000598666], 0, 1.13072, 1701292885], "v": "v0.6"}
{"i": [["[\"64fc294db670ac5881ff1574fd6ef294\", [32, 256, 28, 28], [], [32, 1, 28, 28]]", "cuda -keys=cuda,gpu -arch=sm_80 -max_num_threads=1024 -thread_warp_size=32", [-1, 16, 64, 49152, 2147483647, 1024, 8, 32], "llvm -keys=cpu ", 0, []], [[], [["CI", 5], ["CI", 3], ["CI", 2], ["FU", 6, [0, 1, 2, 3]], ["SP", 6, 0, 25088, [1], 1], ["AN", 6, 0, 5], ["AN", 6, 1, 6], ["FU", 4, [0, 1, 2, 3]], ["SP", 4, 0, 25088, [1], 1], ["AN", 4, 0, 5], ["AN", 4, 1, 6], ["PR", 4, 0, "auto_unroll_max_step$16"]]]], "r": [[0.00135993], 0, 1.14306, 1701292885], "v": "v0.6"}
{"i": [["[\"64fc294db670ac5881ff1574fd6ef294\", [32, 256, 28, 28], [], [32, 1, 28, 28]]", "cuda -keys=cuda,gpu -arch=sm_80 -max_num_threads=1024 -thread_warp_size=32", [-1, 16, 64, 49152, 2147483647, 1024, 8, 32], "llvm -keys=cpu ", 0, []], [[], [["CI", 5], ["CI", 3], ["CI", 2], ["FU", 6, [0, 1, 2, 3]], ["SP", 6, 0, 25088, [32], 1], ["AN", 6, 0, 5], ["AN", 6, 1, 6], ["FU", 4, [0, 1, 2, 3]], ["SP", 4, 0, 25088, [16], 1], ["AN", 4, 0, 5], ["AN", 4, 1, 6], ["PR", 4, 0, "auto_unroll_max_step$0"]]]], "r": [[0.00011823], 0, 1.13853, 1701292886], "v": "v0.6"}
{"i": [["[\"64fc294db670ac5881ff1574fd6ef294\", [32, 256, 28, 28], [], [32, 1, 28, 28]]", "cuda -keys=cuda,gpu -arch=sm_80 -max_num_threads=1024 -thread_warp_size=32", [-1, 16, 64, 49152, 2147483647, 1024, 8, 32], "llvm -keys=cpu ", 0, []], [[], [["CI", 5], ["CI", 3], ["CI", 2], ["FU", 6, [0, 1, 2, 3]], ["SP", 6, 0, 25088, [2], 1], ["AN", 6, 0, 5], ["AN", 6, 1, 6], ["FU", 4, [0, 1, 2, 3]], ["SP", 4, 0, 25088, [64], 1], ["AN", 4, 0, 5], ["AN", 4, 1, 6], ["PR", 4, 0, "auto_unroll_max_step$0"]]]], "r": [[0.000119136], 0, 1.13759, 1701292886], "v": "v0.6"}
{"i": [["[\"64fc294db670ac5881ff1574fd6ef294\", [32, 256, 28, 28], [], [32, 1, 28, 28]]", "cuda -keys=cuda,gpu -arch=sm_80 -max_num_threads=1024 -thread_warp_size=32", [-1, 16, 64, 49152, 2147483647, 1024, 8, 32], "llvm -keys=cpu ", 0, []], [[], [["CI", 5], ["CI", 3], ["CI", 2], ["FU", 6, [0, 1, 2, 3]], ["SP", 6, 0, 25088, [1], 1], ["AN", 6, 0, 5], ["AN", 6, 1, 6], ["FU", 4, [0, 1, 2, 3]], ["SP", 4, 0, 25088, [32], 1], ["AN", 4, 0, 5], ["AN", 4, 1, 6], ["PR", 4, 0, "auto_unroll_max_step$1024"]]]], "r": [[0.000129825], 0, 1.14428, 1701292887], "v": "v0.6"}
{"i": [["[\"64fc294db670ac5881ff1574fd6ef294\", [32, 256, 28, 28], [], [32, 1, 28, 28]]", "cuda -keys=cuda,gpu -arch=sm_80 -max_num_threads=1024 -thread_warp_size=32", [-1, 16, 64, 49152, 2147483647, 1024, 8, 32], "llvm -keys=cpu ", 0, []], [[], [["CI", 5], ["CI", 3], ["CI", 2], ["FU", 6, [0, 1, 2, 3]], ["SP", 6, 0, 25088, [2], 1], ["AN", 6, 0, 5], ["AN", 6, 1, 6], ["FU", 4, [0, 1, 2, 3]], ["SP", 4, 0, 25088, [64], 1], ["AN", 4, 0, 5], ["AN", 4, 1, 6], ["PR", 4, 0, "auto_unroll_max_step$512"]]]], "r": [[0.000119171], 0, 1.1318, 1701292887], "v": "v0.6"}
{"i": [["[\"64fc294db670ac5881ff1574fd6ef294\", [32, 256, 28, 28], [], [32, 1, 28, 28]]", "cuda -keys=cuda,gpu -arch=sm_80 -max_num_threads=1024 -thread_warp_size=32", [-1, 16, 64, 49152, 2147483647, 1024, 8, 32], "llvm -keys=cpu ", 0, []], [[], [["CI", 5], ["SP", 6, 3, 28, [24], 1], ["AN", 6, 4, 6], ["FSP", 4, 4, 1, 1], ["AN", 4, 5, 6], ["CA", 4, 6, 3], ["CI", 3], ["CI", 2], ["FU", 6, [0, 1, 2, 3]], ["AN", 6, 0, 5], ["PR", 4, 0, "auto_unroll_max_step$64"]]]], "r": [[0.000142034], 0, 1.26614, 1701292888], "v": "v0.6"}
{"i": [["[\"64fc294db670ac5881ff1574fd6ef294\", [32, 256, 28, 28], [], [32, 1, 28, 28]]", "cuda -keys=cuda,gpu -arch=sm_80 -max_num_threads=1024 -thread_warp_size=32", [-1, 16, 64, 49152, 2147483647, 1024, 8, 32], "llvm -keys=cpu ", 0, []], [[], [["CI", 5], ["CI", 3], ["CI", 2], ["FU", 6, [0, 1, 2, 3]], ["SP", 6, 0, 25088, [1], 1], ["AN", 6, 0, 5], ["AN", 6, 1, 6], ["FU", 4, [0, 1, 2, 3]], ["SP", 4, 0, 25088, [2], 1], ["AN", 4, 0, 5], ["AN", 4, 1, 6], ["PR", 4, 0, "auto_unroll_max_step$0"]]]], "r": [[0.000616873], 0, 1.0907, 1701292888], "v": "v0.6"}
{"i": [["[\"64fc294db670ac5881ff1574fd6ef294\", [32, 256, 28, 28], [], [32, 1, 28, 28]]", "cuda -keys=cuda,gpu -arch=sm_80 -max_num_threads=1024 -thread_warp_size=32", [-1, 16, 64, 49152, 2147483647, 1024, 8, 32], "llvm -keys=cpu ", 0, []], [[], [["CI", 5], ["CI", 3], ["CI", 2], ["FU", 6, [0, 1, 2, 3]], ["SP", 6, 0, 25088, [32], 1], ["AN", 6, 0, 5], ["AN", 6, 1, 6], ["FU", 4, [0, 1, 2, 3]], ["SP", 4, 0, 25088, [56], 1], ["AN", 4, 0, 5], ["AN", 4, 1, 6], ["PR", 4, 0, "auto_unroll_max_step$1024"]]]], "r": [[0.000113526], 0, 1.14112, 1701292889], "v": "v0.6"}
{"i": [["[\"64fc294db670ac5881ff1574fd6ef294\", [32, 256, 28, 28], [], [32, 1, 28, 28]]", "cuda -keys=cuda,gpu -arch=sm_80 -max_num_threads=1024 -thread_warp_size=32", [-1, 16, 64, 49152, 2147483647, 1024, 8, 32], "llvm -keys=cpu ", 0, []], [[], [["CI", 5], ["CI", 3], ["CI", 2], ["FU", 6, [0, 1, 2, 3]], ["SP", 6, 0, 25088, [1], 1], ["AN", 6, 0, 5], ["AN", 6, 1, 6], ["FU", 4, [0, 1, 2, 3]], ["SP", 4, 0, 25088, [32], 1], ["AN", 4, 0, 5], ["AN", 4, 1, 6], ["PR", 4, 0, "auto_unroll_max_step$512"]]]], "r": [[0.000129809], 0, 1.16532, 1701292889], "v": "v0.6"}
{"i": [["[\"64fc294db670ac5881ff1574fd6ef294\", [32, 256, 28, 28], [], [32, 1, 28, 28]]", "cuda -keys=cuda,gpu -arch=sm_80 -max_num_threads=1024 -thread_warp_size=32", [-1, 16, 64, 49152, 2147483647, 1024, 8, 32], "llvm -keys=cpu ", 0, []], [[], [["CI", 5], ["CI", 3], ["CI", 2], ["FU", 6, [0, 1, 2, 3]], ["SP", 6, 0, 25088, [4], 1], ["AN", 6, 0, 5], ["AN", 6, 1, 6], ["FU", 4, [0, 1, 2, 3]], ["SP", 4, 0, 25088, [32], 1], ["AN", 4, 0, 5], ["AN", 4, 1, 6], ["PR", 4, 0, "auto_unroll_max_step$0"]]]], "r": [[0.000115711], 0, 1.13613, 1701292890], "v": "v0.6"}
{"i": [["[\"64fc294db670ac5881ff1574fd6ef294\", [32, 256, 28, 28], [], [32, 1, 28, 28]]", "cuda -keys=cuda,gpu -arch=sm_80 -max_num_threads=1024 -thread_warp_size=32", [-1, 16, 64, 49152, 2147483647, 1024, 8, 32], "llvm -keys=cpu ", 0, []], [[], [["CI", 5], ["CI", 3], ["CI", 2], ["FU", 6, [0, 1, 2, 3]], ["SP", 6, 0, 25088, [8], 1], ["AN", 6, 0, 5], ["AN", 6, 1, 6], ["FU", 4, [0, 1, 2, 3]], ["SP", 4, 0, 25088, [2], 1], ["AN", 4, 0, 5], ["AN", 4, 1, 6], ["PR", 4, 0, "auto_unroll_max_step$64"]]]], "r": [[0.000600637], 0, 1.15685, 1701292890], "v": "v0.6"}
{"i": [["[\"64fc294db670ac5881ff1574fd6ef294\", [32, 256, 28, 28], [], [32, 1, 28, 28]]", "cuda -keys=cuda,gpu -arch=sm_80 -max_num_threads=1024 -thread_warp_size=32", [-1, 16, 64, 49152, 2147483647, 1024, 8, 32], "llvm -keys=cpu ", 0, []], [[], [["CI", 5], ["CI", 3], ["CI", 2], ["FU", 6, [0, 1, 2, 3]], ["SP", 6, 0, 25088, [64], 1], ["AN", 6, 0, 5], ["AN", 6, 1, 6], ["FU", 4, [0, 1, 2, 3]], ["SP", 4, 0, 25088, [32], 1], ["AN", 4, 0, 5], ["AN", 4, 1, 6], ["PR", 4, 0, "auto_unroll_max_step$0"]]]], "r": [[0.000111472], 0, 1.15921, 1701292891], "v": "v0.6"}
{"i": [["[\"64fc294db670ac5881ff1574fd6ef294\", [32, 256, 28, 28], [], [32, 1, 28, 28]]", "cuda -keys=cuda,gpu -arch=sm_80 -max_num_threads=1024 -thread_warp_size=32", [-1, 16, 64, 49152, 2147483647, 1024, 8, 32], "llvm -keys=cpu ", 0, []], [[], [["CI", 5], ["CI", 3], ["CI", 2], ["FU", 6, [0, 1, 2, 3]], ["SP", 6, 0, 25088, [64], 1], ["AN", 6, 0, 5], ["AN", 6, 1, 6], ["FU", 4, [0, 1, 2, 3]], ["SP", 4, 0, 25088, [7], 1], ["AN", 4, 0, 5], ["AN", 4, 1, 6], ["PR", 4, 0, "auto_unroll_max_step$16"]]]], "r": [[0.000224763], 0, 1.14329, 1701292891], "v": "v0.6"}
{"i": [["[\"64fc294db670ac5881ff1574fd6ef294\", [32, 256, 28, 28], [], [32, 1, 28, 28]]", "cuda -keys=cuda,gpu -arch=sm_80 -max_num_threads=1024 -thread_warp_size=32", [-1, 16, 64, 49152, 2147483647, 1024, 8, 32], "llvm -keys=cpu ", 0, []], [[], [["CI", 5], ["CI", 3], ["CI", 2], ["FU", 6, [0, 1, 2, 3]], ["SP", 6, 0, 25088, [2], 1], ["AN", 6, 0, 5], ["AN", 6, 1, 6], ["FU", 4, [0, 1, 2, 3]], ["SP", 4, 0, 25088, [32], 1], ["AN", 4, 0, 5], ["AN", 4, 1, 6], ["PR", 4, 0, "auto_unroll_max_step$512"]]]], "r": [[0.000120426], 0, 1.20095, 1701292892], "v": "v0.6"}
{"i": [["[\"64fc294db670ac5881ff1574fd6ef294\", [32, 256, 28, 28], [], [32, 1, 28, 28]]", "cuda -keys=cuda,gpu -arch=sm_80 -max_num_threads=1024 -thread_warp_size=32", [-1, 16, 64, 49152, 2147483647, 1024, 8, 32], "llvm -keys=cpu ", 0, []], [[], [["CI", 5], ["CI", 3], ["CI", 2], ["FU", 6, [0, 1, 2, 3]], ["SP", 6, 0, 25088, [8], 1], ["AN", 6, 0, 5], ["AN", 6, 1, 6], ["FU", 4, [0, 1, 2, 3]], ["SP", 4, 0, 25088, [8], 1], ["AN", 4, 0, 5], ["AN", 4, 1, 6], ["PR", 4, 0, "auto_unroll_max_step$0"]]]], "r": [[0.000192869], 0, 1.11591, 1701292893], "v": "v0.6"}
{"i": [["[\"64fc294db670ac5881ff1574fd6ef294\", [32, 256, 28, 28], [], [32, 1, 28, 28]]", "cuda -keys=cuda,gpu -arch=sm_80 -max_num_threads=1024 -thread_warp_size=32", [-1, 16, 64, 49152, 2147483647, 1024, 8, 32], "llvm -keys=cpu ", 0, []], [[], [["CI", 5], ["CI", 3], ["CI", 2], ["FU", 6, [0, 1, 2, 3]], ["SP", 6, 0, 25088, [1], 1], ["AN", 6, 0, 5], ["AN", 6, 1, 6], ["FU", 4, [0, 1, 2, 3]], ["SP", 4, 0, 25088, [64], 1], ["AN", 4, 0, 5], ["AN", 4, 1, 6], ["PR", 4, 0, "auto_unroll_max_step$64"]]]], "r": [[0.000128494], 0, 1.08946, 1701292893], "v": "v0.6"}
{"i": [["[\"64fc294db670ac5881ff1574fd6ef294\", [32, 256, 28, 28], [], [32, 1, 28, 28]]", "cuda -keys=cuda,gpu -arch=sm_80 -max_num_threads=1024 -thread_warp_size=32", [-1, 16, 64, 49152, 2147483647, 1024, 8, 32], "llvm -keys=cpu ", 0, []], [[], [["CI", 5], ["CI", 3], ["CI", 2], ["FU", 6, [0, 1, 2, 3]], ["SP", 6, 0, 25088, [1], 1], ["AN", 6, 0, 5], ["AN", 6, 1, 6], ["FU", 4, [0, 1, 2, 3]], ["SP", 4, 0, 25088, [32], 1], ["AN", 4, 0, 5], ["AN", 4, 1, 6], ["PR", 4, 0, "auto_unroll_max_step$16"]]]], "r": [[0.000129784], 0, 1.17339, 1701292894], "v": "v0.6"}
{"i": [["[\"64fc294db670ac5881ff1574fd6ef294\", [32, 256, 28, 28], [], [32, 1, 28, 28]]", "cuda -keys=cuda,gpu -arch=sm_80 -max_num_threads=1024 -thread_warp_size=32", [-1, 16, 64, 49152, 2147483647, 1024, 8, 32], "llvm -keys=cpu ", 0, []], [[], [["CI", 5], ["CI", 3], ["CI", 2], ["FU", 6, [0, 1, 2, 3]], ["SP", 6, 0, 25088, [32], 1], ["AN", 6, 0, 5], ["AN", 6, 1, 6], ["FU", 4, [0, 1, 2, 3]], ["SP", 4, 0, 25088, [32], 1], ["AN", 4, 0, 5], ["AN", 4, 1, 6], ["PR", 4, 0, "auto_unroll_max_step$1024"]]]], "r": [[0.000111578], 0, 1.12932, 1701292894], "v": "v0.6"}
{"i": [["[\"64fc294db670ac5881ff1574fd6ef294\", [32, 256, 28, 28], [], [32, 1, 28, 28]]", "cuda -keys=cuda,gpu -arch=sm_80 -max_num_threads=1024 -thread_warp_size=32", [-1, 16, 64, 49152, 2147483647, 1024, 8, 32], "llvm -keys=cpu ", 0, []], [[], [["CI", 5], ["CI", 3], ["CI", 2], ["FU", 6, [0, 1, 2, 3]], ["SP", 6, 0, 25088, [32], 1], ["AN", 6, 0, 5], ["AN", 6, 1, 6], ["FU", 4, [0, 1, 2, 3]], ["SP", 4, 0, 25088, [32], 1], ["AN", 4, 0, 5], ["AN", 4, 1, 6], ["PR", 4, 0, "auto_unroll_max_step$0"]]]], "r": [[0.00011158], 0, 1.14191, 1701292895], "v": "v0.6"}
{"i": [["[\"64fc294db670ac5881ff1574fd6ef294\", [32, 256, 28, 28], [], [32, 1, 28, 28]]", "cuda -keys=cuda,gpu -arch=sm_80 -max_num_threads=1024 -thread_warp_size=32", [-1, 16, 64, 49152, 2147483647, 1024, 8, 32], "llvm -keys=cpu ", 0, []], [[], [["CI", 5], ["SP", 6, 3, 28, [32], 1], ["AN", 6, 4, 6], ["FSP", 4, 4, 1, 1], ["AN", 4, 5, 6], ["CA", 4, 6, 3], ["CI", 3], ["CI", 2], ["FU", 6, [0, 1, 2, 3]], ["AN", 6, 0, 5], ["PR", 4, 0, "auto_unroll_max_step$0"]]]], "r": [[0.000105681], 0, 1.17943, 1701292895], "v": "v0.6"}
{"i": [["[\"e626244ee8f5215994f59dd6fdf80d98\", [32, 256, 28, 28], [32, 1, 28, 28], [1, 256, 1, 1], [32, 1, 28, 28], [1, 256, 1, 1], [32, 256, 28, 28]]", "cuda -keys=cuda,gpu -arch=sm_80 -max_num_threads=1024 -thread_warp_size=32", [-1, 16, 64, 49152, 2147483647, 1024, 8, 32], "llvm -keys=cpu ", 0, []], [[], [["CI", 6], ["CI", 4], ["CI", 2], ["FU", 8, [0, 1, 2, 3]], ["SP", 8, 0, 6422528, [49], 1], ["AN", 8, 0, 5], ["AN", 8, 1, 6]]]], "r": [[0.000123997], 0, 1.70305, 1701292946], "v": "v0.6"}
{"i": [["[\"e626244ee8f5215994f59dd6fdf80d98\", [32, 256, 28, 28], [32, 1, 28, 28], [1, 256, 1, 1], [32, 1, 28, 28], [1, 256, 1, 1], [32, 256, 28, 28]]", "cuda -keys=cuda,gpu -arch=sm_80 -max_num_threads=1024 -thread_warp_size=32", [-1, 16, 64, 49152, 2147483647, 1024, 8, 32], "llvm -keys=cpu ", 0, []], [[], [["CI", 6], ["CI", 4], ["CI", 2], ["FU", 8, [0, 1, 2, 3]], ["SP", 8, 0, 6422528, [56], 1], ["AN", 8, 0, 5], ["AN", 8, 1, 6]]]], "r": [[8.82646e-05], 0, 1.31654, 1701292947], "v": "v0.6"}
{"i": [["[\"e626244ee8f5215994f59dd6fdf80d98\", [32, 256, 28, 28], [32, 1, 28, 28], [1, 256, 1, 1], [32, 1, 28, 28], [1, 256, 1, 1], [32, 256, 28, 28]]", "cuda -keys=cuda,gpu -arch=sm_80 -max_num_threads=1024 -thread_warp_size=32", [-1, 16, 64, 49152, 2147483647, 1024, 8, 32], "llvm -keys=cpu ", 0, []], [[], [["CI", 6], ["CI", 4], ["CI", 2], ["FU", 8, [0, 1, 2, 3]], ["SP", 8, 0, 6422528, [64], 1], ["AN", 8, 0, 5], ["AN", 8, 1, 6]]]], "r": [[7.75694e-05], 0, 1.26412, 1701292948], "v": "v0.6"}
{"i": [["[\"e626244ee8f5215994f59dd6fdf80d98\", [32, 256, 28, 28], [32, 1, 28, 28], [1, 256, 1, 1], [32, 1, 28, 28], [1, 256, 1, 1], [32, 256, 28, 28]]", "cuda -keys=cuda,gpu -arch=sm_80 -max_num_threads=1024 -thread_warp_size=32", [-1, 16, 64, 49152, 2147483647, 1024, 8, 32], "llvm -keys=cpu ", 0, []], [[], [["CI", 6], ["CI", 4], ["CI", 2], ["FU", 8, [0, 1, 2, 3]], ["SP", 8, 0, 6422528, [4], 1], ["AN", 8, 0, 5], ["AN", 8, 1, 6]]]], "r": [[0.00119231], 0, 1.12241, 1701292948], "v": "v0.6"}
{"i": [["[\"e626244ee8f5215994f59dd6fdf80d98\", [32, 256, 28, 28], [32, 1, 28, 28], [1, 256, 1, 1], [32, 1, 28, 28], [1, 256, 1, 1], [32, 256, 28, 28]]", "cuda -keys=cuda,gpu -arch=sm_80 -max_num_threads=1024 -thread_warp_size=32", [-1, 16, 64, 49152, 2147483647, 1024, 8, 32], "llvm -keys=cpu ", 0, []], [[], [["CI", 6], ["CI", 4], ["CI", 2], ["FU", 8, [0, 1, 2, 3]], ["SP", 8, 0, 6422528, [8], 1], ["AN", 8, 0, 5], ["AN", 8, 1, 6]]]], "r": [[0.000598384], 0, 1.30136, 1701292949], "v": "v0.6"}
{"i": [["[\"e626244ee8f5215994f59dd6fdf80d98\", [32, 256, 28, 28], [32, 1, 28, 28], [1, 256, 1, 1], [32, 1, 28, 28], [1, 256, 1, 1], [32, 256, 28, 28]]", "cuda -keys=cuda,gpu -arch=sm_80 -max_num_threads=1024 -thread_warp_size=32", [-1, 16, 64, 49152, 2147483647, 1024, 8, 32], "llvm -keys=cpu ", 0, []], [[], [["CI", 6], ["CI", 4], ["CI", 2], ["FU", 8, [0, 1, 2, 3]], ["SP", 8, 0, 6422528, [2], 1], ["AN", 8, 0, 5], ["AN", 8, 1, 6]]]], "r": [[0.00238173], 0, 1.13714, 1701292950], "v": "v0.6"}
{"i": [["[\"e626244ee8f5215994f59dd6fdf80d98\", [32, 256, 28, 28], [32, 1, 28, 28], [1, 256, 1, 1], [32, 1, 28, 28], [1, 256, 1, 1], [32, 256, 28, 28]]", "cuda -keys=cuda,gpu -arch=sm_80 -max_num_threads=1024 -thread_warp_size=32", [-1, 16, 64, 49152, 2147483647, 1024, 8, 32], "llvm -keys=cpu ", 0, []], [[], [["CI", 6], ["CI", 4], ["CI", 2], ["FU", 8, [0, 1, 2, 3]], ["SP", 8, 0, 6422528, [1], 1], ["AN", 8, 0, 5], ["AN", 8, 1, 6]]]], "r": [[0.00476051], 0, 1.28405, 1701292950], "v": "v0.6"}
{"i": [["[\"e626244ee8f5215994f59dd6fdf80d98\", [32, 256, 28, 28], [32, 1, 28, 28], [1, 256, 1, 1], [32, 1, 28, 28], [1, 256, 1, 1], [32, 256, 28, 28]]", "cuda -keys=cuda,gpu -arch=sm_80 -max_num_threads=1024 -thread_warp_size=32", [-1, 16, 64, 49152, 2147483647, 1024, 8, 32], "llvm -keys=cpu ", 0, []], [[], [["CI", 6], ["CI", 4], ["CI", 2], ["FU", 8, [0, 1, 2, 3]], ["SP", 8, 0, 6422528, [16], 1], ["AN", 8, 0, 5], ["AN", 8, 1, 6]]]], "r": [[0.000300991], 0, 1.29629, 1701292951], "v": "v0.6"}
{"i": [["[\"e626244ee8f5215994f59dd6fdf80d98\", [32, 256, 28, 28], [32, 1, 28, 28], [1, 256, 1, 1], [32, 1, 28, 28], [1, 256, 1, 1], [32, 256, 28, 28]]", "cuda -keys=cuda,gpu -arch=sm_80 -max_num_threads=1024 -thread_warp_size=32", [-1, 16, 64, 49152, 2147483647, 1024, 8, 32], "llvm -keys=cpu ", 0, []], [[], [["CI", 6], ["CI", 4], ["CI", 2], ["FU", 8, [0, 1, 2, 3]], ["SP", 8, 0, 6422528, [28], 1], ["AN", 8, 0, 5], ["AN", 8, 1, 6]]]], "r": [[0.000173651], 0, 1.26307, 1701292952], "v": "v0.6"}
{"i": [["[\"e626244ee8f5215994f59dd6fdf80d98\", [32, 256, 28, 28], [32, 1, 28, 28], [1, 256, 1, 1], [32, 1, 28, 28], [1, 256, 1, 1], [32, 256, 28, 28]]", "cuda -keys=cuda,gpu -arch=sm_80 -max_num_threads=1024 -thread_warp_size=32", [-1, 16, 64, 49152, 2147483647, 1024, 8, 32], "llvm -keys=cpu ", 0, []], [[], [["CI", 6], ["CI", 4], ["CI", 2], ["FU", 8, [0, 1, 2, 3]], ["SP", 8, 0, 6422528, [14], 1], ["AN", 8, 0, 5], ["AN", 8, 1, 6]]]], "r": [[0.000342986], 0, 1.29215, 1701292952], "v": "v0.6"}
{"i": [["[\"e626244ee8f5215994f59dd6fdf80d98\", [32, 256, 28, 28], [32, 1, 28, 28], [1, 256, 1, 1], [32, 1, 28, 28], [1, 256, 1, 1], [32, 256, 28, 28]]", "cuda -keys=cuda,gpu -arch=sm_80 -max_num_threads=1024 -thread_warp_size=32", [-1, 16, 64, 49152, 2147483647, 1024, 8, 32], "llvm -keys=cpu ", 0, []], [[], [["CI", 6], ["CI", 4], ["CI", 2], ["FU", 8, [0, 1, 2, 3]], ["SP", 8, 0, 6422528, [7], 1], ["AN", 8, 0, 5], ["AN", 8, 1, 6]]]], "r": [[0.000682632], 0, 1.15747, 1701292953], "v": "v0.6"}
{"i": [["[\"e626244ee8f5215994f59dd6fdf80d98\", [32, 256, 28, 28], [32, 1, 28, 28], [1, 256, 1, 1], [32, 1, 28, 28], [1, 256, 1, 1], [32, 256, 28, 28]]", "cuda -keys=cuda,gpu -arch=sm_80 -max_num_threads=1024 -thread_warp_size=32", [-1, 16, 64, 49152, 2147483647, 1024, 8, 32], "llvm -keys=cpu ", 0, []], [[], [["CI", 6], ["CI", 4], ["CI", 2], ["FU", 8, [0, 1, 2, 3]], ["SP", 8, 0, 6422528, [32], 1], ["AN", 8, 0, 5], ["AN", 8, 1, 6]]]], "r": [[0.000152093], 0, 1.28522, 1701292954], "v": "v0.6"}
{"i": [["[\"74163f45f8ae062cfd50252b9c22bad8\", [32, 256, 28, 28], [32, 1, 28, 28]]", "cuda -keys=cuda,gpu -arch=sm_80 -max_num_threads=1024 -thread_warp_size=32", [-1, 16, 64, 49152, 2147483647, 1024, 8, 32], "llvm -keys=cpu ", 0, []], [[], [["CI", 3], ["CI", 1], ["FU", 4, [0, 1, 2, 3]], ["SP", 4, 0, 25088, [64], 1], ["AN", 4, 0, 5], ["AN", 4, 1, 6], ["FU", 2, [0, 1, 2, 3]], ["SP", 2, 0, 25088, [32], 1], ["AN", 2, 0, 5], ["AN", 2, 1, 6], ["PR", 2, 0, "auto_unroll_max_step$64"]]]], "r": [[1.14528e-05], 0, 1.73411, 1701293015], "v": "v0.6"}
{"i": [["[\"74163f45f8ae062cfd50252b9c22bad8\", [32, 256, 28, 28], [32, 1, 28, 28]]", "cuda -keys=cuda,gpu -arch=sm_80 -max_num_threads=1024 -thread_warp_size=32", [-1, 16, 64, 49152, 2147483647, 1024, 8, 32], "llvm -keys=cpu ", 0, []], [[], [["CI", 3], ["CI", 1], ["FU", 4, [0, 1, 2, 3]], ["SP", 4, 0, 25088, [2], 1], ["AN", 4, 0, 5], ["AN", 4, 1, 6], ["FU", 2, [0, 1, 2, 3]], ["SP", 2, 0, 25088, [2], 1], ["AN", 2, 0, 5], ["AN", 2, 1, 6], ["PR", 2, 0, "auto_unroll_max_step$512"]]]], "r": [[6.01333e-05], 0, 1.23018, 1701293015], "v": "v0.6"}
{"i": [["[\"74163f45f8ae062cfd50252b9c22bad8\", [32, 256, 28, 28], [32, 1, 28, 28]]", "cuda -keys=cuda,gpu -arch=sm_80 -max_num_threads=1024 -thread_warp_size=32", [-1, 16, 64, 49152, 2147483647, 1024, 8, 32], "llvm -keys=cpu ", 0, []], [[], [["CI", 3], ["CI", 1], ["FU", 4, [0, 1, 2, 3]], ["SP", 4, 0, 25088, [4], 1], ["AN", 4, 0, 5], ["AN", 4, 1, 6], ["FU", 2, [0, 1, 2, 3]], ["SP", 2, 0, 25088, [1], 1], ["AN", 2, 0, 5], ["AN", 2, 1, 6], ["PR", 2, 0, "auto_unroll_max_step$512"]]]], "r": [[0.000122448], 0, 1.2257, 1701293016], "v": "v0.6"}
{"i": [["[\"74163f45f8ae062cfd50252b9c22bad8\", [32, 256, 28, 28], [32, 1, 28, 28]]", "cuda -keys=cuda,gpu -arch=sm_80 -max_num_threads=1024 -thread_warp_size=32", [-1, 16, 64, 49152, 2147483647, 1024, 8, 32], "llvm -keys=cpu ", 0, []], [[], [["CI", 3], ["CI", 1], ["FU", 4, [0, 1, 2, 3]], ["SP", 4, 0, 25088, [8], 1], ["AN", 4, 0, 5], ["AN", 4, 1, 6], ["FU", 2, [0, 1, 2, 3]], ["SP", 2, 0, 25088, [8], 1], ["AN", 2, 0, 5], ["AN", 2, 1, 6], ["PR", 2, 0, "auto_unroll_max_step$0"]]]], "r": [[2.03472e-05], 0, 1.37059, 1701293016], "v": "v0.6"}
{"i": [["[\"74163f45f8ae062cfd50252b9c22bad8\", [32, 256, 28, 28], [32, 1, 28, 28]]", "cuda -keys=cuda,gpu -arch=sm_80 -max_num_threads=1024 -thread_warp_size=32", [-1, 16, 64, 49152, 2147483647, 1024, 8, 32], "llvm -keys=cpu ", 0, []], [[], [["CI", 3], ["CI", 1], ["FU", 4, [0, 1, 2, 3]], ["SP", 4, 0, 25088, [32], 1], ["AN", 4, 0, 5], ["AN", 4, 1, 6], ["FU", 2, [0, 1, 2, 3]], ["SP", 2, 0, 25088, [8], 1], ["AN", 2, 0, 5], ["AN", 2, 1, 6], ["PR", 2, 0, "auto_unroll_max_step$512"]]]], "r": [[1.86222e-05], 0, 1.12815, 1701293017], "v": "v0.6"}
{"i": [["[\"74163f45f8ae062cfd50252b9c22bad8\", [32, 256, 28, 28], [32, 1, 28, 28]]", "cuda -keys=cuda,gpu -arch=sm_80 -max_num_threads=1024 -thread_warp_size=32", [-1, 16, 64, 49152, 2147483647, 1024, 8, 32], "llvm -keys=cpu ", 0, []], [[], [["CI", 3], ["CI", 1], ["FU", 4, [0, 1, 2, 3]], ["SP", 4, 0, 25088, [8], 1], ["AN", 4, 0, 5], ["AN", 4, 1, 6], ["FU", 2, [0, 1, 2, 3]], ["SP", 2, 0, 25088, [1], 1], ["AN", 2, 0, 5], ["AN", 2, 1, 6], ["PR", 2, 0, "auto_unroll_max_step$512"]]]], "r": [[0.000120269], 0, 1.28153, 1701293017], "v": "v0.6"}
{"i": [["[\"74163f45f8ae062cfd50252b9c22bad8\", [32, 256, 28, 28], [32, 1, 28, 28]]", "cuda -keys=cuda,gpu -arch=sm_80 -max_num_threads=1024 -thread_warp_size=32", [-1, 16, 64, 49152, 2147483647, 1024, 8, 32], "llvm -keys=cpu ", 0, []], [[], [["CI", 3], ["CI", 1], ["FU", 4, [0, 1, 2, 3]], ["SP", 4, 0, 25088, [64], 1], ["AN", 4, 0, 5], ["AN", 4, 1, 6], ["FU", 2, [0, 1, 2, 3]], ["SP", 2, 0, 25088, [16], 1], ["AN", 2, 0, 5], ["AN", 2, 1, 6], ["PR", 2, 0, "auto_unroll_max_step$512"]]]], "r": [[1.29604e-05], 0, 1.40766, 1701293018], "v": "v0.6"}
{"i": [["[\"74163f45f8ae062cfd50252b9c22bad8\", [32, 256, 28, 28], [32, 1, 28, 28]]", "cuda -keys=cuda,gpu -arch=sm_80 -max_num_threads=1024 -thread_warp_size=32", [-1, 16, 64, 49152, 2147483647, 1024, 8, 32], "llvm -keys=cpu ", 0, []], [[], [["CI", 3], ["CI", 1], ["FU", 4, [0, 1, 2, 3]], ["SP", 4, 0, 25088, [8], 1], ["AN", 4, 0, 5], ["AN", 4, 1, 6], ["FU", 2, [0, 1, 2, 3]], ["SP", 2, 0, 25088, [2], 1], ["AN", 2, 0, 5], ["AN", 2, 1, 6], ["PR", 2, 0, "auto_unroll_max_step$0"]]]], "r": [[5.30635e-05], 0, 1.23492, 1701293018], "v": "v0.6"}
{"i": [["[\"74163f45f8ae062cfd50252b9c22bad8\", [32, 256, 28, 28], [32, 1, 28, 28]]", "cuda -keys=cuda,gpu -arch=sm_80 -max_num_threads=1024 -thread_warp_size=32", [-1, 16, 64, 49152, 2147483647, 1024, 8, 32], "llvm -keys=cpu ", 0, []], [[], [["CI", 3], ["CI", 1], ["FU", 4, [0, 1, 2, 3]], ["SP", 4, 0, 25088, [32], 1], ["AN", 4, 0, 5], ["AN", 4, 1, 6], ["FU", 2, [0, 1, 2, 3]], ["SP", 2, 0, 25088, [64], 1], ["AN", 2, 0, 5], ["AN", 2, 1, 6], ["PR", 2, 0, "auto_unroll_max_step$512"]]]], "r": [[1.0952e-05], 0, 1.20905, 1701293019], "v": "v0.6"}
{"i": [["[\"74163f45f8ae062cfd50252b9c22bad8\", [32, 256, 28, 28], [32, 1, 28, 28]]", "cuda -keys=cuda,gpu -arch=sm_80 -max_num_threads=1024 -thread_warp_size=32", [-1, 16, 64, 49152, 2147483647, 1024, 8, 32], "llvm -keys=cpu ", 0, []], [[], [["CI", 3], ["CI", 1], ["FU", 4, [0, 1, 2, 3]], ["SP", 4, 0, 25088, [32], 1], ["AN", 4, 0, 5], ["AN", 4, 1, 6], ["FU", 2, [0, 1, 2, 3]], ["SP", 2, 0, 25088, [2], 1], ["AN", 2, 0, 5], ["AN", 2, 1, 6], ["PR", 2, 0, "auto_unroll_max_step$0"]]]], "r": [[5.12439e-05], 0, 1.31482, 1701293019], "v": "v0.6"}
{"i": [["[\"74163f45f8ae062cfd50252b9c22bad8\", [32, 256, 28, 28], [32, 1, 28, 28]]", "cuda -keys=cuda,gpu -arch=sm_80 -max_num_threads=1024 -thread_warp_size=32", [-1, 16, 64, 49152, 2147483647, 1024, 8, 32], "llvm -keys=cpu ", 0, []], [[], [["CI", 3], ["CI", 1], ["FU", 4, [0, 1, 2, 3]], ["SP", 4, 0, 25088, [28], 1], ["AN", 4, 0, 5], ["AN", 4, 1, 6], ["FU", 2, [0, 1, 2, 3]], ["SP", 2, 0, 25088, [2], 1], ["AN", 2, 0, 5], ["AN", 2, 1, 6], ["PR", 2, 0, "auto_unroll_max_step$512"]]]], "r": [[5.1368e-05], 0, 1.2255, 1701293020], "v": "v0.6"}
{"i": [["[\"74163f45f8ae062cfd50252b9c22bad8\", [32, 256, 28, 28], [32, 1, 28, 28]]", "cuda -keys=cuda,gpu -arch=sm_80 -max_num_threads=1024 -thread_warp_size=32", [-1, 16, 64, 49152, 2147483647, 1024, 8, 32], "llvm -keys=cpu ", 0, []], [[], [["CI", 3], ["CI", 1], ["FU", 4, [0, 1, 2, 3]], ["SP", 4, 0, 25088, [16], 1], ["AN", 4, 0, 5], ["AN", 4, 1, 6], ["FU", 2, [0, 1, 2, 3]], ["SP", 2, 0, 25088, [32], 1], ["AN", 2, 0, 5], ["AN", 2, 1, 6], ["PR", 2, 0, "auto_unroll_max_step$1024"]]]], "r": [[1.14218e-05], 0, 1.28305, 1701293020], "v": "v0.6"}
{"i": [["[\"74163f45f8ae062cfd50252b9c22bad8\", [32, 256, 28, 28], [32, 1, 28, 28]]", "cuda -keys=cuda,gpu -arch=sm_80 -max_num_threads=1024 -thread_warp_size=32", [-1, 16, 64, 49152, 2147483647, 1024, 8, 32], "llvm -keys=cpu ", 0, []], [[], [["CI", 3], ["SP", 4, 3, 28, [7], 1], ["AN", 4, 4, 6], ["FSP", 2, 4, 1, 1], ["AN", 2, 5, 6], ["CA", 2, 4, 3], ["CI", 1], ["FU", 4, [0, 1, 2, 3]], ["AN", 4, 0, 5], ["PR", 2, 0, "auto_unroll_max_step$16"]]]], "r": [[8.69814e-05], 0, 1.2783, 1701293021], "v": "v0.6"}
{"i": [["[\"74163f45f8ae062cfd50252b9c22bad8\", [32, 256, 28, 28], [32, 1, 28, 28]]", "cuda -keys=cuda,gpu -arch=sm_80 -max_num_threads=1024 -thread_warp_size=32", [-1, 16, 64, 49152, 2147483647, 1024, 8, 32], "llvm -keys=cpu ", 0, []], [[], [["CI", 3], ["CI", 1], ["FU", 4, [0, 1, 2, 3]], ["SP", 4, 0, 25088, [16], 1], ["AN", 4, 0, 5], ["AN", 4, 1, 6], ["FU", 2, [0, 1, 2, 3]], ["SP", 2, 0, 25088, [4], 1], ["AN", 2, 0, 5], ["AN", 2, 1, 6], ["PR", 2, 0, "auto_unroll_max_step$0"]]]], "r": [[2.99698e-05], 0, 1.1564, 1701293021], "v": "v0.6"}
{"i": [["[\"74163f45f8ae062cfd50252b9c22bad8\", [32, 256, 28, 28], [32, 1, 28, 28]]", "cuda -keys=cuda,gpu -arch=sm_80 -max_num_threads=1024 -thread_warp_size=32", [-1, 16, 64, 49152, 2147483647, 1024, 8, 32], "llvm -keys=cpu ", 0, []], [[], [["CI", 3], ["CI", 1], ["FU", 4, [0, 1, 2, 3]], ["SP", 4, 0, 25088, [64], 1], ["AN", 4, 0, 5], ["AN", 4, 1, 6], ["FU", 2, [0, 1, 2, 3]], ["SP", 2, 0, 25088, [8], 1], ["AN", 2, 0, 5], ["AN", 2, 1, 6], ["PR", 2, 0, "auto_unroll_max_step$16"]]]], "r": [[1.84713e-05], 0, 1.29662, 1701293022], "v": "v0.6"}
{"i": [["[\"74163f45f8ae062cfd50252b9c22bad8\", [32, 256, 28, 28], [32, 1, 28, 28]]", "cuda -keys=cuda,gpu -arch=sm_80 -max_num_threads=1024 -thread_warp_size=32", [-1, 16, 64, 49152, 2147483647, 1024, 8, 32], "llvm -keys=cpu ", 0, []], [[], [["CI", 3], ["CI", 1], ["FU", 4, [0, 1, 2, 3]], ["SP", 4, 0, 25088, [64], 1], ["AN", 4, 0, 5], ["AN", 4, 1, 6], ["FU", 2, [0, 1, 2, 3]], ["SP", 2, 0, 25088, [1], 1], ["AN", 2, 0, 5], ["AN", 2, 1, 6], ["PR", 2, 0, "auto_unroll_max_step$64"]]]], "r": [[0.000118308], 0, 1.22806, 1701293022], "v": "v0.6"}
{"i": [["[\"74163f45f8ae062cfd50252b9c22bad8\", [32, 256, 28, 28], [32, 1, 28, 28]]", "cuda -keys=cuda,gpu -arch=sm_80 -max_num_threads=1024 -thread_warp_size=32", [-1, 16, 64, 49152, 2147483647, 1024, 8, 32], "llvm -keys=cpu ", 0, []], [[], [["CI", 3], ["CI", 1], ["FU", 4, [0, 1, 2, 3]], ["SP", 4, 0, 25088, [8], 1], ["AN", 4, 0, 5], ["AN", 4, 1, 6], ["FU", 2, [0, 1, 2, 3]], ["SP", 2, 0, 25088, [64], 1], ["AN", 2, 0, 5], ["AN", 2, 1, 6], ["PR", 2, 0, "auto_unroll_max_step$0"]]]], "r": [[1.26606e-05], 0, 1.21105, 1701293023], "v": "v0.6"}
{"i": [["[\"74163f45f8ae062cfd50252b9c22bad8\", [32, 256, 28, 28], [32, 1, 28, 28]]", "cuda -keys=cuda,gpu -arch=sm_80 -max_num_threads=1024 -thread_warp_size=32", [-1, 16, 64, 49152, 2147483647, 1024, 8, 32], "llvm -keys=cpu ", 0, []], [[], [["CI", 3], ["CI", 1], ["FU", 4, [0, 1, 2, 3]], ["SP", 4, 0, 25088, [16], 1], ["AN", 4, 0, 5], ["AN", 4, 1, 6], ["FU", 2, [0, 1, 2, 3]], ["SP", 2, 0, 25088, [64], 1], ["AN", 2, 0, 5], ["AN", 2, 1, 6], ["PR", 2, 0, "auto_unroll_max_step$16"]]]], "r": [[1.14634e-05], 0, 1.29025, 1701293023], "v": "v0.6"}
{"i": [["[\"74163f45f8ae062cfd50252b9c22bad8\", [32, 256, 28, 28], [32, 1, 28, 28]]", "cuda -keys=cuda,gpu -arch=sm_80 -max_num_threads=1024 -thread_warp_size=32", [-1, 16, 64, 49152, 2147483647, 1024, 8, 32], "llvm -keys=cpu ", 0, []], [[], [["CI", 3], ["CI", 1], ["FU", 4, [0, 1, 2, 3]], ["SP", 4, 0, 25088, [1], 1], ["AN", 4, 0, 5], ["AN", 4, 1, 6], ["FU", 2, [0, 1, 2, 3]], ["SP", 2, 0, 25088, [32], 1], ["AN", 2, 0, 5], ["AN", 2, 1, 6], ["PR", 2, 0, "auto_unroll_max_step$1024"]]]], "r": [[2.89001e-05], 0, 1.2786, 1701293024], "v": "v0.6"}
{"i": [["[\"74163f45f8ae062cfd50252b9c22bad8\", [32, 256, 28, 28], [32, 1, 28, 28]]", "cuda -keys=cuda,gpu -arch=sm_80 -max_num_threads=1024 -thread_warp_size=32", [-1, 16, 64, 49152, 2147483647, 1024, 8, 32], "llvm -keys=cpu ", 0, []], [[], [["CI", 3], ["CI", 1], ["FU", 4, [0, 1, 2, 3]], ["SP", 4, 0, 25088, [64], 1], ["AN", 4, 0, 5], ["AN", 4, 1, 6], ["FU", 2, [0, 1, 2, 3]], ["SP", 2, 0, 25088, [2], 1], ["AN", 2, 0, 5], ["AN", 2, 1, 6], ["PR", 2, 0, "auto_unroll_max_step$0"]]]], "r": [[5.10952e-05], 0, 1.28364, 1701293024], "v": "v0.6"}
{"i": [["[\"74163f45f8ae062cfd50252b9c22bad8\", [32, 256, 28, 28], [32, 1, 28, 28]]", "cuda -keys=cuda,gpu -arch=sm_80 -max_num_threads=1024 -thread_warp_size=32", [-1, 16, 64, 49152, 2147483647, 1024, 8, 32], "llvm -keys=cpu ", 0, []], [[], [["CI", 3], ["CI", 1], ["FU", 4, [0, 1, 2, 3]], ["SP", 4, 0, 25088, [32], 1], ["AN", 4, 0, 5], ["AN", 4, 1, 6], ["FU", 2, [0, 1, 2, 3]], ["SP", 2, 0, 25088, [32], 1], ["AN", 2, 0, 5], ["AN", 2, 1, 6], ["PR", 2, 0, "auto_unroll_max_step$0"]]]], "r": [[1.06525e-05], 0, 1.09398, 1701293025], "v": "v0.6"}
{"i": [["[\"74163f45f8ae062cfd50252b9c22bad8\", [32, 256, 28, 28], [32, 1, 28, 28]]", "cuda -keys=cuda,gpu -arch=sm_80 -max_num_threads=1024 -thread_warp_size=32", [-1, 16, 64, 49152, 2147483647, 1024, 8, 32], "llvm -keys=cpu ", 0, []], [[], [["CI", 3], ["CI", 1], ["FU", 4, [0, 1, 2, 3]], ["SP", 4, 0, 25088, [2], 1], ["AN", 4, 0, 5], ["AN", 4, 1, 6], ["FU", 2, [0, 1, 2, 3]], ["SP", 2, 0, 25088, [16], 1], ["AN", 2, 0, 5], ["AN", 2, 1, 6], ["PR", 2, 0, "auto_unroll_max_step$512"]]]], "r": [[2.18255e-05], 0, 1.32954, 1701293025], "v": "v0.6"}
{"i": [["[\"74163f45f8ae062cfd50252b9c22bad8\", [32, 256, 28, 28], [32, 1, 28, 28]]", "cuda -keys=cuda,gpu -arch=sm_80 -max_num_threads=1024 -thread_warp_size=32", [-1, 16, 64, 49152, 2147483647, 1024, 8, 32], "llvm -keys=cpu ", 0, []], [[], [["CI", 3], ["CI", 1], ["FU", 4, [0, 1, 2, 3]], ["SP", 4, 0, 25088, [32], 1], ["AN", 4, 0, 5], ["AN", 4, 1, 6], ["FU", 2, [0, 1, 2, 3]], ["SP", 2, 0, 25088, [16], 1], ["AN", 2, 0, 5], ["AN", 2, 1, 6], ["PR", 2, 0, "auto_unroll_max_step$1024"]]]], "r": [[1.30356e-05], 0, 1.28395, 1701293026], "v": "v0.6"}
{"i": [["[\"74163f45f8ae062cfd50252b9c22bad8\", [32, 256, 28, 28], [32, 1, 28, 28]]", "cuda -keys=cuda,gpu -arch=sm_80 -max_num_threads=1024 -thread_warp_size=32", [-1, 16, 64, 49152, 2147483647, 1024, 8, 32], "llvm -keys=cpu ", 0, []], [[], [["CI", 3], ["CI", 1], ["FU", 4, [0, 1, 2, 3]], ["SP", 4, 0, 25088, [64], 1], ["AN", 4, 0, 5], ["AN", 4, 1, 6], ["FU", 2, [0, 1, 2, 3]], ["SP", 2, 0, 25088, [4], 1], ["AN", 2, 0, 5], ["AN", 2, 1, 6], ["PR", 2, 0, "auto_unroll_max_step$512"]]]], "r": [[2.92185e-05], 0, 1.2087, 1701293026], "v": "v0.6"}
{"i": [["[\"74163f45f8ae062cfd50252b9c22bad8\", [32, 256, 28, 28], [32, 1, 28, 28]]", "cuda -keys=cuda,gpu -arch=sm_80 -max_num_threads=1024 -thread_warp_size=32", [-1, 16, 64, 49152, 2147483647, 1024, 8, 32], "llvm -keys=cpu ", 0, []], [[], [["CI", 3], ["CI", 1], ["FU", 4, [0, 1, 2, 3]], ["SP", 4, 0, 25088, [2], 1], ["AN", 4, 0, 5], ["AN", 4, 1, 6], ["FU", 2, [0, 1, 2, 3]], ["SP", 2, 0, 25088, [64], 1], ["AN", 2, 0, 5], ["AN", 2, 1, 6], ["PR", 2, 0, "auto_unroll_max_step$64"]]]], "r": [[1.96578e-05], 0, 1.14957, 1701293027], "v": "v0.6"}
{"i": [["[\"74163f45f8ae062cfd50252b9c22bad8\", [32, 256, 28, 28], [32, 1, 28, 28]]", "cuda -keys=cuda,gpu -arch=sm_80 -max_num_threads=1024 -thread_warp_size=32", [-1, 16, 64, 49152, 2147483647, 1024, 8, 32], "llvm -keys=cpu ", 0, []], [[], [["CI", 3], ["CI", 1], ["FU", 4, [0, 1, 2, 3]], ["SP", 4, 0, 25088, [32], 1], ["AN", 4, 0, 5], ["AN", 4, 1, 6], ["FU", 2, [0, 1, 2, 3]], ["SP", 2, 0, 25088, [8], 1], ["AN", 2, 0, 5], ["AN", 2, 1, 6], ["PR", 2, 0, "auto_unroll_max_step$0"]]]], "r": [[1.86285e-05], 0, 1.14332, 1701293027], "v": "v0.6"}
{"i": [["[\"74163f45f8ae062cfd50252b9c22bad8\", [32, 256, 28, 28], [32, 1, 28, 28]]", "cuda -keys=cuda,gpu -arch=sm_80 -max_num_threads=1024 -thread_warp_size=32", [-1, 16, 64, 49152, 2147483647, 1024, 8, 32], "llvm -keys=cpu ", 0, []], [[], [["CI", 3], ["SP", 4, 3, 28, [2], 1], ["AN", 4, 4, 6], ["FSP", 2, 4, 1, 1], ["AN", 2, 5, 6], ["CA", 2, 4, 3], ["CI", 1], ["FU", 4, [0, 1, 2, 3]], ["AN", 4, 0, 5], ["PR", 2, 0, "auto_unroll_max_step$16"]]]], "r": [[6.12969e-05], 0, 1.27114, 1701293028], "v": "v0.6"}
{"i": [["[\"74163f45f8ae062cfd50252b9c22bad8\", [32, 256, 28, 28], [32, 1, 28, 28]]", "cuda -keys=cuda,gpu -arch=sm_80 -max_num_threads=1024 -thread_warp_size=32", [-1, 16, 64, 49152, 2147483647, 1024, 8, 32], "llvm -keys=cpu ", 0, []], [[], [["CI", 3], ["CI", 1], ["FU", 4, [0, 1, 2, 3]], ["SP", 4, 0, 25088, [4], 1], ["AN", 4, 0, 5], ["AN", 4, 1, 6], ["FU", 2, [0, 1, 2, 3]], ["SP", 2, 0, 25088, [16], 1], ["AN", 2, 0, 5], ["AN", 2, 1, 6], ["PR", 2, 0, "auto_unroll_max_step$512"]]]], "r": [[1.71105e-05], 0, 1.2825, 1701293028], "v": "v0.6"}
{"i": [["[\"74163f45f8ae062cfd50252b9c22bad8\", [32, 256, 28, 28], [32, 1, 28, 28]]", "cuda -keys=cuda,gpu -arch=sm_80 -max_num_threads=1024 -thread_warp_size=32", [-1, 16, 64, 49152, 2147483647, 1024, 8, 32], "llvm -keys=cpu ", 0, []], [[], [["CI", 3], ["SP", 4, 3, 28, [7], 1], ["AN", 4, 4, 6], ["FSP", 2, 4, 1, 1], ["AN", 2, 5, 6], ["CA", 2, 4, 3], ["CI", 1], ["FU", 4, [0, 1, 2, 3]], ["AN", 4, 0, 5], ["PR", 2, 0, "auto_unroll_max_step$64"]]]], "r": [[6.53173e-05], 0, 1.27216, 1701293029], "v": "v0.6"}
{"i": [["[\"74163f45f8ae062cfd50252b9c22bad8\", [32, 256, 28, 28], [32, 1, 28, 28]]", "cuda -keys=cuda,gpu -arch=sm_80 -max_num_threads=1024 -thread_warp_size=32", [-1, 16, 64, 49152, 2147483647, 1024, 8, 32], "llvm -keys=cpu ", 0, []], [[], [["CI", 3], ["SP", 4, 3, 28, [24], 1], ["AN", 4, 4, 6], ["FSP", 2, 4, 1, 1], ["AN", 2, 5, 6], ["CA", 2, 4, 3], ["CI", 1], ["FU", 4, [0, 1, 2, 3]], ["AN", 4, 0, 5], ["PR", 2, 0, "auto_unroll_max_step$64"]]]], "r": [[7.82272e-05], 0, 1.1042, 1701293029], "v": "v0.6"}
{"i": [["[\"74163f45f8ae062cfd50252b9c22bad8\", [32, 256, 28, 28], [32, 1, 28, 28]]", "cuda -keys=cuda,gpu -arch=sm_80 -max_num_threads=1024 -thread_warp_size=32", [-1, 16, 64, 49152, 2147483647, 1024, 8, 32], "llvm -keys=cpu ", 0, []], [[], [["CI", 3], ["CI", 1], ["FU", 4, [0, 1, 2, 3]], ["SP", 4, 0, 25088, [1], 1], ["AN", 4, 0, 5], ["AN", 4, 1, 6], ["FU", 2, [0, 1, 2, 3]], ["SP", 2, 0, 25088, [32], 1], ["AN", 2, 0, 5], ["AN", 2, 1, 6], ["PR", 2, 0, "auto_unroll_max_step$0"]]]], "r": [[2.88896e-05], 0, 1.15371, 1701293030], "v": "v0.6"}
{"i": [["[\"74163f45f8ae062cfd50252b9c22bad8\", [32, 256, 28, 28], [32, 1, 28, 28]]", "cuda -keys=cuda,gpu -arch=sm_80 -max_num_threads=1024 -thread_warp_size=32", [-1, 16, 64, 49152, 2147483647, 1024, 8, 32], "llvm -keys=cpu ", 0, []], [[], [["CI", 3], ["CI", 1], ["FU", 4, [0, 1, 2, 3]], ["SP", 4, 0, 25088, [64], 1], ["AN", 4, 0, 5], ["AN", 4, 1, 6], ["FU", 2, [0, 1, 2, 3]], ["SP", 2, 0, 25088, [2], 1], ["AN", 2, 0, 5], ["AN", 2, 1, 6], ["PR", 2, 0, "auto_unroll_max_step$16"]]]], "r": [[5.10447e-05], 0, 1.23168, 1701293030], "v": "v0.6"}
{"i": [["[\"74163f45f8ae062cfd50252b9c22bad8\", [32, 256, 28, 28], [32, 1, 28, 28]]", "cuda -keys=cuda,gpu -arch=sm_80 -max_num_threads=1024 -thread_warp_size=32", [-1, 16, 64, 49152, 2147483647, 1024, 8, 32], "llvm -keys=cpu ", 0, []], [[], [["CI", 3], ["CI", 1], ["FU", 4, [0, 1, 2, 3]], ["SP", 4, 0, 25088, [64], 1], ["AN", 4, 0, 5], ["AN", 4, 1, 6], ["FU", 2, [0, 1, 2, 3]], ["SP", 2, 0, 25088, [32], 1], ["AN", 2, 0, 5], ["AN", 2, 1, 6], ["PR", 2, 0, "auto_unroll_max_step$16"]]]], "r": [[1.0648e-05], 0, 1.21955, 1701293031], "v": "v0.6"}
{"i": [["[\"74163f45f8ae062cfd50252b9c22bad8\", [32, 256, 28, 28], [32, 1, 28, 28]]", "cuda -keys=cuda,gpu -arch=sm_80 -max_num_threads=1024 -thread_warp_size=32", [-1, 16, 64, 49152, 2147483647, 1024, 8, 32], "llvm -keys=cpu ", 0, []], [[], [["CI", 3], ["SP", 4, 3, 28, [8], 1], ["AN", 4, 4, 6], ["FSP", 2, 4, 1, 1], ["AN", 2, 5, 6], ["CA", 2, 4, 3], ["CI", 1], ["FU", 4, [0, 1, 2, 3]], ["AN", 4, 0, 5], ["PR", 2, 0, "auto_unroll_max_step$0"]]]], "r": [[6.86761e-05], 0, 1.21958, 1701293031], "v": "v0.6"}
{"i": [["[\"74163f45f8ae062cfd50252b9c22bad8\", [32, 256, 28, 28], [32, 1, 28, 28]]", "cuda -keys=cuda,gpu -arch=sm_80 -max_num_threads=1024 -thread_warp_size=32", [-1, 16, 64, 49152, 2147483647, 1024, 8, 32], "llvm -keys=cpu ", 0, []], [[], [["CI", 3], ["SP", 4, 3, 28, [4], 1], ["AN", 4, 4, 6], ["FSP", 2, 4, 1, 1], ["AN", 2, 5, 6], ["CA", 2, 4, 3], ["CI", 1], ["FU", 4, [0, 1, 2, 3]], ["AN", 4, 0, 5], ["PR", 2, 0, "auto_unroll_max_step$0"]]]], "r": [[6.26383e-05], 0, 1.26417, 1701293032], "v": "v0.6"}
{"i": [["[\"74163f45f8ae062cfd50252b9c22bad8\", [32, 256, 28, 28], [32, 1, 28, 28]]", "cuda -keys=cuda,gpu -arch=sm_80 -max_num_threads=1024 -thread_warp_size=32", [-1, 16, 64, 49152, 2147483647, 1024, 8, 32], "llvm -keys=cpu ", 0, []], [[], [["CI", 3], ["SP", 4, 3, 28, [12], 1], ["AN", 4, 4, 6], ["FSP", 2, 4, 1, 1], ["AN", 2, 5, 6], ["CA", 2, 4, 3], ["CI", 1], ["FU", 4, [0, 1, 2, 3]], ["AN", 4, 0, 5], ["PR", 2, 0, "auto_unroll_max_step$0"]]]], "r": [[7.50392e-05], 0, 1.18733, 1701293032], "v": "v0.6"}
{"i": [["[\"74163f45f8ae062cfd50252b9c22bad8\", [32, 256, 28, 28], [32, 1, 28, 28]]", "cuda -keys=cuda,gpu -arch=sm_80 -max_num_threads=1024 -thread_warp_size=32", [-1, 16, 64, 49152, 2147483647, 1024, 8, 32], "llvm -keys=cpu ", 0, []], [[], [["CI", 3], ["CI", 1], ["FU", 4, [0, 1, 2, 3]], ["SP", 4, 0, 25088, [32], 1], ["AN", 4, 0, 5], ["AN", 4, 1, 6], ["FU", 2, [0, 1, 2, 3]], ["SP", 2, 0, 25088, [32], 1], ["AN", 2, 0, 5], ["AN", 2, 1, 6], ["PR", 2, 0, "auto_unroll_max_step$512"]]]], "r": [[1.0629e-05], 0, 1.13372, 1701293033], "v": "v0.6"}
{"i": [["[\"74163f45f8ae062cfd50252b9c22bad8\", [32, 256, 28, 28], [32, 1, 28, 28]]", "cuda -keys=cuda,gpu -arch=sm_80 -max_num_threads=1024 -thread_warp_size=32", [-1, 16, 64, 49152, 2147483647, 1024, 8, 32], "llvm -keys=cpu ", 0, []], [[], [["CI", 3], ["CI", 1], ["FU", 4, [0, 1, 2, 3]], ["SP", 4, 0, 25088, [64], 1], ["AN", 4, 0, 5], ["AN", 4, 1, 6], ["FU", 2, [0, 1, 2, 3]], ["SP", 2, 0, 25088, [32], 1], ["AN", 2, 0, 5], ["AN", 2, 1, 6], ["PR", 2, 0, "auto_unroll_max_step$0"]]]], "r": [[1.06665e-05], 0, 1.0991, 1701293033], "v": "v0.6"}
{"i": [["[\"74163f45f8ae062cfd50252b9c22bad8\", [32, 256, 28, 28], [32, 1, 28, 28]]", "cuda -keys=cuda,gpu -arch=sm_80 -max_num_threads=1024 -thread_warp_size=32", [-1, 16, 64, 49152, 2147483647, 1024, 8, 32], "llvm -keys=cpu ", 0, []], [[], [["CI", 3], ["SP", 4, 3, 28, [28], 1], ["AN", 4, 4, 6], ["FSP", 2, 4, 1, 1], ["AN", 2, 5, 6], ["CA", 2, 4, 3], ["CI", 1], ["FU", 4, [0, 1, 2, 3]], ["AN", 4, 0, 5], ["PR", 2, 0, "auto_unroll_max_step$16"]]]], "r": [[4.11984e-05], 0, 1.13242, 1701293034], "v": "v0.6"}
{"i": [["[\"74163f45f8ae062cfd50252b9c22bad8\", [32, 256, 28, 28], [32, 1, 28, 28]]", "cuda -keys=cuda,gpu -arch=sm_80 -max_num_threads=1024 -thread_warp_size=32", [-1, 16, 64, 49152, 2147483647, 1024, 8, 32], "llvm -keys=cpu ", 0, []], [[], [["CI", 3], ["CI", 1], ["FU", 4, [0, 1, 2, 3]], ["SP", 4, 0, 25088, [1], 1], ["AN", 4, 0, 5], ["AN", 4, 1, 6], ["FU", 2, [0, 1, 2, 3]], ["SP", 2, 0, 25088, [1], 1], ["AN", 2, 0, 5], ["AN", 2, 1, 6], ["PR", 2, 0, "auto_unroll_max_step$16"]]]], "r": [[0.000136486], 0, 1.23379, 1701293034], "v": "v0.6"}
