benchmark/subgraphs/bert/tvm_ansor.log
{"i": [["[\"43565f6f4fca46dbcfcfdaf993d26ecc\", [512, 4, 1024], [2048, 1024]]", "cuda -keys=cuda,gpu -arch=sm_80 -max_num_threads=1024 -thread_warp_size=32", [-1, 16, 64, 49152, 2147483647, 1024, 8, 32], "llvm -keys=cpu ", 0, []], [[], [["FU", 1, [0, 1]], ["SP", 1, 0, 2097152, [64], 1], ["AN", 1, 0, 5], ["AN", 1, 1, 6]]]], "r": [[3.23174e-05], 0, 2.79685, 1701237683], "v": "v0.6"}
{"i": [["[\"43565f6f4fca46dbcfcfdaf993d26ecc\", [512, 4, 1024], [2048, 1024]]", "cuda -keys=cuda,gpu -arch=sm_80 -max_num_threads=1024 -thread_warp_size=32", [-1, 16, 64, 49152, 2147483647, 1024, 8, 32], "llvm -keys=cpu ", 0, []], [[], [["FU", 1, [0, 1]], ["SP", 1, 0, 2097152, [4], 1], ["AN", 1, 0, 5], ["AN", 1, 1, 6]]]], "r": [[0.000391093], 0, 0.97266, 1701237683], "v": "v0.6"}
{"i": [["[\"43565f6f4fca46dbcfcfdaf993d26ecc\", [512, 4, 1024], [2048, 1024]]", "cuda -keys=cuda,gpu -arch=sm_80 -max_num_threads=1024 -thread_warp_size=32", [-1, 16, 64, 49152, 2147483647, 1024, 8, 32], "llvm -keys=cpu ", 0, []], [[], [["FU", 1, [0, 1]], ["SP", 1, 0, 2097152, [2], 1], ["AN", 1, 0, 5], ["AN", 1, 1, 6]]]], "r": [[0.000779486], 0, 0.849086, 1701237683], "v": "v0.6"}
{"i": [["[\"43565f6f4fca46dbcfcfdaf993d26ecc\", [512, 4, 1024], [2048, 1024]]", "cuda -keys=cuda,gpu -arch=sm_80 -max_num_threads=1024 -thread_warp_size=32", [-1, 16, 64, 49152, 2147483647, 1024, 8, 32], "llvm -keys=cpu ", 0, []], [[], [["FU", 1, [0, 1]], ["SP", 1, 0, 2097152, [32], 1], ["AN", 1, 0, 5], ["AN", 1, 1, 6]]]], "r": [[5.13526e-05], 0, 1.00557, 1701237684], "v": "v0.6"}
{"i": [["[\"43565f6f4fca46dbcfcfdaf993d26ecc\", [512, 4, 1024], [2048, 1024]]", "cuda -keys=cuda,gpu -arch=sm_80 -max_num_threads=1024 -thread_warp_size=32", [-1, 16, 64, 49152, 2147483647, 1024, 8, 32], "llvm -keys=cpu ", 0, []], [[], [["FU", 1, [0, 1]], ["SP", 1, 0, 2097152, [1], 1], ["AN", 1, 0, 5], ["AN", 1, 1, 6]]]], "r": [[0.00155624], 0, 0.961438, 1701237684], "v": "v0.6"}
{"i": [["[\"43565f6f4fca46dbcfcfdaf993d26ecc\", [512, 4, 1024], [2048, 1024]]", "cuda -keys=cuda,gpu -arch=sm_80 -max_num_threads=1024 -thread_warp_size=32", [-1, 16, 64, 49152, 2147483647, 1024, 8, 32], "llvm -keys=cpu ", 0, []], [[], [["FU", 1, [0, 1]], ["SP", 1, 0, 2097152, [8], 1], ["AN", 1, 0, 5], ["AN", 1, 1, 6]]]], "r": [[0.000196893], 0, 0.912973, 1701237685], "v": "v0.6"}
{"i": [["[\"43565f6f4fca46dbcfcfdaf993d26ecc\", [512, 4, 1024], [2048, 1024]]", "cuda -keys=cuda,gpu -arch=sm_80 -max_num_threads=1024 -thread_warp_size=32", [-1, 16, 64, 49152, 2147483647, 1024, 8, 32], "llvm -keys=cpu ", 0, []], [[], [["FU", 1, [0, 1]], ["SP", 1, 0, 2097152, [16], 1], ["AN", 1, 0, 5], ["AN", 1, 1, 6]]]], "r": [[9.98137e-05], 0, 0.958652, 1701237685], "v": "v0.6"}
{"i": [["[\"2564aab26bdcae13fcce01c8ad455163\", [64, 64, 512], [64, 64, 512]]", "cuda -keys=cuda,gpu -arch=sm_80 -max_num_threads=1024 -thread_warp_size=32", [-1, 16, 64, 49152, 2147483647, 1024, 8, 32], "llvm -keys=cpu ", 0, []], [[], [["CI", 1], ["FU", 2, [0, 1, 2]], ["SP", 2, 0, 2097152, [16], 1], ["AN", 2, 0, 5], ["AN", 2, 1, 6]]]], "r": [[0.000105712], 0, 2.2552, 1701237715], "v": "v0.6"}
{"i": [["[\"2564aab26bdcae13fcce01c8ad455163\", [64, 64, 512], [64, 64, 512]]", "cuda -keys=cuda,gpu -arch=sm_80 -max_num_threads=1024 -thread_warp_size=32", [-1, 16, 64, 49152, 2147483647, 1024, 8, 32], "llvm -keys=cpu ", 0, []], [[], [["CI", 1], ["FU", 2, [0, 1, 2]], ["SP", 2, 0, 2097152, [64], 1], ["AN", 2, 0, 5], ["AN", 2, 1, 6]]]], "r": [[2.66215e-05], 0, 0.930168, 1701237716], "v": "v0.6"}
{"i": [["[\"2564aab26bdcae13fcce01c8ad455163\", [64, 64, 512], [64, 64, 512]]", "cuda -keys=cuda,gpu -arch=sm_80 -max_num_threads=1024 -thread_warp_size=32", [-1, 16, 64, 49152, 2147483647, 1024, 8, 32], "llvm -keys=cpu ", 0, []], [[], [["CI", 1], ["FU", 2, [0, 1, 2]], ["SP", 2, 0, 2097152, [8], 1], ["AN", 2, 0, 5], ["AN", 2, 1, 6]]]], "r": [[0.000196901], 0, 0.945327, 1701237716], "v": "v0.6"}
{"i": [["[\"2564aab26bdcae13fcce01c8ad455163\", [64, 64, 512], [64, 64, 512]]", "cuda -keys=cuda,gpu -arch=sm_80 -max_num_threads=1024 -thread_warp_size=32", [-1, 16, 64, 49152, 2147483647, 1024, 8, 32], "llvm -keys=cpu ", 0, []], [[], [["CI", 1], ["FU", 2, [0, 1, 2]], ["SP", 2, 0, 2097152, [2], 1], ["AN", 2, 0, 5], ["AN", 2, 1, 6]]]], "r": [[0.000779494], 0, 0.894412, 1701237717], "v": "v0.6"}
{"i": [["[\"2564aab26bdcae13fcce01c8ad455163\", [64, 64, 512], [64, 64, 512]]", "cuda -keys=cuda,gpu -arch=sm_80 -max_num_threads=1024 -thread_warp_size=32", [-1, 16, 64, 49152, 2147483647, 1024, 8, 32], "llvm -keys=cpu ", 0, []], [[], [["CI", 1], ["FU", 2, [0, 1, 2]], ["SP", 2, 0, 2097152, [32], 1], ["AN", 2, 0, 5], ["AN", 2, 1, 6]]]], "r": [[5.13617e-05], 0, 0.987688, 1701237717], "v": "v0.6"}
{"i": [["[\"2564aab26bdcae13fcce01c8ad455163\", [64, 64, 512], [64, 64, 512]]", "cuda -keys=cuda,gpu -arch=sm_80 -max_num_threads=1024 -thread_warp_size=32", [-1, 16, 64, 49152, 2147483647, 1024, 8, 32], "llvm -keys=cpu ", 0, []], [[], [["CI", 1], ["FU", 2, [0, 1, 2]], ["SP", 2, 0, 2097152, [1], 1], ["AN", 2, 0, 5], ["AN", 2, 1, 6]]]], "r": [[0.00155749], 0, 0.812158, 1701237718], "v": "v0.6"}
{"i": [["[\"2564aab26bdcae13fcce01c8ad455163\", [64, 64, 512], [64, 64, 512]]", "cuda -keys=cuda,gpu -arch=sm_80 -max_num_threads=1024 -thread_warp_size=32", [-1, 16, 64, 49152, 2147483647, 1024, 8, 32], "llvm -keys=cpu ", 0, []], [[], [["CI", 1], ["FU", 2, [0, 1, 2]], ["SP", 2, 0, 2097152, [4], 1], ["AN", 2, 0, 5], ["AN", 2, 1, 6]]]], "r": [[0.000391088], 0, 0.980407, 1701237718], "v": "v0.6"}
{"i": [["[\"1f732d0f9fbc7a089a944574985c0d96\", [64, 512, 64], [64, 512, 64]]", "cuda -keys=cuda,gpu -arch=sm_80 -max_num_threads=1024 -thread_warp_size=32", [-1, 16, 64, 49152, 2147483647, 1024, 8, 32], "llvm -keys=cpu ", 0, []], [[], [["CI", 1], ["FU", 2, [0, 1, 2]], ["SP", 2, 0, 2097152, [32], 1], ["AN", 2, 0, 5], ["AN", 2, 1, 6]]]], "r": [[5.33673e-05], 0, 1.81722, 1701237748], "v": "v0.6"}
{"i": [["[\"1f732d0f9fbc7a089a944574985c0d96\", [64, 512, 64], [64, 512, 64]]", "cuda -keys=cuda,gpu -arch=sm_80 -max_num_threads=1024 -thread_warp_size=32", [-1, 16, 64, 49152, 2147483647, 1024, 8, 32], "llvm -keys=cpu ", 0, []], [[], [["CI", 1], ["FU", 2, [0, 1, 2]], ["SP", 2, 0, 2097152, [4], 1], ["AN", 2, 0, 5], ["AN", 2, 1, 6]]]], "r": [[0.000391093], 0, 0.963186, 1701237748], "v": "v0.6"}
{"i": [["[\"1f732d0f9fbc7a089a944574985c0d96\", [64, 512, 64], [64, 512, 64]]", "cuda -keys=cuda,gpu -arch=sm_80 -max_num_threads=1024 -thread_warp_size=32", [-1, 16, 64, 49152, 2147483647, 1024, 8, 32], "llvm -keys=cpu ", 0, []], [[], [["CI", 1], ["FU", 2, [0, 1, 2]], ["SP", 2, 0, 2097152, [1], 1], ["AN", 2, 0, 5], ["AN", 2, 1, 6]]]], "r": [[0.00155747], 0, 0.805133, 1701237748], "v": "v0.6"}
{"i": [["[\"1f732d0f9fbc7a089a944574985c0d96\", [64, 512, 64], [64, 512, 64]]", "cuda -keys=cuda,gpu -arch=sm_80 -max_num_threads=1024 -thread_warp_size=32", [-1, 16, 64, 49152, 2147483647, 1024, 8, 32], "llvm -keys=cpu ", 0, []], [[], [["CI", 1], ["FU", 2, [0, 1, 2]], ["SP", 2, 0, 2097152, [16], 1], ["AN", 2, 0, 5], ["AN", 2, 1, 6]]]], "r": [[9.98091e-05], 0, 0.957668, 1701237749], "v": "v0.6"}
{"i": [["[\"1f732d0f9fbc7a089a944574985c0d96\", [64, 512, 64], [64, 512, 64]]", "cuda -keys=cuda,gpu -arch=sm_80 -max_num_threads=1024 -thread_warp_size=32", [-1, 16, 64, 49152, 2147483647, 1024, 8, 32], "llvm -keys=cpu ", 0, []], [[], [["CI", 1], ["FU", 2, [0, 1, 2]], ["SP", 2, 0, 2097152, [2], 1], ["AN", 2, 0, 5], ["AN", 2, 1, 6]]]], "r": [[0.000779714], 0, 0.957219, 1701237749], "v": "v0.6"}
{"i": [["[\"1f732d0f9fbc7a089a944574985c0d96\", [64, 512, 64], [64, 512, 64]]", "cuda -keys=cuda,gpu -arch=sm_80 -max_num_threads=1024 -thread_warp_size=32", [-1, 16, 64, 49152, 2147483647, 1024, 8, 32], "llvm -keys=cpu ", 0, []], [[], [["CI", 1], ["FU", 2, [0, 1, 2]], ["SP", 2, 0, 2097152, [64], 1], ["AN", 2, 0, 5], ["AN", 2, 1, 6]]]], "r": [[2.66403e-05], 0, 0.934263, 1701237750], "v": "v0.6"}
{"i": [["[\"1f732d0f9fbc7a089a944574985c0d96\", [64, 512, 64], [64, 512, 64]]", "cuda -keys=cuda,gpu -arch=sm_80 -max_num_threads=1024 -thread_warp_size=32", [-1, 16, 64, 49152, 2147483647, 1024, 8, 32], "llvm -keys=cpu ", 0, []], [[], [["CI", 1], ["FU", 2, [0, 1, 2]], ["SP", 2, 0, 2097152, [8], 1], ["AN", 2, 0, 5], ["AN", 2, 1, 6]]]], "r": [[0.000196903], 0, 0.973048, 1701237750], "v": "v0.6"}
{"i": [["[\"05ea4bc9dd6b49bd09addb0a73f992ce\", [4, 16, 512, 512], [4, 16, 512, 512]]", "cuda -keys=cuda,gpu -arch=sm_80 -max_num_threads=1024 -thread_warp_size=32", [-1, 16, 64, 49152, 2147483647, 1024, 8, 32], "llvm -keys=cpu ", 0, []], [[], [["SP", 4, 3, 512, [1], 1], ["AN", 4, 4, 6], ["FSP", 3, 3, 0, 1], ["AN", 3, 4, 6], ["CA", 3, 4, 2], ["CI", 2], ["FSP", 1, 3, 0, 1], ["AN", 1, 4, 6], ["CA", 1, 4, 2], ["FU", 4, [0, 1, 2]], ["AN", 4, 0, 5], ["PR", 1, 0, "auto_unroll_max_step$0"], ["PR", 3, 0, "auto_unroll_max_step$1024"]]]], "r": [[0.00228501], 0, 6.04631, 1701237784], "v": "v0.6"}
{"i": [["[\"05ea4bc9dd6b49bd09addb0a73f992ce\", [4, 16, 512, 512], [4, 16, 512, 512]]", "cuda -keys=cuda,gpu -arch=sm_80 -max_num_threads=1024 -thread_warp_size=32", [-1, 16, 64, 49152, 2147483647, 1024, 8, 32], "llvm -keys=cpu ", 0, []], [[], [["CI", 2], ["SP", 1, 3, 512, [16], 1], ["AN", 1, 4, 6], ["FU", 4, [0, 1, 2, 3]], ["SP", 4, 0, 16777216, [64], 1], ["AN", 4, 0, 5], ["AN", 4, 1, 6], ["FU", 3, [0, 1, 2]], ["SP", 3, 0, 32768, [64], 1], ["AN", 3, 0, 5], ["AN", 3, 1, 6], ["FU", 1, [0, 1, 2]], ["AN", 1, 0, 5], ["PR", 1, 0, "auto_unroll_max_step$16"], ["PR", 3, 0, "auto_unroll_max_step$0"]]]], "r": [[0.00038554], 0, 2.17956, 1701237785], "v": "v0.6"}
{"i": [["[\"05ea4bc9dd6b49bd09addb0a73f992ce\", [4, 16, 512, 512], [4, 16, 512, 512]]", "cuda -keys=cuda,gpu -arch=sm_80 -max_num_threads=1024 -thread_warp_size=32", [-1, 16, 64, 49152, 2147483647, 1024, 8, 32], "llvm -keys=cpu ", 0, []], [[], [["CI", 2], ["FU", 4, [0, 1, 2, 3]], ["SP", 4, 0, 16777216, [8], 1], ["AN", 4, 0, 5], ["AN", 4, 1, 6], ["FU", 3, [0, 1, 2]], ["SP", 3, 0, 32768, [32], 1], ["AN", 3, 0, 5], ["AN", 3, 1, 6], ["FU", 1, [0, 1, 2]], ["SP", 1, 0, 32768, [32], 1], ["AN", 1, 0, 5], ["AN", 1, 1, 6], ["PR", 1, 0, "auto_unroll_max_step$1024"], ["PR", 3, 0, "auto_unroll_max_step$1024"]]]], "r": [[0.0018245], 0, 2.06369, 1701237787], "v": "v0.6"}
{"i": [["[\"05ea4bc9dd6b49bd09addb0a73f992ce\", [4, 16, 512, 512], [4, 16, 512, 512]]", "cuda -keys=cuda,gpu -arch=sm_80 -max_num_threads=1024 -thread_warp_size=32", [-1, 16, 64, 49152, 2147483647, 1024, 8, 32], "llvm -keys=cpu ", 0, []], [[], [["CI", 2], ["SP", 1, 3, 512, [16], 1], ["AN", 1, 4, 6], ["FU", 4, [0, 1, 2, 3]], ["SP", 4, 0, 16777216, [32], 1], ["AN", 4, 0, 5], ["AN", 4, 1, 6], ["FU", 3, [0, 1, 2]], ["SP", 3, 0, 32768, [64], 1], ["AN", 3, 0, 5], ["AN", 3, 1, 6], ["FU", 1, [0, 1, 2]], ["AN", 1, 0, 5], ["PR", 1, 0, "auto_unroll_max_step$16"], ["PR", 3, 0, "auto_unroll_max_step$0"]]]], "r": [[0.000577289], 0, 2.04618, 1701237788], "v": "v0.6"}
{"i": [["[\"05ea4bc9dd6b49bd09addb0a73f992ce\", [4, 16, 512, 512], [4, 16, 512, 512]]", "cuda -keys=cuda,gpu -arch=sm_80 -max_num_threads=1024 -thread_warp_size=32", [-1, 16, 64, 49152, 2147483647, 1024, 8, 32], "llvm -keys=cpu ", 0, []], [[], [["CI", 2], ["SP", 1, 3, 512, [32], 1], ["AN", 1, 4, 6], ["FU", 4, [0, 1, 2, 3]], ["SP", 4, 0, 16777216, [32], 1], ["AN", 4, 0, 5], ["AN", 4, 1, 6], ["FU", 3, [0, 1, 2]], ["SP", 3, 0, 32768, [8], 1], ["AN", 3, 0, 5], ["AN", 3, 1, 6], ["FU", 1, [0, 1, 2]], ["AN", 1, 0, 5], ["PR", 1, 0, "auto_unroll_max_step$512"], ["PR", 3, 0, "auto_unroll_max_step$1024"]]]], "r": [[0.000574996], 0, 2.10031, 1701237790], "v": "v0.6"}
{"i": [["[\"05ea4bc9dd6b49bd09addb0a73f992ce\", [4, 16, 512, 512], [4, 16, 512, 512]]", "cuda -keys=cuda,gpu -arch=sm_80 -max_num_threads=1024 -thread_warp_size=32", [-1, 16, 64, 49152, 2147483647, 1024, 8, 32], "llvm -keys=cpu ", 0, []], [[], [["CI", 2], ["SP", 1, 3, 512, [64], 1], ["AN", 1, 4, 6], ["FU", 4, [0, 1, 2, 3]], ["SP", 4, 0, 16777216, [32], 1], ["AN", 4, 0, 5], ["AN", 4, 1, 6], ["FU", 3, [0, 1, 2]], ["SP", 3, 0, 32768, [32], 1], ["AN", 3, 0, 5], ["AN", 3, 1, 6], ["FU", 1, [0, 1, 2]], ["AN", 1, 0, 5], ["PR", 1, 0, "auto_unroll_max_step$16"], ["PR", 3, 0, "auto_unroll_max_step$0"]]]], "r": [[0.000575763], 0, 2.08434, 1701237791], "v": "v0.6"}
{"i": [["[\"05ea4bc9dd6b49bd09addb0a73f992ce\", [4, 16, 512, 512], [4, 16, 512, 512]]", "cuda -keys=cuda,gpu -arch=sm_80 -max_num_threads=1024 -thread_warp_size=32", [-1, 16, 64, 49152, 2147483647, 1024, 8, 32], "llvm -keys=cpu ", 0, []], [[], [["SP", 4, 3, 512, [32], 1], ["AN", 4, 4, 6], ["FSP", 3, 3, 0, 1], ["AN", 3, 4, 6], ["CA", 3, 4, 2], ["CI", 2], ["FSP", 1, 3, 0, 1], ["AN", 1, 4, 6], ["CA", 1, 4, 2], ["FU", 4, [0, 1, 2]], ["AN", 4, 0, 5], ["PR", 1, 0, "auto_unroll_max_step$64"], ["PR", 3, 0, "auto_unroll_max_step$0"]]]], "r": [[6.09117e-05], 0, 1.94728, 1701237792], "v": "v0.6"}
{"i": [["[\"05ea4bc9dd6b49bd09addb0a73f992ce\", [4, 16, 512, 512], [4, 16, 512, 512]]", "cuda -keys=cuda,gpu -arch=sm_80 -max_num_threads=1024 -thread_warp_size=32", [-1, 16, 64, 49152, 2147483647, 1024, 8, 32], "llvm -keys=cpu ", 0, []], [[], [["SP", 4, 3, 512, [1], 1], ["AN", 4, 4, 6], ["FSP", 3, 3, 0, 1], ["AN", 3, 4, 6], ["CA", 3, 4, 2], ["CI", 2], ["FSP", 1, 3, 0, 1], ["AN", 1, 4, 6], ["CA", 1, 4, 2], ["FU", 4, [0, 1, 2]], ["AN", 4, 0, 5], ["PR", 1, 0, "auto_unroll_max_step$16"], ["PR", 3, 0, "auto_unroll_max_step$0"]]]], "r": [[0.00154016], 0, 2.01631, 1701237794], "v": "v0.6"}
{"i": [["[\"05ea4bc9dd6b49bd09addb0a73f992ce\", [4, 16, 512, 512], [4, 16, 512, 512]]", "cuda -keys=cuda,gpu -arch=sm_80 -max_num_threads=1024 -thread_warp_size=32", [-1, 16, 64, 49152, 2147483647, 1024, 8, 32], "llvm -keys=cpu ", 0, []], [[], [["SP", 4, 3, 512, [2], 1], ["AN", 4, 4, 6], ["FSP", 3, 3, 0, 1], ["AN", 3, 4, 6], ["CA", 3, 4, 2], ["CI", 2], ["FSP", 1, 3, 0, 1], ["AN", 1, 4, 6], ["CA", 1, 4, 2], ["FU", 4, [0, 1, 2]], ["AN", 4, 0, 5], ["PR", 1, 0, "auto_unroll_max_step$16"], ["PR", 3, 0, "auto_unroll_max_step$512"]]]], "r": [[0.000820324], 0, 3.11316, 1701237795], "v": "v0.6"}
{"i": [["[\"05ea4bc9dd6b49bd09addb0a73f992ce\", [4, 16, 512, 512], [4, 16, 512, 512]]", "cuda -keys=cuda,gpu -arch=sm_80 -max_num_threads=1024 -thread_warp_size=32", [-1, 16, 64, 49152, 2147483647, 1024, 8, 32], "llvm -keys=cpu ", 0, []], [[], [["CI", 2], ["SP", 1, 3, 512, [64], 1], ["AN", 1, 4, 6], ["FU", 4, [0, 1, 2, 3]], ["SP", 4, 0, 16777216, [32], 1], ["AN", 4, 0, 5], ["AN", 4, 1, 6], ["FU", 3, [0, 1, 2]], ["SP", 3, 0, 32768, [32], 1], ["AN", 3, 0, 5], ["AN", 3, 1, 6], ["FU", 1, [0, 1, 2]], ["AN", 1, 0, 5], ["PR", 1, 0, "auto_unroll_max_step$1024"], ["PR", 3, 0, "auto_unroll_max_step$64"]]]], "r": [[0.000573768], 0, 1.96161, 1701237796], "v": "v0.6"}
{"i": [["[\"05ea4bc9dd6b49bd09addb0a73f992ce\", [4, 16, 512, 512], [4, 16, 512, 512]]", "cuda -keys=cuda,gpu -arch=sm_80 -max_num_threads=1024 -thread_warp_size=32", [-1, 16, 64, 49152, 2147483647, 1024, 8, 32], "llvm -keys=cpu ", 0, []], [[], [["CI", 2], ["FU", 4, [0, 1, 2, 3]], ["SP", 4, 0, 16777216, [64], 1], ["AN", 4, 0, 5], ["AN", 4, 1, 6], ["FU", 3, [0, 1, 2]], ["SP", 3, 0, 32768, [4], 1], ["AN", 3, 0, 5], ["AN", 3, 1, 6], ["FU", 1, [0, 1, 2]], ["SP", 1, 0, 32768, [32], 1], ["AN", 1, 0, 5], ["AN", 1, 1, 6], ["PR", 1, 0, "auto_unroll_max_step$0"], ["PR", 3, 0, "auto_unroll_max_step$16"]]]], "r": [[0.00051992], 0, 2.05675, 1701237798], "v": "v0.6"}
{"i": [["[\"05ea4bc9dd6b49bd09addb0a73f992ce\", [4, 16, 512, 512], [4, 16, 512, 512]]", "cuda -keys=cuda,gpu -arch=sm_80 -max_num_threads=1024 -thread_warp_size=32", [-1, 16, 64, 49152, 2147483647, 1024, 8, 32], "llvm -keys=cpu ", 0, []], [[], [["SP", 4, 3, 512, [32], 1], ["AN", 4, 4, 6], ["FSP", 3, 3, 0, 1], ["AN", 3, 4, 6], ["CA", 3, 4, 2], ["CI", 2], ["FU", 4, [0, 1, 2]], ["AN", 4, 0, 5], ["FU", 1, [0, 1, 2]], ["SP", 1, 0, 32768, [64], 1], ["AN", 1, 0, 5], ["AN", 1, 1, 6], ["PR", 1, 0, "auto_unroll_max_step$1024"], ["PR", 3, 0, "auto_unroll_max_step$512"]]]], "r": [[0.000185211], 0, 2.01432, 1701237799], "v": "v0.6"}
{"i": [["[\"05ea4bc9dd6b49bd09addb0a73f992ce\", [4, 16, 512, 512], [4, 16, 512, 512]]", "cuda -keys=cuda,gpu -arch=sm_80 -max_num_threads=1024 -thread_warp_size=32", [-1, 16, 64, 49152, 2147483647, 1024, 8, 32], "llvm -keys=cpu ", 0, []], [[], [["SP", 4, 3, 512, [64], 1], ["AN", 4, 4, 6], ["FSP", 3, 3, 0, 1], ["AN", 3, 4, 6], ["CA", 3, 4, 2], ["CI", 2], ["FU", 4, [0, 1, 2]], ["AN", 4, 0, 5], ["FU", 1, [0, 1, 2]], ["SP", 1, 0, 32768, [2], 1], ["AN", 1, 0, 5], ["AN", 1, 1, 6], ["PR", 1, 0, "auto_unroll_max_step$16"], ["PR", 3, 0, "auto_unroll_max_step$16"]]]], "r": [[0.000247239], 0, 2.05824, 1701237800], "v": "v0.6"}
{"i": [["[\"05ea4bc9dd6b49bd09addb0a73f992ce\", [4, 16, 512, 512], [4, 16, 512, 512]]", "cuda -keys=cuda,gpu -arch=sm_80 -max_num_threads=1024 -thread_warp_size=32", [-1, 16, 64, 49152, 2147483647, 1024, 8, 32], "llvm -keys=cpu ", 0, []], [[], [["SP", 4, 3, 512, [32], 1], ["AN", 4, 4, 6], ["FSP", 3, 3, 0, 1], ["AN", 3, 4, 6], ["CA", 3, 4, 2], ["CI", 2], ["FSP", 1, 3, 0, 1], ["AN", 1, 4, 6], ["CA", 1, 4, 2], ["FU", 4, [0, 1, 2]], ["AN", 4, 0, 5], ["PR", 1, 0, "auto_unroll_max_step$1024"], ["PR", 3, 0, "auto_unroll_max_step$1024"]]]], "r": [[6.01119e-05], 0, 2.04132, 1701237802], "v": "v0.6"}
{"i": [["[\"05ea4bc9dd6b49bd09addb0a73f992ce\", [4, 16, 512, 512], [4, 16, 512, 512]]", "cuda -keys=cuda,gpu -arch=sm_80 -max_num_threads=1024 -thread_warp_size=32", [-1, 16, 64, 49152, 2147483647, 1024, 8, 32], "llvm -keys=cpu ", 0, []], [[], [["CI", 2], ["FU", 4, [0, 1, 2, 3]], ["SP", 4, 0, 16777216, [64], 1], ["AN", 4, 0, 5], ["AN", 4, 1, 6], ["FU", 3, [0, 1, 2]], ["SP", 3, 0, 32768, [32], 1], ["AN", 3, 0, 5], ["AN", 3, 1, 6], ["FU", 1, [0, 1, 2]], ["SP", 1, 0, 32768, [32], 1], ["AN", 1, 0, 5], ["AN", 1, 1, 6], ["PR", 1, 0, "auto_unroll_max_step$512"], ["PR", 3, 0, "auto_unroll_max_step$1024"]]]], "r": [[0.000466465], 0, 1.93371, 1701237803], "v": "v0.6"}
{"i": [["[\"05ea4bc9dd6b49bd09addb0a73f992ce\", [4, 16, 512, 512], [4, 16, 512, 512]]", "cuda -keys=cuda,gpu -arch=sm_80 -max_num_threads=1024 -thread_warp_size=32", [-1, 16, 64, 49152, 2147483647, 1024, 8, 32], "llvm -keys=cpu ", 0, []], [[], [["SP", 4, 3, 512, [16], 1], ["AN", 4, 4, 6], ["FSP", 3, 3, 0, 1], ["AN", 3, 4, 6], ["CA", 3, 4, 2], ["CI", 2], ["FU", 4, [0, 1, 2]], ["AN", 4, 0, 5], ["FU", 1, [0, 1, 2]], ["SP", 1, 0, 32768, [4], 1], ["AN", 1, 0, 5], ["AN", 1, 1, 6], ["PR", 1, 0, "auto_unroll_max_step$0"], ["PR", 3, 0, "auto_unroll_max_step$16"]]]], "r": [[0.000237342], 0, 2.02482, 1701237804], "v": "v0.6"}
{"i": [["[\"05ea4bc9dd6b49bd09addb0a73f992ce\", [4, 16, 512, 512], [4, 16, 512, 512]]", "cuda -keys=cuda,gpu -arch=sm_80 -max_num_threads=1024 -thread_warp_size=32", [-1, 16, 64, 49152, 2147483647, 1024, 8, 32], "llvm -keys=cpu ", 0, []], [[], [["CI", 2], ["FU", 4, [0, 1, 2, 3]], ["SP", 4, 0, 16777216, [1], 1], ["AN", 4, 0, 5], ["AN", 4, 1, 6], ["FU", 3, [0, 1, 2]], ["SP", 3, 0, 32768, [16], 1], ["AN", 3, 0, 5], ["AN", 3, 1, 6], ["FU", 1, [0, 1, 2]], ["SP", 1, 0, 32768, [4], 1], ["AN", 1, 0, 5], ["AN", 1, 1, 6], ["PR", 1, 0, "auto_unroll_max_step$0"], ["PR", 3, 0, "auto_unroll_max_step$0"]]]], "r": [[0.016321], 0, 2.03301, 1701237805], "v": "v0.6"}
{"i": [["[\"05ea4bc9dd6b49bd09addb0a73f992ce\", [4, 16, 512, 512], [4, 16, 512, 512]]", "cuda -keys=cuda,gpu -arch=sm_80 -max_num_threads=1024 -thread_warp_size=32", [-1, 16, 64, 49152, 2147483647, 1024, 8, 32], "llvm -keys=cpu ", 0, []], [[], [["CI", 2], ["SP", 1, 3, 512, [64], 1], ["AN", 1, 4, 6], ["FU", 4, [0, 1, 2, 3]], ["SP", 4, 0, 16777216, [32], 1], ["AN", 4, 0, 5], ["AN", 4, 1, 6], ["FU", 3, [0, 1, 2]], ["SP", 3, 0, 32768, [64], 1], ["AN", 3, 0, 5], ["AN", 3, 1, 6], ["FU", 1, [0, 1, 2]], ["AN", 1, 0, 5], ["PR", 1, 0, "auto_unroll_max_step$64"], ["PR", 3, 0, "auto_unroll_max_step$512"]]]], "r": [[0.000583258], 0, 2.20912, 1701237807], "v": "v0.6"}
{"i": [["[\"05ea4bc9dd6b49bd09addb0a73f992ce\", [4, 16, 512, 512], [4, 16, 512, 512]]", "cuda -keys=cuda,gpu -arch=sm_80 -max_num_threads=1024 -thread_warp_size=32", [-1, 16, 64, 49152, 2147483647, 1024, 8, 32], "llvm -keys=cpu ", 0, []], [[], [["SP", 4, 3, 512, [64], 1], ["AN", 4, 4, 6], ["FSP", 3, 3, 0, 1], ["AN", 3, 4, 6], ["CA", 3, 4, 2], ["CI", 2], ["FSP", 1, 3, 0, 1], ["AN", 1, 4, 6], ["CA", 1, 4, 2], ["FU", 4, [0, 1, 2]], ["AN", 4, 0, 5], ["PR", 1, 0, "auto_unroll_max_step$16"], ["PR", 3, 0, "auto_unroll_max_step$512"]]]], "r": [[6.11036e-05], 0, 1.96378, 1701237808], "v": "v0.6"}
{"i": [["[\"05ea4bc9dd6b49bd09addb0a73f992ce\", [4, 16, 512, 512], [4, 16, 512, 512]]", "cuda -keys=cuda,gpu -arch=sm_80 -max_num_threads=1024 -thread_warp_size=32", [-1, 16, 64, 49152, 2147483647, 1024, 8, 32], "llvm -keys=cpu ", 0, []], [[], [["CI", 2], ["SP", 1, 3, 512, [2], 1], ["AN", 1, 4, 6], ["FU", 4, [0, 1, 2, 3]], ["SP", 4, 0, 16777216, [2], 1], ["AN", 4, 0, 5], ["AN", 4, 1, 6], ["FU", 3, [0, 1, 2]], ["SP", 3, 0, 32768, [64], 1], ["AN", 3, 0, 5], ["AN", 3, 1, 6], ["FU", 1, [0, 1, 2]], ["AN", 1, 0, 5], ["PR", 1, 0, "auto_unroll_max_step$512"], ["PR", 3, 0, "auto_unroll_max_step$0"]]]], "r": [[0.00654624], 0, 2.1402, 1701237809], "v": "v0.6"}
{"i": [["[\"05ea4bc9dd6b49bd09addb0a73f992ce\", [4, 16, 512, 512], [4, 16, 512, 512]]", "cuda -keys=cuda,gpu -arch=sm_80 -max_num_threads=1024 -thread_warp_size=32", [-1, 16, 64, 49152, 2147483647, 1024, 8, 32], "llvm -keys=cpu ", 0, []], [[], [["CI", 2], ["FU", 4, [0, 1, 2, 3]], ["SP", 4, 0, 16777216, [32], 1], ["AN", 4, 0, 5], ["AN", 4, 1, 6], ["FU", 3, [0, 1, 2]], ["SP", 3, 0, 32768, [64], 1], ["AN", 3, 0, 5], ["AN", 3, 1, 6], ["FU", 1, [0, 1, 2]], ["SP", 1, 0, 32768, [1], 1], ["AN", 1, 0, 5], ["AN", 1, 1, 6], ["PR", 1, 0, "auto_unroll_max_step$1024"], ["PR", 3, 0, "auto_unroll_max_step$1024"]]]], "r": [[0.000787424], 0, 2.17307, 1701237811], "v": "v0.6"}
{"i": [["[\"05ea4bc9dd6b49bd09addb0a73f992ce\", [4, 16, 512, 512], [4, 16, 512, 512]]", "cuda -keys=cuda,gpu -arch=sm_80 -max_num_threads=1024 -thread_warp_size=32", [-1, 16, 64, 49152, 2147483647, 1024, 8, 32], "llvm -keys=cpu ", 0, []], [[], [["CI", 2], ["FU", 4, [0, 1, 2, 3]], ["SP", 4, 0, 16777216, [32], 1], ["AN", 4, 0, 5], ["AN", 4, 1, 6], ["FU", 3, [0, 1, 2]], ["SP", 3, 0, 32768, [32], 1], ["AN", 3, 0, 5], ["AN", 3, 1, 6], ["FU", 1, [0, 1, 2]], ["SP", 1, 0, 32768, [64], 1], ["AN", 1, 0, 5], ["AN", 1, 1, 6], ["PR", 1, 0, "auto_unroll_max_step$64"], ["PR", 3, 0, "auto_unroll_max_step$64"]]]], "r": [[0.000847356], 0, 2.01207, 1701237812], "v": "v0.6"}
{"i": [["[\"05ea4bc9dd6b49bd09addb0a73f992ce\", [4, 16, 512, 512], [4, 16, 512, 512]]", "cuda -keys=cuda,gpu -arch=sm_80 -max_num_threads=1024 -thread_warp_size=32", [-1, 16, 64, 49152, 2147483647, 1024, 8, 32], "llvm -keys=cpu ", 0, []], [[], [["CI", 2], ["FU", 4, [0, 1, 2, 3]], ["SP", 4, 0, 16777216, [4], 1], ["AN", 4, 0, 5], ["AN", 4, 1, 6], ["FU", 3, [0, 1, 2]], ["SP", 3, 0, 32768, [64], 1], ["AN", 3, 0, 5], ["AN", 3, 1, 6], ["FU", 1, [0, 1, 2]], ["SP", 1, 0, 32768, [4], 1], ["AN", 1, 0, 5], ["AN", 1, 1, 6], ["PR", 1, 0, "auto_unroll_max_step$0"], ["PR", 3, 0, "auto_unroll_max_step$1024"]]]], "r": [[0.00338586], 0, 2.03822, 1701237813], "v": "v0.6"}
{"i": [["[\"05ea4bc9dd6b49bd09addb0a73f992ce\", [4, 16, 512, 512], [4, 16, 512, 512]]", "cuda -keys=cuda,gpu -arch=sm_80 -max_num_threads=1024 -thread_warp_size=32", [-1, 16, 64, 49152, 2147483647, 1024, 8, 32], "llvm -keys=cpu ", 0, []], [[], [["SP", 4, 3, 512, [2], 1], ["AN", 4, 4, 6], ["FSP", 3, 3, 0, 1], ["AN", 3, 4, 6], ["CA", 3, 4, 2], ["CI", 2], ["FU", 4, [0, 1, 2]], ["AN", 4, 0, 5], ["FU", 1, [0, 1, 2]], ["SP", 1, 0, 32768, [2], 1], ["AN", 1, 0, 5], ["AN", 1, 1, 6], ["PR", 1, 0, "auto_unroll_max_step$1024"], ["PR", 3, 0, "auto_unroll_max_step$512"]]]], "r": [[0.000926738], 0, 3.06606, 1701237815], "v": "v0.6"}
{"i": [["[\"05ea4bc9dd6b49bd09addb0a73f992ce\", [4, 16, 512, 512], [4, 16, 512, 512]]", "cuda -keys=cuda,gpu -arch=sm_80 -max_num_threads=1024 -thread_warp_size=32", [-1, 16, 64, 49152, 2147483647, 1024, 8, 32], "llvm -keys=cpu ", 0, []], [[], [["CI", 2], ["FU", 4, [0, 1, 2, 3]], ["SP", 4, 0, 16777216, [32], 1], ["AN", 4, 0, 5], ["AN", 4, 1, 6], ["FU", 3, [0, 1, 2]], ["SP", 3, 0, 32768, [8], 1], ["AN", 3, 0, 5], ["AN", 3, 1, 6], ["FU", 1, [0, 1, 2]], ["SP", 1, 0, 32768, [64], 1], ["AN", 1, 0, 5], ["AN", 1, 1, 6], ["PR", 1, 0, "auto_unroll_max_step$0"], ["PR", 3, 0, "auto_unroll_max_step$64"]]]], "r": [[0.000675226], 0, 2.09525, 1701237816], "v": "v0.6"}
{"i": [["[\"05ea4bc9dd6b49bd09addb0a73f992ce\", [4, 16, 512, 512], [4, 16, 512, 512]]", "cuda -keys=cuda,gpu -arch=sm_80 -max_num_threads=1024 -thread_warp_size=32", [-1, 16, 64, 49152, 2147483647, 1024, 8, 32], "llvm -keys=cpu ", 0, []], [[], [["CI", 2], ["SP", 1, 3, 512, [16], 1], ["AN", 1, 4, 6], ["FU", 4, [0, 1, 2, 3]], ["SP", 4, 0, 16777216, [32], 1], ["AN", 4, 0, 5], ["AN", 4, 1, 6], ["FU", 3, [0, 1, 2]], ["SP", 3, 0, 32768, [32], 1], ["AN", 3, 0, 5], ["AN", 3, 1, 6], ["FU", 1, [0, 1, 2]], ["AN", 1, 0, 5], ["PR", 1, 0, "auto_unroll_max_step$64"], ["PR", 3, 0, "auto_unroll_max_step$1024"]]]], "r": [[0.000575758], 0, 1.94864, 1701237817], "v": "v0.6"}
{"i": [["[\"05ea4bc9dd6b49bd09addb0a73f992ce\", [4, 16, 512, 512], [4, 16, 512, 512]]", "cuda -keys=cuda,gpu -arch=sm_80 -max_num_threads=1024 -thread_warp_size=32", [-1, 16, 64, 49152, 2147483647, 1024, 8, 32], "llvm -keys=cpu ", 0, []], [[], [["CI", 2], ["SP", 1, 3, 512, [8], 1], ["AN", 1, 4, 6], ["FU", 4, [0, 1, 2, 3]], ["SP", 4, 0, 16777216, [32], 1], ["AN", 4, 0, 5], ["AN", 4, 1, 6], ["FU", 3, [0, 1, 2]], ["SP", 3, 0, 32768, [32], 1], ["AN", 3, 0, 5], ["AN", 3, 1, 6], ["FU", 1, [0, 1, 2]], ["AN", 1, 0, 5], ["PR", 1, 0, "auto_unroll_max_step$1024"], ["PR", 3, 0, "auto_unroll_max_step$512"]]]], "r": [[0.000596004], 0, 2.11142, 1701237819], "v": "v0.6"}
{"i": [["[\"05ea4bc9dd6b49bd09addb0a73f992ce\", [4, 16, 512, 512], [4, 16, 512, 512]]", "cuda -keys=cuda,gpu -arch=sm_80 -max_num_threads=1024 -thread_warp_size=32", [-1, 16, 64, 49152, 2147483647, 1024, 8, 32], "llvm -keys=cpu ", 0, []], [[], [["CI", 2], ["FU", 4, [0, 1, 2, 3]], ["SP", 4, 0, 16777216, [2], 1], ["AN", 4, 0, 5], ["AN", 4, 1, 6], ["FU", 3, [0, 1, 2]], ["SP", 3, 0, 32768, [4], 1], ["AN", 3, 0, 5], ["AN", 3, 1, 6], ["FU", 1, [0, 1, 2]], ["SP", 1, 0, 32768, [32], 1], ["AN", 1, 0, 5], ["AN", 1, 1, 6], ["PR", 1, 0, "auto_unroll_max_step$1024"], ["PR", 3, 0, "auto_unroll_max_step$1024"]]]], "r": [[0.00655437], 0, 2.16267, 1701237820], "v": "v0.6"}
{"i": [["[\"05ea4bc9dd6b49bd09addb0a73f992ce\", [4, 16, 512, 512], [4, 16, 512, 512]]", "cuda -keys=cuda,gpu -arch=sm_80 -max_num_threads=1024 -thread_warp_size=32", [-1, 16, 64, 49152, 2147483647, 1024, 8, 32], "llvm -keys=cpu ", 0, []], [[], [["SP", 4, 3, 512, [32], 1], ["AN", 4, 4, 6], ["FSP", 3, 3, 0, 1], ["AN", 3, 4, 6], ["CA", 3, 4, 2], ["CI", 2], ["FU", 4, [0, 1, 2]], ["AN", 4, 0, 5], ["FU", 1, [0, 1, 2]], ["SP", 1, 0, 32768, [32], 1], ["AN", 1, 0, 5], ["AN", 1, 1, 6], ["PR", 1, 0, "auto_unroll_max_step$1024"], ["PR", 3, 0, "auto_unroll_max_step$16"]]]], "r": [[0.000186788], 0, 2.01417, 1701237821], "v": "v0.6"}
{"i": [["[\"05ea4bc9dd6b49bd09addb0a73f992ce\", [4, 16, 512, 512], [4, 16, 512, 512]]", "cuda -keys=cuda,gpu -arch=sm_80 -max_num_threads=1024 -thread_warp_size=32", [-1, 16, 64, 49152, 2147483647, 1024, 8, 32], "llvm -keys=cpu ", 0, []], [[], [["SP", 4, 3, 512, [2], 1], ["AN", 4, 4, 6], ["FSP", 3, 3, 0, 1], ["AN", 3, 4, 6], ["CA", 3, 4, 2], ["CI", 2], ["FU", 4, [0, 1, 2]], ["AN", 4, 0, 5], ["FU", 1, [0, 1, 2]], ["SP", 1, 0, 32768, [32], 1], ["AN", 1, 0, 5], ["AN", 1, 1, 6], ["PR", 1, 0, "auto_unroll_max_step$0"], ["PR", 3, 0, "auto_unroll_max_step$64"]]]], "r": [[0.000864022], 0, 2.08389, 1701237823], "v": "v0.6"}
{"i": [["[\"05ea4bc9dd6b49bd09addb0a73f992ce\", [4, 16, 512, 512], [4, 16, 512, 512]]", "cuda -keys=cuda,gpu -arch=sm_80 -max_num_threads=1024 -thread_warp_size=32", [-1, 16, 64, 49152, 2147483647, 1024, 8, 32], "llvm -keys=cpu ", 0, []], [[], [["CI", 2], ["FU", 4, [0, 1, 2, 3]], ["SP", 4, 0, 16777216, [32], 1], ["AN", 4, 0, 5], ["AN", 4, 1, 6], ["FU", 3, [0, 1, 2]], ["SP", 3, 0, 32768, [1], 1], ["AN", 3, 0, 5], ["AN", 3, 1, 6], ["FU", 1, [0, 1, 2]], ["SP", 1, 0, 32768, [32], 1], ["AN", 1, 0, 5], ["AN", 1, 1, 6], ["PR", 1, 0, "auto_unroll_max_step$0"], ["PR", 3, 0, "auto_unroll_max_step$0"]]]], "r": [[0.00154262], 0, 2.05587, 1701237824], "v": "v0.6"}
{"i": [["[\"05ea4bc9dd6b49bd09addb0a73f992ce\", [4, 16, 512, 512], [4, 16, 512, 512]]", "cuda -keys=cuda,gpu -arch=sm_80 -max_num_threads=1024 -thread_warp_size=32", [-1, 16, 64, 49152, 2147483647, 1024, 8, 32], "llvm -keys=cpu ", 0, []], [[], [["CI", 2], ["SP", 1, 3, 512, [64], 1], ["AN", 1, 4, 6], ["FU", 4, [0, 1, 2, 3]], ["SP", 4, 0, 16777216, [1], 1], ["AN", 4, 0, 5], ["AN", 4, 1, 6], ["FU", 3, [0, 1, 2]], ["SP", 3, 0, 32768, [32], 1], ["AN", 3, 0, 5], ["AN", 3, 1, 6], ["FU", 1, [0, 1, 2]], ["AN", 1, 0, 5], ["PR", 1, 0, "auto_unroll_max_step$1024"], ["PR", 3, 0, "auto_unroll_max_step$64"]]]], "r": [[0.0126257], 0, 2.16386, 1701237825], "v": "v0.6"}
{"i": [["[\"05ea4bc9dd6b49bd09addb0a73f992ce\", [4, 16, 512, 512], [4, 16, 512, 512]]", "cuda -keys=cuda,gpu -arch=sm_80 -max_num_threads=1024 -thread_warp_size=32", [-1, 16, 64, 49152, 2147483647, 1024, 8, 32], "llvm -keys=cpu ", 0, []], [[], [["SP", 4, 3, 512, [4], 1], ["AN", 4, 4, 6], ["FSP", 3, 3, 0, 1], ["AN", 3, 4, 6], ["CA", 3, 4, 2], ["CI", 2], ["FU", 4, [0, 1, 2]], ["AN", 4, 0, 5], ["FU", 1, [0, 1, 2]], ["SP", 1, 0, 32768, [64], 1], ["AN", 1, 0, 5], ["AN", 1, 1, 6], ["PR", 1, 0, "auto_unroll_max_step$1024"], ["PR", 3, 0, "auto_unroll_max_step$0"]]]], "r": [[0.000517059], 0, 2.06414, 1701237827], "v": "v0.6"}
{"i": [["[\"05ea4bc9dd6b49bd09addb0a73f992ce\", [4, 16, 512, 512], [4, 16, 512, 512]]", "cuda -keys=cuda,gpu -arch=sm_80 -max_num_threads=1024 -thread_warp_size=32", [-1, 16, 64, 49152, 2147483647, 1024, 8, 32], "llvm -keys=cpu ", 0, []], [[], [["CI", 2], ["FU", 4, [0, 1, 2, 3]], ["SP", 4, 0, 16777216, [1], 1], ["AN", 4, 0, 5], ["AN", 4, 1, 6], ["FU", 3, [0, 1, 2]], ["SP", 3, 0, 32768, [2], 1], ["AN", 3, 0, 5], ["AN", 3, 1, 6], ["FU", 1, [0, 1, 2]], ["SP", 1, 0, 32768, [32], 1], ["AN", 1, 0, 5], ["AN", 1, 1, 6], ["PR", 1, 0, "auto_unroll_max_step$1024"], ["PR", 3, 0, "auto_unroll_max_step$1024"]]]], "r": [[0.0129458], 0, 2.03503, 1701237828], "v": "v0.6"}
{"i": [["[\"05ea4bc9dd6b49bd09addb0a73f992ce\", [4, 16, 512, 512], [4, 16, 512, 512]]", "cuda -keys=cuda,gpu -arch=sm_80 -max_num_threads=1024 -thread_warp_size=32", [-1, 16, 64, 49152, 2147483647, 1024, 8, 32], "llvm -keys=cpu ", 0, []], [[], [["CI", 2], ["FU", 4, [0, 1, 2, 3]], ["SP", 4, 0, 16777216, [32], 1], ["AN", 4, 0, 5], ["AN", 4, 1, 6], ["FU", 3, [0, 1, 2]], ["SP", 3, 0, 32768, [2], 1], ["AN", 3, 0, 5], ["AN", 3, 1, 6], ["FU", 1, [0, 1, 2]], ["SP", 1, 0, 32768, [32], 1], ["AN", 1, 0, 5], ["AN", 1, 1, 6], ["PR", 1, 0, "auto_unroll_max_step$16"], ["PR", 3, 0, "auto_unroll_max_step$0"]]]], "r": [[0.000930316], 0, 2.15217, 1701237829], "v": "v0.6"}
{"i": [["[\"05ea4bc9dd6b49bd09addb0a73f992ce\", [4, 16, 512, 512], [4, 16, 512, 512]]", "cuda -keys=cuda,gpu -arch=sm_80 -max_num_threads=1024 -thread_warp_size=32", [-1, 16, 64, 49152, 2147483647, 1024, 8, 32], "llvm -keys=cpu ", 0, []], [[], [["SP", 4, 3, 512, [1], 1], ["AN", 4, 4, 6], ["FSP", 3, 3, 0, 1], ["AN", 3, 4, 6], ["CA", 3, 4, 2], ["CI", 2], ["FSP", 1, 3, 0, 1], ["AN", 1, 4, 6], ["CA", 1, 4, 2], ["FU", 4, [0, 1, 2]], ["AN", 4, 0, 5], ["PR", 1, 0, "auto_unroll_max_step$512"], ["PR", 3, 0, "auto_unroll_max_step$64"]]]], "r": [[0.00153029], 0, 3.36848, 1701237831], "v": "v0.6"}
{"i": [["[\"05ea4bc9dd6b49bd09addb0a73f992ce\", [4, 16, 512, 512], [4, 16, 512, 512]]", "cuda -keys=cuda,gpu -arch=sm_80 -max_num_threads=1024 -thread_warp_size=32", [-1, 16, 64, 49152, 2147483647, 1024, 8, 32], "llvm -keys=cpu ", 0, []], [[], [["SP", 4, 3, 512, [32], 1], ["AN", 4, 4, 6], ["FSP", 3, 3, 0, 1], ["AN", 3, 4, 6], ["CA", 3, 4, 2], ["CI", 2], ["FU", 4, [0, 1, 2]], ["AN", 4, 0, 5], ["FU", 1, [0, 1, 2]], ["SP", 1, 0, 32768, [32], 1], ["AN", 1, 0, 5], ["AN", 1, 1, 6], ["PR", 1, 0, "auto_unroll_max_step$16"], ["PR", 3, 0, "auto_unroll_max_step$512"]]]], "r": [[0.000187027], 0, 2.14832, 1701237832], "v": "v0.6"}
{"i": [["[\"05ea4bc9dd6b49bd09addb0a73f992ce\", [4, 16, 512, 512], [4, 16, 512, 512]]", "cuda -keys=cuda,gpu -arch=sm_80 -max_num_threads=1024 -thread_warp_size=32", [-1, 16, 64, 49152, 2147483647, 1024, 8, 32], "llvm -keys=cpu ", 0, []], [[], [["SP", 4, 3, 512, [2], 1], ["AN", 4, 4, 6], ["FSP", 3, 3, 0, 1], ["AN", 3, 4, 6], ["CA", 3, 4, 2], ["CI", 2], ["FU", 4, [0, 1, 2]], ["AN", 4, 0, 5], ["FU", 1, [0, 1, 2]], ["SP", 1, 0, 32768, [64], 1], ["AN", 1, 0, 5], ["AN", 1, 1, 6], ["PR", 1, 0, "auto_unroll_max_step$512"], ["PR", 3, 0, "auto_unroll_max_step$16"]]]], "r": [[0.000946416], 0, 2.21018, 1701237833], "v": "v0.6"}
{"i": [["[\"05ea4bc9dd6b49bd09addb0a73f992ce\", [4, 16, 512, 512], [4, 16, 512, 512]]", "cuda -keys=cuda,gpu -arch=sm_80 -max_num_threads=1024 -thread_warp_size=32", [-1, 16, 64, 49152, 2147483647, 1024, 8, 32], "llvm -keys=cpu ", 0, []], [[], [["CI", 2], ["FU", 4, [0, 1, 2, 3]], ["SP", 4, 0, 16777216, [16], 1], ["AN", 4, 0, 5], ["AN", 4, 1, 6], ["FU", 3, [0, 1, 2]], ["SP", 3, 0, 32768, [2], 1], ["AN", 3, 0, 5], ["AN", 3, 1, 6], ["FU", 1, [0, 1, 2]], ["SP", 1, 0, 32768, [32], 1], ["AN", 1, 0, 5], ["AN", 1, 1, 6], ["PR", 1, 0, "auto_unroll_max_step$16"], ["PR", 3, 0, "auto_unroll_max_step$0"]]]], "r": [[0.00131456], 0, 2.16636, 1701237835], "v": "v0.6"}
{"i": [["[\"05ea4bc9dd6b49bd09addb0a73f992ce\", [4, 16, 512, 512], [4, 16, 512, 512]]", "cuda -keys=cuda,gpu -arch=sm_80 -max_num_threads=1024 -thread_warp_size=32", [-1, 16, 64, 49152, 2147483647, 1024, 8, 32], "llvm -keys=cpu ", 0, []], [[], [["SP", 4, 3, 512, [32], 1], ["AN", 4, 4, 6], ["FSP", 3, 3, 0, 1], ["AN", 3, 4, 6], ["CA", 3, 4, 2], ["CI", 2], ["FU", 4, [0, 1, 2]], ["AN", 4, 0, 5], ["FU", 1, [0, 1, 2]], ["SP", 1, 0, 32768, [4], 1], ["AN", 1, 0, 5], ["AN", 1, 1, 6], ["PR", 1, 0, "auto_unroll_max_step$1024"], ["PR", 3, 0, "auto_unroll_max_step$16"]]]], "r": [[0.000184891], 0, 2.17729, 1701237836], "v": "v0.6"}
{"i": [["[\"05ea4bc9dd6b49bd09addb0a73f992ce\", [4, 16, 512, 512], [4, 16, 512, 512]]", "cuda -keys=cuda,gpu -arch=sm_80 -max_num_threads=1024 -thread_warp_size=32", [-1, 16, 64, 49152, 2147483647, 1024, 8, 32], "llvm -keys=cpu ", 0, []], [[], [["CI", 2], ["FU", 4, [0, 1, 2, 3]], ["SP", 4, 0, 16777216, [32], 1], ["AN", 4, 0, 5], ["AN", 4, 1, 6], ["FU", 3, [0, 1, 2]], ["SP", 3, 0, 32768, [64], 1], ["AN", 3, 0, 5], ["AN", 3, 1, 6], ["FU", 1, [0, 1, 2]], ["SP", 1, 0, 32768, [16], 1], ["AN", 1, 0, 5], ["AN", 1, 1, 6], ["PR", 1, 0, "auto_unroll_max_step$0"], ["PR", 3, 0, "auto_unroll_max_step$64"]]]], "r": [[0.00065967], 0, 2.28402, 1701237838], "v": "v0.6"}
{"i": [["[\"05ea4bc9dd6b49bd09addb0a73f992ce\", [4, 16, 512, 512], [4, 16, 512, 512]]", "cuda -keys=cuda,gpu -arch=sm_80 -max_num_threads=1024 -thread_warp_size=32", [-1, 16, 64, 49152, 2147483647, 1024, 8, 32], "llvm -keys=cpu ", 0, []], [[], [["SP", 4, 3, 512, [64], 1], ["AN", 4, 4, 6], ["FSP", 3, 3, 0, 1], ["AN", 3, 4, 6], ["CA", 3, 4, 2], ["CI", 2], ["FSP", 1, 3, 0, 1], ["AN", 1, 4, 6], ["CA", 1, 4, 2], ["FU", 4, [0, 1, 2]], ["AN", 4, 0, 5], ["PR", 1, 0, "auto_unroll_max_step$64"], ["PR", 3, 0, "auto_unroll_max_step$1024"]]]], "r": [[6.14456e-05], 0, 2.09267, 1701237839], "v": "v0.6"}
{"i": [["[\"05ea4bc9dd6b49bd09addb0a73f992ce\", [4, 16, 512, 512], [4, 16, 512, 512]]", "cuda -keys=cuda,gpu -arch=sm_80 -max_num_threads=1024 -thread_warp_size=32", [-1, 16, 64, 49152, 2147483647, 1024, 8, 32], "llvm -keys=cpu ", 0, []], [[], [["CI", 2], ["FU", 4, [0, 1, 2, 3]], ["SP", 4, 0, 16777216, [8], 1], ["AN", 4, 0, 5], ["AN", 4, 1, 6], ["FU", 3, [0, 1, 2]], ["SP", 3, 0, 32768, [64], 1], ["AN", 3, 0, 5], ["AN", 3, 1, 6], ["FU", 1, [0, 1, 2]], ["SP", 1, 0, 32768, [32], 1], ["AN", 1, 0, 5], ["AN", 1, 1, 6], ["PR", 1, 0, "auto_unroll_max_step$0"], ["PR", 3, 0, "auto_unroll_max_step$16"]]]], "r": [[0.0018233], 0, 2.06274, 1701237840], "v": "v0.6"}
{"i": [["[\"05ea4bc9dd6b49bd09addb0a73f992ce\", [4, 16, 512, 512], [4, 16, 512, 512]]", "cuda -keys=cuda,gpu -arch=sm_80 -max_num_threads=1024 -thread_warp_size=32", [-1, 16, 64, 49152, 2147483647, 1024, 8, 32], "llvm -keys=cpu ", 0, []], [[], [["CI", 2], ["FU", 4, [0, 1, 2, 3]], ["SP", 4, 0, 16777216, [4], 1], ["AN", 4, 0, 5], ["AN", 4, 1, 6], ["FU", 3, [0, 1, 2]], ["SP", 3, 0, 32768, [32], 1], ["AN", 3, 0, 5], ["AN", 3, 1, 6], ["FU", 1, [0, 1, 2]], ["SP", 1, 0, 32768, [32], 1], ["AN", 1, 0, 5], ["AN", 1, 1, 6], ["PR", 1, 0, "auto_unroll_max_step$16"], ["PR", 3, 0, "auto_unroll_max_step$1024"]]]], "r": [[0.00435324], 0, 2.10448, 1701237842], "v": "v0.6"}
{"i": [["[\"05ea4bc9dd6b49bd09addb0a73f992ce\", [4, 16, 512, 512], [4, 16, 512, 512]]", "cuda -keys=cuda,gpu -arch=sm_80 -max_num_threads=1024 -thread_warp_size=32", [-1, 16, 64, 49152, 2147483647, 1024, 8, 32], "llvm -keys=cpu ", 0, []], [[], [["SP", 4, 3, 512, [32], 1], ["AN", 4, 4, 6], ["FSP", 3, 3, 0, 1], ["AN", 3, 4, 6], ["CA", 3, 4, 2], ["CI", 2], ["FU", 4, [0, 1, 2]], ["AN", 4, 0, 5], ["FU", 1, [0, 1, 2]], ["SP", 1, 0, 32768, [64], 1], ["AN", 1, 0, 5], ["AN", 1, 1, 6], ["PR", 1, 0, "auto_unroll_max_step$1024"], ["PR", 3, 0, "auto_unroll_max_step$0"]]]], "r": [[0.000183501], 0, 2.0316, 1701237843], "v": "v0.6"}
{"i": [["[\"05ea4bc9dd6b49bd09addb0a73f992ce\", [4, 16, 512, 512], [4, 16, 512, 512]]", "cuda -keys=cuda,gpu -arch=sm_80 -max_num_threads=1024 -thread_warp_size=32", [-1, 16, 64, 49152, 2147483647, 1024, 8, 32], "llvm -keys=cpu ", 0, []], [[], [["SP", 4, 3, 512, [64], 1], ["AN", 4, 4, 6], ["FSP", 3, 3, 0, 1], ["AN", 3, 4, 6], ["CA", 3, 4, 2], ["CI", 2], ["FU", 4, [0, 1, 2]], ["AN", 4, 0, 5], ["FU", 1, [0, 1, 2]], ["SP", 1, 0, 32768, [4], 1], ["AN", 1, 0, 5], ["AN", 1, 1, 6], ["PR", 1, 0, "auto_unroll_max_step$0"], ["PR", 3, 0, "auto_unroll_max_step$64"]]]], "r": [[0.000176569], 0, 1.97786, 1701237844], "v": "v0.6"}
{"i": [["[\"05ea4bc9dd6b49bd09addb0a73f992ce\", [4, 16, 512, 512], [4, 16, 512, 512]]", "cuda -keys=cuda,gpu -arch=sm_80 -max_num_threads=1024 -thread_warp_size=32", [-1, 16, 64, 49152, 2147483647, 1024, 8, 32], "llvm -keys=cpu ", 0, []], [[], [["CI", 2], ["SP", 1, 3, 512, [32], 1], ["AN", 1, 4, 6], ["FU", 4, [0, 1, 2, 3]], ["SP", 4, 0, 16777216, [2], 1], ["AN", 4, 0, 5], ["AN", 4, 1, 6], ["FU", 3, [0, 1, 2]], ["SP", 3, 0, 32768, [64], 1], ["AN", 3, 0, 5], ["AN", 3, 1, 6], ["FU", 1, [0, 1, 2]], ["AN", 1, 0, 5], ["PR", 1, 0, "auto_unroll_max_step$16"], ["PR", 3, 0, "auto_unroll_max_step$512"]]]], "r": [[0.00640954], 0, 2.01877, 1701237846], "v": "v0.6"}
{"i": [["[\"05ea4bc9dd6b49bd09addb0a73f992ce\", [4, 16, 512, 512], [4, 16, 512, 512]]", "cuda -keys=cuda,gpu -arch=sm_80 -max_num_threads=1024 -thread_warp_size=32", [-1, 16, 64, 49152, 2147483647, 1024, 8, 32], "llvm -keys=cpu ", 0, []], [[], [["SP", 4, 3, 512, [2], 1], ["AN", 4, 4, 6], ["FSP", 3, 3, 0, 1], ["AN", 3, 4, 6], ["CA", 3, 4, 2], ["CI", 2], ["FSP", 1, 3, 0, 1], ["AN", 1, 4, 6], ["CA", 1, 4, 2], ["FU", 4, [0, 1, 2]], ["AN", 4, 0, 5], ["PR", 1, 0, "auto_unroll_max_step$512"], ["PR", 3, 0, "auto_unroll_max_step$64"]]]], "r": [[0.000764005], 0, 2.493, 1701237847], "v": "v0.6"}
{"i": [["[\"05ea4bc9dd6b49bd09addb0a73f992ce\", [4, 16, 512, 512], [4, 16, 512, 512]]", "cuda -keys=cuda,gpu -arch=sm_80 -max_num_threads=1024 -thread_warp_size=32", [-1, 16, 64, 49152, 2147483647, 1024, 8, 32], "llvm -keys=cpu ", 0, []], [[], [["SP", 4, 3, 512, [8], 1], ["AN", 4, 4, 6], ["FSP", 3, 3, 0, 1], ["AN", 3, 4, 6], ["CA", 3, 4, 2], ["CI", 2], ["FSP", 1, 3, 0, 1], ["AN", 1, 4, 6], ["CA", 1, 4, 2], ["FU", 4, [0, 1, 2]], ["AN", 4, 0, 5], ["PR", 1, 0, "auto_unroll_max_step$0"], ["PR", 3, 0, "auto_unroll_max_step$64"]]]], "r": [[0.000204161], 0, 2.249, 1701237848], "v": "v0.6"}
{"i": [["[\"05ea4bc9dd6b49bd09addb0a73f992ce\", [4, 16, 512, 512], [4, 16, 512, 512]]", "cuda -keys=cuda,gpu -arch=sm_80 -max_num_threads=1024 -thread_warp_size=32", [-1, 16, 64, 49152, 2147483647, 1024, 8, 32], "llvm -keys=cpu ", 0, []], [[], [["CI", 2], ["SP", 1, 3, 512, [16], 1], ["AN", 1, 4, 6], ["FU", 4, [0, 1, 2, 3]], ["SP", 4, 0, 16777216, [1], 1], ["AN", 4, 0, 5], ["AN", 4, 1, 6], ["FU", 3, [0, 1, 2]], ["SP", 3, 0, 32768, [32], 1], ["AN", 3, 0, 5], ["AN", 3, 1, 6], ["FU", 1, [0, 1, 2]], ["AN", 1, 0, 5], ["PR", 1, 0, "auto_unroll_max_step$16"], ["PR", 3, 0, "auto_unroll_max_step$0"]]]], "r": [[0.012609], 0, 2.11314, 1701237849], "v": "v0.6"}
{"i": [["[\"05ea4bc9dd6b49bd09addb0a73f992ce\", [4, 16, 512, 512], [4, 16, 512, 512]]", "cuda -keys=cuda,gpu -arch=sm_80 -max_num_threads=1024 -thread_warp_size=32", [-1, 16, 64, 49152, 2147483647, 1024, 8, 32], "llvm -keys=cpu ", 0, []], [[], [["CI", 2], ["FU", 4, [0, 1, 2, 3]], ["SP", 4, 0, 16777216, [16], 1], ["AN", 4, 0, 5], ["AN", 4, 1, 6], ["FU", 3, [0, 1, 2]], ["SP", 3, 0, 32768, [32], 1], ["AN", 3, 0, 5], ["AN", 3, 1, 6], ["FU", 1, [0, 1, 2]], ["SP", 1, 0, 32768, [32], 1], ["AN", 1, 0, 5], ["AN", 1, 1, 6], ["PR", 1, 0, "auto_unroll_max_step$64"], ["PR", 3, 0, "auto_unroll_max_step$512"]]]], "r": [[0.00105074], 0, 2.04256, 1701237851], "v": "v0.6"}
{"i": [["[\"05ea4bc9dd6b49bd09addb0a73f992ce\", [4, 16, 512, 512], [4, 16, 512, 512]]", "cuda -keys=cuda,gpu -arch=sm_80 -max_num_threads=1024 -thread_warp_size=32", [-1, 16, 64, 49152, 2147483647, 1024, 8, 32], "llvm -keys=cpu ", 0, []], [[], [["CI", 2], ["SP", 1, 3, 512, [32], 1], ["AN", 1, 4, 6], ["FU", 4, [0, 1, 2, 3]], ["SP", 4, 0, 16777216, [32], 1], ["AN", 4, 0, 5], ["AN", 4, 1, 6], ["FU", 3, [0, 1, 2]], ["SP", 3, 0, 32768, [32], 1], ["AN", 3, 0, 5], ["AN", 3, 1, 6], ["FU", 1, [0, 1, 2]], ["AN", 1, 0, 5], ["PR", 1, 0, "auto_unroll_max_step$1024"], ["PR", 3, 0, "auto_unroll_max_step$1024"]]]], "r": [[0.000576031], 0, 2.0509, 1701237852], "v": "v0.6"}
{"i": [["[\"05ea4bc9dd6b49bd09addb0a73f992ce\", [4, 16, 512, 512], [4, 16, 512, 512]]", "cuda -keys=cuda,gpu -arch=sm_80 -max_num_threads=1024 -thread_warp_size=32", [-1, 16, 64, 49152, 2147483647, 1024, 8, 32], "llvm -keys=cpu ", 0, []], [[], [["CI", 2], ["FU", 4, [0, 1, 2, 3]], ["SP", 4, 0, 16777216, [32], 1], ["AN", 4, 0, 5], ["AN", 4, 1, 6], ["FU", 3, [0, 1, 2]], ["SP", 3, 0, 32768, [64], 1], ["AN", 3, 0, 5], ["AN", 3, 1, 6], ["FU", 1, [0, 1, 2]], ["SP", 1, 0, 32768, [32], 1], ["AN", 1, 0, 5], ["AN", 1, 1, 6], ["PR", 1, 0, "auto_unroll_max_step$512"], ["PR", 3, 0, "auto_unroll_max_step$512"]]]], "r": [[0.000672513], 0, 2.1986, 1701237853], "v": "v0.6"}
{"i": [["[\"05ea4bc9dd6b49bd09addb0a73f992ce\", [4, 16, 512, 512], [4, 16, 512, 512]]", "cuda -keys=cuda,gpu -arch=sm_80 -max_num_threads=1024 -thread_warp_size=32", [-1, 16, 64, 49152, 2147483647, 1024, 8, 32], "llvm -keys=cpu ", 0, []], [[], [["SP", 4, 3, 512, [64], 1], ["AN", 4, 4, 6], ["FSP", 3, 3, 0, 1], ["AN", 3, 4, 6], ["CA", 3, 4, 2], ["CI", 2], ["FSP", 1, 3, 0, 1], ["AN", 1, 4, 6], ["CA", 1, 4, 2], ["FU", 4, [0, 1, 2]], ["AN", 4, 0, 5], ["PR", 1, 0, "auto_unroll_max_step$1024"], ["PR", 3, 0, "auto_unroll_max_step$64"]]]], "r": [[6.07249e-05], 0, 2.09786, 1701237855], "v": "v0.6"}
{"i": [["[\"05ea4bc9dd6b49bd09addb0a73f992ce\", [4, 16, 512, 512], [4, 16, 512, 512]]", "cuda -keys=cuda,gpu -arch=sm_80 -max_num_threads=1024 -thread_warp_size=32", [-1, 16, 64, 49152, 2147483647, 1024, 8, 32], "llvm -keys=cpu ", 0, []], [[], [["SP", 4, 3, 512, [32], 1], ["AN", 4, 4, 6], ["FSP", 3, 3, 0, 1], ["AN", 3, 4, 6], ["CA", 3, 4, 2], ["CI", 2], ["FU", 4, [0, 1, 2]], ["AN", 4, 0, 5], ["FU", 1, [0, 1, 2]], ["SP", 1, 0, 32768, [2], 1], ["AN", 1, 0, 5], ["AN", 1, 1, 6], ["PR", 1, 0, "auto_unroll_max_step$0"], ["PR", 3, 0, "auto_unroll_max_step$1024"]]]], "r": [[0.00023075], 0, 2.04928, 1701237856], "v": "v0.6"}
{"i": [["[\"05ea4bc9dd6b49bd09addb0a73f992ce\", [4, 16, 512, 512], [4, 16, 512, 512]]", "cuda -keys=cuda,gpu -arch=sm_80 -max_num_threads=1024 -thread_warp_size=32", [-1, 16, 64, 49152, 2147483647, 1024, 8, 32], "llvm -keys=cpu ", 0, []], [[], [["CI", 2], ["SP", 1, 3, 512, [32], 1], ["AN", 1, 4, 6], ["FU", 4, [0, 1, 2, 3]], ["SP", 4, 0, 16777216, [32], 1], ["AN", 4, 0, 5], ["AN", 4, 1, 6], ["FU", 3, [0, 1, 2]], ["SP", 3, 0, 32768, [64], 1], ["AN", 3, 0, 5], ["AN", 3, 1, 6], ["FU", 1, [0, 1, 2]], ["AN", 1, 0, 5], ["PR", 1, 0, "auto_unroll_max_step$1024"], ["PR", 3, 0, "auto_unroll_max_step$1024"]]]], "r": [[0.000576877], 0, 2.04824, 1701237857], "v": "v0.6"}
{"i": [["[\"05ea4bc9dd6b49bd09addb0a73f992ce\", [4, 16, 512, 512], [4, 16, 512, 512]]", "cuda -keys=cuda,gpu -arch=sm_80 -max_num_threads=1024 -thread_warp_size=32", [-1, 16, 64, 49152, 2147483647, 1024, 8, 32], "llvm -keys=cpu ", 0, []], [[], [["CI", 2], ["SP", 1, 3, 512, [32], 1], ["AN", 1, 4, 6], ["FU", 4, [0, 1, 2, 3]], ["SP", 4, 0, 16777216, [8], 1], ["AN", 4, 0, 5], ["AN", 4, 1, 6], ["FU", 3, [0, 1, 2]], ["SP", 3, 0, 32768, [64], 1], ["AN", 3, 0, 5], ["AN", 3, 1, 6], ["FU", 1, [0, 1, 2]], ["AN", 1, 0, 5], ["PR", 1, 0, "auto_unroll_max_step$16"], ["PR", 3, 0, "auto_unroll_max_step$512"]]]], "r": [[0.00221678], 0, 1.92109, 1701237859], "v": "v0.6"}
{"i": [["[\"05ea4bc9dd6b49bd09addb0a73f992ce\", [4, 16, 512, 512], [4, 16, 512, 512]]", "cuda -keys=cuda,gpu -arch=sm_80 -max_num_threads=1024 -thread_warp_size=32", [-1, 16, 64, 49152, 2147483647, 1024, 8, 32], "llvm -keys=cpu ", 0, []], [[], [["CI", 2], ["SP", 1, 3, 512, [2], 1], ["AN", 1, 4, 6], ["FU", 4, [0, 1, 2, 3]], ["SP", 4, 0, 16777216, [32], 1], ["AN", 4, 0, 5], ["AN", 4, 1, 6], ["FU", 3, [0, 1, 2]], ["SP", 3, 0, 32768, [32], 1], ["AN", 3, 0, 5], ["AN", 3, 1, 6], ["FU", 1, [0, 1, 2]], ["AN", 1, 0, 5], ["PR", 1, 0, "auto_unroll_max_step$512"], ["PR", 3, 0, "auto_unroll_max_step$1024"]]]], "r": [[0.000704619], 0, 2.04572, 1701237860], "v": "v0.6"}
{"i": [["[\"05ea4bc9dd6b49bd09addb0a73f992ce\", [4, 16, 512, 512], [4, 16, 512, 512]]", "cuda -keys=cuda,gpu -arch=sm_80 -max_num_threads=1024 -thread_warp_size=32", [-1, 16, 64, 49152, 2147483647, 1024, 8, 32], "llvm -keys=cpu ", 0, []], [[], [["SP", 4, 3, 512, [16], 1], ["AN", 4, 4, 6], ["FSP", 3, 3, 0, 1], ["AN", 3, 4, 6], ["CA", 3, 4, 2], ["CI", 2], ["FU", 4, [0, 1, 2]], ["AN", 4, 0, 5], ["FU", 1, [0, 1, 2]], ["SP", 1, 0, 32768, [1], 1], ["AN", 1, 0, 5], ["AN", 1, 1, 6], ["PR", 1, 0, "auto_unroll_max_step$16"], ["PR", 3, 0, "auto_unroll_max_step$64"]]]], "r": [[0.000453637], 0, 1.96265, 1701237861], "v": "v0.6"}
{"i": [["[\"05ea4bc9dd6b49bd09addb0a73f992ce\", [4, 16, 512, 512], [4, 16, 512, 512]]", "cuda -keys=cuda,gpu -arch=sm_80 -max_num_threads=1024 -thread_warp_size=32", [-1, 16, 64, 49152, 2147483647, 1024, 8, 32], "llvm -keys=cpu ", 0, []], [[], [["CI", 2], ["FU", 4, [0, 1, 2, 3]], ["SP", 4, 0, 16777216, [32], 1], ["AN", 4, 0, 5], ["AN", 4, 1, 6], ["FU", 3, [0, 1, 2]], ["SP", 3, 0, 32768, [32], 1], ["AN", 3, 0, 5], ["AN", 3, 1, 6], ["FU", 1, [0, 1, 2]], ["SP", 1, 0, 32768, [32], 1], ["AN", 1, 0, 5], ["AN", 1, 1, 6], ["PR", 1, 0, "auto_unroll_max_step$1024"], ["PR", 3, 0, "auto_unroll_max_step$512"]]]], "r": [[0.000670839], 0, 2.01792, 1701237863], "v": "v0.6"}
{"i": [["[\"05ea4bc9dd6b49bd09addb0a73f992ce\", [4, 16, 512, 512], [4, 16, 512, 512]]", "cuda -keys=cuda,gpu -arch=sm_80 -max_num_threads=1024 -thread_warp_size=32", [-1, 16, 64, 49152, 2147483647, 1024, 8, 32], "llvm -keys=cpu ", 0, []], [[], [["CI", 2], ["SP", 1, 3, 512, [32], 1], ["AN", 1, 4, 6], ["FU", 4, [0, 1, 2, 3]], ["SP", 4, 0, 16777216, [8], 1], ["AN", 4, 0, 5], ["AN", 4, 1, 6], ["FU", 3, [0, 1, 2]], ["SP", 3, 0, 32768, [32], 1], ["AN", 3, 0, 5], ["AN", 3, 1, 6], ["FU", 1, [0, 1, 2]], ["AN", 1, 0, 5], ["PR", 1, 0, "auto_unroll_max_step$16"], ["PR", 3, 0, "auto_unroll_max_step$64"]]]], "r": [[0.00174717], 0, 2.06079, 1701237864], "v": "v0.6"}
{"i": [["[\"05ea4bc9dd6b49bd09addb0a73f992ce\", [4, 16, 512, 512], [4, 16, 512, 512]]", "cuda -keys=cuda,gpu -arch=sm_80 -max_num_threads=1024 -thread_warp_size=32", [-1, 16, 64, 49152, 2147483647, 1024, 8, 32], "llvm -keys=cpu ", 0, []], [[], [["SP", 4, 3, 512, [32], 1], ["AN", 4, 4, 6], ["FSP", 3, 3, 0, 1], ["AN", 3, 4, 6], ["CA", 3, 4, 2], ["CI", 2], ["FU", 4, [0, 1, 2]], ["AN", 4, 0, 5], ["FU", 1, [0, 1, 2]], ["SP", 1, 0, 32768, [32], 1], ["AN", 1, 0, 5], ["AN", 1, 1, 6], ["PR", 1, 0, "auto_unroll_max_step$1024"], ["PR", 3, 0, "auto_unroll_max_step$64"]]]], "r": [[0.000186277], 0, 1.94065, 1701237865], "v": "v0.6"}
{"i": [["[\"05ea4bc9dd6b49bd09addb0a73f992ce\", [4, 16, 512, 512], [4, 16, 512, 512]]", "cuda -keys=cuda,gpu -arch=sm_80 -max_num_threads=1024 -thread_warp_size=32", [-1, 16, 64, 49152, 2147483647, 1024, 8, 32], "llvm -keys=cpu ", 0, []], [[], [["SP", 4, 3, 512, [32], 1], ["AN", 4, 4, 6], ["FSP", 3, 3, 0, 1], ["AN", 3, 4, 6], ["CA", 3, 4, 2], ["CI", 2], ["FSP", 1, 3, 0, 1], ["AN", 1, 4, 6], ["CA", 1, 4, 2], ["FU", 4, [0, 1, 2]], ["AN", 4, 0, 5], ["PR", 1, 0, "auto_unroll_max_step$16"], ["PR", 3, 0, "auto_unroll_max_step$0"]]]], "r": [[6.28956e-05], 0, 2.04277, 1701237866], "v": "v0.6"}
{"i": [["[\"05ea4bc9dd6b49bd09addb0a73f992ce\", [4, 16, 512, 512], [4, 16, 512, 512]]", "cuda -keys=cuda,gpu -arch=sm_80 -max_num_threads=1024 -thread_warp_size=32", [-1, 16, 64, 49152, 2147483647, 1024, 8, 32], "llvm -keys=cpu ", 0, []], [[], [["CI", 2], ["FU", 4, [0, 1, 2, 3]], ["SP", 4, 0, 16777216, [32], 1], ["AN", 4, 0, 5], ["AN", 4, 1, 6], ["FU", 3, [0, 1, 2]], ["SP", 3, 0, 32768, [32], 1], ["AN", 3, 0, 5], ["AN", 3, 1, 6], ["FU", 1, [0, 1, 2]], ["SP", 1, 0, 32768, [32], 1], ["AN", 1, 0, 5], ["AN", 1, 1, 6], ["PR", 1, 0, "auto_unroll_max_step$64"], ["PR", 3, 0, "auto_unroll_max_step$16"]]]], "r": [[0.000663893], 0, 2.13447, 1701237868], "v": "v0.6"}
{"i": [["[\"bbcae65aaa032011179de7a9ae01aa45\", [64, 512, 64], [512, 4, 1024]]", "cuda -keys=cuda,gpu -arch=sm_80 -max_num_threads=1024 -thread_warp_size=32", [-1, 16, 64, 49152, 2147483647, 1024, 8, 32], "llvm -keys=cpu ", 0, []], [[], [["CI", 4], ["CI", 3], ["CI", 2], ["CI", 1], ["FU", 5, [0, 1, 2]], ["SP", 5, 0, 2097152, [64], 1], ["AN", 5, 0, 5], ["AN", 5, 1, 6]]]], "r": [[2.81215e-05], 0, 1.99818, 1701237922], "v": "v0.6"}
{"i": [["[\"bbcae65aaa032011179de7a9ae01aa45\", [64, 512, 64], [512, 4, 1024]]", "cuda -keys=cuda,gpu -arch=sm_80 -max_num_threads=1024 -thread_warp_size=32", [-1, 16, 64, 49152, 2147483647, 1024, 8, 32], "llvm -keys=cpu ", 0, []], [[], [["CI", 4], ["CI", 3], ["CI", 2], ["CI", 1], ["FU", 5, [0, 1, 2]], ["SP", 5, 0, 2097152, [16], 1], ["AN", 5, 0, 5], ["AN", 5, 1, 6]]]], "r": [[9.9806e-05], 0, 0.993372, 1701237923], "v": "v0.6"}
{"i": [["[\"bbcae65aaa032011179de7a9ae01aa45\", [64, 512, 64], [512, 4, 1024]]", "cuda -keys=cuda,gpu -arch=sm_80 -max_num_threads=1024 -thread_warp_size=32", [-1, 16, 64, 49152, 2147483647, 1024, 8, 32], "llvm -keys=cpu ", 0, []], [[], [["CI", 4], ["CI", 3], ["CI", 2], ["CI", 1], ["FU", 5, [0, 1, 2]], ["SP", 5, 0, 2097152, [8], 1], ["AN", 5, 0, 5], ["AN", 5, 1, 6]]]], "r": [[0.000196893], 0, 0.960407, 1701237923], "v": "v0.6"}
{"i": [["[\"bbcae65aaa032011179de7a9ae01aa45\", [64, 512, 64], [512, 4, 1024]]", "cuda -keys=cuda,gpu -arch=sm_80 -max_num_threads=1024 -thread_warp_size=32", [-1, 16, 64, 49152, 2147483647, 1024, 8, 32], "llvm -keys=cpu ", 0, []], [[], [["CI", 4], ["CI", 3], ["CI", 2], ["CI", 1], ["FU", 5, [0, 1, 2]], ["SP", 5, 0, 2097152, [32], 1], ["AN", 5, 0, 5], ["AN", 5, 1, 6]]]], "r": [[5.1335e-05], 0, 0.976957, 1701237924], "v": "v0.6"}
{"i": [["[\"bbcae65aaa032011179de7a9ae01aa45\", [64, 512, 64], [512, 4, 1024]]", "cuda -keys=cuda,gpu -arch=sm_80 -max_num_threads=1024 -thread_warp_size=32", [-1, 16, 64, 49152, 2147483647, 1024, 8, 32], "llvm -keys=cpu ", 0, []], [[], [["CI", 4], ["CI", 3], ["CI", 2], ["CI", 1], ["FU", 5, [0, 1, 2]], ["SP", 5, 0, 2097152, [4], 1], ["AN", 5, 0, 5], ["AN", 5, 1, 6]]]], "r": [[0.000391106], 0, 0.943014, 1701237924], "v": "v0.6"}
{"i": [["[\"bbcae65aaa032011179de7a9ae01aa45\", [64, 512, 64], [512, 4, 1024]]", "cuda -keys=cuda,gpu -arch=sm_80 -max_num_threads=1024 -thread_warp_size=32", [-1, 16, 64, 49152, 2147483647, 1024, 8, 32], "llvm -keys=cpu ", 0, []], [[], [["CI", 4], ["CI", 3], ["CI", 2], ["CI", 1], ["FU", 5, [0, 1, 2]], ["SP", 5, 0, 2097152, [1], 1], ["AN", 5, 0, 5], ["AN", 5, 1, 6]]]], "r": [[0.00155621], 0, 0.799812, 1701237924], "v": "v0.6"}
{"i": [["[\"bbcae65aaa032011179de7a9ae01aa45\", [64, 512, 64], [512, 4, 1024]]", "cuda -keys=cuda,gpu -arch=sm_80 -max_num_threads=1024 -thread_warp_size=32", [-1, 16, 64, 49152, 2147483647, 1024, 8, 32], "llvm -keys=cpu ", 0, []], [[], [["CI", 4], ["CI", 3], ["CI", 2], ["CI", 1], ["FU", 5, [0, 1, 2]], ["SP", 5, 0, 2097152, [2], 1], ["AN", 5, 0, 5], ["AN", 5, 1, 6]]]], "r": [[0.000779502], 0, 0.819659, 1701237925], "v": "v0.6"}
{"i": [["[\"abb711af873a842ad787525d75e8adba\", [4, 16, 512, 512], [64, 512, 512]]", "cuda -keys=cuda,gpu -arch=sm_80 -max_num_threads=1024 -thread_warp_size=32", [-1, 16, 64, 49152, 2147483647, 1024, 8, 32], "llvm -keys=cpu ", 0, []], [[], [["FU", 1, [0, 1, 2]], ["SP", 1, 0, 16777216, [64], 1], ["AN", 1, 0, 5], ["AN", 1, 1, 6]]]], "r": [[0.000260355], 0, 3.00381, 1701237961], "v": "v0.6"}
{"i": [["[\"abb711af873a842ad787525d75e8adba\", [4, 16, 512, 512], [64, 512, 512]]", "cuda -keys=cuda,gpu -arch=sm_80 -max_num_threads=1024 -thread_warp_size=32", [-1, 16, 64, 49152, 2147483647, 1024, 8, 32], "llvm -keys=cpu ", 0, []], [[], [["FU", 1, [0, 1, 2]], ["SP", 1, 0, 16777216, [4], 1], ["AN", 1, 0, 5], ["AN", 1, 1, 6]]]], "r": [[0.00312556], 0, 1.80754, 1701237962], "v": "v0.6"}
{"i": [["[\"abb711af873a842ad787525d75e8adba\", [4, 16, 512, 512], [64, 512, 512]]", "cuda -keys=cuda,gpu -arch=sm_80 -max_num_threads=1024 -thread_warp_size=32", [-1, 16, 64, 49152, 2147483647, 1024, 8, 32], "llvm -keys=cpu ", 0, []], [[], [["FU", 1, [0, 1, 2]], ["SP", 1, 0, 16777216, [16], 1], ["AN", 1, 0, 5], ["AN", 1, 1, 6]]]], "r": [[0.000936895], 0, 1.90974, 1701237963], "v": "v0.6"}
{"i": [["[\"abb711af873a842ad787525d75e8adba\", [4, 16, 512, 512], [64, 512, 512]]", "cuda -keys=cuda,gpu -arch=sm_80 -max_num_threads=1024 -thread_warp_size=32", [-1, 16, 64, 49152, 2147483647, 1024, 8, 32], "llvm -keys=cpu ", 0, []], [[], [["FU", 1, [0, 1, 2]], ["SP", 1, 0, 16777216, [32], 1], ["AN", 1, 0, 5], ["AN", 1, 1, 6]]]], "r": [[0.00040138], 0, 1.7717, 1701237965], "v": "v0.6"}
{"i": [["[\"abb711af873a842ad787525d75e8adba\", [4, 16, 512, 512], [64, 512, 512]]", "cuda -keys=cuda,gpu -arch=sm_80 -max_num_threads=1024 -thread_warp_size=32", [-1, 16, 64, 49152, 2147483647, 1024, 8, 32], "llvm -keys=cpu ", 0, []], [[], [["FU", 1, [0, 1, 2]], ["SP", 1, 0, 16777216, [2], 1], ["AN", 1, 0, 5], ["AN", 1, 1, 6]]]], "r": [[0.00622688], 0, 1.78748, 1701237966], "v": "v0.6"}
{"i": [["[\"abb711af873a842ad787525d75e8adba\", [4, 16, 512, 512], [64, 512, 512]]", "cuda -keys=cuda,gpu -arch=sm_80 -max_num_threads=1024 -thread_warp_size=32", [-1, 16, 64, 49152, 2147483647, 1024, 8, 32], "llvm -keys=cpu ", 0, []], [[], [["FU", 1, [0, 1, 2]], ["SP", 1, 0, 16777216, [1], 1], ["AN", 1, 0, 5], ["AN", 1, 1, 6]]]], "r": [[0.0159943], 0, 1.84313, 1701237967], "v": "v0.6"}
{"i": [["[\"abb711af873a842ad787525d75e8adba\", [4, 16, 512, 512], [64, 512, 512]]", "cuda -keys=cuda,gpu -arch=sm_80 -max_num_threads=1024 -thread_warp_size=32", [-1, 16, 64, 49152, 2147483647, 1024, 8, 32], "llvm -keys=cpu ", 0, []], [[], [["FU", 1, [0, 1, 2]], ["SP", 1, 0, 16777216, [8], 1], ["AN", 1, 0, 5], ["AN", 1, 1, 6]]]], "r": [[0.00156373], 0, 1.81281, 1701237969], "v": "v0.6"}
{"i": [["[\"e7d1cd69b22b59aaf439cde15026c57a\", [2048, 1024], [1024], [64, 512, 64]]", "cuda -keys=cuda,gpu -arch=sm_80 -max_num_threads=1024 -thread_warp_size=32", [-1, 16, 64, 49152, 2147483647, 1024, 8, 32], "llvm -keys=cpu ", 0, []], [[], [["CI", 5], ["CI", 4], ["CI", 3], ["CI", 1], ["FU", 6, [0, 1, 2]], ["SP", 6, 0, 2097152, [1], 1], ["AN", 6, 0, 5], ["AN", 6, 1, 6]]]], "r": [[0.00200227], 0, 1.74265, 1701238007], "v": "v0.6"}
{"i": [["[\"e7d1cd69b22b59aaf439cde15026c57a\", [2048, 1024], [1024], [64, 512, 64]]", "cuda -keys=cuda,gpu -arch=sm_80 -max_num_threads=1024 -thread_warp_size=32", [-1, 16, 64, 49152, 2147483647, 1024, 8, 32], "llvm -keys=cpu ", 0, []], [[], [["CI", 5], ["CI", 4], ["CI", 3], ["CI", 1], ["FU", 6, [0, 1, 2]], ["SP", 6, 0, 2097152, [64], 1], ["AN", 6, 0, 5], ["AN", 6, 1, 6]]]], "r": [[2.69379e-05], 0, 0.958337, 1701238007], "v": "v0.6"}
{"i": [["[\"e7d1cd69b22b59aaf439cde15026c57a\", [2048, 1024], [1024], [64, 512, 64]]", "cuda -keys=cuda,gpu -arch=sm_80 -max_num_threads=1024 -thread_warp_size=32", [-1, 16, 64, 49152, 2147483647, 1024, 8, 32], "llvm -keys=cpu ", 0, []], [[], [["CI", 5], ["CI", 4], ["CI", 3], ["CI", 1], ["FU", 6, [0, 1, 2]], ["SP", 6, 0, 2097152, [32], 1], ["AN", 6, 0, 5], ["AN", 6, 1, 6]]]], "r": [[5.13285e-05], 0, 0.957255, 1701238007], "v": "v0.6"}
{"i": [["[\"e7d1cd69b22b59aaf439cde15026c57a\", [2048, 1024], [1024], [64, 512, 64]]", "cuda -keys=cuda,gpu -arch=sm_80 -max_num_threads=1024 -thread_warp_size=32", [-1, 16, 64, 49152, 2147483647, 1024, 8, 32], "llvm -keys=cpu ", 0, []], [[], [["CI", 5], ["CI", 4], ["CI", 3], ["CI", 1], ["FU", 6, [0, 1, 2]], ["SP", 6, 0, 2097152, [2], 1], ["AN", 6, 0, 5], ["AN", 6, 1, 6]]]], "r": [[0.000779486], 0, 0.769827, 1701238008], "v": "v0.6"}
{"i": [["[\"e7d1cd69b22b59aaf439cde15026c57a\", [2048, 1024], [1024], [64, 512, 64]]", "cuda -keys=cuda,gpu -arch=sm_80 -max_num_threads=1024 -thread_warp_size=32", [-1, 16, 64, 49152, 2147483647, 1024, 8, 32], "llvm -keys=cpu ", 0, []], [[], [["CI", 5], ["CI", 4], ["CI", 3], ["CI", 1], ["FU", 6, [0, 1, 2]], ["SP", 6, 0, 2097152, [8], 1], ["AN", 6, 0, 5], ["AN", 6, 1, 6]]]], "r": [[0.000196907], 0, 0.93659, 1701238008], "v": "v0.6"}
{"i": [["[\"e7d1cd69b22b59aaf439cde15026c57a\", [2048, 1024], [1024], [64, 512, 64]]", "cuda -keys=cuda,gpu -arch=sm_80 -max_num_threads=1024 -thread_warp_size=32", [-1, 16, 64, 49152, 2147483647, 1024, 8, 32], "llvm -keys=cpu ", 0, []], [[], [["CI", 5], ["CI", 4], ["CI", 3], ["CI", 1], ["FU", 6, [0, 1, 2]], ["SP", 6, 0, 2097152, [16], 1], ["AN", 6, 0, 5], ["AN", 6, 1, 6]]]], "r": [[9.98575e-05], 0, 0.926969, 1701238009], "v": "v0.6"}
{"i": [["[\"e7d1cd69b22b59aaf439cde15026c57a\", [2048, 1024], [1024], [64, 512, 64]]", "cuda -keys=cuda,gpu -arch=sm_80 -max_num_threads=1024 -thread_warp_size=32", [-1, 16, 64, 49152, 2147483647, 1024, 8, 32], "llvm -keys=cpu ", 0, []], [[], [["CI", 5], ["CI", 4], ["CI", 3], ["CI", 1], ["FU", 6, [0, 1, 2]], ["SP", 6, 0, 2097152, [4], 1], ["AN", 6, 0, 5], ["AN", 6, 1, 6]]]], "r": [[0.000391083], 0, 0.983988, 1701238009], "v": "v0.6"}
{"i": [["[\"55cecb26ea40981ff8c3d5ddc2bd9004\", [64, 512, 512], [64, 512, 512]]", "cuda -keys=cuda,gpu -arch=sm_80 -max_num_threads=1024 -thread_warp_size=32", [-1, 16, 64, 49152, 2147483647, 1024, 8, 32], "llvm -keys=cpu ", 0, []], [[], [["CI", 1], ["FU", 2, [0, 1, 2]], ["SP", 2, 0, 16777216, [4], 1], ["AN", 2, 0, 5], ["AN", 2, 1, 6]]]], "r": [[0.00400372], 0, 3.447, 1701238041], "v": "v0.6"}
{"i": [["[\"55cecb26ea40981ff8c3d5ddc2bd9004\", [64, 512, 512], [64, 512, 512]]", "cuda -keys=cuda,gpu -arch=sm_80 -max_num_threads=1024 -thread_warp_size=32", [-1, 16, 64, 49152, 2147483647, 1024, 8, 32], "llvm -keys=cpu ", 0, []], [[], [["CI", 1], ["FU", 2, [0, 1, 2]], ["SP", 2, 0, 16777216, [8], 1], ["AN", 2, 0, 5], ["AN", 2, 1, 6]]]], "r": [[0.00155967], 0, 1.92753, 1701238042], "v": "v0.6"}
{"i": [["[\"55cecb26ea40981ff8c3d5ddc2bd9004\", [64, 512, 512], [64, 512, 512]]", "cuda -keys=cuda,gpu -arch=sm_80 -max_num_threads=1024 -thread_warp_size=32", [-1, 16, 64, 49152, 2147483647, 1024, 8, 32], "llvm -keys=cpu ", 0, []], [[], [["CI", 1], ["FU", 2, [0, 1, 2]], ["SP", 2, 0, 16777216, [1], 1], ["AN", 2, 0, 5], ["AN", 2, 1, 6]]]], "r": [[0.0124311], 0, 1.78862, 1701238043], "v": "v0.6"}
{"i": [["[\"55cecb26ea40981ff8c3d5ddc2bd9004\", [64, 512, 512], [64, 512, 512]]", "cuda -keys=cuda,gpu -arch=sm_80 -max_num_threads=1024 -thread_warp_size=32", [-1, 16, 64, 49152, 2147483647, 1024, 8, 32], "llvm -keys=cpu ", 0, []], [[], [["CI", 1], ["FU", 2, [0, 1, 2]], ["SP", 2, 0, 16777216, [32], 1], ["AN", 2, 0, 5], ["AN", 2, 1, 6]]]], "r": [[0.000395873], 0, 1.76224, 1701238045], "v": "v0.6"}
{"i": [["[\"55cecb26ea40981ff8c3d5ddc2bd9004\", [64, 512, 512], [64, 512, 512]]", "cuda -keys=cuda,gpu -arch=sm_80 -max_num_threads=1024 -thread_warp_size=32", [-1, 16, 64, 49152, 2147483647, 1024, 8, 32], "llvm -keys=cpu ", 0, []], [[], [["CI", 1], ["FU", 2, [0, 1, 2]], ["SP", 2, 0, 16777216, [2], 1], ["AN", 2, 0, 5], ["AN", 2, 1, 6]]]], "r": [[0.00623496], 0, 1.79663, 1701238046], "v": "v0.6"}
{"i": [["[\"55cecb26ea40981ff8c3d5ddc2bd9004\", [64, 512, 512], [64, 512, 512]]", "cuda -keys=cuda,gpu -arch=sm_80 -max_num_threads=1024 -thread_warp_size=32", [-1, 16, 64, 49152, 2147483647, 1024, 8, 32], "llvm -keys=cpu ", 0, []], [[], [["CI", 1], ["FU", 2, [0, 1, 2]], ["SP", 2, 0, 16777216, [16], 1], ["AN", 2, 0, 5], ["AN", 2, 1, 6]]]], "r": [[0.000785992], 0, 1.77386, 1701238047], "v": "v0.6"}
{"i": [["[\"55cecb26ea40981ff8c3d5ddc2bd9004\", [64, 512, 512], [64, 512, 512]]", "cuda -keys=cuda,gpu -arch=sm_80 -max_num_threads=1024 -thread_warp_size=32", [-1, 16, 64, 49152, 2147483647, 1024, 8, 32], "llvm -keys=cpu ", 0, []], [[], [["CI", 1], ["FU", 2, [0, 1, 2]], ["SP", 2, 0, 16777216, [64], 1], ["AN", 2, 0, 5], ["AN", 2, 1, 6]]]], "r": [[0.000203469], 0, 1.75187, 1701238048], "v": "v0.6"}
{"i": [["[\"f90846096226ab34eee197ad1c6b71d4\", [64, 512, 512], [1], [4, 1, 1, 512], [4, 16, 512, 512]]", "cuda -keys=cuda,gpu -arch=sm_80 -max_num_threads=1024 -thread_warp_size=32", [-1, 16, 64, 49152, 2147483647, 1024, 8, 32], "llvm -keys=cpu ", 0, []], [[], [["CI", 5], ["CI", 3], ["CI", 2], ["CI", 1], ["FU", 7, [0, 1, 2, 3]], ["SP", 7, 0, 16777216, [1], 1], ["AN", 7, 0, 5], ["AN", 7, 1, 6]]]], "r": [[0.0159917], 0, 3.32269, 1701238131], "v": "v0.6"}
{"i": [["[\"f90846096226ab34eee197ad1c6b71d4\", [64, 512, 512], [1], [4, 1, 1, 512], [4, 16, 512, 512]]", "cuda -keys=cuda,gpu -arch=sm_80 -max_num_threads=1024 -thread_warp_size=32", [-1, 16, 64, 49152, 2147483647, 1024, 8, 32], "llvm -keys=cpu ", 0, []], [[], [["CI", 5], ["CI", 3], ["CI", 2], ["CI", 1], ["FU", 7, [0, 1, 2, 3]], ["SP", 7, 0, 16777216, [8], 1], ["AN", 7, 0, 5], ["AN", 7, 1, 6]]]], "r": [[0.00156306], 0, 1.78616, 1701238132], "v": "v0.6"}
{"i": [["[\"f90846096226ab34eee197ad1c6b71d4\", [64, 512, 512], [1], [4, 1, 1, 512], [4, 16, 512, 512]]", "cuda -keys=cuda,gpu -arch=sm_80 -max_num_threads=1024 -thread_warp_size=32", [-1, 16, 64, 49152, 2147483647, 1024, 8, 32], "llvm -keys=cpu ", 0, []], [[], [["CI", 5], ["CI", 3], ["CI", 2], ["CI", 1], ["FU", 7, [0, 1, 2, 3]], ["SP", 7, 0, 16777216, [32], 1], ["AN", 7, 0, 5], ["AN", 7, 1, 6]]]], "r": [[0.000400965], 0, 1.92981, 1701238134], "v": "v0.6"}
{"i": [["[\"f90846096226ab34eee197ad1c6b71d4\", [64, 512, 512], [1], [4, 1, 1, 512], [4, 16, 512, 512]]", "cuda -keys=cuda,gpu -arch=sm_80 -max_num_threads=1024 -thread_warp_size=32", [-1, 16, 64, 49152, 2147483647, 1024, 8, 32], "llvm -keys=cpu ", 0, []], [[], [["CI", 5], ["CI", 3], ["CI", 2], ["CI", 1], ["FU", 7, [0, 1, 2, 3]], ["SP", 7, 0, 16777216, [16], 1], ["AN", 7, 0, 5], ["AN", 7, 1, 6]]]], "r": [[0.00078678], 0, 1.98251, 1701238135], "v": "v0.6"}
{"i": [["[\"f90846096226ab34eee197ad1c6b71d4\", [64, 512, 512], [1], [4, 1, 1, 512], [4, 16, 512, 512]]", "cuda -keys=cuda,gpu -arch=sm_80 -max_num_threads=1024 -thread_warp_size=32", [-1, 16, 64, 49152, 2147483647, 1024, 8, 32], "llvm -keys=cpu ", 0, []], [[], [["CI", 5], ["CI", 3], ["CI", 2], ["CI", 1], ["FU", 7, [0, 1, 2, 3]], ["SP", 7, 0, 16777216, [4], 1], ["AN", 7, 0, 5], ["AN", 7, 1, 6]]]], "r": [[0.00311941], 0, 1.80316, 1701238136], "v": "v0.6"}
{"i": [["[\"f90846096226ab34eee197ad1c6b71d4\", [64, 512, 512], [1], [4, 1, 1, 512], [4, 16, 512, 512]]", "cuda -keys=cuda,gpu -arch=sm_80 -max_num_threads=1024 -thread_warp_size=32", [-1, 16, 64, 49152, 2147483647, 1024, 8, 32], "llvm -keys=cpu ", 0, []], [[], [["CI", 5], ["CI", 3], ["CI", 2], ["CI", 1], ["FU", 7, [0, 1, 2, 3]], ["SP", 7, 0, 16777216, [2], 1], ["AN", 7, 0, 5], ["AN", 7, 1, 6]]]], "r": [[0.00622664], 0, 1.79587, 1701238138], "v": "v0.6"}
