benchmark/subgraphs/bert/tvm_autotvm.log
{"input": ["cuda -keys=cuda,gpu -arch=sm_80 -max_num_threads=1024 -thread_warp_size=32", "batch_matmul.cuda", [["TENSOR", [64, 512, 512], "float16"], ["TENSOR", [64, 512, 64], "float16"], [64, 512, 64], "float16", 0, 0], {}], "config": {"index": 73070, "code_hash": null, "entity": [["tile_y", "sp", [-1, 8, 8]], ["tile_x", "sp", [-1, 32, 2]], ["tile_k", "sp", [-1, 128]], ["auto_unroll_max_step", "ot", 8], ["unroll_explicit", "ot", 1]]}, "result": [[9.064742910727681e-05], 0, 4.59218168258667, 1701214378.2742636], "version": 0.2, "tvm_version": "0.15.dev0"}
{"input": ["cuda -keys=cuda,gpu -arch=sm_80 -max_num_threads=1024 -thread_warp_size=32", "batch_matmul.cuda", [["TENSOR", [64, 512, 64], "float16"], ["TENSOR", [64, 64, 512], "float16"], [64, 512, 512], "float16", 0, 0], {}], "config": {"index": 143524, "code_hash": null, "entity": [["tile_y", "sp", [-1, 4, 8]], ["tile_x", "sp", [-1, 32, 4]], ["tile_k", "sp", [-1, 32]], ["auto_unroll_max_step", "ot", 32], ["unroll_explicit", "ot", 1]]}, "result": [[7.841208500973393e-05], 0, 5.873342037200928, 1701217056.3119097], "version": 0.2, "tvm_version": "0.15.dev0"}
{"input": ["cuda -keys=cuda,gpu -arch=sm_80 -max_num_threads=1024 -thread_warp_size=32", "dense_large_batch.gpu", [["TENSOR", [2048, 1024], "float16"], ["TENSOR", [1024, 1024], "float16"], null, "float16"], {}], "config": {"index": 2305390, "code_hash": null, "entity": [["tile_x", "sp", [-1, 1, 16, 4]], ["tile_y", "sp", [-1, 8, 16, 1]], ["tile_k", "sp", [-1, 2, 4]]]}, "result": [[0.0006437501276595745], 0, 2.5296199321746826, 1701218376.64848], "version": 0.2, "tvm_version": "0.15.dev0"}
{"input": ["cuda -keys=cuda,gpu -arch=sm_80 -max_num_threads=1024 -thread_warp_size=32", "dense_tensorcore.cuda", [["TENSOR", [2048, 1024], "float16"], ["TENSOR", [1024, 1024], "float16"], null, "float16"], {}], "config": {"index": 15439, "code_hash": null, "entity": [["block_row_warps", "ot", 2], ["block_col_warps", "ot", 2], ["warp_row_tiles", "ot", 4], ["warp_col_tiles", "ot", 2], ["chunk", "ot", 4], ["offset", "ot", 8], ["offsetCS", "ot", 8], ["vec", "ot", 8], ["wmma_m", "ot", 8]]}, "result": [[3.798398500867918e-05], 0, 5.103894948959351, 1701219393.425325], "version": 0.2, "tvm_version": "0.15.dev0"}
{"input": ["cuda -keys=cuda,gpu -arch=sm_80 -max_num_threads=1024 -thread_warp_size=32", "dense_small_batch.gpu", [["TENSOR", [2048, 1024], "float16"], ["TENSOR", [1024, 1024], "float16"], null, "float16"], {}], "config": {"index": 5, "code_hash": null, "entity": [["tile_k", "sp", [-1, 32]]]}, "result": [[0.0015606182886597937], 0, 2.1149566173553467, 1701220210.8172174], "version": 0.2, "tvm_version": "0.15.dev0"}
