benchmark/subgraphs/gcn/tvm_ansor.log
{"i": [["[\"f9f9098169fc2698284eb7fdb0ccda8c\", [736392], [], [], [736392, 352]]", "cuda -keys=cuda,gpu -arch=sm_80 -max_num_threads=1024 -thread_warp_size=32", [-1, 16, 64, 49152, 2147483647, 1024, 8, 32], "llvm -keys=cpu ", 0, []], [[], [["CI", 3], ["FU", 4, [0, 1]], ["SP", 4, 0, 259209984, [6], 1], ["AN", 4, 0, 5], ["AN", 4, 1, 6]]]], "r": [[0.0411672], 0, 9.49636, 1701231630], "v": "v0.6"}
{"i": [["[\"f9f9098169fc2698284eb7fdb0ccda8c\", [736392], [], [], [736392, 352]]", "cuda -keys=cuda,gpu -arch=sm_80 -max_num_threads=1024 -thread_warp_size=32", [-1, 16, 64, 49152, 2147483647, 1024, 8, 32], "llvm -keys=cpu ", 0, []], [[], [["CI", 3], ["FU", 4, [0, 1]], ["SP", 4, 0, 259209984, [44], 1], ["AN", 4, 0, 5], ["AN", 4, 1, 6]]]], "r": [[0.00442887], 0, 9.13745, 1701231639], "v": "v0.6"}
{"i": [["[\"f9f9098169fc2698284eb7fdb0ccda8c\", [736392], [], [], [736392, 352]]", "cuda -keys=cuda,gpu -arch=sm_80 -max_num_threads=1024 -thread_warp_size=32", [-1, 16, 64, 49152, 2147483647, 1024, 8, 32], "llvm -keys=cpu ", 0, []], [[], [["CI", 3], ["FU", 4, [0, 1]], ["SP", 4, 0, 259209984, [61], 1], ["AN", 4, 0, 5], ["AN", 4, 1, 6]]]], "r": [[0.00315113], 0, 9.14761, 1701231648], "v": "v0.6"}
{"i": [["[\"f9f9098169fc2698284eb7fdb0ccda8c\", [736392], [], [], [736392, 352]]", "cuda -keys=cuda,gpu -arch=sm_80 -max_num_threads=1024 -thread_warp_size=32", [-1, 16, 64, 49152, 2147483647, 1024, 8, 32], "llvm -keys=cpu ", 0, []], [[], [["CI", 3], ["FU", 4, [0, 1]], ["SP", 4, 0, 259209984, [64], 1], ["AN", 4, 0, 5], ["AN", 4, 1, 6]]]], "r": [[0.00386272], 0, 8.9975, 1701231656], "v": "v0.6"}
{"i": [["[\"f9f9098169fc2698284eb7fdb0ccda8c\", [736392], [], [], [736392, 352]]", "cuda -keys=cuda,gpu -arch=sm_80 -max_num_threads=1024 -thread_warp_size=32", [-1, 16, 64, 49152, 2147483647, 1024, 8, 32], "llvm -keys=cpu ", 0, []], [[], [["CI", 3], ["FU", 4, [0, 1]], ["SP", 4, 0, 259209984, [48], 1], ["AN", 4, 0, 5], ["AN", 4, 1, 6]]]], "r": [[0.00514765], 0, 9.08346, 1701231665], "v": "v0.6"}
{"i": [["[\"f9f9098169fc2698284eb7fdb0ccda8c\", [736392], [], [], [736392, 352]]", "cuda -keys=cuda,gpu -arch=sm_80 -max_num_threads=1024 -thread_warp_size=32", [-1, 16, 64, 49152, 2147483647, 1024, 8, 32], "llvm -keys=cpu ", 0, []], [[], [["CI", 3], ["FU", 4, [0, 1]], ["SP", 4, 0, 259209984, [4], 1], ["AN", 4, 0, 5], ["AN", 4, 1, 6]]]], "r": [[0.0564224], 0, 9.11725, 1701231673], "v": "v0.6"}
{"i": [["[\"f9f9098169fc2698284eb7fdb0ccda8c\", [736392], [], [], [736392, 352]]", "cuda -keys=cuda,gpu -arch=sm_80 -max_num_threads=1024 -thread_warp_size=32", [-1, 16, 64, 49152, 2147483647, 1024, 8, 32], "llvm -keys=cpu ", 0, []], [[], [["CI", 3], ["FU", 4, [0, 1]], ["SP", 4, 0, 259209984, [22], 1], ["AN", 4, 0, 5], ["AN", 4, 1, 6]]]], "r": [[0.0112364], 0, 9.03232, 1701231682], "v": "v0.6"}
{"i": [["[\"f9f9098169fc2698284eb7fdb0ccda8c\", [736392], [], [], [736392, 352]]", "cuda -keys=cuda,gpu -arch=sm_80 -max_num_threads=1024 -thread_warp_size=32", [-1, 16, 64, 49152, 2147483647, 1024, 8, 32], "llvm -keys=cpu ", 0, []], [[], [["CI", 3], ["FU", 4, [0, 1]], ["SP", 4, 0, 259209984, [1], 1], ["AN", 4, 0, 5], ["AN", 4, 1, 6]]]], "r": [[0.192141], 0, 9.80506, 1701231691], "v": "v0.6"}
{"i": [["[\"f9f9098169fc2698284eb7fdb0ccda8c\", [736392], [], [], [736392, 352]]", "cuda -keys=cuda,gpu -arch=sm_80 -max_num_threads=1024 -thread_warp_size=32", [-1, 16, 64, 49152, 2147483647, 1024, 8, 32], "llvm -keys=cpu ", 0, []], [[], [["CI", 3], ["FU", 4, [0, 1]], ["SP", 4, 0, 259209984, [11], 1], ["AN", 4, 0, 5], ["AN", 4, 1, 6]]]], "r": [[0.0204063], 0, 9.08466, 1701231700], "v": "v0.6"}
{"i": [["[\"f9f9098169fc2698284eb7fdb0ccda8c\", [736392], [], [], [736392, 352]]", "cuda -keys=cuda,gpu -arch=sm_80 -max_num_threads=1024 -thread_warp_size=32", [-1, 16, 64, 49152, 2147483647, 1024, 8, 32], "llvm -keys=cpu ", 0, []], [[], [["CI", 3], ["FU", 4, [0, 1]], ["SP", 4, 0, 259209984, [16], 1], ["AN", 4, 0, 5], ["AN", 4, 1, 6]]]], "r": [[0.0120312], 0, 9.19772, 1701231708], "v": "v0.6"}
{"i": [["[\"f9f9098169fc2698284eb7fdb0ccda8c\", [736392], [], [], [736392, 352]]", "cuda -keys=cuda,gpu -arch=sm_80 -max_num_threads=1024 -thread_warp_size=32", [-1, 16, 64, 49152, 2147483647, 1024, 8, 32], "llvm -keys=cpu ", 0, []], [[], [["CI", 3], ["FU", 4, [0, 1]], ["SP", 4, 0, 259209984, [2], 1], ["AN", 4, 0, 5], ["AN", 4, 1, 6]]]], "r": [[0.101974], 0, 9.3353, 1701231717], "v": "v0.6"}
{"i": [["[\"f9f9098169fc2698284eb7fdb0ccda8c\", [736392], [], [], [736392, 352]]", "cuda -keys=cuda,gpu -arch=sm_80 -max_num_threads=1024 -thread_warp_size=32", [-1, 16, 64, 49152, 2147483647, 1024, 8, 32], "llvm -keys=cpu ", 0, []], [[], [["CI", 3], ["FU", 4, [0, 1]], ["SP", 4, 0, 259209984, [24], 1], ["AN", 4, 0, 5], ["AN", 4, 1, 6]]]], "r": [[0.0092903], 0, 9.22259, 1701231726], "v": "v0.6"}
{"i": [["[\"f9f9098169fc2698284eb7fdb0ccda8c\", [736392], [], [], [736392, 352]]", "cuda -keys=cuda,gpu -arch=sm_80 -max_num_threads=1024 -thread_warp_size=32", [-1, 16, 64, 49152, 2147483647, 1024, 8, 32], "llvm -keys=cpu ", 0, []], [[], [["CI", 3], ["FU", 4, [0, 1]], ["SP", 4, 0, 259209984, [12], 1], ["AN", 4, 0, 5], ["AN", 4, 1, 6]]]], "r": [[0.020589], 0, 9.09281, 1701231735], "v": "v0.6"}
{"i": [["[\"f9f9098169fc2698284eb7fdb0ccda8c\", [736392], [], [], [736392, 352]]", "cuda -keys=cuda,gpu -arch=sm_80 -max_num_threads=1024 -thread_warp_size=32", [-1, 16, 64, 49152, 2147483647, 1024, 8, 32], "llvm -keys=cpu ", 0, []], [[], [["CI", 3], ["FU", 4, [0, 1]], ["SP", 4, 0, 259209984, [3], 1], ["AN", 4, 0, 5], ["AN", 4, 1, 6]]]], "r": [[0.0650728], 0, 9.1985, 1701231743], "v": "v0.6"}
{"i": [["[\"f9f9098169fc2698284eb7fdb0ccda8c\", [736392], [], [], [736392, 352]]", "cuda -keys=cuda,gpu -arch=sm_80 -max_num_threads=1024 -thread_warp_size=32", [-1, 16, 64, 49152, 2147483647, 1024, 8, 32], "llvm -keys=cpu ", 0, []], [[], [["CI", 3], ["FU", 4, [0, 1]], ["SP", 4, 0, 259209984, [32], 1], ["AN", 4, 0, 5], ["AN", 4, 1, 6]]]], "r": [[0.0077264], 0, 9.07311, 1701231752], "v": "v0.6"}
{"i": [["[\"f9f9098169fc2698284eb7fdb0ccda8c\", [736392], [], [], [736392, 352]]", "cuda -keys=cuda,gpu -arch=sm_80 -max_num_threads=1024 -thread_warp_size=32", [-1, 16, 64, 49152, 2147483647, 1024, 8, 32], "llvm -keys=cpu ", 0, []], [[], [["CI", 3], ["FU", 4, [0, 1]], ["SP", 4, 0, 259209984, [33], 1], ["AN", 4, 0, 5], ["AN", 4, 1, 6]]]], "r": [[0.00748486], 0, 9.0373, 1701231760], "v": "v0.6"}
{"i": [["[\"f9f9098169fc2698284eb7fdb0ccda8c\", [736392], [], [], [736392, 352]]", "cuda -keys=cuda,gpu -arch=sm_80 -max_num_threads=1024 -thread_warp_size=32", [-1, 16, 64, 49152, 2147483647, 1024, 8, 32], "llvm -keys=cpu ", 0, []], [[], [["CI", 3], ["FU", 4, [0, 1]], ["SP", 4, 0, 259209984, [8], 1], ["AN", 4, 0, 5], ["AN", 4, 1, 6]]]], "r": [[0.0240049], 0, 9.25085, 1701231769], "v": "v0.6"}
{"i": [["[\"cf5b5e7c98c5108a1795e28663ca909c\", [736392], [736392]]", "cuda -keys=cuda,gpu -arch=sm_80 -max_num_threads=1024 -thread_warp_size=32", [-1, 16, 64, 49152, 2147483647, 1024, 8, 32], "llvm -keys=cpu ", 0, []], [[], [["SP", 1, 0, 736392, [6], 1], ["AN", 1, 0, 5], ["AN", 1, 1, 6]]]], "r": [[0.000100676], 0, 1.27746, 1701231799], "v": "v0.6"}
{"i": [["[\"cf5b5e7c98c5108a1795e28663ca909c\", [736392], [736392]]", "cuda -keys=cuda,gpu -arch=sm_80 -max_num_threads=1024 -thread_warp_size=32", [-1, 16, 64, 49152, 2147483647, 1024, 8, 32], "llvm -keys=cpu ", 0, []], [[], [["SP", 1, 0, 736392, [64], 1], ["AN", 1, 0, 5], ["AN", 1, 1, 6]]]], "r": [[1.11783e-05], 0, 0.780425, 1701231799], "v": "v0.6"}
{"i": [["[\"cf5b5e7c98c5108a1795e28663ca909c\", [736392], [736392]]", "cuda -keys=cuda,gpu -arch=sm_80 -max_num_threads=1024 -thread_warp_size=32", [-1, 16, 64, 49152, 2147483647, 1024, 8, 32], "llvm -keys=cpu ", 0, []], [[], [["SP", 1, 0, 736392, [8], 1], ["AN", 1, 0, 5], ["AN", 1, 1, 6]]]], "r": [[7.0938e-05], 0, 0.792325, 1701231800], "v": "v0.6"}
{"i": [["[\"cf5b5e7c98c5108a1795e28663ca909c\", [736392], [736392]]", "cuda -keys=cuda,gpu -arch=sm_80 -max_num_threads=1024 -thread_warp_size=32", [-1, 16, 64, 49152, 2147483647, 1024, 8, 32], "llvm -keys=cpu ", 0, []], [[], [["SP", 1, 0, 736392, [4], 1], ["AN", 1, 0, 5], ["AN", 1, 1, 6]]]], "r": [[0.000139062], 0, 0.764702, 1701231800], "v": "v0.6"}
{"i": [["[\"cf5b5e7c98c5108a1795e28663ca909c\", [736392], [736392]]", "cuda -keys=cuda,gpu -arch=sm_80 -max_num_threads=1024 -thread_warp_size=32", [-1, 16, 64, 49152, 2147483647, 1024, 8, 32], "llvm -keys=cpu ", 0, []], [[], [["SP", 1, 0, 736392, [32], 1], ["AN", 1, 0, 5], ["AN", 1, 1, 6]]]], "r": [[1.99265e-05], 0, 0.776684, 1701231800], "v": "v0.6"}
{"i": [["[\"cf5b5e7c98c5108a1795e28663ca909c\", [736392], [736392]]", "cuda -keys=cuda,gpu -arch=sm_80 -max_num_threads=1024 -thread_warp_size=32", [-1, 16, 64, 49152, 2147483647, 1024, 8, 32], "llvm -keys=cpu ", 0, []], [[], [["SP", 1, 0, 736392, [3], 1], ["AN", 1, 0, 5], ["AN", 1, 1, 6]]]], "r": [[0.000184587], 0, 0.776562, 1701231801], "v": "v0.6"}
{"i": [["[\"cf5b5e7c98c5108a1795e28663ca909c\", [736392], [736392]]", "cuda -keys=cuda,gpu -arch=sm_80 -max_num_threads=1024 -thread_warp_size=32", [-1, 16, 64, 49152, 2147483647, 1024, 8, 32], "llvm -keys=cpu ", 0, []], [[], [["SP", 1, 0, 736392, [1], 1], ["AN", 1, 0, 5], ["AN", 1, 1, 6]]]], "r": [[0.00054822], 0, 0.798717, 1701231801], "v": "v0.6"}
{"i": [["[\"cf5b5e7c98c5108a1795e28663ca909c\", [736392], [736392]]", "cuda -keys=cuda,gpu -arch=sm_80 -max_num_threads=1024 -thread_warp_size=32", [-1, 16, 64, 49152, 2147483647, 1024, 8, 32], "llvm -keys=cpu ", 0, []], [[], [["SP", 1, 0, 736392, [12], 1], ["AN", 1, 0, 5], ["AN", 1, 1, 6]]]], "r": [[4.82623e-05], 0, 0.795822, 1701231801], "v": "v0.6"}
{"i": [["[\"cf5b5e7c98c5108a1795e28663ca909c\", [736392], [736392]]", "cuda -keys=cuda,gpu -arch=sm_80 -max_num_threads=1024 -thread_warp_size=32", [-1, 16, 64, 49152, 2147483647, 1024, 8, 32], "llvm -keys=cpu ", 0, []], [[], [["SP", 1, 0, 736392, [61], 1], ["AN", 1, 0, 5], ["AN", 1, 1, 6]]]], "r": [[1.16795e-05], 0, 0.765655, 1701231802], "v": "v0.6"}
{"i": [["[\"cf5b5e7c98c5108a1795e28663ca909c\", [736392], [736392]]", "cuda -keys=cuda,gpu -arch=sm_80 -max_num_threads=1024 -thread_warp_size=32", [-1, 16, 64, 49152, 2147483647, 1024, 8, 32], "llvm -keys=cpu ", 0, []], [[], [["SP", 1, 0, 736392, [24], 1], ["AN", 1, 0, 5], ["AN", 1, 1, 6]]]], "r": [[2.56184e-05], 0, 0.755616, 1701231802], "v": "v0.6"}
{"i": [["[\"cf5b5e7c98c5108a1795e28663ca909c\", [736392], [736392]]", "cuda -keys=cuda,gpu -arch=sm_80 -max_num_threads=1024 -thread_warp_size=32", [-1, 16, 64, 49152, 2147483647, 1024, 8, 32], "llvm -keys=cpu ", 0, []], [[], [["SP", 1, 0, 736392, [16], 1], ["AN", 1, 0, 5], ["AN", 1, 1, 6]]]], "r": [[3.69281e-05], 0, 0.80726, 1701231802], "v": "v0.6"}
{"i": [["[\"cf5b5e7c98c5108a1795e28663ca909c\", [736392], [736392]]", "cuda -keys=cuda,gpu -arch=sm_80 -max_num_threads=1024 -thread_warp_size=32", [-1, 16, 64, 49152, 2147483647, 1024, 8, 32], "llvm -keys=cpu ", 0, []], [[], [["SP", 1, 0, 736392, [2], 1], ["AN", 1, 0, 5], ["AN", 1, 1, 6]]]], "r": [[0.000275452], 0, 0.801123, 1701231803], "v": "v0.6"}
