benchmark/subgraphs/mlp/tvm_ansor.log
{"i": [["[\"460e8399c68e56ab38b35f30119390c3\", [4096, 2048], [2048, 4096]]", "cuda -keys=cuda,gpu -arch=sm_80 -max_num_threads=1024 -thread_warp_size=32", [-1, 16, 64, 49152, 2147483647, 1024, 8, 32], "llvm -keys=cpu ", 0, []], [[], [["FU", 1, [0, 1]], ["SP", 1, 0, 8388608, [4], 1], ["AN", 1, 0, 5], ["AN", 1, 1, 6]]]], "r": [[0.00200088], 0, 1.75264, 1701249723], "v": "v0.6"}
{"i": [["[\"460e8399c68e56ab38b35f30119390c3\", [4096, 2048], [2048, 4096]]", "cuda -keys=cuda,gpu -arch=sm_80 -max_num_threads=1024 -thread_warp_size=32", [-1, 16, 64, 49152, 2147483647, 1024, 8, 32], "llvm -keys=cpu ", 0, []], [[], [["FU", 1, [0, 1]], ["SP", 1, 0, 8388608, [16], 1], ["AN", 1, 0, 5], ["AN", 1, 1, 6]]]], "r": [[0.000391374], 0, 1.34979, 1701249724], "v": "v0.6"}
{"i": [["[\"460e8399c68e56ab38b35f30119390c3\", [4096, 2048], [2048, 4096]]", "cuda -keys=cuda,gpu -arch=sm_80 -max_num_threads=1024 -thread_warp_size=32", [-1, 16, 64, 49152, 2147483647, 1024, 8, 32], "llvm -keys=cpu ", 0, []], [[], [["FU", 1, [0, 1]], ["SP", 1, 0, 8388608, [32], 1], ["AN", 1, 0, 5], ["AN", 1, 1, 6]]]], "r": [[0.000197526], 0, 1.33064, 1701249725], "v": "v0.6"}
{"i": [["[\"460e8399c68e56ab38b35f30119390c3\", [4096, 2048], [2048, 4096]]", "cuda -keys=cuda,gpu -arch=sm_80 -max_num_threads=1024 -thread_warp_size=32", [-1, 16, 64, 49152, 2147483647, 1024, 8, 32], "llvm -keys=cpu ", 0, []], [[], [["FU", 1, [0, 1]], ["SP", 1, 0, 8388608, [2], 1], ["AN", 1, 0, 5], ["AN", 1, 1, 6]]]], "r": [[0.00310976], 0, 1.18614, 1701249726], "v": "v0.6"}
{"i": [["[\"460e8399c68e56ab38b35f30119390c3\", [4096, 2048], [2048, 4096]]", "cuda -keys=cuda,gpu -arch=sm_80 -max_num_threads=1024 -thread_warp_size=32", [-1, 16, 64, 49152, 2147483647, 1024, 8, 32], "llvm -keys=cpu ", 0, []], [[], [["FU", 1, [0, 1]], ["SP", 1, 0, 8388608, [8], 1], ["AN", 1, 0, 5], ["AN", 1, 1, 6]]]], "r": [[0.000779558], 0, 1.1932, 1701249726], "v": "v0.6"}
{"i": [["[\"460e8399c68e56ab38b35f30119390c3\", [4096, 2048], [2048, 4096]]", "cuda -keys=cuda,gpu -arch=sm_80 -max_num_threads=1024 -thread_warp_size=32", [-1, 16, 64, 49152, 2147483647, 1024, 8, 32], "llvm -keys=cpu ", 0, []], [[], [["FU", 1, [0, 1]], ["SP", 1, 0, 8388608, [1], 1], ["AN", 1, 0, 5], ["AN", 1, 1, 6]]]], "r": [[0.00621682], 0, 1.20752, 1701249727], "v": "v0.6"}
{"i": [["[\"460e8399c68e56ab38b35f30119390c3\", [4096, 2048], [2048, 4096]]", "cuda -keys=cuda,gpu -arch=sm_80 -max_num_threads=1024 -thread_warp_size=32", [-1, 16, 64, 49152, 2147483647, 1024, 8, 32], "llvm -keys=cpu ", 0, []], [[], [["FU", 1, [0, 1]], ["SP", 1, 0, 8388608, [64], 1], ["AN", 1, 0, 5], ["AN", 1, 1, 6]]]], "r": [[0.000100402], 0, 1.35003, 1701249728], "v": "v0.6"}
{"i": [["[\"5610d2b06b4580f608f3c90e06bc90fd\", [2048, 256], [2048, 256]]", "cuda -keys=cuda,gpu -arch=sm_80 -max_num_threads=1024 -thread_warp_size=32", [-1, 16, 64, 49152, 2147483647, 1024, 8, 32], "llvm -keys=cpu ", 0, []], [[], [["FU", 1, [0, 1]], ["SP", 1, 0, 524288, [8], 1], ["AN", 1, 0, 5], ["AN", 1, 1, 6]]]], "r": [[5.35727e-05], 0, 1.53257, 1701249747], "v": "v0.6"}
{"i": [["[\"5610d2b06b4580f608f3c90e06bc90fd\", [2048, 256], [2048, 256]]", "cuda -keys=cuda,gpu -arch=sm_80 -max_num_threads=1024 -thread_warp_size=32", [-1, 16, 64, 49152, 2147483647, 1024, 8, 32], "llvm -keys=cpu ", 0, []], [[], [["FU", 1, [0, 1]], ["SP", 1, 0, 524288, [4], 1], ["AN", 1, 0, 5], ["AN", 1, 1, 6]]]], "r": [[9.9865e-05], 0, 0.843421, 1701249747], "v": "v0.6"}
{"i": [["[\"5610d2b06b4580f608f3c90e06bc90fd\", [2048, 256], [2048, 256]]", "cuda -keys=cuda,gpu -arch=sm_80 -max_num_threads=1024 -thread_warp_size=32", [-1, 16, 64, 49152, 2147483647, 1024, 8, 32], "llvm -keys=cpu ", 0, []], [[], [["FU", 1, [0, 1]], ["SP", 1, 0, 524288, [64], 1], ["AN", 1, 0, 5], ["AN", 1, 1, 6]]]], "r": [[8.57144e-06], 0, 0.812809, 1701249748], "v": "v0.6"}
{"i": [["[\"5610d2b06b4580f608f3c90e06bc90fd\", [2048, 256], [2048, 256]]", "cuda -keys=cuda,gpu -arch=sm_80 -max_num_threads=1024 -thread_warp_size=32", [-1, 16, 64, 49152, 2147483647, 1024, 8, 32], "llvm -keys=cpu ", 0, []], [[], [["FU", 1, [0, 1]], ["SP", 1, 0, 524288, [2], 1], ["AN", 1, 0, 5], ["AN", 1, 1, 6]]]], "r": [[0.00019691], 0, 0.866924, 1701249748], "v": "v0.6"}
{"i": [["[\"5610d2b06b4580f608f3c90e06bc90fd\", [2048, 256], [2048, 256]]", "cuda -keys=cuda,gpu -arch=sm_80 -max_num_threads=1024 -thread_warp_size=32", [-1, 16, 64, 49152, 2147483647, 1024, 8, 32], "llvm -keys=cpu ", 0, []], [[], [["FU", 1, [0, 1]], ["SP", 1, 0, 524288, [1], 1], ["AN", 1, 0, 5], ["AN", 1, 1, 6]]]], "r": [[0.000391108], 0, 0.841882, 1701249748], "v": "v0.6"}
{"i": [["[\"5610d2b06b4580f608f3c90e06bc90fd\", [2048, 256], [2048, 256]]", "cuda -keys=cuda,gpu -arch=sm_80 -max_num_threads=1024 -thread_warp_size=32", [-1, 16, 64, 49152, 2147483647, 1024, 8, 32], "llvm -keys=cpu ", 0, []], [[], [["FU", 1, [0, 1]], ["SP", 1, 0, 524288, [32], 1], ["AN", 1, 0, 5], ["AN", 1, 1, 6]]]], "r": [[1.49824e-05], 0, 0.803119, 1701249749], "v": "v0.6"}
{"i": [["[\"5610d2b06b4580f608f3c90e06bc90fd\", [2048, 256], [2048, 256]]", "cuda -keys=cuda,gpu -arch=sm_80 -max_num_threads=1024 -thread_warp_size=32", [-1, 16, 64, 49152, 2147483647, 1024, 8, 32], "llvm -keys=cpu ", 0, []], [[], [["FU", 1, [0, 1]], ["SP", 1, 0, 524288, [16], 1], ["AN", 1, 0, 5], ["AN", 1, 1, 6]]]], "r": [[2.70965e-05], 0, 0.796338, 1701249749], "v": "v0.6"}
{"i": [["[\"7f98392439bf47c9cf44f554aaafc65f\", [4096, 2048], [4096, 2048]]", "cuda -keys=cuda,gpu -arch=sm_80 -max_num_threads=1024 -thread_warp_size=32", [-1, 16, 64, 49152, 2147483647, 1024, 8, 32], "llvm -keys=cpu ", 0, []], [[], [["CI", 1], ["FU", 2, [0, 1]], ["SP", 2, 0, 8388608, [64], 1], ["AN", 2, 0, 5], ["AN", 2, 1, 6]]]], "r": [[0.000110657], 0, 1.99681, 1701249769], "v": "v0.6"}
{"i": [["[\"7f98392439bf47c9cf44f554aaafc65f\", [4096, 2048], [4096, 2048]]", "cuda -keys=cuda,gpu -arch=sm_80 -max_num_threads=1024 -thread_warp_size=32", [-1, 16, 64, 49152, 2147483647, 1024, 8, 32], "llvm -keys=cpu ", 0, []], [[], [["CI", 1], ["FU", 2, [0, 1]], ["SP", 2, 0, 8388608, [4], 1], ["AN", 2, 0, 5], ["AN", 2, 1, 6]]]], "r": [[0.00155654], 0, 1.18743, 1701249769], "v": "v0.6"}
{"i": [["[\"7f98392439bf47c9cf44f554aaafc65f\", [4096, 2048], [4096, 2048]]", "cuda -keys=cuda,gpu -arch=sm_80 -max_num_threads=1024 -thread_warp_size=32", [-1, 16, 64, 49152, 2147483647, 1024, 8, 32], "llvm -keys=cpu ", 0, []], [[], [["CI", 1], ["FU", 2, [0, 1]], ["SP", 2, 0, 8388608, [1], 1], ["AN", 2, 0, 5], ["AN", 2, 1, 6]]]], "r": [[0.00621688], 0, 1.222, 1701249770], "v": "v0.6"}
{"i": [["[\"7f98392439bf47c9cf44f554aaafc65f\", [4096, 2048], [4096, 2048]]", "cuda -keys=cuda,gpu -arch=sm_80 -max_num_threads=1024 -thread_warp_size=32", [-1, 16, 64, 49152, 2147483647, 1024, 8, 32], "llvm -keys=cpu ", 0, []], [[], [["CI", 1], ["FU", 2, [0, 1]], ["SP", 2, 0, 8388608, [2], 1], ["AN", 2, 0, 5], ["AN", 2, 1, 6]]]], "r": [[0.00310998], 0, 1.20963, 1701249771], "v": "v0.6"}
{"i": [["[\"7f98392439bf47c9cf44f554aaafc65f\", [4096, 2048], [4096, 2048]]", "cuda -keys=cuda,gpu -arch=sm_80 -max_num_threads=1024 -thread_warp_size=32", [-1, 16, 64, 49152, 2147483647, 1024, 8, 32], "llvm -keys=cpu ", 0, []], [[], [["CI", 1], ["FU", 2, [0, 1]], ["SP", 2, 0, 8388608, [32], 1], ["AN", 2, 0, 5], ["AN", 2, 1, 6]]]], "r": [[0.000198082], 0, 1.34425, 1701249772], "v": "v0.6"}
{"i": [["[\"7f98392439bf47c9cf44f554aaafc65f\", [4096, 2048], [4096, 2048]]", "cuda -keys=cuda,gpu -arch=sm_80 -max_num_threads=1024 -thread_warp_size=32", [-1, 16, 64, 49152, 2147483647, 1024, 8, 32], "llvm -keys=cpu ", 0, []], [[], [["CI", 1], ["FU", 2, [0, 1]], ["SP", 2, 0, 8388608, [16], 1], ["AN", 2, 0, 5], ["AN", 2, 1, 6]]]], "r": [[0.000391784], 0, 1.35351, 1701249772], "v": "v0.6"}
{"i": [["[\"7f98392439bf47c9cf44f554aaafc65f\", [4096, 2048], [4096, 2048]]", "cuda -keys=cuda,gpu -arch=sm_80 -max_num_threads=1024 -thread_warp_size=32", [-1, 16, 64, 49152, 2147483647, 1024, 8, 32], "llvm -keys=cpu ", 0, []], [[], [["CI", 1], ["FU", 2, [0, 1]], ["SP", 2, 0, 8388608, [8], 1], ["AN", 2, 0, 5], ["AN", 2, 1, 6]]]], "r": [[0.000779971], 0, 1.36113, 1701249773], "v": "v0.6"}
{"i": [["[\"460e8399c68e56ab38b35f30119390c3\", [256, 2048], [2048, 256]]", "cuda -keys=cuda,gpu -arch=sm_80 -max_num_threads=1024 -thread_warp_size=32", [-1, 16, 64, 49152, 2147483647, 1024, 8, 32], "llvm -keys=cpu ", 0, []], [[], [["FU", 1, [0, 1]], ["SP", 1, 0, 524288, [2], 1], ["AN", 1, 0, 5], ["AN", 1, 1, 6]]]], "r": [[0.0002129], 0, 1.4425, 1701249793], "v": "v0.6"}
{"i": [["[\"460e8399c68e56ab38b35f30119390c3\", [256, 2048], [2048, 256]]", "cuda -keys=cuda,gpu -arch=sm_80 -max_num_threads=1024 -thread_warp_size=32", [-1, 16, 64, 49152, 2147483647, 1024, 8, 32], "llvm -keys=cpu ", 0, []], [[], [["FU", 1, [0, 1]], ["SP", 1, 0, 524288, [8], 1], ["AN", 1, 0, 5], ["AN", 1, 1, 6]]]], "r": [[5.13553e-05], 0, 0.833551, 1701249794], "v": "v0.6"}
{"i": [["[\"460e8399c68e56ab38b35f30119390c3\", [256, 2048], [2048, 256]]", "cuda -keys=cuda,gpu -arch=sm_80 -max_num_threads=1024 -thread_warp_size=32", [-1, 16, 64, 49152, 2147483647, 1024, 8, 32], "llvm -keys=cpu ", 0, []], [[], [["FU", 1, [0, 1]], ["SP", 1, 0, 524288, [1], 1], ["AN", 1, 0, 5], ["AN", 1, 1, 6]]]], "r": [[0.000391163], 0, 0.828953, 1701249794], "v": "v0.6"}
{"i": [["[\"460e8399c68e56ab38b35f30119390c3\", [256, 2048], [2048, 256]]", "cuda -keys=cuda,gpu -arch=sm_80 -max_num_threads=1024 -thread_warp_size=32", [-1, 16, 64, 49152, 2147483647, 1024, 8, 32], "llvm -keys=cpu ", 0, []], [[], [["FU", 1, [0, 1]], ["SP", 1, 0, 524288, [4], 1], ["AN", 1, 0, 5], ["AN", 1, 1, 6]]]], "r": [[9.98644e-05], 0, 0.832927, 1701249794], "v": "v0.6"}
{"i": [["[\"460e8399c68e56ab38b35f30119390c3\", [256, 2048], [2048, 256]]", "cuda -keys=cuda,gpu -arch=sm_80 -max_num_threads=1024 -thread_warp_size=32", [-1, 16, 64, 49152, 2147483647, 1024, 8, 32], "llvm -keys=cpu ", 0, []], [[], [["FU", 1, [0, 1]], ["SP", 1, 0, 524288, [16], 1], ["AN", 1, 0, 5], ["AN", 1, 1, 6]]]], "r": [[2.71726e-05], 0, 0.813691, 1701249795], "v": "v0.6"}
{"i": [["[\"460e8399c68e56ab38b35f30119390c3\", [256, 2048], [2048, 256]]", "cuda -keys=cuda,gpu -arch=sm_80 -max_num_threads=1024 -thread_warp_size=32", [-1, 16, 64, 49152, 2147483647, 1024, 8, 32], "llvm -keys=cpu ", 0, []], [[], [["FU", 1, [0, 1]], ["SP", 1, 0, 524288, [32], 1], ["AN", 1, 0, 5], ["AN", 1, 1, 6]]]], "r": [[1.51063e-05], 0, 0.816995, 1701249795], "v": "v0.6"}
{"i": [["[\"460e8399c68e56ab38b35f30119390c3\", [256, 2048], [2048, 256]]", "cuda -keys=cuda,gpu -arch=sm_80 -max_num_threads=1024 -thread_warp_size=32", [-1, 16, 64, 49152, 2147483647, 1024, 8, 32], "llvm -keys=cpu ", 0, []], [[], [["FU", 1, [0, 1]], ["SP", 1, 0, 524288, [64], 1], ["AN", 1, 0, 5], ["AN", 1, 1, 6]]]], "r": [[9.44701e-06], 0, 0.781808, 1701249795], "v": "v0.6"}
{"i": [["[\"d66e0b0e1d043ea6473cb12ee1253348\", [4096, 2048], [4096, 2048], [], [4096, 2048]]", "cuda -keys=cuda,gpu -arch=sm_80 -max_num_threads=1024 -thread_warp_size=32", [-1, 16, 64, 49152, 2147483647, 1024, 8, 32], "llvm -keys=cpu ", 0, []], [[], [["CI", 5], ["CI", 4], ["CI", 1], ["FU", 6, [0, 1]], ["SP", 6, 0, 8388608, [64], 1], ["AN", 6, 0, 5], ["AN", 6, 1, 6]]]], "r": [[0.00011295], 0, 2.12707, 1701249817], "v": "v0.6"}
{"i": [["[\"d66e0b0e1d043ea6473cb12ee1253348\", [4096, 2048], [4096, 2048], [], [4096, 2048]]", "cuda -keys=cuda,gpu -arch=sm_80 -max_num_threads=1024 -thread_warp_size=32", [-1, 16, 64, 49152, 2147483647, 1024, 8, 32], "llvm -keys=cpu ", 0, []], [[], [["CI", 5], ["CI", 4], ["CI", 1], ["FU", 6, [0, 1]], ["SP", 6, 0, 8388608, [1], 1], ["AN", 6, 0, 5], ["AN", 6, 1, 6]]]], "r": [[0.00621701], 0, 1.53635, 1701249818], "v": "v0.6"}
{"i": [["[\"d66e0b0e1d043ea6473cb12ee1253348\", [4096, 2048], [4096, 2048], [], [4096, 2048]]", "cuda -keys=cuda,gpu -arch=sm_80 -max_num_threads=1024 -thread_warp_size=32", [-1, 16, 64, 49152, 2147483647, 1024, 8, 32], "llvm -keys=cpu ", 0, []], [[], [["CI", 5], ["CI", 4], ["CI", 1], ["FU", 6, [0, 1]], ["SP", 6, 0, 8388608, [2], 1], ["AN", 6, 0, 5], ["AN", 6, 1, 6]]]], "r": [[0.00310998], 0, 1.48683, 1701249819], "v": "v0.6"}
{"i": [["[\"d66e0b0e1d043ea6473cb12ee1253348\", [4096, 2048], [4096, 2048], [], [4096, 2048]]", "cuda -keys=cuda,gpu -arch=sm_80 -max_num_threads=1024 -thread_warp_size=32", [-1, 16, 64, 49152, 2147483647, 1024, 8, 32], "llvm -keys=cpu ", 0, []], [[], [["CI", 5], ["CI", 4], ["CI", 1], ["FU", 6, [0, 1]], ["SP", 6, 0, 8388608, [4], 1], ["AN", 6, 0, 5], ["AN", 6, 1, 6]]]], "r": [[0.00155654], 0, 1.48681, 1701249820], "v": "v0.6"}
{"i": [["[\"d66e0b0e1d043ea6473cb12ee1253348\", [4096, 2048], [4096, 2048], [], [4096, 2048]]", "cuda -keys=cuda,gpu -arch=sm_80 -max_num_threads=1024 -thread_warp_size=32", [-1, 16, 64, 49152, 2147483647, 1024, 8, 32], "llvm -keys=cpu ", 0, []], [[], [["CI", 5], ["CI", 4], ["CI", 1], ["FU", 6, [0, 1]], ["SP", 6, 0, 8388608, [16], 1], ["AN", 6, 0, 5], ["AN", 6, 1, 6]]]], "r": [[0.00039186], 0, 1.59882, 1701249821], "v": "v0.6"}
{"i": [["[\"d66e0b0e1d043ea6473cb12ee1253348\", [4096, 2048], [4096, 2048], [], [4096, 2048]]", "cuda -keys=cuda,gpu -arch=sm_80 -max_num_threads=1024 -thread_warp_size=32", [-1, 16, 64, 49152, 2147483647, 1024, 8, 32], "llvm -keys=cpu ", 0, []], [[], [["CI", 5], ["CI", 4], ["CI", 1], ["FU", 6, [0, 1]], ["SP", 6, 0, 8388608, [32], 1], ["AN", 6, 0, 5], ["AN", 6, 1, 6]]]], "r": [[0.00019789], 0, 1.69052, 1701249823], "v": "v0.6"}
{"i": [["[\"d66e0b0e1d043ea6473cb12ee1253348\", [4096, 2048], [4096, 2048], [], [4096, 2048]]", "cuda -keys=cuda,gpu -arch=sm_80 -max_num_threads=1024 -thread_warp_size=32", [-1, 16, 64, 49152, 2147483647, 1024, 8, 32], "llvm -keys=cpu ", 0, []], [[], [["CI", 5], ["CI", 4], ["CI", 1], ["FU", 6, [0, 1]], ["SP", 6, 0, 8388608, [8], 1], ["AN", 6, 0, 5], ["AN", 6, 1, 6]]]], "r": [[0.000780006], 0, 1.65097, 1701249824], "v": "v0.6"}
{"i": [["[\"460e8399c68e56ab38b35f30119390c3\", [4096, 256], [256, 4096]]", "cuda -keys=cuda,gpu -arch=sm_80 -max_num_threads=1024 -thread_warp_size=32", [-1, 16, 64, 49152, 2147483647, 1024, 8, 32], "llvm -keys=cpu ", 0, []], [[], [["FU", 1, [0, 1]], ["SP", 1, 0, 1048576, [2], 1], ["AN", 1, 0, 5], ["AN", 1, 1, 6]]]], "r": [[0.000495788], 0, 1.34396, 1701249844], "v": "v0.6"}
{"i": [["[\"460e8399c68e56ab38b35f30119390c3\", [4096, 256], [256, 4096]]", "cuda -keys=cuda,gpu -arch=sm_80 -max_num_threads=1024 -thread_warp_size=32", [-1, 16, 64, 49152, 2147483647, 1024, 8, 32], "llvm -keys=cpu ", 0, []], [[], [["FU", 1, [0, 1]], ["SP", 1, 0, 1048576, [64], 1], ["AN", 1, 0, 5], ["AN", 1, 1, 6]]]], "r": [[1.50859e-05], 0, 0.843701, 1701249844], "v": "v0.6"}
{"i": [["[\"460e8399c68e56ab38b35f30119390c3\", [4096, 256], [256, 4096]]", "cuda -keys=cuda,gpu -arch=sm_80 -max_num_threads=1024 -thread_warp_size=32", [-1, 16, 64, 49152, 2147483647, 1024, 8, 32], "llvm -keys=cpu ", 0, []], [[], [["FU", 1, [0, 1]], ["SP", 1, 0, 1048576, [1], 1], ["AN", 1, 0, 5], ["AN", 1, 1, 6]]]], "r": [[0.000779534], 0, 0.685823, 1701249845], "v": "v0.6"}
{"i": [["[\"460e8399c68e56ab38b35f30119390c3\", [4096, 256], [256, 4096]]", "cuda -keys=cuda,gpu -arch=sm_80 -max_num_threads=1024 -thread_warp_size=32", [-1, 16, 64, 49152, 2147483647, 1024, 8, 32], "llvm -keys=cpu ", 0, []], [[], [["FU", 1, [0, 1]], ["SP", 1, 0, 1048576, [16], 1], ["AN", 1, 0, 5], ["AN", 1, 1, 6]]]], "r": [[5.13938e-05], 0, 0.865217, 1701249845], "v": "v0.6"}
{"i": [["[\"460e8399c68e56ab38b35f30119390c3\", [4096, 256], [256, 4096]]", "cuda -keys=cuda,gpu -arch=sm_80 -max_num_threads=1024 -thread_warp_size=32", [-1, 16, 64, 49152, 2147483647, 1024, 8, 32], "llvm -keys=cpu ", 0, []], [[], [["FU", 1, [0, 1]], ["SP", 1, 0, 1048576, [8], 1], ["AN", 1, 0, 5], ["AN", 1, 1, 6]]]], "r": [[9.98651e-05], 0, 0.873673, 1701249845], "v": "v0.6"}
{"i": [["[\"460e8399c68e56ab38b35f30119390c3\", [4096, 256], [256, 4096]]", "cuda -keys=cuda,gpu -arch=sm_80 -max_num_threads=1024 -thread_warp_size=32", [-1, 16, 64, 49152, 2147483647, 1024, 8, 32], "llvm -keys=cpu ", 0, []], [[], [["FU", 1, [0, 1]], ["SP", 1, 0, 1048576, [32], 1], ["AN", 1, 0, 5], ["AN", 1, 1, 6]]]], "r": [[2.72378e-05], 0, 0.852804, 1701249846], "v": "v0.6"}
{"i": [["[\"460e8399c68e56ab38b35f30119390c3\", [4096, 256], [256, 4096]]", "cuda -keys=cuda,gpu -arch=sm_80 -max_num_threads=1024 -thread_warp_size=32", [-1, 16, 64, 49152, 2147483647, 1024, 8, 32], "llvm -keys=cpu ", 0, []], [[], [["FU", 1, [0, 1]], ["SP", 1, 0, 1048576, [4], 1], ["AN", 1, 0, 5], ["AN", 1, 1, 6]]]], "r": [[0.000196886], 0, 0.876977, 1701249846], "v": "v0.6"}
{"i": [["[\"5610d2b06b4580f608f3c90e06bc90fd\", [4096, 256], [4096, 256]]", "cuda -keys=cuda,gpu -arch=sm_80 -max_num_threads=1024 -thread_warp_size=32", [-1, 16, 64, 49152, 2147483647, 1024, 8, 32], "llvm -keys=cpu ", 0, []], [[], [["FU", 1, [0, 1]], ["SP", 1, 0, 1048576, [8], 1], ["AN", 1, 0, 5], ["AN", 1, 1, 6]]]], "r": [[0.000128391], 0, 1.63709, 1701249865], "v": "v0.6"}
{"i": [["[\"5610d2b06b4580f608f3c90e06bc90fd\", [4096, 256], [4096, 256]]", "cuda -keys=cuda,gpu -arch=sm_80 -max_num_threads=1024 -thread_warp_size=32", [-1, 16, 64, 49152, 2147483647, 1024, 8, 32], "llvm -keys=cpu ", 0, []], [[], [["FU", 1, [0, 1]], ["SP", 1, 0, 1048576, [4], 1], ["AN", 1, 0, 5], ["AN", 1, 1, 6]]]], "r": [[0.000196886], 0, 0.869616, 1701249865], "v": "v0.6"}
{"i": [["[\"5610d2b06b4580f608f3c90e06bc90fd\", [4096, 256], [4096, 256]]", "cuda -keys=cuda,gpu -arch=sm_80 -max_num_threads=1024 -thread_warp_size=32", [-1, 16, 64, 49152, 2147483647, 1024, 8, 32], "llvm -keys=cpu ", 0, []], [[], [["FU", 1, [0, 1]], ["SP", 1, 0, 1048576, [2], 1], ["AN", 1, 0, 5], ["AN", 1, 1, 6]]]], "r": [[0.000391106], 0, 0.871171, 1701249866], "v": "v0.6"}
{"i": [["[\"5610d2b06b4580f608f3c90e06bc90fd\", [4096, 256], [4096, 256]]", "cuda -keys=cuda,gpu -arch=sm_80 -max_num_threads=1024 -thread_warp_size=32", [-1, 16, 64, 49152, 2147483647, 1024, 8, 32], "llvm -keys=cpu ", 0, []], [[], [["FU", 1, [0, 1]], ["SP", 1, 0, 1048576, [1], 1], ["AN", 1, 0, 5], ["AN", 1, 1, 6]]]], "r": [[0.000779492], 0, 0.868788, 1701249866], "v": "v0.6"}
{"i": [["[\"5610d2b06b4580f608f3c90e06bc90fd\", [4096, 256], [4096, 256]]", "cuda -keys=cuda,gpu -arch=sm_80 -max_num_threads=1024 -thread_warp_size=32", [-1, 16, 64, 49152, 2147483647, 1024, 8, 32], "llvm -keys=cpu ", 0, []], [[], [["FU", 1, [0, 1]], ["SP", 1, 0, 1048576, [32], 1], ["AN", 1, 0, 5], ["AN", 1, 1, 6]]]], "r": [[2.71355e-05], 0, 0.870616, 1701249867], "v": "v0.6"}
{"i": [["[\"5610d2b06b4580f608f3c90e06bc90fd\", [4096, 256], [4096, 256]]", "cuda -keys=cuda,gpu -arch=sm_80 -max_num_threads=1024 -thread_warp_size=32", [-1, 16, 64, 49152, 2147483647, 1024, 8, 32], "llvm -keys=cpu ", 0, []], [[], [["FU", 1, [0, 1]], ["SP", 1, 0, 1048576, [64], 1], ["AN", 1, 0, 5], ["AN", 1, 1, 6]]]], "r": [[1.45453e-05], 0, 0.85256, 1701249867], "v": "v0.6"}
{"i": [["[\"5610d2b06b4580f608f3c90e06bc90fd\", [4096, 256], [4096, 256]]", "cuda -keys=cuda,gpu -arch=sm_80 -max_num_threads=1024 -thread_warp_size=32", [-1, 16, 64, 49152, 2147483647, 1024, 8, 32], "llvm -keys=cpu ", 0, []], [[], [["FU", 1, [0, 1]], ["SP", 1, 0, 1048576, [16], 1], ["AN", 1, 0, 5], ["AN", 1, 1, 6]]]], "r": [[5.1364e-05], 0, 0.867733, 1701249867], "v": "v0.6"}
{"i": [["[\"460e8399c68e56ab38b35f30119390c3\", [2048, 256], [256, 2048]]", "cuda -keys=cuda,gpu -arch=sm_80 -max_num_threads=1024 -thread_warp_size=32", [-1, 16, 64, 49152, 2147483647, 1024, 8, 32], "llvm -keys=cpu ", 0, []], [[], [["FU", 1, [0, 1]], ["SP", 1, 0, 524288, [2], 1], ["AN", 1, 0, 5], ["AN", 1, 1, 6]]]], "r": [[0.000206371], 0, 1.57535, 1701249888], "v": "v0.6"}
{"i": [["[\"460e8399c68e56ab38b35f30119390c3\", [2048, 256], [256, 2048]]", "cuda -keys=cuda,gpu -arch=sm_80 -max_num_threads=1024 -thread_warp_size=32", [-1, 16, 64, 49152, 2147483647, 1024, 8, 32], "llvm -keys=cpu ", 0, []], [[], [["FU", 1, [0, 1]], ["SP", 1, 0, 524288, [8], 1], ["AN", 1, 0, 5], ["AN", 1, 1, 6]]]], "r": [[5.13651e-05], 0, 0.804171, 1701249888], "v": "v0.6"}
{"i": [["[\"460e8399c68e56ab38b35f30119390c3\", [2048, 256], [256, 2048]]", "cuda -keys=cuda,gpu -arch=sm_80 -max_num_threads=1024 -thread_warp_size=32", [-1, 16, 64, 49152, 2147483647, 1024, 8, 32], "llvm -keys=cpu ", 0, []], [[], [["FU", 1, [0, 1]], ["SP", 1, 0, 524288, [16], 1], ["AN", 1, 0, 5], ["AN", 1, 1, 6]]]], "r": [[2.71713e-05], 0, 0.813484, 1701249888], "v": "v0.6"}
{"i": [["[\"460e8399c68e56ab38b35f30119390c3\", [2048, 256], [256, 2048]]", "cuda -keys=cuda,gpu -arch=sm_80 -max_num_threads=1024 -thread_warp_size=32", [-1, 16, 64, 49152, 2147483647, 1024, 8, 32], "llvm -keys=cpu ", 0, []], [[], [["FU", 1, [0, 1]], ["SP", 1, 0, 524288, [1], 1], ["AN", 1, 0, 5], ["AN", 1, 1, 6]]]], "r": [[0.000391195], 0, 0.813464, 1701249889], "v": "v0.6"}
{"i": [["[\"460e8399c68e56ab38b35f30119390c3\", [2048, 256], [256, 2048]]", "cuda -keys=cuda,gpu -arch=sm_80 -max_num_threads=1024 -thread_warp_size=32", [-1, 16, 64, 49152, 2147483647, 1024, 8, 32], "llvm -keys=cpu ", 0, []], [[], [["FU", 1, [0, 1]], ["SP", 1, 0, 524288, [32], 1], ["AN", 1, 0, 5], ["AN", 1, 1, 6]]]], "r": [[1.511e-05], 0, 0.814064, 1701249889], "v": "v0.6"}
{"i": [["[\"460e8399c68e56ab38b35f30119390c3\", [2048, 256], [256, 2048]]", "cuda -keys=cuda,gpu -arch=sm_80 -max_num_threads=1024 -thread_warp_size=32", [-1, 16, 64, 49152, 2147483647, 1024, 8, 32], "llvm -keys=cpu ", 0, []], [[], [["FU", 1, [0, 1]], ["SP", 1, 0, 524288, [64], 1], ["AN", 1, 0, 5], ["AN", 1, 1, 6]]]], "r": [[9.07785e-06], 0, 0.78234, 1701249889], "v": "v0.6"}
{"i": [["[\"460e8399c68e56ab38b35f30119390c3\", [2048, 256], [256, 2048]]", "cuda -keys=cuda,gpu -arch=sm_80 -max_num_threads=1024 -thread_warp_size=32", [-1, 16, 64, 49152, 2147483647, 1024, 8, 32], "llvm -keys=cpu ", 0, []], [[], [["FU", 1, [0, 1]], ["SP", 1, 0, 524288, [4], 1], ["AN", 1, 0, 5], ["AN", 1, 1, 6]]]], "r": [[9.98605e-05], 0, 0.820041, 1701249890], "v": "v0.6"}
{"i": [["[\"5610d2b06b4580f608f3c90e06bc90fd\", [256, 2048], [256, 2048]]", "cuda -keys=cuda,gpu -arch=sm_80 -max_num_threads=1024 -thread_warp_size=32", [-1, 16, 64, 49152, 2147483647, 1024, 8, 32], "llvm -keys=cpu ", 0, []], [[], [["FU", 1, [0, 1]], ["SP", 1, 0, 524288, [64], 1], ["AN", 1, 0, 5], ["AN", 1, 1, 6]]]], "r": [[9.77947e-06], 0, 1.64201, 1701249909], "v": "v0.6"}
{"i": [["[\"5610d2b06b4580f608f3c90e06bc90fd\", [256, 2048], [256, 2048]]", "cuda -keys=cuda,gpu -arch=sm_80 -max_num_threads=1024 -thread_warp_size=32", [-1, 16, 64, 49152, 2147483647, 1024, 8, 32], "llvm -keys=cpu ", 0, []], [[], [["FU", 1, [0, 1]], ["SP", 1, 0, 524288, [8], 1], ["AN", 1, 0, 5], ["AN", 1, 1, 6]]]], "r": [[5.1354e-05], 0, 0.849624, 1701249909], "v": "v0.6"}
{"i": [["[\"5610d2b06b4580f608f3c90e06bc90fd\", [256, 2048], [256, 2048]]", "cuda -keys=cuda,gpu -arch=sm_80 -max_num_threads=1024 -thread_warp_size=32", [-1, 16, 64, 49152, 2147483647, 1024, 8, 32], "llvm -keys=cpu ", 0, []], [[], [["FU", 1, [0, 1]], ["SP", 1, 0, 524288, [2], 1], ["AN", 1, 0, 5], ["AN", 1, 1, 6]]]], "r": [[0.000196913], 0, 0.849052, 1701249910], "v": "v0.6"}
{"i": [["[\"5610d2b06b4580f608f3c90e06bc90fd\", [256, 2048], [256, 2048]]", "cuda -keys=cuda,gpu -arch=sm_80 -max_num_threads=1024 -thread_warp_size=32", [-1, 16, 64, 49152, 2147483647, 1024, 8, 32], "llvm -keys=cpu ", 0, []], [[], [["FU", 1, [0, 1]], ["SP", 1, 0, 524288, [32], 1], ["AN", 1, 0, 5], ["AN", 1, 1, 6]]]], "r": [[1.49816e-05], 0, 0.818043, 1701249910], "v": "v0.6"}
{"i": [["[\"5610d2b06b4580f608f3c90e06bc90fd\", [256, 2048], [256, 2048]]", "cuda -keys=cuda,gpu -arch=sm_80 -max_num_threads=1024 -thread_warp_size=32", [-1, 16, 64, 49152, 2147483647, 1024, 8, 32], "llvm -keys=cpu ", 0, []], [[], [["FU", 1, [0, 1]], ["SP", 1, 0, 524288, [4], 1], ["AN", 1, 0, 5], ["AN", 1, 1, 6]]]], "r": [[9.9865e-05], 0, 0.862333, 1701249910], "v": "v0.6"}
{"i": [["[\"5610d2b06b4580f608f3c90e06bc90fd\", [256, 2048], [256, 2048]]", "cuda -keys=cuda,gpu -arch=sm_80 -max_num_threads=1024 -thread_warp_size=32", [-1, 16, 64, 49152, 2147483647, 1024, 8, 32], "llvm -keys=cpu ", 0, []], [[], [["FU", 1, [0, 1]], ["SP", 1, 0, 524288, [1], 1], ["AN", 1, 0, 5], ["AN", 1, 1, 6]]]], "r": [[0.000391108], 0, 0.864424, 1701249911], "v": "v0.6"}
{"i": [["[\"5610d2b06b4580f608f3c90e06bc90fd\", [256, 2048], [256, 2048]]", "cuda -keys=cuda,gpu -arch=sm_80 -max_num_threads=1024 -thread_warp_size=32", [-1, 16, 64, 49152, 2147483647, 1024, 8, 32], "llvm -keys=cpu ", 0, []], [[], [["FU", 1, [0, 1]], ["SP", 1, 0, 524288, [16], 1], ["AN", 1, 0, 5], ["AN", 1, 1, 6]]]], "r": [[2.70958e-05], 0, 0.832417, 1701249911], "v": "v0.6"}
{"i": [["[\"7f98392439bf47c9cf44f554aaafc65f\", [4096, 256], [4096, 256]]", "cuda -keys=cuda,gpu -arch=sm_80 -max_num_threads=1024 -thread_warp_size=32", [-1, 16, 64, 49152, 2147483647, 1024, 8, 32], "llvm -keys=cpu ", 0, []], [[], [["CI", 1], ["FU", 2, [0, 1]], ["SP", 2, 0, 1048576, [32], 1], ["AN", 2, 0, 5], ["AN", 2, 1, 6]]]], "r": [[3.47227e-05], 0, 1.64291, 1701249930], "v": "v0.6"}
{"i": [["[\"7f98392439bf47c9cf44f554aaafc65f\", [4096, 256], [4096, 256]]", "cuda -keys=cuda,gpu -arch=sm_80 -max_num_threads=1024 -thread_warp_size=32", [-1, 16, 64, 49152, 2147483647, 1024, 8, 32], "llvm -keys=cpu ", 0, []], [[], [["CI", 1], ["FU", 2, [0, 1]], ["SP", 2, 0, 1048576, [4], 1], ["AN", 2, 0, 5], ["AN", 2, 1, 6]]]], "r": [[0.000196888], 0, 0.870804, 1701249931], "v": "v0.6"}
{"i": [["[\"7f98392439bf47c9cf44f554aaafc65f\", [4096, 256], [4096, 256]]", "cuda -keys=cuda,gpu -arch=sm_80 -max_num_threads=1024 -thread_warp_size=32", [-1, 16, 64, 49152, 2147483647, 1024, 8, 32], "llvm -keys=cpu ", 0, []], [[], [["CI", 1], ["FU", 2, [0, 1]], ["SP", 2, 0, 1048576, [1], 1], ["AN", 2, 0, 5], ["AN", 2, 1, 6]]]], "r": [[0.000779502], 0, 0.722244, 1701249931], "v": "v0.6"}
{"i": [["[\"7f98392439bf47c9cf44f554aaafc65f\", [4096, 256], [4096, 256]]", "cuda -keys=cuda,gpu -arch=sm_80 -max_num_threads=1024 -thread_warp_size=32", [-1, 16, 64, 49152, 2147483647, 1024, 8, 32], "llvm -keys=cpu ", 0, []], [[], [["CI", 1], ["FU", 2, [0, 1]], ["SP", 2, 0, 1048576, [2], 1], ["AN", 2, 0, 5], ["AN", 2, 1, 6]]]], "r": [[0.000391103], 0, 0.878956, 1701249931], "v": "v0.6"}
{"i": [["[\"7f98392439bf47c9cf44f554aaafc65f\", [4096, 256], [4096, 256]]", "cuda -keys=cuda,gpu -arch=sm_80 -max_num_threads=1024 -thread_warp_size=32", [-1, 16, 64, 49152, 2147483647, 1024, 8, 32], "llvm -keys=cpu ", 0, []], [[], [["CI", 1], ["FU", 2, [0, 1]], ["SP", 2, 0, 1048576, [8], 1], ["AN", 2, 0, 5], ["AN", 2, 1, 6]]]], "r": [[9.98291e-05], 0, 0.865143, 1701249932], "v": "v0.6"}
{"i": [["[\"7f98392439bf47c9cf44f554aaafc65f\", [4096, 256], [4096, 256]]", "cuda -keys=cuda,gpu -arch=sm_80 -max_num_threads=1024 -thread_warp_size=32", [-1, 16, 64, 49152, 2147483647, 1024, 8, 32], "llvm -keys=cpu ", 0, []], [[], [["CI", 1], ["FU", 2, [0, 1]], ["SP", 2, 0, 1048576, [16], 1], ["AN", 2, 0, 5], ["AN", 2, 1, 6]]]], "r": [[5.13707e-05], 0, 0.874128, 1701249932], "v": "v0.6"}
{"i": [["[\"7f98392439bf47c9cf44f554aaafc65f\", [4096, 256], [4096, 256]]", "cuda -keys=cuda,gpu -arch=sm_80 -max_num_threads=1024 -thread_warp_size=32", [-1, 16, 64, 49152, 2147483647, 1024, 8, 32], "llvm -keys=cpu ", 0, []], [[], [["CI", 1], ["FU", 2, [0, 1]], ["SP", 2, 0, 1048576, [64], 1], ["AN", 2, 0, 5], ["AN", 2, 1, 6]]]], "r": [[1.45788e-05], 0, 0.842073, 1701249932], "v": "v0.6"}
{"i": [["[\"d35e8e86e916242699474a54c41cae95\", [4096, 256], [], [4096, 256]]", "cuda -keys=cuda,gpu -arch=sm_80 -max_num_threads=1024 -thread_warp_size=32", [-1, 16, 64, 49152, 2147483647, 1024, 8, 32], "llvm -keys=cpu ", 0, []], [[], [["CI", 7], ["CI", 6], ["CI", 4], ["SP", 8, 1, 256, [16], 1], ["AN", 8, 2, 6], ["FSP", 3, 1, 3, 1], ["AN", 3, 2, 6], ["CA", 3, 8, 0], ["CI", 2], ["AN", 8, 0, 5], ["SP", 1, 0, 4096, [32], 1], ["AN", 1, 0, 5], ["AN", 1, 1, 6], ["PR", 1, 0, "auto_unroll_max_step$0"], ["PR", 3, 0, "auto_unroll_max_step$64"]]]], "r": [[3.22619e-05], 0, 1.59151, 1701249955], "v": "v0.6"}
{"i": [["[\"d35e8e86e916242699474a54c41cae95\", [4096, 256], [], [4096, 256]]", "cuda -keys=cuda,gpu -arch=sm_80 -max_num_threads=1024 -thread_warp_size=32", [-1, 16, 64, 49152, 2147483647, 1024, 8, 32], "llvm -keys=cpu ", 0, []], [[], [["CI", 7], ["CI", 6], ["CI", 4], ["CI", 2], ["SP", 1, 1, 256, [32], 1], ["AN", 1, 2, 6], ["FU", 8, [0, 1]], ["SP", 8, 0, 1048576, [64], 1], ["AN", 8, 0, 5], ["AN", 8, 1, 6], ["SP", 3, 0, 4096, [2], 1], ["AN", 3, 0, 5], ["AN", 3, 1, 6], ["AN", 1, 0, 5], ["PR", 1, 0, "auto_unroll_max_step$512"], ["PR", 3, 0, "auto_unroll_max_step$1024"]]]], "r": [[6.17453e-05], 0, 1.08843, 1701249955], "v": "v0.6"}
{"i": [["[\"d35e8e86e916242699474a54c41cae95\", [4096, 256], [], [4096, 256]]", "cuda -keys=cuda,gpu -arch=sm_80 -max_num_threads=1024 -thread_warp_size=32", [-1, 16, 64, 49152, 2147483647, 1024, 8, 32], "llvm -keys=cpu ", 0, []], [[], [["CI", 7], ["CI", 6], ["CI", 4], ["SP", 8, 1, 256, [64], 1], ["AN", 8, 2, 6], ["FSP", 3, 1, 3, 1], ["AN", 3, 2, 6], ["CA", 3, 8, 0], ["CI", 2], ["FSP", 1, 1, 3, 1], ["AN", 1, 2, 6], ["CA", 1, 8, 0], ["AN", 8, 0, 5], ["PR", 1, 0, "auto_unroll_max_step$0"], ["PR", 3, 0, "auto_unroll_max_step$64"]]]], "r": [[7.41932e-06], 0, 1.02026, 1701249956], "v": "v0.6"}
{"i": [["[\"d35e8e86e916242699474a54c41cae95\", [4096, 256], [], [4096, 256]]", "cuda -keys=cuda,gpu -arch=sm_80 -max_num_threads=1024 -thread_warp_size=32", [-1, 16, 64, 49152, 2147483647, 1024, 8, 32], "llvm -keys=cpu ", 0, []], [[], [["CI", 7], ["CI", 6], ["CI", 4], ["SP", 8, 1, 256, [64], 1], ["AN", 8, 2, 6], ["FSP", 3, 1, 3, 1], ["AN", 3, 2, 6], ["CA", 3, 8, 0], ["CI", 2], ["FSP", 1, 1, 3, 1], ["AN", 1, 2, 6], ["CA", 1, 8, 0], ["AN", 8, 0, 5], ["PR", 1, 0, "auto_unroll_max_step$512"], ["PR", 3, 0, "auto_unroll_max_step$512"]]]], "r": [[7.4177e-06], 0, 0.954981, 1701249956], "v": "v0.6"}
{"i": [["[\"d35e8e86e916242699474a54c41cae95\", [4096, 256], [], [4096, 256]]", "cuda -keys=cuda,gpu -arch=sm_80 -max_num_threads=1024 -thread_warp_size=32", [-1, 16, 64, 49152, 2147483647, 1024, 8, 32], "llvm -keys=cpu ", 0, []], [[], [["CI", 7], ["CI", 6], ["CI", 4], ["SP", 8, 1, 256, [2], 1], ["AN", 8, 2, 6], ["FSP", 3, 1, 3, 1], ["AN", 3, 2, 6], ["CA", 3, 8, 0], ["CI", 2], ["AN", 8, 0, 5], ["SP", 1, 0, 4096, [64], 1], ["AN", 1, 0, 5], ["AN", 1, 1, 6], ["PR", 1, 0, "auto_unroll_max_step$0"], ["PR", 3, 0, "auto_unroll_max_step$1024"]]]], "r": [[7.48783e-05], 0, 1.53043, 1701249956], "v": "v0.6"}
{"i": [["[\"d35e8e86e916242699474a54c41cae95\", [4096, 256], [], [4096, 256]]", "cuda -keys=cuda,gpu -arch=sm_80 -max_num_threads=1024 -thread_warp_size=32", [-1, 16, 64, 49152, 2147483647, 1024, 8, 32], "llvm -keys=cpu ", 0, []], [[], [["CI", 7], ["CI", 6], ["CI", 4], ["CI", 2], ["SP", 1, 1, 256, [16], 1], ["AN", 1, 2, 6], ["FU", 8, [0, 1]], ["SP", 8, 0, 1048576, [32], 1], ["AN", 8, 0, 5], ["AN", 8, 1, 6], ["SP", 3, 0, 4096, [32], 1], ["AN", 3, 0, 5], ["AN", 3, 1, 6], ["AN", 1, 0, 5], ["PR", 1, 0, "auto_unroll_max_step$0"], ["PR", 3, 0, "auto_unroll_max_step$0"]]]], "r": [[5.57138e-05], 0, 1.06685, 1701249957], "v": "v0.6"}
{"i": [["[\"d35e8e86e916242699474a54c41cae95\", [4096, 256], [], [4096, 256]]", "cuda -keys=cuda,gpu -arch=sm_80 -max_num_threads=1024 -thread_warp_size=32", [-1, 16, 64, 49152, 2147483647, 1024, 8, 32], "llvm -keys=cpu ", 0, []], [[], [["CI", 7], ["CI", 6], ["CI", 4], ["SP", 8, 1, 256, [4], 1], ["AN", 8, 2, 6], ["FSP", 3, 1, 3, 1], ["AN", 3, 2, 6], ["CA", 3, 8, 0], ["CI", 2], ["FSP", 1, 1, 3, 1], ["AN", 1, 2, 6], ["CA", 1, 8, 0], ["AN", 8, 0, 5], ["PR", 1, 0, "auto_unroll_max_step$64"], ["PR", 3, 0, "auto_unroll_max_step$0"]]]], "r": [[3.29079e-05], 0, 1.25429, 1701249957], "v": "v0.6"}
{"i": [["[\"d35e8e86e916242699474a54c41cae95\", [4096, 256], [], [4096, 256]]", "cuda -keys=cuda,gpu -arch=sm_80 -max_num_threads=1024 -thread_warp_size=32", [-1, 16, 64, 49152, 2147483647, 1024, 8, 32], "llvm -keys=cpu ", 0, []], [[], [["CI", 7], ["CI", 6], ["CI", 4], ["CI", 2], ["SP", 1, 1, 256, [16], 1], ["AN", 1, 2, 6], ["FU", 8, [0, 1]], ["SP", 8, 0, 1048576, [64], 1], ["AN", 8, 0, 5], ["AN", 8, 1, 6], ["SP", 3, 0, 4096, [32], 1], ["AN", 3, 0, 5], ["AN", 3, 1, 6], ["AN", 1, 0, 5], ["PR", 1, 0, "auto_unroll_max_step$0"], ["PR", 3, 0, "auto_unroll_max_step$16"]]]], "r": [[4.32418e-05], 0, 1.13195, 1701249958], "v": "v0.6"}
{"i": [["[\"d35e8e86e916242699474a54c41cae95\", [4096, 256], [], [4096, 256]]", "cuda -keys=cuda,gpu -arch=sm_80 -max_num_threads=1024 -thread_warp_size=32", [-1, 16, 64, 49152, 2147483647, 1024, 8, 32], "llvm -keys=cpu ", 0, []], [[], [["CI", 7], ["CI", 6], ["CI", 4], ["CI", 2], ["FU", 8, [0, 1]], ["SP", 8, 0, 1048576, [32], 1], ["AN", 8, 0, 5], ["AN", 8, 1, 6], ["SP", 3, 0, 4096, [64], 1], ["AN", 3, 0, 5], ["AN", 3, 1, 6], ["SP", 1, 0, 4096, [32], 1], ["AN", 1, 0, 5], ["AN", 1, 1, 6], ["PR", 1, 0, "auto_unroll_max_step$1024"], ["PR", 3, 0, "auto_unroll_max_step$16"]]]], "r": [[6.4649e-05], 0, 1.02116, 1701249958], "v": "v0.6"}
{"i": [["[\"d35e8e86e916242699474a54c41cae95\", [4096, 256], [], [4096, 256]]", "cuda -keys=cuda,gpu -arch=sm_80 -max_num_threads=1024 -thread_warp_size=32", [-1, 16, 64, 49152, 2147483647, 1024, 8, 32], "llvm -keys=cpu ", 0, []], [[], [["CI", 7], ["CI", 6], ["CI", 4], ["SP", 8, 1, 256, [32], 1], ["AN", 8, 2, 6], ["FSP", 3, 1, 3, 1], ["AN", 3, 2, 6], ["CA", 3, 8, 0], ["CI", 2], ["FSP", 1, 1, 3, 1], ["AN", 1, 2, 6], ["CA", 1, 8, 0], ["AN", 8, 0, 5], ["PR", 1, 0, "auto_unroll_max_step$64"], ["PR", 3, 0, "auto_unroll_max_step$1024"]]]], "r": [[7.11059e-06], 0, 1.03548, 1701249958], "v": "v0.6"}
{"i": [["[\"d35e8e86e916242699474a54c41cae95\", [4096, 256], [], [4096, 256]]", "cuda -keys=cuda,gpu -arch=sm_80 -max_num_threads=1024 -thread_warp_size=32", [-1, 16, 64, 49152, 2147483647, 1024, 8, 32], "llvm -keys=cpu ", 0, []], [[], [["CI", 7], ["CI", 6], ["CI", 4], ["SP", 8, 1, 256, [1], 1], ["AN", 8, 2, 6], ["FSP", 3, 1, 3, 1], ["AN", 3, 2, 6], ["CA", 3, 8, 0], ["CI", 2], ["FSP", 1, 1, 3, 1], ["AN", 1, 2, 6], ["CA", 1, 8, 0], ["AN", 8, 0, 5], ["PR", 1, 0, "auto_unroll_max_step$1024"], ["PR", 3, 0, "auto_unroll_max_step$1024"]]]], "r": [[0.000168712], 0, 2.68089, 1701249959], "v": "v0.6"}
{"i": [["[\"d35e8e86e916242699474a54c41cae95\", [4096, 256], [], [4096, 256]]", "cuda -keys=cuda,gpu -arch=sm_80 -max_num_threads=1024 -thread_warp_size=32", [-1, 16, 64, 49152, 2147483647, 1024, 8, 32], "llvm -keys=cpu ", 0, []], [[], [["CI", 7], ["CI", 6], ["CI", 4], ["CI", 2], ["SP", 1, 1, 256, [64], 1], ["AN", 1, 2, 6], ["FU", 8, [0, 1]], ["SP", 8, 0, 1048576, [64], 1], ["AN", 8, 0, 5], ["AN", 8, 1, 6], ["SP", 3, 0, 4096, [64], 1], ["AN", 3, 0, 5], ["AN", 3, 1, 6], ["AN", 1, 0, 5], ["PR", 1, 0, "auto_unroll_max_step$0"], ["PR", 3, 0, "auto_unroll_max_step$512"]]]], "r": [[4.28019e-05], 0, 1.08346, 1701249959], "v": "v0.6"}
{"i": [["[\"d35e8e86e916242699474a54c41cae95\", [4096, 256], [], [4096, 256]]", "cuda -keys=cuda,gpu -arch=sm_80 -max_num_threads=1024 -thread_warp_size=32", [-1, 16, 64, 49152, 2147483647, 1024, 8, 32], "llvm -keys=cpu ", 0, []], [[], [["CI", 7], ["CI", 6], ["CI", 4], ["CI", 2], ["SP", 1, 1, 256, [16], 1], ["AN", 1, 2, 6], ["FU", 8, [0, 1]], ["SP", 8, 0, 1048576, [64], 1], ["AN", 8, 0, 5], ["AN", 8, 1, 6], ["SP", 3, 0, 4096, [64], 1], ["AN", 3, 0, 5], ["AN", 3, 1, 6], ["AN", 1, 0, 5], ["PR", 1, 0, "auto_unroll_max_step$512"], ["PR", 3, 0, "auto_unroll_max_step$16"]]]], "r": [[4.29905e-05], 0, 1.01552, 1701249959], "v": "v0.6"}
{"i": [["[\"d35e8e86e916242699474a54c41cae95\", [4096, 256], [], [4096, 256]]", "cuda -keys=cuda,gpu -arch=sm_80 -max_num_threads=1024 -thread_warp_size=32", [-1, 16, 64, 49152, 2147483647, 1024, 8, 32], "llvm -keys=cpu ", 0, []], [[], [["CI", 7], ["CI", 6], ["CI", 4], ["SP", 8, 1, 256, [4], 1], ["AN", 8, 2, 6], ["FSP", 3, 1, 3, 1], ["AN", 3, 2, 6], ["CA", 3, 8, 0], ["CI", 2], ["FSP", 1, 1, 3, 1], ["AN", 1, 2, 6], ["CA", 1, 8, 0], ["AN", 8, 0, 5], ["PR", 1, 0, "auto_unroll_max_step$0"], ["PR", 3, 0, "auto_unroll_max_step$1024"]]]], "r": [[3.32014e-05], 0, 1.31198, 1701249960], "v": "v0.6"}
{"i": [["[\"d35e8e86e916242699474a54c41cae95\", [4096, 256], [], [4096, 256]]", "cuda -keys=cuda,gpu -arch=sm_80 -max_num_threads=1024 -thread_warp_size=32", [-1, 16, 64, 49152, 2147483647, 1024, 8, 32], "llvm -keys=cpu ", 0, []], [[], [["CI", 7], ["CI", 6], ["CI", 4], ["SP", 8, 1, 256, [2], 1], ["AN", 8, 2, 6], ["FSP", 3, 1, 3, 1], ["AN", 3, 2, 6], ["CA", 3, 8, 0], ["CI", 2], ["FSP", 1, 1, 3, 1], ["AN", 1, 2, 6], ["CA", 1, 8, 0], ["AN", 8, 0, 5], ["PR", 1, 0, "auto_unroll_max_step$0"], ["PR", 3, 0, "auto_unroll_max_step$64"]]]], "r": [[6.46606e-05], 0, 1.06029, 1701249960], "v": "v0.6"}
{"i": [["[\"d35e8e86e916242699474a54c41cae95\", [4096, 256], [], [4096, 256]]", "cuda -keys=cuda,gpu -arch=sm_80 -max_num_threads=1024 -thread_warp_size=32", [-1, 16, 64, 49152, 2147483647, 1024, 8, 32], "llvm -keys=cpu ", 0, []], [[], [["CI", 7], ["CI", 6], ["CI", 4], ["SP", 8, 1, 256, [16], 1], ["AN", 8, 2, 6], ["FSP", 3, 1, 3, 1], ["AN", 3, 2, 6], ["CA", 3, 8, 0], ["CI", 2], ["AN", 8, 0, 5], ["SP", 1, 0, 4096, [64], 1], ["AN", 1, 0, 5], ["AN", 1, 1, 6], ["PR", 1, 0, "auto_unroll_max_step$64"], ["PR", 3, 0, "auto_unroll_max_step$64"]]]], "r": [[2.65691e-05], 0, 1.04214, 1701249961], "v": "v0.6"}
{"i": [["[\"d35e8e86e916242699474a54c41cae95\", [4096, 256], [], [4096, 256]]", "cuda -keys=cuda,gpu -arch=sm_80 -max_num_threads=1024 -thread_warp_size=32", [-1, 16, 64, 49152, 2147483647, 1024, 8, 32], "llvm -keys=cpu ", 0, []], [[], [["CI", 7], ["CI", 6], ["CI", 4], ["CI", 2], ["FU", 8, [0, 1]], ["SP", 8, 0, 1048576, [2], 1], ["AN", 8, 0, 5], ["AN", 8, 1, 6], ["SP", 3, 0, 4096, [64], 1], ["AN", 3, 0, 5], ["AN", 3, 1, 6], ["SP", 1, 0, 4096, [4], 1], ["AN", 1, 0, 5], ["AN", 1, 1, 6], ["PR", 1, 0, "auto_unroll_max_step$64"], ["PR", 3, 0, "auto_unroll_max_step$0"]]]], "r": [[0.000427934], 0, 1.14806, 1701249961], "v": "v0.6"}
{"i": [["[\"d35e8e86e916242699474a54c41cae95\", [4096, 256], [], [4096, 256]]", "cuda -keys=cuda,gpu -arch=sm_80 -max_num_threads=1024 -thread_warp_size=32", [-1, 16, 64, 49152, 2147483647, 1024, 8, 32], "llvm -keys=cpu ", 0, []], [[], [["CI", 7], ["CI", 6], ["CI", 4], ["CI", 2], ["SP", 1, 1, 256, [32], 1], ["AN", 1, 2, 6], ["FU", 8, [0, 1]], ["SP", 8, 0, 1048576, [32], 1], ["AN", 8, 0, 5], ["AN", 8, 1, 6], ["SP", 3, 0, 4096, [32], 1], ["AN", 3, 0, 5], ["AN", 3, 1, 6], ["AN", 1, 0, 5], ["PR", 1, 0, "auto_unroll_max_step$64"], ["PR", 3, 0, "auto_unroll_max_step$64"]]]], "r": [[5.53797e-05], 0, 1.14335, 1701249961], "v": "v0.6"}
{"i": [["[\"d35e8e86e916242699474a54c41cae95\", [4096, 256], [], [4096, 256]]", "cuda -keys=cuda,gpu -arch=sm_80 -max_num_threads=1024 -thread_warp_size=32", [-1, 16, 64, 49152, 2147483647, 1024, 8, 32], "llvm -keys=cpu ", 0, []], [[], [["CI", 7], ["CI", 6], ["CI", 4], ["CI", 2], ["SP", 1, 1, 256, [32], 1], ["AN", 1, 2, 6], ["FU", 8, [0, 1]], ["SP", 8, 0, 1048576, [64], 1], ["AN", 8, 0, 5], ["AN", 8, 1, 6], ["SP", 3, 0, 4096, [1], 1], ["AN", 3, 0, 5], ["AN", 3, 1, 6], ["AN", 1, 0, 5], ["PR", 1, 0, "auto_unroll_max_step$1024"], ["PR", 3, 0, "auto_unroll_max_step$1024"]]]], "r": [[9.22395e-05], 0, 1.03691, 1701249962], "v": "v0.6"}
{"i": [["[\"d35e8e86e916242699474a54c41cae95\", [4096, 256], [], [4096, 256]]", "cuda -keys=cuda,gpu -arch=sm_80 -max_num_threads=1024 -thread_warp_size=32", [-1, 16, 64, 49152, 2147483647, 1024, 8, 32], "llvm -keys=cpu ", 0, []], [[], [["CI", 7], ["CI", 6], ["CI", 4], ["SP", 8, 1, 256, [16], 1], ["AN", 8, 2, 6], ["FSP", 3, 1, 3, 1], ["AN", 3, 2, 6], ["CA", 3, 8, 0], ["CI", 2], ["AN", 8, 0, 5], ["SP", 1, 0, 4096, [32], 1], ["AN", 1, 0, 5], ["AN", 1, 1, 6], ["PR", 1, 0, "auto_unroll_max_step$1024"], ["PR", 3, 0, "auto_unroll_max_step$0"]]]], "r": [[2.58528e-05], 0, 0.992935, 1701249962], "v": "v0.6"}
{"i": [["[\"d35e8e86e916242699474a54c41cae95\", [4096, 256], [], [4096, 256]]", "cuda -keys=cuda,gpu -arch=sm_80 -max_num_threads=1024 -thread_warp_size=32", [-1, 16, 64, 49152, 2147483647, 1024, 8, 32], "llvm -keys=cpu ", 0, []], [[], [["CI", 7], ["CI", 6], ["CI", 4], ["CI", 2], ["SP", 1, 1, 256, [32], 1], ["AN", 1, 2, 6], ["FU", 8, [0, 1]], ["SP", 8, 0, 1048576, [32], 1], ["AN", 8, 0, 5], ["AN", 8, 1, 6], ["SP", 3, 0, 4096, [32], 1], ["AN", 3, 0, 5], ["AN", 3, 1, 6], ["AN", 1, 0, 5], ["PR", 1, 0, "auto_unroll_max_step$512"], ["PR", 3, 0, "auto_unroll_max_step$16"]]]], "r": [[5.53772e-05], 0, 1.13385, 1701249963], "v": "v0.6"}
{"i": [["[\"d35e8e86e916242699474a54c41cae95\", [4096, 256], [], [4096, 256]]", "cuda -keys=cuda,gpu -arch=sm_80 -max_num_threads=1024 -thread_warp_size=32", [-1, 16, 64, 49152, 2147483647, 1024, 8, 32], "llvm -keys=cpu ", 0, []], [[], [["CI", 7], ["CI", 6], ["CI", 4], ["SP", 8, 1, 256, [64], 1], ["AN", 8, 2, 6], ["FSP", 3, 1, 3, 1], ["AN", 3, 2, 6], ["CA", 3, 8, 0], ["CI", 2], ["FSP", 1, 1, 3, 1], ["AN", 1, 2, 6], ["CA", 1, 8, 0], ["AN", 8, 0, 5], ["PR", 1, 0, "auto_unroll_max_step$512"], ["PR", 3, 0, "auto_unroll_max_step$16"]]]], "r": [[7.42518e-06], 0, 0.989113, 1701249963], "v": "v0.6"}
{"i": [["[\"d35e8e86e916242699474a54c41cae95\", [4096, 256], [], [4096, 256]]", "cuda -keys=cuda,gpu -arch=sm_80 -max_num_threads=1024 -thread_warp_size=32", [-1, 16, 64, 49152, 2147483647, 1024, 8, 32], "llvm -keys=cpu ", 0, []], [[], [["CI", 7], ["CI", 6], ["CI", 4], ["SP", 8, 1, 256, [64], 1], ["AN", 8, 2, 6], ["FSP", 3, 1, 3, 1], ["AN", 3, 2, 6], ["CA", 3, 8, 0], ["CI", 2], ["FSP", 1, 1, 3, 1], ["AN", 1, 2, 6], ["CA", 1, 8, 0], ["AN", 8, 0, 5], ["PR", 1, 0, "auto_unroll_max_step$0"], ["PR", 3, 0, "auto_unroll_max_step$1024"]]]], "r": [[7.42518e-06], 0, 0.99179, 1701249963], "v": "v0.6"}
{"i": [["[\"d35e8e86e916242699474a54c41cae95\", [4096, 256], [], [4096, 256]]", "cuda -keys=cuda,gpu -arch=sm_80 -max_num_threads=1024 -thread_warp_size=32", [-1, 16, 64, 49152, 2147483647, 1024, 8, 32], "llvm -keys=cpu ", 0, []], [[], [["CI", 7], ["CI", 6], ["CI", 4], ["CI", 2], ["SP", 1, 1, 256, [32], 1], ["AN", 1, 2, 6], ["FU", 8, [0, 1]], ["SP", 8, 0, 1048576, [32], 1], ["AN", 8, 0, 5], ["AN", 8, 1, 6], ["SP", 3, 0, 4096, [32], 1], ["AN", 3, 0, 5], ["AN", 3, 1, 6], ["AN", 1, 0, 5], ["PR", 1, 0, "auto_unroll_max_step$512"], ["PR", 3, 0, "auto_unroll_max_step$512"]]]], "r": [[5.53656e-05], 0, 1.06479, 1701249964], "v": "v0.6"}
{"i": [["[\"d35e8e86e916242699474a54c41cae95\", [4096, 256], [], [4096, 256]]", "cuda -keys=cuda,gpu -arch=sm_80 -max_num_threads=1024 -thread_warp_size=32", [-1, 16, 64, 49152, 2147483647, 1024, 8, 32], "llvm -keys=cpu ", 0, []], [[], [["CI", 7], ["CI", 6], ["CI", 4], ["CI", 2], ["FU", 8, [0, 1]], ["SP", 8, 0, 1048576, [32], 1], ["AN", 8, 0, 5], ["AN", 8, 1, 6], ["SP", 3, 0, 4096, [64], 1], ["AN", 3, 0, 5], ["AN", 3, 1, 6], ["SP", 1, 0, 4096, [32], 1], ["AN", 1, 0, 5], ["AN", 1, 1, 6], ["PR", 1, 0, "auto_unroll_max_step$512"], ["PR", 3, 0, "auto_unroll_max_step$16"]]]], "r": [[6.45899e-05], 0, 1.03167, 1701249964], "v": "v0.6"}
{"i": [["[\"d35e8e86e916242699474a54c41cae95\", [4096, 256], [], [4096, 256]]", "cuda -keys=cuda,gpu -arch=sm_80 -max_num_threads=1024 -thread_warp_size=32", [-1, 16, 64, 49152, 2147483647, 1024, 8, 32], "llvm -keys=cpu ", 0, []], [[], [["CI", 7], ["CI", 6], ["CI", 4], ["CI", 2], ["SP", 1, 1, 256, [32], 1], ["AN", 1, 2, 6], ["FU", 8, [0, 1]], ["SP", 8, 0, 1048576, [64], 1], ["AN", 8, 0, 5], ["AN", 8, 1, 6], ["SP", 3, 0, 4096, [16], 1], ["AN", 3, 0, 5], ["AN", 3, 1, 6], ["AN", 1, 0, 5], ["PR", 1, 0, "auto_unroll_max_step$512"], ["PR", 3, 0, "auto_unroll_max_step$64"]]]], "r": [[3.74904e-05], 0, 1.1711, 1701249964], "v": "v0.6"}
{"i": [["[\"d35e8e86e916242699474a54c41cae95\", [4096, 256], [], [4096, 256]]", "cuda -keys=cuda,gpu -arch=sm_80 -max_num_threads=1024 -thread_warp_size=32", [-1, 16, 64, 49152, 2147483647, 1024, 8, 32], "llvm -keys=cpu ", 0, []], [[], [["CI", 7], ["CI", 6], ["CI", 4], ["SP", 8, 1, 256, [2], 1], ["AN", 8, 2, 6], ["FSP", 3, 1, 3, 1], ["AN", 3, 2, 6], ["CA", 3, 8, 0], ["CI", 2], ["FSP", 1, 1, 3, 1], ["AN", 1, 2, 6], ["CA", 1, 8, 0], ["AN", 8, 0, 5], ["PR", 1, 0, "auto_unroll_max_step$0"], ["PR", 3, 0, "auto_unroll_max_step$16"]]]], "r": [[6.46594e-05], 0, 1.08259, 1701249965], "v": "v0.6"}
{"i": [["[\"d35e8e86e916242699474a54c41cae95\", [4096, 256], [], [4096, 256]]", "cuda -keys=cuda,gpu -arch=sm_80 -max_num_threads=1024 -thread_warp_size=32", [-1, 16, 64, 49152, 2147483647, 1024, 8, 32], "llvm -keys=cpu ", 0, []], [[], [["CI", 7], ["CI", 6], ["CI", 4], ["SP", 8, 1, 256, [4], 1], ["AN", 8, 2, 6], ["FSP", 3, 1, 3, 1], ["AN", 3, 2, 6], ["CA", 3, 8, 0], ["CI", 2], ["AN", 8, 0, 5], ["SP", 1, 0, 4096, [8], 1], ["AN", 1, 0, 5], ["AN", 1, 1, 6], ["PR", 1, 0, "auto_unroll_max_step$512"], ["PR", 3, 0, "auto_unroll_max_step$64"]]]], "r": [[4.2079e-05], 0, 1.19268, 1701249965], "v": "v0.6"}
{"i": [["[\"d35e8e86e916242699474a54c41cae95\", [4096, 256], [], [4096, 256]]", "cuda -keys=cuda,gpu -arch=sm_80 -max_num_threads=1024 -thread_warp_size=32", [-1, 16, 64, 49152, 2147483647, 1024, 8, 32], "llvm -keys=cpu ", 0, []], [[], [["CI", 7], ["CI", 6], ["CI", 4], ["SP", 8, 1, 256, [64], 1], ["AN", 8, 2, 6], ["FSP", 3, 1, 3, 1], ["AN", 3, 2, 6], ["CA", 3, 8, 0], ["CI", 2], ["AN", 8, 0, 5], ["SP", 1, 0, 4096, [32], 1], ["AN", 1, 0, 5], ["AN", 1, 1, 6], ["PR", 1, 0, "auto_unroll_max_step$1024"], ["PR", 3, 0, "auto_unroll_max_step$64"]]]], "r": [[2.19156e-05], 0, 1.11085, 1701249966], "v": "v0.6"}
{"i": [["[\"d35e8e86e916242699474a54c41cae95\", [4096, 256], [], [4096, 256]]", "cuda -keys=cuda,gpu -arch=sm_80 -max_num_threads=1024 -thread_warp_size=32", [-1, 16, 64, 49152, 2147483647, 1024, 8, 32], "llvm -keys=cpu ", 0, []], [[], [["CI", 7], ["CI", 6], ["CI", 4], ["CI", 2], ["FU", 8, [0, 1]], ["SP", 8, 0, 1048576, [32], 1], ["AN", 8, 0, 5], ["AN", 8, 1, 6], ["SP", 3, 0, 4096, [1], 1], ["AN", 3, 0, 5], ["AN", 3, 1, 6], ["SP", 1, 0, 4096, [32], 1], ["AN", 1, 0, 5], ["AN", 1, 1, 6], ["PR", 1, 0, "auto_unroll_max_step$64"], ["PR", 3, 0, "auto_unroll_max_step$1024"]]]], "r": [[0.000114229], 0, 1.07032, 1701249966], "v": "v0.6"}
{"i": [["[\"d35e8e86e916242699474a54c41cae95\", [4096, 256], [], [4096, 256]]", "cuda -keys=cuda,gpu -arch=sm_80 -max_num_threads=1024 -thread_warp_size=32", [-1, 16, 64, 49152, 2147483647, 1024, 8, 32], "llvm -keys=cpu ", 0, []], [[], [["CI", 7], ["CI", 6], ["CI", 4], ["CI", 2], ["SP", 1, 1, 256, [1], 1], ["AN", 1, 2, 6], ["FU", 8, [0, 1]], ["SP", 8, 0, 1048576, [64], 1], ["AN", 8, 0, 5], ["AN", 8, 1, 6], ["SP", 3, 0, 4096, [32], 1], ["AN", 3, 0, 5], ["AN", 3, 1, 6], ["AN", 1, 0, 5], ["PR", 1, 0, "auto_unroll_max_step$64"], ["PR", 3, 0, "auto_unroll_max_step$0"]]]], "r": [[5.56767e-05], 0, 1.12648, 1701249966], "v": "v0.6"}
{"i": [["[\"d35e8e86e916242699474a54c41cae95\", [4096, 256], [], [4096, 256]]", "cuda -keys=cuda,gpu -arch=sm_80 -max_num_threads=1024 -thread_warp_size=32", [-1, 16, 64, 49152, 2147483647, 1024, 8, 32], "llvm -keys=cpu ", 0, []], [[], [["CI", 7], ["CI", 6], ["CI", 4], ["SP", 8, 1, 256, [16], 1], ["AN", 8, 2, 6], ["FSP", 3, 1, 3, 1], ["AN", 3, 2, 6], ["CA", 3, 8, 0], ["CI", 2], ["AN", 8, 0, 5], ["SP", 1, 0, 4096, [32], 1], ["AN", 1, 0, 5], ["AN", 1, 1, 6], ["PR", 1, 0, "auto_unroll_max_step$16"], ["PR", 3, 0, "auto_unroll_max_step$64"]]]], "r": [[2.58604e-05], 0, 1.02728, 1701249967], "v": "v0.6"}
{"i": [["[\"d35e8e86e916242699474a54c41cae95\", [4096, 256], [], [4096, 256]]", "cuda -keys=cuda,gpu -arch=sm_80 -max_num_threads=1024 -thread_warp_size=32", [-1, 16, 64, 49152, 2147483647, 1024, 8, 32], "llvm -keys=cpu ", 0, []], [[], [["CI", 7], ["CI", 6], ["CI", 4], ["SP", 8, 1, 256, [16], 1], ["AN", 8, 2, 6], ["FSP", 3, 1, 3, 1], ["AN", 3, 2, 6], ["CA", 3, 8, 0], ["CI", 2], ["FSP", 1, 1, 3, 1], ["AN", 1, 2, 6], ["CA", 1, 8, 0], ["AN", 8, 0, 5], ["PR", 1, 0, "auto_unroll_max_step$1024"], ["PR", 3, 0, "auto_unroll_max_step$64"]]]], "r": [[1.09777e-05], 0, 1.05393, 1701249967], "v": "v0.6"}
{"i": [["[\"d35e8e86e916242699474a54c41cae95\", [4096, 256], [], [4096, 256]]", "cuda -keys=cuda,gpu -arch=sm_80 -max_num_threads=1024 -thread_warp_size=32", [-1, 16, 64, 49152, 2147483647, 1024, 8, 32], "llvm -keys=cpu ", 0, []], [[], [["CI", 7], ["CI", 6], ["CI", 4], ["CI", 2], ["SP", 1, 1, 256, [32], 1], ["AN", 1, 2, 6], ["FU", 8, [0, 1]], ["SP", 8, 0, 1048576, [32], 1], ["AN", 8, 0, 5], ["AN", 8, 1, 6], ["SP", 3, 0, 4096, [32], 1], ["AN", 3, 0, 5], ["AN", 3, 1, 6], ["AN", 1, 0, 5], ["PR", 1, 0, "auto_unroll_max_step$1024"], ["PR", 3, 0, "auto_unroll_max_step$16"]]]], "r": [[5.53719e-05], 0, 1.17543, 1701249968], "v": "v0.6"}
{"i": [["[\"d35e8e86e916242699474a54c41cae95\", [4096, 256], [], [4096, 256]]", "cuda -keys=cuda,gpu -arch=sm_80 -max_num_threads=1024 -thread_warp_size=32", [-1, 16, 64, 49152, 2147483647, 1024, 8, 32], "llvm -keys=cpu ", 0, []], [[], [["CI", 7], ["CI", 6], ["CI", 4], ["SP", 8, 1, 256, [16], 1], ["AN", 8, 2, 6], ["FSP", 3, 1, 3, 1], ["AN", 3, 2, 6], ["CA", 3, 8, 0], ["CI", 2], ["FSP", 1, 1, 3, 1], ["AN", 1, 2, 6], ["CA", 1, 8, 0], ["AN", 8, 0, 5], ["PR", 1, 0, "auto_unroll_max_step$512"], ["PR", 3, 0, "auto_unroll_max_step$16"]]]], "r": [[1.09779e-05], 0, 1.05287, 1701249968], "v": "v0.6"}
{"i": [["[\"d35e8e86e916242699474a54c41cae95\", [4096, 256], [], [4096, 256]]", "cuda -keys=cuda,gpu -arch=sm_80 -max_num_threads=1024 -thread_warp_size=32", [-1, 16, 64, 49152, 2147483647, 1024, 8, 32], "llvm -keys=cpu ", 0, []], [[], [["CI", 7], ["CI", 6], ["CI", 4], ["CI", 2], ["FU", 8, [0, 1]], ["SP", 8, 0, 1048576, [1], 1], ["AN", 8, 0, 5], ["AN", 8, 1, 6], ["SP", 3, 0, 4096, [32], 1], ["AN", 3, 0, 5], ["AN", 3, 1, 6], ["SP", 1, 0, 4096, [32], 1], ["AN", 1, 0, 5], ["AN", 1, 1, 6], ["PR", 1, 0, "auto_unroll_max_step$0"], ["PR", 3, 0, "auto_unroll_max_step$0"]]]], "r": [[0.000817027], 0, 0.890351, 1701249968], "v": "v0.6"}
{"i": [["[\"d35e8e86e916242699474a54c41cae95\", [4096, 256], [], [4096, 256]]", "cuda -keys=cuda,gpu -arch=sm_80 -max_num_threads=1024 -thread_warp_size=32", [-1, 16, 64, 49152, 2147483647, 1024, 8, 32], "llvm -keys=cpu ", 0, []], [[], [["CI", 7], ["CI", 6], ["CI", 4], ["CI", 2], ["SP", 1, 1, 256, [4], 1], ["AN", 1, 2, 6], ["FU", 8, [0, 1]], ["SP", 8, 0, 1048576, [64], 1], ["AN", 8, 0, 5], ["AN", 8, 1, 6], ["SP", 3, 0, 4096, [1], 1], ["AN", 3, 0, 5], ["AN", 3, 1, 6], ["AN", 1, 0, 5], ["PR", 1, 0, "auto_unroll_max_step$512"], ["PR", 3, 0, "auto_unroll_max_step$64"]]]], "r": [[9.359e-05], 0, 1.12804, 1701249969], "v": "v0.6"}
{"i": [["[\"d35e8e86e916242699474a54c41cae95\", [4096, 256], [], [4096, 256]]", "cuda -keys=cuda,gpu -arch=sm_80 -max_num_threads=1024 -thread_warp_size=32", [-1, 16, 64, 49152, 2147483647, 1024, 8, 32], "llvm -keys=cpu ", 0, []], [[], [["CI", 7], ["CI", 6], ["CI", 4], ["SP", 8, 1, 256, [2], 1], ["AN", 8, 2, 6], ["FSP", 3, 1, 3, 1], ["AN", 3, 2, 6], ["CA", 3, 8, 0], ["CI", 2], ["AN", 8, 0, 5], ["SP", 1, 0, 4096, [64], 1], ["AN", 1, 0, 5], ["AN", 1, 1, 6], ["PR", 1, 0, "auto_unroll_max_step$16"], ["PR", 3, 0, "auto_unroll_max_step$0"]]]], "r": [[7.52074e-05], 0, 1.08879, 1701249969], "v": "v0.6"}
{"i": [["[\"d35e8e86e916242699474a54c41cae95\", [4096, 256], [], [4096, 256]]", "cuda -keys=cuda,gpu -arch=sm_80 -max_num_threads=1024 -thread_warp_size=32", [-1, 16, 64, 49152, 2147483647, 1024, 8, 32], "llvm -keys=cpu ", 0, []], [[], [["CI", 7], ["CI", 6], ["CI", 4], ["SP", 8, 1, 256, [32], 1], ["AN", 8, 2, 6], ["FSP", 3, 1, 3, 1], ["AN", 3, 2, 6], ["CA", 3, 8, 0], ["CI", 2], ["AN", 8, 0, 5], ["SP", 1, 0, 4096, [32], 1], ["AN", 1, 0, 5], ["AN", 1, 1, 6], ["PR", 1, 0, "auto_unroll_max_step$0"], ["PR", 3, 0, "auto_unroll_max_step$16"]]]], "r": [[2.22056e-05], 0, 1.04164, 1701249969], "v": "v0.6"}
{"i": [["[\"d35e8e86e916242699474a54c41cae95\", [4096, 256], [], [4096, 256]]", "cuda -keys=cuda,gpu -arch=sm_80 -max_num_threads=1024 -thread_warp_size=32", [-1, 16, 64, 49152, 2147483647, 1024, 8, 32], "llvm -keys=cpu ", 0, []], [[], [["CI", 7], ["CI", 6], ["CI", 4], ["SP", 8, 1, 256, [8], 1], ["AN", 8, 2, 6], ["FSP", 3, 1, 3, 1], ["AN", 3, 2, 6], ["CA", 3, 8, 0], ["CI", 2], ["FSP", 1, 1, 3, 1], ["AN", 1, 2, 6], ["CA", 1, 8, 0], ["AN", 8, 0, 5], ["PR", 1, 0, "auto_unroll_max_step$0"], ["PR", 3, 0, "auto_unroll_max_step$64"]]]], "r": [[1.85563e-05], 0, 1.11574, 1701249970], "v": "v0.6"}
{"i": [["[\"d35e8e86e916242699474a54c41cae95\", [4096, 256], [], [4096, 256]]", "cuda -keys=cuda,gpu -arch=sm_80 -max_num_threads=1024 -thread_warp_size=32", [-1, 16, 64, 49152, 2147483647, 1024, 8, 32], "llvm -keys=cpu ", 0, []], [[], [["CI", 7], ["CI", 6], ["CI", 4], ["SP", 8, 1, 256, [4], 1], ["AN", 8, 2, 6], ["FSP", 3, 1, 3, 1], ["AN", 3, 2, 6], ["CA", 3, 8, 0], ["CI", 2], ["FSP", 1, 1, 3, 1], ["AN", 1, 2, 6], ["CA", 1, 8, 0], ["AN", 8, 0, 5], ["PR", 1, 0, "auto_unroll_max_step$64"], ["PR", 3, 0, "auto_unroll_max_step$512"]]]], "r": [[3.29177e-05], 0, 1.34878, 1701249970], "v": "v0.6"}
{"i": [["[\"d35e8e86e916242699474a54c41cae95\", [4096, 256], [], [4096, 256]]", "cuda -keys=cuda,gpu -arch=sm_80 -max_num_threads=1024 -thread_warp_size=32", [-1, 16, 64, 49152, 2147483647, 1024, 8, 32], "llvm -keys=cpu ", 0, []], [[], [["CI", 7], ["CI", 6], ["CI", 4], ["SP", 8, 1, 256, [32], 1], ["AN", 8, 2, 6], ["FSP", 3, 1, 3, 1], ["AN", 3, 2, 6], ["CA", 3, 8, 0], ["CI", 2], ["AN", 8, 0, 5], ["SP", 1, 0, 4096, [64], 1], ["AN", 1, 0, 5], ["AN", 1, 1, 6], ["PR", 1, 0, "auto_unroll_max_step$0"], ["PR", 3, 0, "auto_unroll_max_step$0"]]]], "r": [[2.29239e-05], 0, 1.15303, 1701249970], "v": "v0.6"}
{"i": [["[\"d35e8e86e916242699474a54c41cae95\", [4096, 256], [], [4096, 256]]", "cuda -keys=cuda,gpu -arch=sm_80 -max_num_threads=1024 -thread_warp_size=32", [-1, 16, 64, 49152, 2147483647, 1024, 8, 32], "llvm -keys=cpu ", 0, []], [[], [["CI", 7], ["CI", 6], ["CI", 4], ["CI", 2], ["SP", 1, 1, 256, [64], 1], ["AN", 1, 2, 6], ["FU", 8, [0, 1]], ["SP", 8, 0, 1048576, [32], 1], ["AN", 8, 0, 5], ["AN", 8, 1, 6], ["SP", 3, 0, 4096, [32], 1], ["AN", 3, 0, 5], ["AN", 3, 1, 6], ["AN", 1, 0, 5], ["PR", 1, 0, "auto_unroll_max_step$64"], ["PR", 3, 0, "auto_unroll_max_step$0"]]]], "r": [[5.55136e-05], 0, 1.0949, 1701249971], "v": "v0.6"}
{"i": [["[\"d35e8e86e916242699474a54c41cae95\", [4096, 256], [], [4096, 256]]", "cuda -keys=cuda,gpu -arch=sm_80 -max_num_threads=1024 -thread_warp_size=32", [-1, 16, 64, 49152, 2147483647, 1024, 8, 32], "llvm -keys=cpu ", 0, []], [[], [["CI", 7], ["CI", 6], ["CI", 4], ["CI", 2], ["FU", 8, [0, 1]], ["SP", 8, 0, 1048576, [64], 1], ["AN", 8, 0, 5], ["AN", 8, 1, 6], ["SP", 3, 0, 4096, [16], 1], ["AN", 3, 0, 5], ["AN", 3, 1, 6], ["SP", 1, 0, 4096, [16], 1], ["AN", 1, 0, 5], ["AN", 1, 1, 6], ["PR", 1, 0, "auto_unroll_max_step$64"], ["PR", 3, 0, "auto_unroll_max_step$1024"]]]], "r": [[4.45825e-05], 0, 1.00215, 1701249971], "v": "v0.6"}
{"i": [["[\"d35e8e86e916242699474a54c41cae95\", [4096, 256], [], [4096, 256]]", "cuda -keys=cuda,gpu -arch=sm_80 -max_num_threads=1024 -thread_warp_size=32", [-1, 16, 64, 49152, 2147483647, 1024, 8, 32], "llvm -keys=cpu ", 0, []], [[], [["CI", 7], ["CI", 6], ["CI", 4], ["SP", 8, 1, 256, [64], 1], ["AN", 8, 2, 6], ["FSP", 3, 1, 3, 1], ["AN", 3, 2, 6], ["CA", 3, 8, 0], ["CI", 2], ["FSP", 1, 1, 3, 1], ["AN", 1, 2, 6], ["CA", 1, 8, 0], ["AN", 8, 0, 5], ["PR", 1, 0, "auto_unroll_max_step$64"], ["PR", 3, 0, "auto_unroll_max_step$64"]]]], "r": [[7.41467e-06], 0, 1.10837, 1701249972], "v": "v0.6"}
{"i": [["[\"d35e8e86e916242699474a54c41cae95\", [4096, 256], [], [4096, 256]]", "cuda -keys=cuda,gpu -arch=sm_80 -max_num_threads=1024 -thread_warp_size=32", [-1, 16, 64, 49152, 2147483647, 1024, 8, 32], "llvm -keys=cpu ", 0, []], [[], [["CI", 7], ["CI", 6], ["CI", 4], ["CI", 2], ["FU", 8, [0, 1]], ["SP", 8, 0, 1048576, [32], 1], ["AN", 8, 0, 5], ["AN", 8, 1, 6], ["SP", 3, 0, 4096, [32], 1], ["AN", 3, 0, 5], ["AN", 3, 1, 6], ["SP", 1, 0, 4096, [1], 1], ["AN", 1, 0, 5], ["AN", 1, 1, 6], ["PR", 1, 0, "auto_unroll_max_step$16"], ["PR", 3, 0, "auto_unroll_max_step$512"]]]], "r": [[6.93886e-05], 0, 1.01533, 1701249972], "v": "v0.6"}
{"i": [["[\"d35e8e86e916242699474a54c41cae95\", [4096, 256], [], [4096, 256]]", "cuda -keys=cuda,gpu -arch=sm_80 -max_num_threads=1024 -thread_warp_size=32", [-1, 16, 64, 49152, 2147483647, 1024, 8, 32], "llvm -keys=cpu ", 0, []], [[], [["CI", 7], ["CI", 6], ["CI", 4], ["SP", 8, 1, 256, [32], 1], ["AN", 8, 2, 6], ["FSP", 3, 1, 3, 1], ["AN", 3, 2, 6], ["CA", 3, 8, 0], ["CI", 2], ["FSP", 1, 1, 3, 1], ["AN", 1, 2, 6], ["CA", 1, 8, 0], ["AN", 8, 0, 5], ["PR", 1, 0, "auto_unroll_max_step$512"], ["PR", 3, 0, "auto_unroll_max_step$64"]]]], "r": [[7.12402e-06], 0, 1.01521, 1701249972], "v": "v0.6"}
{"i": [["[\"d35e8e86e916242699474a54c41cae95\", [4096, 256], [], [4096, 256]]", "cuda -keys=cuda,gpu -arch=sm_80 -max_num_threads=1024 -thread_warp_size=32", [-1, 16, 64, 49152, 2147483647, 1024, 8, 32], "llvm -keys=cpu ", 0, []], [[], [["CI", 7], ["CI", 6], ["CI", 4], ["CI", 2], ["FU", 8, [0, 1]], ["SP", 8, 0, 1048576, [32], 1], ["AN", 8, 0, 5], ["AN", 8, 1, 6], ["SP", 3, 0, 4096, [32], 1], ["AN", 3, 0, 5], ["AN", 3, 1, 6], ["SP", 1, 0, 4096, [8], 1], ["AN", 1, 0, 5], ["AN", 1, 1, 6], ["PR", 1, 0, "auto_unroll_max_step$64"], ["PR", 3, 0, "auto_unroll_max_step$1024"]]]], "r": [[6.05296e-05], 0, 0.998892, 1701249973], "v": "v0.6"}
{"i": [["[\"d35e8e86e916242699474a54c41cae95\", [4096, 256], [], [4096, 256]]", "cuda -keys=cuda,gpu -arch=sm_80 -max_num_threads=1024 -thread_warp_size=32", [-1, 16, 64, 49152, 2147483647, 1024, 8, 32], "llvm -keys=cpu ", 0, []], [[], [["CI", 7], ["CI", 6], ["CI", 4], ["CI", 2], ["SP", 1, 1, 256, [32], 1], ["AN", 1, 2, 6], ["FU", 8, [0, 1]], ["SP", 8, 0, 1048576, [32], 1], ["AN", 8, 0, 5], ["AN", 8, 1, 6], ["SP", 3, 0, 4096, [2], 1], ["AN", 3, 0, 5], ["AN", 3, 1, 6], ["AN", 1, 0, 5], ["PR", 1, 0, "auto_unroll_max_step$1024"], ["PR", 3, 0, "auto_unroll_max_step$0"]]]], "r": [[7.4162e-05], 0, 1.07625, 1701249973], "v": "v0.6"}
{"i": [["[\"d35e8e86e916242699474a54c41cae95\", [4096, 256], [], [4096, 256]]", "cuda -keys=cuda,gpu -arch=sm_80 -max_num_threads=1024 -thread_warp_size=32", [-1, 16, 64, 49152, 2147483647, 1024, 8, 32], "llvm -keys=cpu ", 0, []], [[], [["CI", 7], ["CI", 6], ["CI", 4], ["CI", 2], ["FU", 8, [0, 1]], ["SP", 8, 0, 1048576, [8], 1], ["AN", 8, 0, 5], ["AN", 8, 1, 6], ["SP", 3, 0, 4096, [32], 1], ["AN", 3, 0, 5], ["AN", 3, 1, 6], ["SP", 1, 0, 4096, [8], 1], ["AN", 1, 0, 5], ["AN", 1, 1, 6], ["PR", 1, 0, "auto_unroll_max_step$16"], ["PR", 3, 0, "auto_unroll_max_step$512"]]]], "r": [[0.000133245], 0, 1.11503, 1701249973], "v": "v0.6"}
{"i": [["[\"d35e8e86e916242699474a54c41cae95\", [4096, 256], [], [4096, 256]]", "cuda -keys=cuda,gpu -arch=sm_80 -max_num_threads=1024 -thread_warp_size=32", [-1, 16, 64, 49152, 2147483647, 1024, 8, 32], "llvm -keys=cpu ", 0, []], [[], [["CI", 7], ["CI", 6], ["CI", 4], ["CI", 2], ["SP", 1, 1, 256, [32], 1], ["AN", 1, 2, 6], ["FU", 8, [0, 1]], ["SP", 8, 0, 1048576, [64], 1], ["AN", 8, 0, 5], ["AN", 8, 1, 6], ["SP", 3, 0, 4096, [32], 1], ["AN", 3, 0, 5], ["AN", 3, 1, 6], ["AN", 1, 0, 5], ["PR", 1, 0, "auto_unroll_max_step$64"], ["PR", 3, 0, "auto_unroll_max_step$0"]]]], "r": [[4.29175e-05], 0, 1.09026, 1701249974], "v": "v0.6"}
{"i": [["[\"d35e8e86e916242699474a54c41cae95\", [4096, 256], [], [4096, 256]]", "cuda -keys=cuda,gpu -arch=sm_80 -max_num_threads=1024 -thread_warp_size=32", [-1, 16, 64, 49152, 2147483647, 1024, 8, 32], "llvm -keys=cpu ", 0, []], [[], [["CI", 7], ["CI", 6], ["CI", 4], ["CI", 2], ["SP", 1, 1, 256, [64], 1], ["AN", 1, 2, 6], ["FU", 8, [0, 1]], ["SP", 8, 0, 1048576, [32], 1], ["AN", 8, 0, 5], ["AN", 8, 1, 6], ["SP", 3, 0, 4096, [64], 1], ["AN", 3, 0, 5], ["AN", 3, 1, 6], ["AN", 1, 0, 5], ["PR", 1, 0, "auto_unroll_max_step$0"], ["PR", 3, 0, "auto_unroll_max_step$16"]]]], "r": [[5.52307e-05], 0, 1.11685, 1701249974], "v": "v0.6"}
{"i": [["[\"d35e8e86e916242699474a54c41cae95\", [4096, 256], [], [4096, 256]]", "cuda -keys=cuda,gpu -arch=sm_80 -max_num_threads=1024 -thread_warp_size=32", [-1, 16, 64, 49152, 2147483647, 1024, 8, 32], "llvm -keys=cpu ", 0, []], [[], [["CI", 7], ["CI", 6], ["CI", 4], ["SP", 8, 1, 256, [16], 1], ["AN", 8, 2, 6], ["FSP", 3, 1, 3, 1], ["AN", 3, 2, 6], ["CA", 3, 8, 0], ["CI", 2], ["FSP", 1, 1, 3, 1], ["AN", 1, 2, 6], ["CA", 1, 8, 0], ["AN", 8, 0, 5], ["PR", 1, 0, "auto_unroll_max_step$64"], ["PR", 3, 0, "auto_unroll_max_step$512"]]]], "r": [[1.09804e-05], 0, 0.9983, 1701249975], "v": "v0.6"}
{"i": [["[\"d35e8e86e916242699474a54c41cae95\", [4096, 256], [], [4096, 256]]", "cuda -keys=cuda,gpu -arch=sm_80 -max_num_threads=1024 -thread_warp_size=32", [-1, 16, 64, 49152, 2147483647, 1024, 8, 32], "llvm -keys=cpu ", 0, []], [[], [["CI", 7], ["CI", 6], ["CI", 4], ["SP", 8, 1, 256, [32], 1], ["AN", 8, 2, 6], ["FSP", 3, 1, 3, 1], ["AN", 3, 2, 6], ["CA", 3, 8, 0], ["CI", 2], ["AN", 8, 0, 5], ["SP", 1, 0, 4096, [64], 1], ["AN", 1, 0, 5], ["AN", 1, 1, 6], ["PR", 1, 0, "auto_unroll_max_step$512"], ["PR", 3, 0, "auto_unroll_max_step$512"]]]], "r": [[2.29208e-05], 0, 1.03068, 1701249975], "v": "v0.6"}
{"i": [["[\"d35e8e86e916242699474a54c41cae95\", [4096, 256], [], [4096, 256]]", "cuda -keys=cuda,gpu -arch=sm_80 -max_num_threads=1024 -thread_warp_size=32", [-1, 16, 64, 49152, 2147483647, 1024, 8, 32], "llvm -keys=cpu ", 0, []], [[], [["CI", 7], ["CI", 6], ["CI", 4], ["CI", 2], ["SP", 1, 1, 256, [32], 1], ["AN", 1, 2, 6], ["FU", 8, [0, 1]], ["SP", 8, 0, 1048576, [64], 1], ["AN", 8, 0, 5], ["AN", 8, 1, 6], ["SP", 3, 0, 4096, [8], 1], ["AN", 3, 0, 5], ["AN", 3, 1, 6], ["AN", 1, 0, 5], ["PR", 1, 0, "auto_unroll_max_step$64"], ["PR", 3, 0, "auto_unroll_max_step$1024"]]]], "r": [[3.74848e-05], 0, 1.1038, 1701249975], "v": "v0.6"}
{"i": [["[\"d35e8e86e916242699474a54c41cae95\", [4096, 256], [], [4096, 256]]", "cuda -keys=cuda,gpu -arch=sm_80 -max_num_threads=1024 -thread_warp_size=32", [-1, 16, 64, 49152, 2147483647, 1024, 8, 32], "llvm -keys=cpu ", 0, []], [[], [["CI", 7], ["CI", 6], ["CI", 4], ["CI", 2], ["FU", 8, [0, 1]], ["SP", 8, 0, 1048576, [2], 1], ["AN", 8, 0, 5], ["AN", 8, 1, 6], ["SP", 3, 0, 4096, [8], 1], ["AN", 3, 0, 5], ["AN", 3, 1, 6], ["SP", 1, 0, 4096, [32], 1], ["AN", 1, 0, 5], ["AN", 1, 1, 6], ["PR", 1, 0, "auto_unroll_max_step$16"], ["PR", 3, 0, "auto_unroll_max_step$512"]]]], "r": [[0.000423554], 0, 1.03724, 1701249976], "v": "v0.6"}
{"i": [["[\"d35e8e86e916242699474a54c41cae95\", [4096, 256], [], [4096, 256]]", "cuda -keys=cuda,gpu -arch=sm_80 -max_num_threads=1024 -thread_warp_size=32", [-1, 16, 64, 49152, 2147483647, 1024, 8, 32], "llvm -keys=cpu ", 0, []], [[], [["CI", 7], ["CI", 6], ["CI", 4], ["SP", 8, 1, 256, [16], 1], ["AN", 8, 2, 6], ["FSP", 3, 1, 3, 1], ["AN", 3, 2, 6], ["CA", 3, 8, 0], ["CI", 2], ["FSP", 1, 1, 3, 1], ["AN", 1, 2, 6], ["CA", 1, 8, 0], ["AN", 8, 0, 5], ["PR", 1, 0, "auto_unroll_max_step$0"], ["PR", 3, 0, "auto_unroll_max_step$64"]]]], "r": [[1.09797e-05], 0, 1.00641, 1701249976], "v": "v0.6"}
{"i": [["[\"d35e8e86e916242699474a54c41cae95\", [4096, 256], [], [4096, 256]]", "cuda -keys=cuda,gpu -arch=sm_80 -max_num_threads=1024 -thread_warp_size=32", [-1, 16, 64, 49152, 2147483647, 1024, 8, 32], "llvm -keys=cpu ", 0, []], [[], [["CI", 7], ["CI", 6], ["CI", 4], ["CI", 2], ["FU", 8, [0, 1]], ["SP", 8, 0, 1048576, [32], 1], ["AN", 8, 0, 5], ["AN", 8, 1, 6], ["SP", 3, 0, 4096, [64], 1], ["AN", 3, 0, 5], ["AN", 3, 1, 6], ["SP", 1, 0, 4096, [64], 1], ["AN", 1, 0, 5], ["AN", 1, 1, 6], ["PR", 1, 0, "auto_unroll_max_step$64"], ["PR", 3, 0, "auto_unroll_max_step$0"]]]], "r": [[6.56109e-05], 0, 1.10856, 1701249976], "v": "v0.6"}
{"i": [["[\"d35e8e86e916242699474a54c41cae95\", [4096, 256], [], [4096, 256]]", "cuda -keys=cuda,gpu -arch=sm_80 -max_num_threads=1024 -thread_warp_size=32", [-1, 16, 64, 49152, 2147483647, 1024, 8, 32], "llvm -keys=cpu ", 0, []], [[], [["CI", 7], ["CI", 6], ["CI", 4], ["SP", 8, 1, 256, [64], 1], ["AN", 8, 2, 6], ["FSP", 3, 1, 3, 1], ["AN", 3, 2, 6], ["CA", 3, 8, 0], ["CI", 2], ["AN", 8, 0, 5], ["SP", 1, 0, 4096, [32], 1], ["AN", 1, 0, 5], ["AN", 1, 1, 6], ["PR", 1, 0, "auto_unroll_max_step$64"], ["PR", 3, 0, "auto_unroll_max_step$512"]]]], "r": [[2.19212e-05], 0, 1.05743, 1701249977], "v": "v0.6"}
