benchmark/subgraphs/mlp/tvm_autotvm.log
{"input": ["cuda -keys=cuda,gpu -arch=sm_80 -max_num_threads=1024 -thread_warp_size=32", "dense_large_batch.gpu", [["TENSOR", [256, 4096], "float16"], ["TENSOR", [2048, 4096], "float16"], null, "float16"], {}], "config": {"index": 1028737, "code_hash": null, "entity": [["tile_x", "sp", [-1, 1, 16, 8]], ["tile_y", "sp", [-1, 16, 16, 1]], ["tile_k", "sp", [-1, 16, 2]]]}, "result": [[0.0022093449859154927], 0, 7.284473657608032, 1701245588.5795], "version": 0.2, "tvm_version": "0.15.dev0"}
{"input": ["cuda -keys=cuda,gpu -arch=sm_80 -max_num_threads=1024 -thread_warp_size=32", "dense_tensorcore.cuda", [["TENSOR", [256, 4096], "float16"], ["TENSOR", [2048, 4096], "float16"], null, "float16"], {}], "config": {"index": 4512, "code_hash": null, "entity": [["block_row_warps", "ot", 1], ["block_col_warps", "ot", 2], ["warp_row_tiles", "ot", 1], ["warp_col_tiles", "ot", 4], ["chunk", "ot", 8], ["offset", "ot", 8], ["offsetCS", "ot", 0], ["vec", "ot", 8], ["wmma_m", "ot", 32]]}, "result": [[6.592146828868233e-05], 0, 3.5750560760498047, 1701245812.9394422], "version": 0.2, "tvm_version": "0.15.dev0"}
{"input": ["cuda -keys=cuda,gpu -arch=sm_80 -max_num_threads=1024 -thread_warp_size=32", "dense_small_batch.gpu", [["TENSOR", [256, 4096], "float16"], ["TENSOR", [2048, 4096], "float16"], null, "float16"], {}], "config": {"index": 5, "code_hash": null, "entity": [["tile_k", "sp", [-1, 32]]]}, "result": [[0.0013677382000000001], 0, 2.5295870304107666, 1701246301.7961793], "version": 0.2, "tvm_version": "0.15.dev0"}
{"input": ["cuda -keys=cuda,gpu -arch=sm_80 -max_num_threads=1024 -thread_warp_size=32", "dense_large_batch.gpu", [["TENSOR", [2048, 4096], "float16"], ["TENSOR", [256, 4096], "float16"], null, "float16"], {}], "config": {"index": 2288996, "code_hash": null, "entity": [["tile_x", "sp", [-1, 2, 4, 4]], ["tile_y", "sp", [-1, 2, 4, 1]], ["tile_k", "sp", [-1, 4, 8]]]}, "result": [[0.0012184807548387096], 0, 3.5927116870880127, 1701246346.6463108], "version": 0.2, "tvm_version": "0.15.dev0"}
{"input": ["cuda -keys=cuda,gpu -arch=sm_80 -max_num_threads=1024 -thread_warp_size=32", "dense_tensorcore.cuda", [["TENSOR", [2048, 4096], "float16"], ["TENSOR", [256, 4096], "float16"], null, "float16"], {}], "config": {"index": 10327, "code_hash": null, "entity": [["block_row_warps", "ot", 2], ["block_col_warps", "ot", 2], ["warp_row_tiles", "ot", 2], ["warp_col_tiles", "ot", 2], ["chunk", "ot", 8], ["offset", "ot", 8], ["offsetCS", "ot", 8], ["vec", "ot", 8], ["wmma_m", "ot", 16]]}, "result": [[6.390107908704884e-05], 0, 3.190307855606079, 1701247024.7111127], "version": 0.2, "tvm_version": "0.15.dev0"}
{"input": ["cuda -keys=cuda,gpu -arch=sm_80 -max_num_threads=1024 -thread_warp_size=32", "dense_small_batch.gpu", [["TENSOR", [2048, 4096], "float16"], ["TENSOR", [256, 4096], "float16"], null, "float16"], {}], "config": {"index": 5, "code_hash": null, "entity": [["tile_k", "sp", [-1, 32]]]}, "result": [[0.0015762772500000001], 0, 2.198014259338379, 1701247522.4303288], "version": 0.2, "tvm_version": "0.15.dev0"}
{"input": ["cuda -keys=cuda,gpu -arch=sm_80 -max_num_threads=1024 -thread_warp_size=32", "dense_large_batch.gpu", [["TENSOR", [4096, 2048], "float16"], ["TENSOR", [256, 2048], "float16"], null, "float16"], {}], "config": {"index": 2009783, "code_hash": null, "entity": [["tile_x", "sp", [-1, 4, 16, 1]], ["tile_y", "sp", [-1, 1, 16, 8]], ["tile_k", "sp", [-1, 8, 4]]]}, "result": [[0.0005863680234375001], 0, 3.976412534713745, 1701247629.108971], "version": 0.2, "tvm_version": "0.15.dev0"}
{"input": ["cuda -keys=cuda,gpu -arch=sm_80 -max_num_threads=1024 -thread_warp_size=32", "dense_tensorcore.cuda", [["TENSOR", [4096, 2048], "float16"], ["TENSOR", [256, 2048], "float16"], null, "float16"], {}], "config": {"index": 14213, "code_hash": null, "entity": [["block_row_warps", "ot", 4], ["block_col_warps", "ot", 1], ["warp_row_tiles", "ot", 2], ["warp_col_tiles", "ot", 2], ["chunk", "ot", 8], ["offset", "ot", 8], ["offsetCS", "ot", 8], ["vec", "ot", 4], ["wmma_m", "ot", 8]]}, "result": [[5.4087735228290066e-05], 0, 3.530372142791748, 1701247754.5299492], "version": 0.2, "tvm_version": "0.15.dev0"}
{"input": ["cuda -keys=cuda,gpu -arch=sm_80 -max_num_threads=1024 -thread_warp_size=32", "dense_small_batch.gpu", [["TENSOR", [4096, 2048], "float16"], ["TENSOR", [256, 2048], "float16"], null, "float16"], {}], "config": {"index": 5, "code_hash": null, "entity": [["tile_k", "sp", [-1, 32]]]}, "result": [[0.0015729173020833332], 0, 2.3824682235717773, 1701248257.912996], "version": 0.2, "tvm_version": "0.15.dev0"}
{"input": ["cuda -keys=cuda,gpu -arch=sm_80 -max_num_threads=1024 -thread_warp_size=32", "dense_large_batch.gpu", [["TENSOR", [4096, 256], "float16"], ["TENSOR", [2048, 256], "float16"], null, "float16"], {}], "config": {"index": 5043791, "code_hash": null, "entity": [["tile_x", "sp", [-1, 4, 4, 2]], ["tile_y", "sp", [-1, 4, 4, 4]], ["tile_k", "sp", [-1, 1, 16]]]}, "result": [[0.0004268392708803612], 0, 5.427376747131348, 1701248287.300234], "version": 0.2, "tvm_version": "0.15.dev0"}
{"input": ["cuda -keys=cuda,gpu -arch=sm_80 -max_num_threads=1024 -thread_warp_size=32", "dense_tensorcore.cuda", [["TENSOR", [4096, 256], "float16"], ["TENSOR", [2048, 256], "float16"], null, "float16"], {}], "config": {"index": 8905, "code_hash": null, "entity": [["block_row_warps", "ot", 2], ["block_col_warps", "ot", 2], ["warp_row_tiles", "ot", 4], ["warp_col_tiles", "ot", 4], ["chunk", "ot", 2], ["offset", "ot", 8], ["offsetCS", "ot", 8], ["vec", "ot", 4], ["wmma_m", "ot", 16]]}, "result": [[3.562725877322324e-05], 0, 4.462890863418579, 1701248885.1895268], "version": 0.2, "tvm_version": "0.15.dev0"}
{"input": ["cuda -keys=cuda,gpu -arch=sm_80 -max_num_threads=1024 -thread_warp_size=32", "dense_small_batch.gpu", [["TENSOR", [4096, 256], "float16"], ["TENSOR", [2048, 256], "float16"], null, "float16"], {}], "config": {"index": 6, "code_hash": null, "entity": [["tile_k", "sp", [-1, 64]]]}, "result": [[0.00621830415625], 0, 2.553818941116333, 1701249426.2419035], "version": 0.2, "tvm_version": "0.15.dev0"}
