benchmark/subgraphs/xmlcnn/tvm_ansor.log
{"i": [["[\"460e8399c68e56ab38b35f30119390c3\", [2048, 4096], [4096, 2048]]", "cuda -keys=cuda,gpu -arch=sm_80 -max_num_threads=1024 -thread_warp_size=32", [-1, 16, 64, 49152, 2147483647, 1024, 8, 32], "llvm -keys=cpu ", 0, []], [[], [["FU", 1, [0, 1]], ["SP", 1, 0, 8388608, [1], 1], ["AN", 1, 0, 5], ["AN", 1, 1, 6]]]], "r": [[0.00799319], 0, 1.71842, 1701203021], "v": "v0.6"}
{"i": [["[\"460e8399c68e56ab38b35f30119390c3\", [2048, 4096], [4096, 2048]]", "cuda -keys=cuda,gpu -arch=sm_80 -max_num_threads=1024 -thread_warp_size=32", [-1, 16, 64, 49152, 2147483647, 1024, 8, 32], "llvm -keys=cpu ", 0, []], [[], [["FU", 1, [0, 1]], ["SP", 1, 0, 8388608, [32], 1], ["AN", 1, 0, 5], ["AN", 1, 1, 6]]]], "r": [[0.000197818], 0, 1.32213, 1701203022], "v": "v0.6"}
{"i": [["[\"460e8399c68e56ab38b35f30119390c3\", [2048, 4096], [4096, 2048]]", "cuda -keys=cuda,gpu -arch=sm_80 -max_num_threads=1024 -thread_warp_size=32", [-1, 16, 64, 49152, 2147483647, 1024, 8, 32], "llvm -keys=cpu ", 0, []], [[], [["FU", 1, [0, 1]], ["SP", 1, 0, 8388608, [8], 1], ["AN", 1, 0, 5], ["AN", 1, 1, 6]]]], "r": [[0.000779534], 0, 1.18149, 1701203023], "v": "v0.6"}
{"i": [["[\"460e8399c68e56ab38b35f30119390c3\", [2048, 4096], [4096, 2048]]", "cuda -keys=cuda,gpu -arch=sm_80 -max_num_threads=1024 -thread_warp_size=32", [-1, 16, 64, 49152, 2147483647, 1024, 8, 32], "llvm -keys=cpu ", 0, []], [[], [["FU", 1, [0, 1]], ["SP", 1, 0, 8388608, [16], 1], ["AN", 1, 0, 5], ["AN", 1, 1, 6]]]], "r": [[0.000391429], 0, 1.35282, 1701203024], "v": "v0.6"}
{"i": [["[\"460e8399c68e56ab38b35f30119390c3\", [2048, 4096], [4096, 2048]]", "cuda -keys=cuda,gpu -arch=sm_80 -max_num_threads=1024 -thread_warp_size=32", [-1, 16, 64, 49152, 2147483647, 1024, 8, 32], "llvm -keys=cpu ", 0, []], [[], [["FU", 1, [0, 1]], ["SP", 1, 0, 8388608, [4], 1], ["AN", 1, 0, 5], ["AN", 1, 1, 6]]]], "r": [[0.00155626], 0, 1.17063, 1701203024], "v": "v0.6"}
{"i": [["[\"460e8399c68e56ab38b35f30119390c3\", [2048, 4096], [4096, 2048]]", "cuda -keys=cuda,gpu -arch=sm_80 -max_num_threads=1024 -thread_warp_size=32", [-1, 16, 64, 49152, 2147483647, 1024, 8, 32], "llvm -keys=cpu ", 0, []], [[], [["FU", 1, [0, 1]], ["SP", 1, 0, 8388608, [2], 1], ["AN", 1, 0, 5], ["AN", 1, 1, 6]]]], "r": [[0.0031097], 0, 1.19791, 1701203025], "v": "v0.6"}
{"i": [["[\"460e8399c68e56ab38b35f30119390c3\", [2048, 4096], [4096, 2048]]", "cuda -keys=cuda,gpu -arch=sm_80 -max_num_threads=1024 -thread_warp_size=32", [-1, 16, 64, 49152, 2147483647, 1024, 8, 32], "llvm -keys=cpu ", 0, []], [[], [["FU", 1, [0, 1]], ["SP", 1, 0, 8388608, [64], 1], ["AN", 1, 0, 5], ["AN", 1, 1, 6]]]], "r": [[0.000100667], 0, 1.31128, 1701203026], "v": "v0.6"}
{"i": [["[\"5610d2b06b4580f608f3c90e06bc90fd\", [4096, 512], [4096, 512]]", "cuda -keys=cuda,gpu -arch=sm_80 -max_num_threads=1024 -thread_warp_size=32", [-1, 16, 64, 49152, 2147483647, 1024, 8, 32], "llvm -keys=cpu ", 0, []], [[], [["FU", 1, [0, 1]], ["SP", 1, 0, 2097152, [2], 1], ["AN", 1, 0, 5], ["AN", 1, 1, 6]]]], "r": [[0.00100213], 0, 1.25893, 1701203045], "v": "v0.6"}
{"i": [["[\"5610d2b06b4580f608f3c90e06bc90fd\", [4096, 512], [4096, 512]]", "cuda -keys=cuda,gpu -arch=sm_80 -max_num_threads=1024 -thread_warp_size=32", [-1, 16, 64, 49152, 2147483647, 1024, 8, 32], "llvm -keys=cpu ", 0, []], [[], [["FU", 1, [0, 1]], ["SP", 1, 0, 2097152, [1], 1], ["AN", 1, 0, 5], ["AN", 1, 1, 6]]]], "r": [[0.00200079], 0, 0.751992, 1701203045], "v": "v0.6"}
{"i": [["[\"5610d2b06b4580f608f3c90e06bc90fd\", [4096, 512], [4096, 512]]", "cuda -keys=cuda,gpu -arch=sm_80 -max_num_threads=1024 -thread_warp_size=32", [-1, 16, 64, 49152, 2147483647, 1024, 8, 32], "llvm -keys=cpu ", 0, []], [[], [["FU", 1, [0, 1]], ["SP", 1, 0, 2097152, [8], 1], ["AN", 1, 0, 5], ["AN", 1, 1, 6]]]], "r": [[0.000196867], 0, 0.906914, 1701203046], "v": "v0.6"}
{"i": [["[\"5610d2b06b4580f608f3c90e06bc90fd\", [4096, 512], [4096, 512]]", "cuda -keys=cuda,gpu -arch=sm_80 -max_num_threads=1024 -thread_warp_size=32", [-1, 16, 64, 49152, 2147483647, 1024, 8, 32], "llvm -keys=cpu ", 0, []], [[], [["FU", 1, [0, 1]], ["SP", 1, 0, 2097152, [64], 1], ["AN", 1, 0, 5], ["AN", 1, 1, 6]]]], "r": [[2.65433e-05], 0, 0.893017, 1701203046], "v": "v0.6"}
{"i": [["[\"5610d2b06b4580f608f3c90e06bc90fd\", [4096, 512], [4096, 512]]", "cuda -keys=cuda,gpu -arch=sm_80 -max_num_threads=1024 -thread_warp_size=32", [-1, 16, 64, 49152, 2147483647, 1024, 8, 32], "llvm -keys=cpu ", 0, []], [[], [["FU", 1, [0, 1]], ["SP", 1, 0, 2097152, [4], 1], ["AN", 1, 0, 5], ["AN", 1, 1, 6]]]], "r": [[0.000391021], 0, 0.923989, 1701203047], "v": "v0.6"}
{"i": [["[\"5610d2b06b4580f608f3c90e06bc90fd\", [4096, 512], [4096, 512]]", "cuda -keys=cuda,gpu -arch=sm_80 -max_num_threads=1024 -thread_warp_size=32", [-1, 16, 64, 49152, 2147483647, 1024, 8, 32], "llvm -keys=cpu ", 0, []], [[], [["FU", 1, [0, 1]], ["SP", 1, 0, 2097152, [16], 1], ["AN", 1, 0, 5], ["AN", 1, 1, 6]]]], "r": [[9.97425e-05], 0, 0.928956, 1701203047], "v": "v0.6"}
{"i": [["[\"5610d2b06b4580f608f3c90e06bc90fd\", [4096, 512], [4096, 512]]", "cuda -keys=cuda,gpu -arch=sm_80 -max_num_threads=1024 -thread_warp_size=32", [-1, 16, 64, 49152, 2147483647, 1024, 8, 32], "llvm -keys=cpu ", 0, []], [[], [["FU", 1, [0, 1]], ["SP", 1, 0, 2097152, [32], 1], ["AN", 1, 0, 5], ["AN", 1, 1, 6]]]], "r": [[5.11761e-05], 0, 0.905414, 1701203048], "v": "v0.6"}
{"i": [["[\"460e8399c68e56ab38b35f30119390c3\", [2048, 512], [512, 2048]]", "cuda -keys=cuda,gpu -arch=sm_80 -max_num_threads=1024 -thread_warp_size=32", [-1, 16, 64, 49152, 2147483647, 1024, 8, 32], "llvm -keys=cpu ", 0, []], [[], [["FU", 1, [0, 1]], ["SP", 1, 0, 1048576, [64], 1], ["AN", 1, 0, 5], ["AN", 1, 1, 6]]]], "r": [[1.5759e-05], 0, 1.43434, 1701203069], "v": "v0.6"}
{"i": [["[\"460e8399c68e56ab38b35f30119390c3\", [2048, 512], [512, 2048]]", "cuda -keys=cuda,gpu -arch=sm_80 -max_num_threads=1024 -thread_warp_size=32", [-1, 16, 64, 49152, 2147483647, 1024, 8, 32], "llvm -keys=cpu ", 0, []], [[], [["FU", 1, [0, 1]], ["SP", 1, 0, 1048576, [16], 1], ["AN", 1, 0, 5], ["AN", 1, 1, 6]]]], "r": [[5.12348e-05], 0, 0.847992, 1701203069], "v": "v0.6"}
{"i": [["[\"460e8399c68e56ab38b35f30119390c3\", [2048, 512], [512, 2048]]", "cuda -keys=cuda,gpu -arch=sm_80 -max_num_threads=1024 -thread_warp_size=32", [-1, 16, 64, 49152, 2147483647, 1024, 8, 32], "llvm -keys=cpu ", 0, []], [[], [["FU", 1, [0, 1]], ["SP", 1, 0, 1048576, [1], 1], ["AN", 1, 0, 5], ["AN", 1, 1, 6]]]], "r": [[0.000779478], 0, 0.696459, 1701203069], "v": "v0.6"}
{"i": [["[\"460e8399c68e56ab38b35f30119390c3\", [2048, 512], [512, 2048]]", "cuda -keys=cuda,gpu -arch=sm_80 -max_num_threads=1024 -thread_warp_size=32", [-1, 16, 64, 49152, 2147483647, 1024, 8, 32], "llvm -keys=cpu ", 0, []], [[], [["FU", 1, [0, 1]], ["SP", 1, 0, 1048576, [4], 1], ["AN", 1, 0, 5], ["AN", 1, 1, 6]]]], "r": [[0.000196835], 0, 0.863704, 1701203070], "v": "v0.6"}
{"i": [["[\"460e8399c68e56ab38b35f30119390c3\", [2048, 512], [512, 2048]]", "cuda -keys=cuda,gpu -arch=sm_80 -max_num_threads=1024 -thread_warp_size=32", [-1, 16, 64, 49152, 2147483647, 1024, 8, 32], "llvm -keys=cpu ", 0, []], [[], [["FU", 1, [0, 1]], ["SP", 1, 0, 1048576, [8], 1], ["AN", 1, 0, 5], ["AN", 1, 1, 6]]]], "r": [[9.97033e-05], 0, 0.853959, 1701203070], "v": "v0.6"}
{"i": [["[\"460e8399c68e56ab38b35f30119390c3\", [2048, 512], [512, 2048]]", "cuda -keys=cuda,gpu -arch=sm_80 -max_num_threads=1024 -thread_warp_size=32", [-1, 16, 64, 49152, 2147483647, 1024, 8, 32], "llvm -keys=cpu ", 0, []], [[], [["FU", 1, [0, 1]], ["SP", 1, 0, 1048576, [32], 1], ["AN", 1, 0, 5], ["AN", 1, 1, 6]]]], "r": [[2.72087e-05], 0, 0.831529, 1701203070], "v": "v0.6"}
{"i": [["[\"460e8399c68e56ab38b35f30119390c3\", [2048, 512], [512, 2048]]", "cuda -keys=cuda,gpu -arch=sm_80 -max_num_threads=1024 -thread_warp_size=32", [-1, 16, 64, 49152, 2147483647, 1024, 8, 32], "llvm -keys=cpu ", 0, []], [[], [["FU", 1, [0, 1]], ["SP", 1, 0, 1048576, [2], 1], ["AN", 1, 0, 5], ["AN", 1, 1, 6]]]], "r": [[0.000391011], 0, 0.882927, 1701203071], "v": "v0.6"}
