benchmark/subgraphs/xmlcnn/tvm_autotvm.log
{"input": ["cuda -keys=cuda,gpu -arch=sm_80 -max_num_threads=1024 -thread_warp_size=32", "dense_large_batch.gpu", [["TENSOR", [4096, 2048], "float16"], ["TENSOR", [512, 2048], "float16"], null, "float16"], {}], "config": {"index": 1295410, "code_hash": null, "entity": [["tile_x", "sp", [-1, 1, 4, 1]], ["tile_y", "sp", [-1, 1, 4, 64]], ["tile_k", "sp", [-1, 1, 2]]]}, "result": [[0.02090439605], 0, 4.596262216567993, 1701200861.4856596], "version": 0.2, "tvm_version": "0.15.dev0"}
{"input": ["cuda -keys=cuda,gpu -arch=sm_80 -max_num_threads=1024 -thread_warp_size=32", "dense_tensorcore.cuda", [["TENSOR", [4096, 2048], "float16"], ["TENSOR", [512, 2048], "float16"], null, "float16"], {}], "config": {"index": 8961, "code_hash": null, "entity": [["block_row_warps", "ot", 1], ["block_col_warps", "ot", 4], ["warp_row_tiles", "ot", 4], ["warp_col_tiles", "ot", 2], ["chunk", "ot", 4], ["offset", "ot", 8], ["offsetCS", "ot", 8], ["vec", "ot", 4], ["wmma_m", "ot", 16]]}, "result": [[7.726196635693689e-05], 0, 4.006493806838989, 1701201399.3238108], "version": 0.2, "tvm_version": "0.15.dev0"}
{"input": ["cuda -keys=cuda,gpu -arch=sm_80 -max_num_threads=1024 -thread_warp_size=32", "dense_small_batch.gpu", [["TENSOR", [4096, 2048], "float16"], ["TENSOR", [512, 2048], "float16"], null, "float16"], {}], "config": {"index": 5, "code_hash": null, "entity": [["tile_k", "sp", [-1, 32]]]}, "result": [[0.0029768482156862742], 0, 2.510589122772217, 1701201914.9745665], "version": 0.2, "tvm_version": "0.15.dev0"}
{"input": ["cuda -keys=cuda,gpu -arch=sm_80 -max_num_threads=1024 -thread_warp_size=32", "dense_large_batch.gpu", [["TENSOR", [2048, 512], "float16"], ["TENSOR", [4096, 512], "float16"], null, "float16"], {}], "config": {"index": 2556959, "code_hash": null, "entity": [["tile_x", "sp", [-1, 1, 8, 8]], ["tile_y", "sp", [-1, 1, 8, 4]], ["tile_k", "sp", [-1, 32, 2]]]}, "result": [[0.0012245041707317072], 0, 7.89447283744812, 1701201948.8222103], "version": 0.2, "tvm_version": "0.15.dev0"}
{"input": ["cuda -keys=cuda,gpu -arch=sm_80 -max_num_threads=1024 -thread_warp_size=32", "dense_tensorcore.cuda", [["TENSOR", [2048, 512], "float16"], ["TENSOR", [4096, 512], "float16"], null, "float16"], {}], "config": {"index": 5098, "code_hash": null, "entity": [["block_row_warps", "ot", 2], ["block_col_warps", "ot", 2], ["warp_row_tiles", "ot", 4], ["warp_col_tiles", "ot", 4], ["chunk", "ot", 4], ["offset", "ot", 8], ["offsetCS", "ot", 8], ["vec", "ot", 8], ["wmma_m", "ot", 32]]}, "result": [[5.908084157160963e-05], 0, 3.816136121749878, 1701202497.69196], "version": 0.2, "tvm_version": "0.15.dev0"}
{"input": ["cuda -keys=cuda,gpu -arch=sm_80 -max_num_threads=1024 -thread_warp_size=32", "dense_small_batch.gpu", [["TENSOR", [2048, 512], "float16"], ["TENSOR", [4096, 512], "float16"], null, "float16"], {}], "config": {"index": 6, "code_hash": null, "entity": [["tile_k", "sp", [-1, 64]]]}, "result": [[0.0062220158437500004], 0, 2.2509586811065674, 1701202979.1918054], "version": 0.2, "tvm_version": "0.15.dev0"}
